index,url,valid,domain,title,description,image,published,archive,content,quote,language,keyword
https://www.stern.de/wirtschaft/news/iw-schaetzung-fuer-2020-2025--krisen-kosten-deutschland-fast-1-000-milliarden-euro-37115284.html,https://www.stern.de/wirtschaft/news/iw-schaetzung-fuer-2020-2025--krisen-kosten-deutschland-fast-1-000-milliarden-euro-37115284.html,0,www.stern.de,IW-Schätzung für 2020-2025: Krisen kosten Deutschland fast 1.000 Milliarden Euro,"Corona-Pandemie, Ukraine-Krieg, Zoll-Streit: Seit 2020 reiht sich eine Krise an die andere. Das kommt die deutsche Wirtschaft teuer zu stehen. Die Einbußen stellen frühere Krisen in den Schatten.",https://image.stern.de/37115286/t/9C/v1/w1440/r1.7778/-/07--hd75uelq7iv6axs2048jpeg---9dff24aebfcb6e4f.jpg,2026-02-07T04:00:04Z,,"Kopiere den aktuellen Link
Zur Merkliste hinzufügen
Corona-Pandemie, Ukraine-Krieg, Zoll-Streit: Seit 2020 reiht sich eine Krise an die andere. Das kommt die deutsche Wirtschaft teuer zu stehen. Di… [+2448 chars]",,de,'Schatten'
https://www.tagesspiegel.de/wirtschaft/iw-schatzung-fur-2020-2025-krisen-kosten-deutschland-fast-1000-milliarden-euro-15228388.html,https://www.tagesspiegel.de/wirtschaft/iw-schatzung-fur-2020-2025-krisen-kosten-deutschland-fast-1000-milliarden-euro-15228388.html,0,www.tagesspiegel.de,IW-Schätzung für 2020-2025: Krisen kosten Deutschland fast 1.000 Milliarden Euro,"Corona-Pandemie, Ukraine-Krieg, Zoll-Streit: Seit 2020 reiht sich eine Krise an die andere. Das kommt die deutsche Wirtschaft teuer zu stehen. Die Einbußen stellen frühere Krisen in den Schatten.",https://www.tagesspiegel.de/images/15228387/alternates/BASE_16_9_W1400/1770436905000/konjunktur.jpeg,2026-02-07T04:01:45Z,,Die ökonomischen Kosten der Dauerkrisen der vergangenen Jahre für Deutschland summieren sich nach IW-Schätzungen inzwischen auf fast eine Billion Euro. Für die sechs Jahre seit 2020 ergebe sich ein A… [+2287 chars],,de,'Schatten'
https://burgenland.orf.at/stories/3340876/,https://burgenland.orf.at/stories/3340876/,0,burgenland.orf.at,Handelsabkommen mit Indien bringt Wirtschaftswachstum,"Im Schatten des viel diskutierten Mercosur-Abkommens zwischen der EU und einigen südamerikanischen Staaten hat die EU auch mit Indien einen Pakt geschlossen. Nicht nur die Industrie, auch die Weinwirtschaft erhofft sich durch das Freihandelsabkommen einen pos…",https://ibs.orf.at/bgl?image=https%3A%2F%2Foekastatic.orf.at%2Fmims%2F2026%2F06%2F84%2Fcrops%2Fw%3D1200%2Ch%3D627%2Cq%3D75%2F2924356_master_1130484_indien_1.jpg%3Fs%3D8d4c5ef75f4ed9841a6603673ecfa6a9f9ac2c38,2026-02-07T04:30:02Z,,"Das Burgenland könnte moderat vom Freihandelsabkommen zwischen der EU und Indien profitieren, wie eine aktuelle Analyse zeigt. Industriell geprägte Bundesländer wie Oberösterreich und Niederösterreic… [+1334 chars]",,de,'Schatten'
https://www.urlaubspiraten.de/pauschalreisen/alicante-staedtetrip,https://www.urlaubspiraten.de/pauschalreisen/alicante-staedtetrip,0,www.urlaubspiraten.de,Winter satt? ✈️ Besuche eine der sonnigsten Städte Europas! ☀️,"Kein Witz, das spanische Alicante gehört zu den sonnigsten Städten Europas, durchschnittlich scheint die Sonne 349 Stunden pro Monat und ab März erwarten euch durchschnittlich um die 19 bis 21 °C Tagestemperatur. ☀️✈️ Bei diesem eisigen Winter hilft neben der…",https://image.urlaubspiraten.de/720/image/upload/v1770367888/Impressions%20and%20Other%20Assets/shutterstock_2057814977_aoimfl.jpg,2026-02-07T07:35:00Z,,"Wir nutzen Cookies, um deine Nutzererfahrung zu verbessern, dir persönlich auf dich zugeschnittene Inhalte liefern zu können und die Nutzung unserer App zu analysieren. Wenn du auf ""alle akzeptieren""… [+435 chars]",,de,'Sonne'
https://www.tagesschau.de/wirtschaft/krisen-kosten-100.html,https://www.tagesschau.de/wirtschaft/krisen-kosten-100.html,0,www.tagesschau.de,IW-Analyse: Krisen kosten Deutschland fast 1.000 Milliarden Euro,"Corona-Pandemie, Ukraine-Krieg, Zoll-Streit: Seit 2020 reiht sich eine Krise an die andere. Das kommt die deutsche Wirtschaft teuer zu stehen. Die Einbußen stellen frühere Krisen in den Schatten.",https://images.tagesschau.de/image/58616c7d-cdf6-416d-925f-1f2384c0fd35/AAABnDce85Y/AAABmyZE0EA/16x9-big/holzwerke-wismar-100.jpg?width=1280,2026-02-07T08:01:42Z,,"Stand: 07.02.2026 09:01 Uhr
Corona-Pandemie, Ukraine-Krieg, Zoll-Streit: Seit 2020 reiht sich eine Krise an die andere. Das kommt die deutsche Wirtschaft teuer zu stehen. Die Einbußen stellen früher… [+1291 chars]",,de,'Schatten'
https://www.bild.de/sport/olympia/olympia-virus-ausbruch-immer-schlimmer-naechstes-spiel-in-gefahr-6986ef292cc074fa476cf787,https://www.bild.de/sport/olympia/olympia-virus-ausbruch-immer-schlimmer-naechstes-spiel-in-gefahr-6986ef292cc074fa476cf787,0,www.bild.de,Virus-Ausbruch immer schlimmer - Nächstes Olympia-Spiel in Gefahr!,Ein Virus rückt das olympische Eishockey-Turnier der Frauen in den Schatten!,"https://images.bild.de/6986ef292cc074fa476cf787/d392a2cbbb3a4818ed7bee003115f675,e129ed75?w=1280",2026-02-07T08:16:22Z,,"TTS-Player überspringenArtikel weiterlesenEin Virus rückt das olympische Eishockey-Turnier der Frauen in den Schatten!
Nach dem finnischen Team hat es nun auch die Schweizerinnen erwischt. Das Spiel… [+1141 chars]",,de,'Schatten'
https://www.stern.de/gesellschaft/regional/baden-wuerttemberg/blick-auf-das-wochenend-wetter--schnell-die-sonne-geniessen---wo-sie-lockt--wo-sie-bleibt-37115316.html,https://www.stern.de/gesellschaft/regional/baden-wuerttemberg/blick-auf-das-wochenend-wetter--schnell-die-sonne-geniessen---wo-sie-lockt--wo-sie-bleibt-37115316.html,0,www.stern.de,"Blick auf das Wochenend-Wetter: Schnell die Sonne genießen - wo sie lockt, wo sie bleibt","Erst Sonne satt, aber Nebel und Wolken warten schon: Das Wetter zeigt sich am Wochenende abwechslungsreich. Wo die Sonnenstrahlen trotzdem zu finden sind.",https://image.stern.de/37115898/t/yw/v1/w1440/r1.7778/-/07--63ery7isa5v8axs2048jpeg---b894dd0ffcfc90eb.jpg,2026-02-07T11:40:48Z,,"Kopiere den aktuellen Link
Zur Merkliste hinzufügen
Erst Sonne satt, aber Nebel und Wolken warten schon: Das Wetter zeigt sich am Wochenende abwechslungsreich. Wo die Sonnenstrahlen trotzdem zu fin… [+1742 chars]",,de,'Sonne'
https://www.stern.de/gesellschaft/regional/rheinland-pfalz-saarland/wetter--nach-sonne-wieder-eher-grauer-himmel-in-den-naechsten-tagen-37115888.html,https://www.stern.de/gesellschaft/regional/rheinland-pfalz-saarland/wetter--nach-sonne-wieder-eher-grauer-himmel-in-den-naechsten-tagen-37115888.html,0,www.stern.de,Wetter: Nach Sonne wieder eher grauer Himmel in den nächsten Tagen,"Erst freundlich - dann vielerorts Wolken, nachts Nebel und stellenweise Glätte: In den nächsten Tagen wird es eher grau in Rheinland-Pfalz und im Saarland.",https://image.stern.de/37116228/t/c8/v1/w1440/r1.7778/-/07--liys4iwsndv9axs2048jpeg---92a4d484c5974280.jpg,2026-02-07T14:59:55Z,,"Kopiere den aktuellen Link
Zur Merkliste hinzufügen
Erst freundlich - dann vielerorts Wolken, nachts Nebel und stellenweise Glätte: In den nächsten Tagen wird es eher grau in Rheinland-Pfalz und im… [+1284 chars]",,de,'Sonne'
https://www.focus.de/wissen/bedrohung-fuer-die-arktis-forscher-warnen-vor-invasivem-risiko-durch-klimawandel-und-mensch_9a45c313-287f-4ff0-9ce7-fa6c4c368665.html,https://www.focus.de/wissen/bedrohung-fuer-die-arktis-forscher-warnen-vor-invasivem-risiko-durch-klimawandel-und-mensch_9a45c313-287f-4ff0-9ce7-fa6c4c368665.html,0,www.focus.de,Bedrohung für die Arktis: Forscher warnen vor invasivem Risiko durch Klimawandel und Mensch,"Eine neue Studie zeigt, dass 2554 fremde Pflanzenarten in der Arktis überleben könnten. Der Klimawandel und menschliche Einflüsse verschärfen die Bedrohung.",https://quadro.burda-forward.de/ctf/9786eaa9-af4a-49f5-9dc8-7edd758fa9a5.8a04e970-3238-4236-9577-5c68858851a9.jpg?im=RegionOfInterestCrop%3D%281200%2C630%29%2CregionOfInterest%3D%281055%2C816%29&hash=2da3b2ae61efcb26c4522fa9738abee94d6057ec3bc6c092dd80017ce433c60e,2026-02-07T18:00:00Z,,"Die Arktis: abgelegen und vom scheinbar ewigen Eis überzogen. Doch genau dieses Bild gerät immer mehr ins Wanken. Forschende warnen nun vor einer neuen, oft unterschätzten Gefahr. Denn immer mehr geb… [+2276 chars]",,de,'Klimawandel'
https://www.faz.net/aktuell/sport/olympische-winterspiele/olympia-2026-zeitplan-heute-hoehepunkte-der-winterspiele-am-8-februar-in-mailand-und-cortina-accg-200512093.html,https://www.faz.net/aktuell/sport/olympische-winterspiele/olympia-2026-zeitplan-heute-hoehepunkte-der-winterspiele-am-8-februar-in-mailand-und-cortina-accg-200512093.html,0,www.faz.net,Zeitplan und Höhepunkte: Das bringt Olympia 2026 an diesem Sonntag,"Im Schatten von Lindsey Vonn rechnen sich zwei Deutsche Chancen auf eine Olympia-Medaille in der Abfahrt aus. Die Blicke gehen danach zu Snowboard und Biathlon, ehe es im Rodeln richtig spannend wird.",https://media0.faz.net/image/w1200h627/1a20f79ef97f/w3815h1993x1029y619o/202602/43601.0.1738038513/lindsey-vonn-emma-aicher-die.webp,2026-02-08T05:02:10Z,,"Olympiatag am 8. Februar 2026 (alle Zeitangaben in MEZ)
Zahl der Entscheidungen: 8Start des Olympiatages: 9.00 UhrEnde des Olympiatages: ca. 23.40 UhrÜbertragende Sender: ZDF und Eurosport
Zum Star… [+4045 chars]",,de,'Schatten'
https://www.stern.de/panorama/deutschland-wetter--glaettegefahr-im-nordosten-bleibt---neblig-trueber-sonntag-37116890.html,https://www.stern.de/panorama/deutschland-wetter--glaettegefahr-im-nordosten-bleibt---neblig-trueber-sonntag-37116890.html,0,www.stern.de,Deutschland-Wetter: Glättegefahr im Nordosten bleibt - Neblig-trüber Sonntag,"Mit viel Nebel und Wolken wird der Sonntag vielerorts eher trist. Im Nordosten und Osten kann es weiter stellenweise glatt sein. Im Westen, Südwesten und am Alpenrand kommt auch mal die Sonne durch.",https://image.stern.de/37116892/t/0a/v1/w1440/r1.7778/-/08--gztacm7jcov3axs2048jpeg---7398efbbb0f28d0d.jpg,2026-02-08T06:12:50Z,,"Kopiere den aktuellen Link
Zur Merkliste hinzufügen
Mit viel Nebel und Wolken wird der Sonntag vielerorts eher trist. Im Nordosten und Osten kann es weiter stellenweise glatt sein. Im Westen, Südwe… [+1660 chars]",,de,'Sonne'
https://www.zeit.de/news/2026-02/08/sonne-nur-in-den-alpen-sonst-bleibt-es-trueb,https://www.zeit.de/news/2026-02/08/sonne-nur-in-den-alpen-sonst-bleibt-es-trueb,0,www.zeit.de,Wetteraussichten: Sonne nur in den Alpen - sonst bleibt es trüb,Hier finden Sie Informationen zu dem Thema „Wetteraussichten“. Lesen Sie jetzt „Sonne nur in den Alpen - sonst bleibt es trüb“.,https://img.zeit.de/news/2026-02/08/sonne-nur-in-den-alpen-sonst-bleibt-es-trueb-image-group/wide__1300x731,2026-02-08T06:28:44Z,,"Sonne genießen - das geht am Sonntag wohl nur in den Alpen. In den meisten anderen Regionen Bayerns bleibe es ganztägig trüb durch Nebel oder Hochnebel, meldete der Deutsche Wetterdienst (DWD). Dicht… [+826 chars]",,de,'Sonne'
https://www.welt.de/wissenschaft/klimabilanz/plus698308042dfdd2aa24524f56/kalte-winter-mehr-kaelteextreme-durch-klimawandel-entzauberung-einer-medienlegende.html,https://www.welt.de/wissenschaft/klimabilanz/plus698308042dfdd2aa24524f56/kalte-winter-mehr-kaelteextreme-durch-klimawandel-entzauberung-einer-medienlegende.html,0,www.welt.de,„Mehr Kälteextreme durch Klimawandel“ – Entzauberung einer Medienlegende,"Die globale Erwärmung verschärfe paradoxerweise Kälteextreme – die These steht in Schulbüchern, wird in Schlagzeilen gepriesen und bringt Preise ein. Dabei ist sie wissenschaftlich längst durchgefallen.",https://images.welt.de/698308042dfdd2aa24524f56/6e21e24b06189748e4d4004c07655b49-master/ci16x9-w1200/dwosb-axel-bojanowski-klimaabgruende-cw-ds-ki-jpg,2026-02-08T08:48:00Z,,"Die globale Erwärmung verschärfe paradoxerweise Kälteextreme die These steht in Schulbüchern, wird in Schlagzeilen gepriesen und bringt Preise ein. Dabei ist sie wissenschaftlich längst durchgefallen.",,de,'Klimawandel'
https://www.zeit.de/news/2026-02/08/glaettegefahr-und-graue-tage-sonne-nur-auf-dem-brocken,https://www.zeit.de/news/2026-02/08/glaettegefahr-und-graue-tage-sonne-nur-auf-dem-brocken,0,www.zeit.de,Wetter: Glättegefahr und graue Tage - Sonne nur auf dem Brocken,Hier finden Sie Informationen zu dem Thema „Wetter“. Lesen Sie jetzt „Glättegefahr und graue Tage - Sonne nur auf dem Brocken“.,https://img.zeit.de/news/2026-02/08/glaettegefahr-und-graue-tage-sonne-nur-auf-dem-brocken-image-group/wide__1300x731,2026-02-08T13:33:51Z,,"Auf die Menschen in Sachsen-Anhalt kommt eine weitere überwiegend graue und teils glatte Wetterwoche zu. Wie der Deutsche Wetterdienst (DWD) mitteilte, bleibt es in den kommenden Tagen meist stark be… [+1157 chars]",,de,'Sonne'
https://www.zeit.de/news/2026-02/09/frost-glaette-und-wenig-sonne-wetter-bleibt-ungemuetlich,https://www.zeit.de/news/2026-02/09/frost-glaette-und-wenig-sonne-wetter-bleibt-ungemuetlich,0,www.zeit.de,"Wetter: Frost, Glätte und wenig Sonne – Wetter bleibt ungemütlich","Hier finden Sie Informationen zu dem Thema „Wetter“. Lesen Sie jetzt „Frost, Glätte und wenig Sonne – Wetter bleibt ungemütlich“.",https://img.zeit.de/news/2026-02/09/frost-glaette-und-wenig-sonne-wetter-bleibt-ungemuetlich-image-group/wide__1300x731,2026-02-09T07:41:26Z,,Frostige Temperaturen und örtliche Glätte prägen in den kommenden Tagen das Wettergeschehen in Hamburg und Schleswig-Holstein. Heute kommt es bis in den Vormittag stellenweise zu Glätte durch gefrier… [+1351 chars],,de,'Sonne'
https://www.sueddeutsche.de/bayern/bayern-wetter-winter-nebel-li.3384359,https://www.sueddeutsche.de/bayern/bayern-wetter-winter-nebel-li.3384359,0,www.sueddeutsche.de,Wetter in Bayern: Graue Tristesse mit einzelnen Lichtblicken,Starke Bewölkung und Hochnebel kündigt der Deutsche Wetterdienst am Montag für weite Teile Bayerns an. Nur in den Alpen kann die Sonne scheinen.,https://www.sueddeutsche.de/2026/02/09/2a72857f-6290-487c-93f0-1d6c2ae1d3cc.jpg?q=60&fm=webp&width=1200&rect=0%2C209%2C4000%2C2250,2026-02-09T07:45:15Z,,"Von Aschaffenburg bis Berchtesgaden: Das Bayern-Team der SZ ist im gesamten Freistaat für Sie unterwegs. Hier entlang, wenn Sie Geschichten, News und Hintergründe direkt aufs Handy bekommen möchten.… [+759 chars]",,de,'Sonne'
https://t3n.de/news/komet-3iatlas-helligkeitszunahme-spherex-1728700/,https://t3n.de/news/komet-3iatlas-helligkeitszunahme-spherex-1728700/,0,t3n.de,Show zum Abschied: Interstellarer Komet 3I/Atlas leuchtet überraschend wieder auf,Die Nasa hat neue Aufnahmen des Kometen 3I/Atlas aus dem Dezember 2025 veröffentlicht. Sie zeigen: Beim Verlassen des inneren Sonnensystems lieferte der interstellare Besucher noch einmal eine überraschende Show. 2025 war das Jahr des Kometen 3I/Atlas. Änderu…,https://cdn.t3n.de/news/wp-content/uploads/2026/02/shutterstock_2580379883.jpg?class=content,2026-02-09T10:20:40Z,,"2025 war das Jahr des Kometen 3I/Atlas. Änderungen in der Helligkeit, Farbveränderungen und spektakuläre Aufnahmen durch Hubble und Juice haben All-Enthusiast:innen monatelang begeistert.
Jetzt hat … [+4439 chars]",,de,'Sonne'
https://www.zeit.de/2026/02/freibad-bauen-ruhestand-schwimmen,https://www.zeit.de/2026/02/freibad-bauen-ruhestand-schwimmen,0,www.zeit.de,"Freibad: ""Vom Wasser aus sieht man die Autos der Nachbarn""",Der Rentner Achim Gall betreibt in seinem Vorgarten ein öffentliches Freibad. Dafür verkaufte er drei Wohnungen und nahm einen Kredit auf. Warum tut er das?,https://img.zeit.de/2026/02/freibad-bauen-ruhestand-schwimmen-teaser/wide__1300x731,2026-02-09T11:47:41Z,,"Ich bin jetzt 69 und lebe allein mit meiner Katze. Wenn ich morgens aufstehe und nichts Bestimmtes anliegt, werde ich unruhig. An solchen Tagen laufe ich vom Kühlschrank in den Garten zum Fernseher, … [+604 chars]",,de,'Freibad'
https://www.focus.de/sport/olympische-winterspiele/die-neue-penis-posse-macht-skispringen-bei-olympia-zum-unwuerdigen-schauspiel_8f69e896-62f9-48d9-95ab-475f07af2cfa.html,https://www.focus.de/sport/olympische-winterspiele/die-neue-penis-posse-macht-skispringen-bei-olympia-zum-unwuerdigen-schauspiel_8f69e896-62f9-48d9-95ab-475f07af2cfa.html,0,www.focus.de,Die neue Penis-Posse macht Skispringen bei Olympia zum unwürdigen Schauspiel,Zwischen olympischem Glanz und bizarren Intim-Injektionen: Eine Penis-Posse wirft dunkle Schatten auf das Skispringen. Die Sportler kämpfen um Glaubwürdigkeit.,https://quadro.burda-forward.de/ctf/32d55e52-3a20-403f-89ff-8917c2ff0bc5.01a9e3b2-3a81-46cf-81b7-3662a8d1696e.jpg?im=RegionOfInterestCrop%3D%281200%2C630%29%2CregionOfInterest%3D%281637%2C1007%29&hash=1f83b6a45f27244b6becafe90328ebe397d82cce767abf1f79416deee4a53a45,2026-02-09T13:31:00Z,,"Früher wurde im Skispringen über Keile in den Schuhen oder die Krümmung der Bindung gestritten. Doch im Jahr 2026 überschreitet der Kampf um den Auftrieb eine Grenze, die sich kaum jemand vorstellen … [+3194 chars]",,de,'Schatten'
https://www.appgefahren.de/jackery-solargenerator-im-winter-sale-besonders-guenstig-kaufen-394396.html,https://www.appgefahren.de/jackery-solargenerator-im-winter-sale-besonders-guenstig-kaufen-394396.html,0,www.appgefahren.de,Jackery Solargenerator im Winter-Sale besonders günstig kaufen,"Anzeige. Die dunkle Jahreszeit ist besonders für Solargeneratoren hart, da einfach die Sonne fehlt, mit der sich kostenlos Strom produzieren lässt. Allerdings ist die Jahreszeit bestens geeignet um sich eine neue Powerstation oder Solargenerator anzuschaffen,…",https://www.appgefahren.de/wp-content/uploads/2026/02/Jackery-Winter-Sale.jpg,2026-02-09T14:10:04Z,,"Anzeige. Die dunkle Jahreszeit ist besonders für Solargeneratoren hart, da einfach die Sonne fehlt, mit der sich kostenlos Strom produzieren lässt. Allerdings ist die Jahreszeit bestens geeignet um s… [+4829 chars]",,de,'Sonne'
https://www.diepresse.com/20561981/die-waechter-des-eismeers-haben-in-groenland-viel-zu-tun,https://www.diepresse.com/20561981/die-waechter-des-eismeers-haben-in-groenland-viel-zu-tun,0,www.diepresse.com,Die Wächter des Eismeers haben in Grönland viel zu tun [premium],"Klimawandel und politische Begehrlichkeiten machen den Grönländern Sorgen. Wer auf die größte Insel der Erde reist, erlebt überwältigende Natur – und die Kultur der Inuit im Umbruch.",https://img.diepresse.com/public/incoming/uqcltx-1-eisberge-r%C3%B8depynt-kangertittivaq-win-schumacher-weltwegejpgjpg/alternates/DPR_SOCIAL_MAGAZIN/1%20Eisberge%20R%C3%B8depynt%20Kangertittivaq%20%C2%A9%20Win%20Schumacher%20WeltwegeJPG.JPG,2026-02-09T14:35:49Z,,"Am zweiten Tag, nachdem die Gletscher und Gipfel von Island am Horizont verschwunden sind, rücken die Eisberge vor dem Schiff immer dichter zusammen. Es scheint, als ob sich die schwimmenden Giganten… [+11340 chars]",,de,'Klimawandel'
https://www.sueddeutsche.de/sport/olympia-lindsey-vonn-sturz-folgen-verletzung-li.3384426,https://www.sueddeutsche.de/sport/olympia-lindsey-vonn-sturz-folgen-verletzung-li.3384426,0,www.sueddeutsche.de,"Lindsey Vonn: Eine Karriere, größer als ihr Sport",Ihre Strahlkraft hat der unter Druck geratenen Skiszene geholfen – aber auch alle anderen in den Schatten gestellt. Das Drama von Cortina zeigt die Ambivalenz des Superstars Lindsey Vonn.,https://www.sueddeutsche.de/2026/02/09/19c68326-aae6-463b-a82b-44137c763d88.jpg?q=60&fm=webp&width=1200&rect=0%2C0%2C2960%2C1665,2026-02-09T15:14:02Z,,"Es brach etwas entzwei, das ist eine Geschichte dieser olympischen Abfahrt von Cortina dAmpezzo, die wenig erzählt wurde: Es brach die Goldmedaille der Olympiasiegerin Breezy Johnson, die am Sonntag … [+367 chars]",,de,'Schatten'
https://www.zeit.de/news/2026-01/06/neue-jets-und-alte-schatten-lufthansa-feiert-100-jahre,https://www.zeit.de/news/2026-01/06/neue-jets-und-alte-schatten-lufthansa-feiert-100-jahre,0,www.zeit.de,Nummer 1 in Europa: Neue Jets und alte Schatten - Lufthansa feiert 100 Jahre,Hier finden Sie Informationen zu dem Thema „Nummer 1 in Europa“. Lesen Sie jetzt „Neue Jets und alte Schatten - Lufthansa feiert 100 Jahre“.,https://img.zeit.de/news/2026-01/06/neue-jets-und-alte-schatten-lufthansa-feiert-100-jahre-image-group/wide__1300x731,2026-02-09T15:18:53Z,,"Es ist kein einfaches Jubiläum, das die Lufthansa im neuen Jahr groß feiern will. Heute steht der 100. Jahrestag der Gründung der ersten «Deutsche Luft Hansa Aktiengesellschaft» in Berlin an, doch di… [+8854 chars]",,de,'Schatten'
https://www.telepolis.de/article/Die-Festplatte-der-Zukunft-ist-nur-drei-Atome-dick-11170567.html,https://www.telepolis.de/article/Die-Festplatte-der-Zukunft-ist-nur-drei-Atome-dick-11170567.html,0,www.telepolis.de,Die Festplatte der Zukunft ist nur drei Atome dick,"Forscher stapeln drei Materialschichten – und erschaffen damit einen Datenspeicher, der alles bisherige in den Schatten stellen könnte.",https://heise.cloudimg.io/bound/1200x1200/q85.png-lossy-85.webp-lossy-85.foil1/_www-heise-de_/imgs/18/5/0/2/4/7/4/3/shutterstock_2466032013-9069523c9c24952a.jpg,2026-02-09T16:00:00Z,,"(Bild: Hasnain_Abbas / Shutterstock.com)
Forscher stapeln drei Materialschichten und erschaffen damit einen Datenspeicher, der alles bisherige in den Schatten stellen könnte.
Festplatten und Speich… [+3701 chars]",,de,'Schatten'
https://www.focus.de/reisen/25-grad-im-winter-halber-liter-bier-kostet-2-50-euro-briten-entdecken-neues-urlaubsziel_6e47fce8-97d7-466e-ab0d-2ce3368d4951.html,https://www.focus.de/reisen/25-grad-im-winter-halber-liter-bier-kostet-2-50-euro-briten-entdecken-neues-urlaubsziel_6e47fce8-97d7-466e-ab0d-2ce3368d4951.html,0,www.focus.de,"25 Grad im Winter, halber Liter Bier kostet 2,50 Euro: Briten entdecken neues Urlaubsziel",Der Sonne entfliehen und dabei den Geldbeutel schonen. Laut einer Umfrage einer Fluggesellschaft haben viele Briten ihren bevorzugten Winter-Hotspot gefunden.,https://quadro.burda-forward.de/ctf/c6ed6a02-6103-43c9-a730-b722a526b47f.c87e26f2-4117-435c-9b11-c694ec342811.jpg?im=RegionOfInterestCrop%3D%281200%2C630%29%2CregionOfInterest%3D%281063%2C894%29&hash=af0a347fb0df36f063b2ac0610f4e3941de0ce08371c7e4b9defda3c4ffba0bc,2026-02-09T20:00:00Z,,"Die Briten sind ein reiselustiges Volk und offenbar sehr findig darin, neue erschwingliche Reiseziele zu entdecken. Weil die Preise in österreichischen und schweizerischen Wintersportorten ins Uferlo… [+2036 chars]",,de,'Sonne'
https://www.zeit.de/news/2026-02/10/studie-klimawandel-koennte-weideflaechen-bis-2100-halbieren,https://www.zeit.de/news/2026-02/10/studie-klimawandel-koennte-weideflaechen-bis-2100-halbieren,0,www.zeit.de,Prognose zur Klimakrise: Studie: Klimawandel könnte Weideflächen bis 2100 halbieren,Hier finden Sie Informationen zu dem Thema „Prognose zur Klimakrise“. Lesen Sie jetzt „Studie: Klimawandel könnte Weideflächen bis 2100 halbieren“.,https://img.zeit.de/news/2026-02/10/studie-klimawandel-koennte-weideflaechen-bis-2100-halbieren-image-group/wide__1300x731,2026-02-10T03:30:06Z,,Weideflächen könnten sich einer Prognose zufolge bei einem weltweiten Temperaturanstieg infolge des Klimawandels künftig deutlich verkleinern. Je nach Szenario würden bis zum Jahr 2100 etwa 36 bis 50… [+2298 chars],,de,'Klimawandel'
https://www.nzz.ch/schweiz/die-grosse-welt-im-wallis-das-beschauliche-bergdorf-bellwald-soll-ein-80-millionen-hotel-erhalten-ld.1919882,https://www.nzz.ch/schweiz/die-grosse-welt-im-wallis-das-beschauliche-bergdorf-bellwald-soll-ein-80-millionen-hotel-erhalten-ld.1919882,0,www.nzz.ch,Die grosse Welt im Wallis: Das beschauliche Bergdorf Bellwald soll ein 80-Millionen-Hotel erhalten,"Ein einheimischer Bauunternehmer plant ein Projekt mit 280 neuen Betten – auf einer Gommer Sonnenterrasse mit 350 Einwohnern. Es geht auch um Verflechtungen, Zweitwohnungen und Gedanken an Christian Constantin. Eine Stilstudie aus dem Oberwallis.","https://img.nzz.ch/2026/01/16/5ee263b9-1f21-4359-afb4-162ba906aa33.jpg?width=1200&height=675&fit=bounds&quality=75&auto=webp&crop=1536,864,x0,y80&wmark=nzz",2026-02-10T04:30:00Z,,"Ein einheimischer Bauunternehmer plant ein Projekt mit 280 neuen Betten auf einer Gommer Sonnenterrasse mit 350 Einwohnern. Es geht auch um Verflechtungen, Zweitwohnungen und Gedanken an Christian Co… [+12469 chars]",,de,'Sonne'
https://science.orf.at/stories/3234142/,https://science.orf.at/stories/3234142/,0,science.orf.at,Erderwärmung könnte Weideflächen halbieren,"Durch die Erderwärmung könnten Weideflächen weltweit deutlich schrumpfen. Je nach Szenario könnten laut einer neuen Studie bis zum Jahr 2100 etwa 36 bis 50 Prozent ihre Nutzbarkeit verlieren. 110 bis 140 Mio. Menschen, die von Weidewirtschaft leben, wären bet…",https://ibs.orf.at/science?image=https%3A%2F%2Ftubestatic.orf.at%2Fmims%2F2020%2F41%2F92%2Fcrops%2Fw%3D1200%2Ch%3D627%2Cq%3D75%2F714156_master_247492_france_-_agriculture_-_lifestyle_2.jpg%3Fs%3D1919cf1af9cf9527083d0554b04d9680e6cb5c71,2026-02-10T08:33:34Z,,"Weidehaltung ist stark von Umweltfaktoren wie Temperatur, Luftfeuchtigkeit und Wasserverfügbarkeit abhängig, sagt Coautor Maximilian Kotz vom Potsdam-Institut für Klimafolgenforschung (PIK). Unsere E… [+1735 chars]",,de,'Erderwärmung'
