index,url,valid,domain,title,description,image,published,archive,content,quote,language,keyword
https://www.tagesschau.de/ausland/asien/wahlen-hongkong-106.html,https://www.tagesschau.de/ausland/asien/wahlen-hongkong-106.html,0,www.tagesschau.de,Hongkonger Parlamentswahl im Schatten der Brandkatastrophe,Viele Bewohner Hongkongs blicken ohne große Hoffnung auf die Parlamentswahlen. Seit 2021 sind nur noch China-treue Kandidaten zugelassen. Für die Bürger der Stadt ist gerade ein anderes Thema wichtiger. Von Eva Lamby-Schmitt.,https://images.tagesschau.de/image/48f0c162-f953-4b7c-b904-5e2a42376dc0/AAABmvfvtEE/AAABmt42H9g/16x9-big/wahlen-hongkong-108.jpg?width=1280,2025-12-07T08:31:13Z,,"Stand: 07.12.2025 09:31 Uhr
Viele Bewohner Hongkongsblicken ohne große Hoffnung auf die Parlamentswahlen. Seit 2021 sind nur noch China-treue Kandidaten zugelassen. Für die Bürger der Stadt ist gera… [+3103 chars]",,de,'Schatten'
https://www.bild.de/news/inland/wetter-temperaturen-bis-zu-18-grad-fruehling-im-advent-69353f6811f914c89b85579a,https://www.bild.de/news/inland/wetter-temperaturen-bis-zu-18-grad-fruehling-im-advent-69353f6811f914c89b85579a,0,www.bild.de,Aber leider ohne Sonne - Bis zu 18 Grad! Frühling im Advent,"Berlin – Der Winter lässt im Advent weiter auf sich warten. Denn das Wetter schaltet 2,5 Wochen vor Weihnachten in den Frühlingsmodus.","https://images.bild.de/69353f6811f914c89b85579a/9386d97c74a45e1a6b7b393b234290e3,a47c119b?w=1280",2025-12-07T09:44:54Z,,"Berlin  Der Winter lässt im Advent weiter auf sich warten. Denn das Wetter schaltet 2,5 Wochen vor Weihnachten in den Frühlingsmodus. In den kommenden Tagen werden Temperaturen im zweistelligen Berei… [+1362 chars]",,de,'Sonne'
https://www.brigitte.de/liebe/persoenlichkeit/ueberperformerin--schnorrerin--justitia--welcher-weihnachtstyp-bist-du--14050530.html,https://www.brigitte.de/liebe/persoenlichkeit/ueberperformerin--schnorrerin--justitia--welcher-weihnachtstyp-bist-du--14050530.html,0,www.brigitte.de,"Überperformerin, Justitia, Schnorrerin: Und welcher Weihnachtstyp bist du?","Manche bekommen schon beim Gedanken an Weihnachten Pickel, andere beginnen nach den Sommerferien, die Wohnung zu schmücken. Erkennst du dich in einem dieser sechs Weihnachtstypen wieder?",https://image.brigitte.de/14050642/t/7Q/v2/w1440/r1.7778/-/weihnachtstypen.jpg,2025-12-07T11:00:00Z,,"1) Die Überperformerin
Die Überperformerin sieht in Weihnachten ein riesiges Projekt, das es zu bewältigen gilt. Ein Projekt, das in einzelne Teilaufgaben und To-Do-Listen heruntergebrochen werden m… [+5661 chars]",,de,'Sommerferien'
https://www.n-tv.de/panorama/Vor-dem-dritten-Advent-wird-s-fruehlinghaft-und-nass-id30114981.html,https://www.n-tv.de/panorama/Vor-dem-dritten-Advent-wird-s-fruehlinghaft-und-nass-id30114981.html,0,www.n-tv.de,Bis zu 16 Grad: Vor dem dritten Advent wird's frühlinghaft - und nass,"Regen, Sonne - und zweistellige Temperaturen: In der Woche vor dem dritten Advent ist das Wetter alles andere als in Weihnachtsstimmung. Nach Höchstwerten von 16 Grad am Montag wird es zum Wochenende hin jedoch wieder etwas kühler.",https://www.n-tv.de/img/30115034/1765112973/Img_16_9/1200/Regentropfen-haengen-an-einer-Weihnachtskugel-mit-der-eine-Fichte-im-Wald-im-Taunus-geschmueckt-ist-Grau-trueb-und-nicht-winterlich-zeigt-sich-das-Wetter-am-ersten-Advent-im-Taunus.jpg,2025-12-07T12:21:35Z,,"Statt Schnee gibt es in der kommenden Vorweihnachts-Woche eine Menge Regen. (Foto: picture alliance / Jan Eifert)
Mit dem zweiten Advent bricht bereits Halbzeit auf dem Adventskranz an und Weihnacht… [+3412 chars]",,de,'Sonne'
https://www.zeit.de/news/2025-12/08/nach-dauerregen-im-suedwesten-zeigt-sich-wieder-die-sonne,https://www.zeit.de/news/2025-12/08/nach-dauerregen-im-suedwesten-zeigt-sich-wieder-die-sonne,0,www.zeit.de,Wetterbericht: Nach Dauerregen: Im Südwesten zeigt sich wieder die Sonne,Hier finden Sie Informationen zu dem Thema „Wetterbericht“. Lesen Sie jetzt „Nach Dauerregen: Im Südwesten zeigt sich wieder die Sonne“.,https://img.zeit.de/news/2025-12/08/nach-dauerregen-im-suedwesten-zeigt-sich-wieder-die-sonne-image-group/wide__1300x731,2025-12-08T04:52:34Z,,Nach reichlich Regen und Wind und auch Frost dürfen sich die Menschen wieder auf ein paar Sonnenstrahlen freuen. Laut dem Deutschen Wetterdienst (DWD) lässt der Dauerregen - vor allem im Schwarzwald … [+419 chars],,de,'Sonne'
https://www.stern.de/lifestyle/leute/jan-zimmermann--sein-engster-freund-meldet-sich-nach-seinem-tod-36938166.html,https://www.stern.de/lifestyle/leute/jan-zimmermann--sein-engster-freund-meldet-sich-nach-seinem-tod-36938166.html,0,www.stern.de,"""Gewitter im Kopf"": Jan Zimmermanns engster Freund und Partner meldet sich nach dessen Tod","Der Tod von Streamer Jan Zimmermann (""Gewitter im Kopf"") berührte viele Menschen. Nun verabschiedet sich sein bester Freund und Streaming-Partner öffentlich von ihm.",https://image.stern.de/36938200/t/8O/v1/w1440/r1.7778/-/jan-zimmermann-und-tim-lehmann.jpg,2025-12-08T05:41:00Z,,"Kopiere den aktuellen Link
Zur Merkliste hinzufügen
Der Tod von Streamer Jan Zimmermann (""Gewitter im Kopf"") berührte viele Menschen. Nun verabschiedet sich sein bester Freund und Streaming-Partner… [+9328 chars]",,de,'Gewitter'
https://www.zeit.de/news/2025-12/08/rekordwerte-fuer-strom-aus-wind-und-sonne,https://www.zeit.de/news/2025-12/08/rekordwerte-fuer-strom-aus-wind-und-sonne,0,www.zeit.de,Stromproduktion in Deutschland: Rekordwerte für Strom aus Wind und Sonne,Hier finden Sie Informationen zu dem Thema „Stromproduktion in Deutschland“. Lesen Sie jetzt „Rekordwerte für Strom aus Wind und Sonne“.,https://img.zeit.de/news/2025-12/08/rekordwerte-fuer-strom-aus-wind-und-sonne-image-group/wide__1300x731,2025-12-08T08:10:59Z,,"Windkraft und Sonne vor Kohle und Gas: Der in Deutschland erzeugte Strom stammte im dritten Quartal 2025 zu zwei Dritteln (64,1 Prozent) aus erneuerbaren Quellen. Das war nach Angaben des Statistisch… [+2039 chars]",,de,'Sonne'
https://www.faz.net/aktuell/wissen/erde-klima/golfstromkollaps-kaelteeinbruch-fuer-europa-wahrscheinlicher-denn-je-accg-200335827.html,https://www.faz.net/aktuell/wissen/erde-klima/golfstromkollaps-kaelteeinbruch-fuer-europa-wahrscheinlicher-denn-je-accg-200335827.html,0,www.faz.net,ErderwÄrmung: „Der Weltklimabericht muss hier revidiert werden“,Der Zusammenbruch des Nordatlantik- und Golfstroms ist von deutschen Forschern neu berechnet worden. Ein Kälteeinbruch für Europa ist für sie wahrscheinlicher denn je.,https://media0.faz.net/image/w1200h627/c64b5f6e8e39/w3000h1567x0y216o/201503/431.0.34525547/eisberge-vor-ilulissat-auf.webp,2025-12-08T16:18:55Z,,Kaum etwas steht sinnbildlich so für die Klimakatastrophe wie die Bilder vom Golfstromkollaps und die daraus folgende europäische Eiszeit. Gleichzeitig wird in den Rechenmodellen der Klimaforschung a… [+458 chars],,de,'Erderwärmung'
https://www.zeit.de/news/2025-12/09/sonne-und-milde-temperaturen-in-bayern,https://www.zeit.de/news/2025-12/09/sonne-und-milde-temperaturen-in-bayern,0,www.zeit.de,Wetter: Sonne und milde Temperaturen in Bayern,Hier finden Sie Informationen zu dem Thema „Wetter“. Lesen Sie jetzt „Sonne und milde Temperaturen in Bayern“.,https://img.zeit.de/news/2025-12/09/sonne-und-milde-temperaturen-in-bayern-image-group/wide__1300x731,2025-12-09T05:36:21Z,,Das Wetter zeigt sich in Bayern von seiner sonnigen Seite. Vor allem im Süden soll es nach Angaben des Deutschen Wetterdienstes (DWD) sehr mild werden. Gebietsweise trübe jedoch Nebel die Sicht. Bis … [+1094 chars],,de,'Sonne'
https://www.n-tv.de/wissen/2025-koennte-zum-zweitwaermsten-Jahr-werden-id30120789.html,https://www.n-tv.de/wissen/2025-koennte-zum-zweitwaermsten-Jahr-werden-id30120789.html,0,www.n-tv.de,Auch November platziert sich: 2025 könnte zum zweitwärmsten Jahr werden,"Die Erderwärmung schreitet fortwährend voran. Jedes Jahr werden neue Temperaturrekorde gemessen. Auch dieses Jahr ist ganz weit vorn mit dabei. Um diesen traurigen Trend zu durchbrechen, hilft nur eins.",https://www.n-tv.de/img/30120811/1765269910/Img_16_9/1200/Autumn-is-a-season-that-occurs-in-the-Northern-Hemisphere-typically-between-September-and-November-It-is-characterized-by-cooler-temperatures-changing-leaves-and-the-harvest-of-crops-During-autumn-deciduous-trees-lose-their-leaves-and-many-change-colors-to-shades-of-yellow-orange-and-red-before-they-fall-to-the-ground.jpg,2025-12-09T08:53:11Z,,"Auch November platziert sich2025 könnte zum zweitwärmsten Jahr werden
Mancherorts fühlte sich der November noch wie Spätsommer an. (Foto: IMAGO/Pond5 Images)
Die Erderwärmung schreitet fortwährend … [+2501 chars]",,de,'Erderwärmung'
https://www.zeit.de/news/2025-12/09/forschungsbericht-ohne-co2-entnahme-keine-klimaneutralitaet,https://www.zeit.de/news/2025-12/09/forschungsbericht-ohne-co2-entnahme-keine-klimaneutralitaet,0,www.zeit.de,Klimawandel: Forschungsbericht: Ohne CO2-Entnahme keine Klimaneutralität,Hier finden Sie Informationen zu dem Thema „Klimawandel“. Lesen Sie jetzt „Forschungsbericht: Ohne CO2-Entnahme keine Klimaneutralität“.,https://img.zeit.de/news/2025-12/09/forschungsbericht-ohne-co2-entnahme-keine-klimaneutralitaet-image-group/wide__1300x731,2025-12-09T14:00:06Z,,"Damit Deutschland bis 2045 treibhausgasneutral werden kann, reicht die Verringerung der Emissionen allein nicht aus - es braucht auch aktive CO2-Entnahmen. Das zeigt der Bericht von mehr als 100 Fors… [+3784 chars]",,de,'Klimawandel'
https://www.faz.net/aktuell/wirtschaft/un-bericht-klimawandel-erfordert-sofortigen-kurswechsel-110800276.html,https://www.faz.net/aktuell/wirtschaft/un-bericht-klimawandel-erfordert-sofortigen-kurswechsel-110800276.html,0,www.faz.net,Bericht zu Umweltkrisen: Noch kann die Welt gerettet werden,"Klimawandel, Raubbau an der Natur und Umweltverschmutzung werden immer bedrohlicher. Wissenschaftler fordern grundlegende Veränderungen – zeigen aber auch positive Entwicklungen auf.",https://media0.faz.net/image/w1200h627/6f1b38d26fa2/w3000h1567x0y224o/202511/43601.0.1446482621/noch-besteht-hoffnung-dass-die.webp,2025-12-09T15:37:30Z,,"Wissenschaftler fordern eindringlich einen Kurswechsel, damit sich die Lebensbedingungen auf der Erde nicht katastrophal verschlechtern. Werde die Wirtschaft weiterhin nach dem Prinzip Business as us… [+3704 chars]",,de,'Klimawandel'
https://www.n-tv.de/politik/EU-setzt-sich-Klimaschutz-Ziel-fuer-2040-id30124551.html,https://www.n-tv.de/politik/EU-setzt-sich-Klimaschutz-Ziel-fuer-2040-id30124551.html,0,www.n-tv.de,"""Pragmatisch und ambitioniert"": EU setzt sich Klimaschutz-Ziel für 2040",Im Kampf gegen den Klimawandel einigt sich die EU auf ein neues Ziel. Das soll - anders als bisher - auch mit Hilfe aus dem außereuropäischen Ausland erreicht werden. Beim Tanken und Heizen setzen sich die osteuropäischen Staaten durch.,https://www.n-tv.de/img/30124567/1765333468/Img_16_9/1200/22-11-2023-Berlin-Deutschland-Stau-am-Morgen-auf-der-A113-stadteinwaerts-in-Hoehe-Abfahrt-Johannisthaler-Chaussee-00S231122D129CARO.jpg,2025-12-10T01:29:08Z,,"""Pragmatisch und ambitioniert"" EU setzt sich Klimaschutz-Ziel für 2040
Das geplante CO2-Preissystem für den Straßenverkehr und Gebäudeheizungen wird um ein Jahr auf 2028 verschoben. (Foto: picture a… [+3038 chars]",,de,'Klimawandel'
https://www.faz.net/aktuell/wirtschaft/klima-nachhaltigkeit/eu-setzt-sich-neues-ziel-fuer-den-klimaschutz-accg-200342064.html,https://www.faz.net/aktuell/wirtschaft/klima-nachhaltigkeit/eu-setzt-sich-neues-ziel-fuer-den-klimaschutz-accg-200342064.html,0,www.faz.net,Treibhausgasemissionen: EU setzt sich neues Ziel für den Klimaschutz,Im Kampf gegen den Klimawandel einigt sich die EU auf ein neues Ziel – anders als bisher aber mit Hilfe aus dem außereuropäischen Ausland. Für Verbraucher gibt es in Sachen Tanken und Heizen Neues.,https://media0.faz.net/image/w1200h627/0f469d053a71/w3000h1567x0y300o/202512/43601.0.1567131340/muenchen-demonstration-von.webp,2025-12-10T02:17:26Z,,Die EU will im Kampf gegen den Klimawandel die Treibhausgasemissionen bis 2040 um 90 Prozent im Vergleich zu 1990 reduzieren. Eine in Brüssel von Unterhändlern der Mitgliedstaaten und des Europaparla… [+4444 chars],,de,'Klimawandel'
https://www.zeit.de/news/2025-12/10/mild-und-trueb-kaum-sonne-in-hessen,https://www.zeit.de/news/2025-12/10/mild-und-trueb-kaum-sonne-in-hessen,0,www.zeit.de,Wetter: Mild und trüb - kaum Sonne in Hessen,Hier finden Sie Informationen zu dem Thema „Wetter“. Lesen Sie jetzt „Mild und trüb - kaum Sonne in Hessen“.,https://img.zeit.de/news/2025-12/10/mild-und-trueb-kaum-sonne-in-hessen-image-group/wide__1300x731,2025-12-10T05:54:18Z,,"Die kommenden Tage werden in Hessen erneut sehr mild. Am Mittwoch ist zunächst mit etwas Regen oder Sprühregen zu rechnen, wie der Deutsche Wetterdienst (DWD) mitteilt. Zum Abend seien im Nordwesten … [+689 chars]",,de,'Sonne'
https://www.dw.com/de/mutter-teresa-film-feminismus-armut-indien-kirche/a-75076658,https://www.dw.com/de/mutter-teresa-film-feminismus-armut-indien-kirche/a-75076658,0,www.dw.com,Ikone mit Brüchen: Neuer Film über Mutter Teresa,"Indien in den 1940er Jahren: Der Film ""Teresa - Ein Leben zwischen Licht und Schatten"" zeigt eine Nonne inmitten von Selbstzweifeln, strengen Prinzipien und Opferbereitschaft. Und stellt die Frage: War Teresa Feministin?",https://static.dw.com/image/75078540_6.jpg,2025-12-10T09:18:00Z,,"Teresa war 19 Jahre alt, als sie als Novizin nach Indien ging - wo sie mit Elend, Hunger, und Krankheit konfrontiert wurde. Sie lebte als Nonne und Lehrerin in Kalkutta, im katholischen Loreto-Orden,… [+6026 chars]",,de,'Schatten'
https://www.diepresse.com/20392029/silber-stellt-heuer-bitcoin-und-sogar-gold-in-den-schatten,https://www.diepresse.com/20392029/silber-stellt-heuer-bitcoin-und-sogar-gold-in-den-schatten,0,www.diepresse.com,Silber stellt heuer Bitcoin und sogar Gold in den Schatten [premium],"Der Silberpreis ist erstmals über 60 Dollar je Feinunze geklettert. Nachdem er seinen 45 Jahre alten Rekord von 50 Dollar übersprungen hatte, scheint er kein Halten mehr zu kennen. Was sind die Hintergründe?",https://img.diepresse.com/public/incoming/9h755-APAIMG_509089222.HR.jpg/alternates/DPR_SOCIAL_NACHRICHTEN/APAIMG_509089222.HR.jpg,2025-12-10T10:00:46Z,,"Das laufende Jahr hat ein paar Überraschungen geboten, auf die zu Jahresbeginn kaum jemand gewettet hätte: Etwa dass der Wiener Leitindex ATX den technologielastigen US-Index Nasdaq 100 schlagen würd… [+5205 chars]",,de,'Schatten'
https://www.dw.com/de/private-credit-risiko-im-schatten-der-banken/a-74972113,https://www.dw.com/de/private-credit-risiko-im-schatten-der-banken/a-74972113,0,www.dw.com,Private Credit: Risiko im Schatten der Banken,Immer mehr Kredite werden außerhalb des Bankensektors vergeben. Experten warnen vor Finanzmarktrisiken. Droht durch Private Credit die nächste Finanzkrise?,https://static.dw.com/image/71563000_6.jpg,2025-12-10T10:55:00Z,,"Während der Fokus der Aufmerksamkeit auf dem Börsenhype rund um Künstliche Intelligenz (KI) liegt, gärt im Hintergrund ein weniger beachtetes Thema: Private Credit. Damit ist die Vergabe von Krediten… [+8279 chars]",,de,'Schatten'
https://orf.at/stories/3414008/,https://orf.at/stories/3414008/,0,orf.at,US-Umweltschutzbehörde löscht Infos zu Klimawandel,,https://orf.at/mojo/1_4_1/storyserver//news/common/images/og-fallback-news.png,2025-12-10T12:52:27Z,,"Die US-Umweltschutzbehörde EPA hat Informationen zur Verantwortung der Menschheit für den Klimawandel von ihrer Website gelöscht.
Wie US-Medien gestern berichteten, geht es auf den Informationsseite… [+889 chars]",,de,'Klimawandel'
https://www.welt.de/regionales/hamburg/article69396f657a0ab5a4f7a80b51/veraenderungen-beim-niederschlag-solche-extreme-fordern-uns-hamburg-wasser-im-klimawandel-stresstest.html,https://www.welt.de/regionales/hamburg/article69396f657a0ab5a4f7a80b51/veraenderungen-beim-niederschlag-solche-extreme-fordern-uns-hamburg-wasser-im-klimawandel-stresstest.html,0,www.welt.de,„Solche Extreme fordern uns“ – Hamburg Wasser im Klimawandel-Stresstest,"Die Niederschlagsverteilung in Hamburg verändert sich: weniger gleichmäßiger Regen, dafür längere Trockenperioden und heftige Schauer. Hamburg Wasser sieht sich vor große Herausforderungen bei Trinkwasserversorgung und Abwasserentsorgung.",https://images.welt.de/69396f657a0ab5a4f7a80b51/e432a6cdd6e6ca4becad312d683acd73-master/ci16x9-w1200/dpa-com-20090101-251210-911-011956-jpg,2025-12-10T13:33:17Z,,"Die Niederschlagsverteilung in Hamburg verändert sich: weniger gleichmäßiger Regen, dafür längere Trockenperioden und heftige Schauer. Hamburg Wasser sieht sich vor große Herausforderungen bei Trinkw… [+2946 chars]",,de,'Klimawandel'
https://www.faz.net/aktuell/rhein-main/region-und-hessen/wie-die-stadt-darmstadt-ihren-wald-heilt-200344187.html,https://www.faz.net/aktuell/rhein-main/region-und-hessen/wie-die-stadt-darmstadt-ihren-wald-heilt-200344187.html,0,www.faz.net,Anpassung an Klimawandel: Wie die Stadt ihren Wald heilt,"Der Stadt Darmstadt gelingt es, ihrem Wald Gutes zu tun, indem sie ihn in Ruhe lässt. Bäume werden nicht gefällt, noch nicht einmal, wenn sie tot sind.",https://media0.faz.net/image/w1200h627/4339e6f4fcdc/w4252h2221x0y85o/201108/431.0.50339286/erfolg-dank-einer-neuen-pflege.webp,2025-12-10T14:01:00Z,,"Der Wald wird in Darmstadt leicht vergessen. Darmstadt präsentiert sich als Wissenschaftsstadt, weil Hochschulen und forschende Unternehmen dort ihren Sitz haben, gilt als Stadt des Jugendstils und i… [+1994 chars]",,de,'Klimawandel'
https://www.n-tv.de/politik/US-Behoerde-veraendert-Gruende-fuer-Klimawandel-auf-eigener-Website-id30127365.html,https://www.n-tv.de/politik/US-Behoerde-veraendert-Gruende-fuer-Klimawandel-auf-eigener-Website-id30127365.html,0,www.n-tv.de,Trump bestreitet Fakten : US-Behörde verändert Gründe für Klimawandel auf eigener Website,"Für US-Präsident Donald Trump ist es der ""weltweit größten Betrug aller Zeiten"". In seiner UN-Rede und durch die Förderung fossiler Brennstoffe wird sein Kampf gegen den Klimawandel deutlich. Nun legen Medienberichte offen, dass eine Umweltschutzbehörde diese…",https://www.n-tv.de/img/30127436/1765376850/Img_16_9/1200/An-old-bridge-part-of-rests-of-the-disappear-village-of-Penarrubia-is-visible-in-the-Guadalteba-reservoir-due-to-low-water-levels-amid-the-severe-drought-in-Andalusia-Andalusia-s-reservoirs-are-at-minimum-levels-as-a-result-of-the-severe-drought-in-Spain-due-to-the-lack-of-rainfall-in-recent-years-The-Andalusian-Government-has-taken-measures-to-limit-the-amount-of-water-used-in-some-Andalusian-villages-and-is-preparing-to-allow-ports-to-receive-ships-loaded-with-water-from-other-countries-to-help-replenish-the-reserves.jpg,2025-12-10T15:17:57Z,,"Wegen der Erderwärmung gibt es in vielen Regionen der Welt häufiger und öfter extremes Wetter, wie Hitzewellen und Dürren. (Foto: picture alliance / Sipa USA)
Für US-Präsident Donald Trump ist es de… [+1862 chars]",,de,'Erderwärmung'
https://www.sueddeutsche.de/politik/nahost-liveblog-news-gazastreifen-israel-unwetter-sturm-li.3336216,https://www.sueddeutsche.de/politik/nahost-liveblog-news-gazastreifen-israel-unwetter-sturm-li.3336216,0,www.sueddeutsche.de,Krieg in Nahost: Starkes Unwetter bedroht Menschen in Israel und Gaza,"Ein Sturmtief bringt viel Regen, teils starken Wind und Gewitter. Im Gazastreifen stürzen viele Zelte ein, Menschen suchen Schutz in oft überfüllten und unbeheizten öffentlichen Gebäuden.",https://www.sueddeutsche.de/2025/12/10/f72a8170-2559-467d-8b28-2f1467dd7d66.jpg?q=60&fm=webp&width=1200&rect=0%2C209%2C4000%2C2250,2025-12-10T16:28:00Z,,Bundeskanzler Friedrich Merz sieht in absehbarer Zukunft keine Voraussetzungen für die Anerkennung eines palästinensischen Staates durch Deutschland. Das sagte der CDU-Politiker nach einem Treffen mi… [+1860 chars],,de,'Gewitter'
https://www.n-tv.de/leute/Meghan-schreibt-ihrem-todkranken-Vater-id30128201.html,https://www.n-tv.de/leute/Meghan-schreibt-ihrem-todkranken-Vater-id30128201.html,0,www.n-tv.de,Erster Kontakt seit Jahren?: Meghan schreibt ihrem todkranken Vater,Sie sollen lange nicht mehr miteinander gesprochen haben. Sehr lange. Schließlich überwarfen sich Herzogin Meghan und ihr Vater Thomas Markle schon bei ihrer Hochzeit 2018. Jetzt springt sie jedoch über ihren Schatten - und schreibt ihrem todkranken Vater ein…,https://www.n-tv.de/img/30128186/1765384240/Img_16_9/1200/Meghan-Herzogin-von-Sussex-nimmt-am-Elterngipfel-der-Archewell-Foundation-zum-Thema-Psychisches-Wohlbefinden-im-digitalen-Zeitalter-im-Rahmen-des-Welttages-der-psychischen-Gesundheit-von-Project-Healthy-Minds-teil.jpg,2025-12-10T18:09:33Z,,"Erster Kontakt seit Jahren?Meghan schreibt ihrem todkranken Vater
Schrieb ihrem Vater einen Brief: Herzogin Meghan. (Foto: picture alliance/dpa/AP)
Sie sollen lange nicht mehr miteinander gesproche… [+3730 chars]",,de,'Schatten'
https://www.stern.de/lifestyle/leute/christina-onassis-waere-75-jahre-alt-geworden--ein-leben-zwischen-jetset-und-abgrund-36950184.html,https://www.stern.de/lifestyle/leute/christina-onassis-waere-75-jahre-alt-geworden--ein-leben-zwischen-jetset-und-abgrund-36950184.html,0,www.stern.de,Christina Onassis wäre 75 Jahre alt geworden: Ein Leben zwischen Jetset und Abgrund,Christina Onassis wuchs im Schatten eines immensen Reichtums auf und zerbrach daran. Am 11. Dezember wäre sie 75 geworden.,https://image.stern.de/36950188/t/Ye/v1/w1440/r1.7778/-/11--ein-leben-zwischen-jetset-und-abgrund---16-9---spoton-article-1125086.jpg,2025-12-11T05:16:00Z,,"Kopiere den aktuellen Link
Zur Merkliste hinzufügen
Christina Onassis wuchs im Schatten eines immensen Reichtums auf und zerbrach daran. Am 11. Dezember wäre sie 75 geworden.
Armes, reiches Mädche… [+8547 chars]",,de,'Schatten'
https://www.stern.de/kultur/krankheit-im-urlaub--so-ist-man-gut-vorbereitet-36950562.html,https://www.stern.de/kultur/krankheit-im-urlaub--so-ist-man-gut-vorbereitet-36950562.html,0,www.stern.de,Krankheit im Urlaub: So ist man gut vorbereitet,"Wer vor dem Winter in die Sonne fliehen möchte, sollte sich gut vorbereiten - auch was mögliche Krankheiten im Ausland angeht.",https://image.stern.de/36950566/t/yG/v1/w1440/r1.7778/-/11--so-ist-man-gut-vorbereitet---16-9---spoton-article-1124319.jpg,2025-12-11T07:21:00Z,,"Kopiere den aktuellen Link
Zur Merkliste hinzufügen
Wer vor dem Winter in die Sonne fliehen möchte, sollte sich gut vorbereiten - auch was mögliche Krankheiten im Ausland angeht.
Die Koffer gepack… [+7287 chars]",,de,'Sonne'
https://www.zeit.de/2025/53/klimawandel-kommunikation-mobilisierung-klimaschutz-apokalyptische-rhetorik,https://www.zeit.de/2025/53/klimawandel-kommunikation-mobilisierung-klimaschutz-apokalyptische-rhetorik,0,www.zeit.de,Klimawandel: Schluss mit der apokalyptischen Dauerschleife!,"Klimaschutz gelingt nicht mit immer düstereren Szenarien. Wer eine Gesellschaft zur Unterstützung bewegen will, muss anders kommunizieren – auch die Medien.",https://img.zeit.de/2025/53/die-position-schluss-mit-der-apokalyptischen-dauerschleife-bild-2/wide__1300x731,2025-12-11T10:02:22Z,,"Ralf Röchert leitet die Strategische Wissenschaftskommunikation am Alfred-Wegener-Institut in Bremerhaven.
Man kann pauschal beklagen, dass der Mensch vom Klimawandel nichts mehr hören will. Zuminde… [+369 chars]",,de,'Klimawandel'
https://www.dw.com/de/australien-tuvalu-klimawandel-migranten-ueberflutung-meeresspiegel/a-75107031,https://www.dw.com/de/australien-tuvalu-klimawandel-migranten-ueberflutung-meeresspiegel/a-75107031,0,www.dw.com,Australien nimmt erste Klima-Migranten aus Tuvalu auf,Australien bietet vom Klimawandel gefährdeten Bewohnern des Inselstaates eine neue Bleibe. Denn ein steigender Meeresspiegel könnte Tuvalu zum Verhängnis werden. Angesichts des drohenden Untergangs ihrer Heimat durch einen steigenden Meeresspiegel sind die er…,https://static.dw.com/image/72142245_6.jpg,2025-12-11T12:10:00Z,,Angesichts des drohenden Untergangs ihrer Heimat durch einen steigenden Meeresspiegel sind die ersten Klima-Migranten aus dem pazifischen Inselstaat Tuvalu in Australien eingetroffen. Das bestätigten… [+1257 chars],,de,'Klimawandel'
https://taz.de/Drohende-Ueberflutung-von-Tuvalu/!6137454/,https://taz.de/Drohende-Ueberflutung-von-Tuvalu/!6137454/,0,taz.de,Drohende Überflutung von Tuvalu: Erste Klima-Migranten aus Inselstaat in Australien gelandet,Der Inselstaat Tuvalu ist eins der vom Klimawandel am stärksten betroffenen Länder der Welt. Die ersten Einwohner wandern deshalb nach Australien aus.,https://taz.de/picture/8122530/1200/39900724.jpeg,2025-12-11T12:39:00Z,,Der Inselstaat Tuvalu ist eins der vom Klimawandel am stärksten betroffenen Länder der Welt. Die ersten Einwohner wandern deshalb nach Australien aus. mehr...,,de,'Klimawandel'
https://www.dw.com/de/klimawandel-machte-fluten-in-indonesien-sri-lanka-schlimmer-millionen-betroffen-tote-infrastruktur/a-75107051,https://www.dw.com/de/klimawandel-machte-fluten-in-indonesien-sri-lanka-schlimmer-millionen-betroffen-tote-infrastruktur/a-75107051,0,www.dw.com,Mehr Tote durch Klimawandel bei Fluten in Südostasien,"Wärmere Ozeane und stärkere Regenfälle haben die tödlichen Überschwemmungen in Indonesien, Sri Lanka und der Region verschärft, das zeigt eine Studie zur Rolle des Klimawandels. Millionen Menschen sind betroffen.",https://static.dw.com/image/75103808_6.jpg,2025-12-11T13:19:00Z,,"Es ist die tödlichste Naturkatastrophe seit vielen Jahren.
In den vergangen Wochen haben zwei Zyklone Sri Lanka, IndonesienThailand und Malaysia getroffen. Als Folge der extremen Regenfälle kam es z… [+3725 chars]",,de,'Klimawandel'
