index,url,valid,domain,title,description,image,published,archive,content,quote,language,keyword
https://www.welt.de/politik/ausland/article697ee066f0e62064809e0b6c/washington-76-meter-hoch-groesser-als-in-paris-trumps-vision-fuer-einen-triumphbogen.html,https://www.welt.de/politik/ausland/article697ee066f0e62064809e0b6c/washington-76-meter-hoch-groesser-als-in-paris-trumps-vision-fuer-einen-triumphbogen.html,0,www.welt.de,"76 Meter hoch, größer als in Paris – Trumps Vision für einen Triumphbogen","Erst ein Ballsall, nun auch noch ein Triumphbogen: Donald Trump gestaltet Washington um. Das Bauwerk soll den Arc de Triomphe in Paris und weitere Triumphbögen in den Schatten stellen – auch wichtige Bauwerke in Washington.",https://images.welt.de/697ee066f0e62064809e0b6c/2a27b85cf224ed01e0465653020cf84d/ci16x9-w1200/260123-trump-arch-jpg,2026-02-01T05:32:58Z,,"Erst ein Ballsall, nun auch noch ein Triumphbogen: Donald Trump gestaltet Washington um. Das Bauwerk soll den Arc de Triomphe in Paris und weitere Triumphbögen in den Schatten stellen auch wichtige B… [+2202 chars]",,de,'Schatten'
https://www.n-tv.de/sport/Abass-Baraou-verpasst-historische-deutsche-Box-Chance-id30310761.html,https://www.n-tv.de/sport/Abass-Baraou-verpasst-historische-deutsche-Box-Chance-id30310761.html,0,www.n-tv.de,Im Schatten der Öffentlichkeit: Abass Baraou verpasst historische deutsche Box-Chance,"Abass Baraou hatte deutsche Boxgeschichte schreiben wollen, doch sein Vorhaben endet mit einer bitteren Niederlage. Der Kämpfer aus Oberhausen unterliegt dem puertoricanischen WBO-Champion Xander Zayas nach Punkten.",,2026-02-01T06:37:52Z,,"Abass Baraou erlitt gegen Xander Zayas eine bittere Niederlage (Archivbild). (Foto: IMAGO/Torsten Helmke)
Abass Baraou hatte deutsche Boxgeschichte schreiben wollen, doch sein Vorhaben endet mit ein… [+2025 chars]",,de,'Schatten'
https://www.zeit.de/news/2026-02/01/regen-schnee-und-sonne-bayerns-wetter-bleibt-unbestaendig,https://www.zeit.de/news/2026-02/01/regen-schnee-und-sonne-bayerns-wetter-bleibt-unbestaendig,0,www.zeit.de,"Wettervorhersage: Regen, Schnee und Sonne: Bayerns Wetter bleibt unbeständig","Hier finden Sie Informationen zu dem Thema „Wettervorhersage“. Lesen Sie jetzt „Regen, Schnee und Sonne: Bayerns Wetter bleibt unbeständig“.",https://img.zeit.de/news/2026-02/01/regen-schnee-und-sonne-bayerns-wetter-bleibt-unbestaendig-image-group/wide__1300x731,2026-02-01T06:47:34Z,,"Bayern muss sich in den kommenden Tagen auf trübes Wetter einstellen. Längere Sonnenphasen sind am Sonntag nur an den Alpen zu erwarten, wie der Deutsche Wetterdienst (DWD) prognostizierte. Bis zum M… [+936 chars]",,de,'Sonne'
https://www.sueddeutsche.de/sport/jelena-rybakina-sieg-australian-open-tennis-trainer-spannungen-li.3379371,https://www.sueddeutsche.de/sport/jelena-rybakina-sieg-australian-open-tennis-trainer-spannungen-li.3379371,0,www.sueddeutsche.de,Australian-Open-Siegerin Rybakina: Ein Erfolg mit einem merkwürdigen Schatten,Nach ihrem Erfolg bei den Australian Open lenkt Jelena Rybakina den Fokus auch auf ihren Trainer – gegen den wegen schweren Vorwürfen schon eine Untersuchung lief.,https://www.sueddeutsche.de/2026/02/01/e866c310-578f-4da3-b448-1c5e41100b28.jpg?q=60&fm=webp&width=1200&rect=0%2C228%2C3873%2C2179,2026-02-01T10:19:41Z,,"Die Art, wie Jelena Rybakina ihren Grand-Slam-Sieg in Melbourne feierte, passte zu ihr. Es sah nämlich aus, als feiere sie ihn gar nicht. Die 26-Jährige, die in den vergangenen zwei Wochen so atember… [+337 chars]",,de,'Schatten'
https://www.golem.de/sonstiges/zustimmung/auswahl.html?from=https://www.golem.de/news/waerme-speichern-finnische-brauerei-speichert-strom-in-sand-2602-204883.html&referer=https://t.co/bd5a106a8c,https://www.golem.de/sonstiges/zustimmung/auswahl.html?from=https://www.golem.de/news/waerme-speichern-finnische-brauerei-speichert-strom-in-sand-2602-204883.html&referer=https://t.co/bd5a106a8c,0,www.golem.de,Wärme speichern: Finnische Brauerei speichert Strom in Sand,"Die Wärme für industrielle Prozesse wird in Sand gespeichert und bei Bedarf freigesetzt. So lässt sich Strom aus Wind und Sonne effektiv nutzen. (Energiewende, Strom)",,2026-02-02T10:30:02Z,,"Besuchen Sie Golem.de wie gewohnt mit Werbung und Tracking,
 indem Sie der Nutzung aller Cookies zustimmen.
 Details zum Tracking finden Sie im Privacy Center.
Skript wurde nicht geladen. Informat… [+607 chars]",,de,'Sonne'
https://www.faz.net/aktuell/wirtschaft/was-busfahrer-im-oeffentlichen-nahverkehr-verdienen-110829831.html,https://www.faz.net/aktuell/wirtschaft/was-busfahrer-im-oeffentlichen-nahverkehr-verdienen-110829831.html,0,www.faz.net,Großstreiktag im Nahverkehr: Sind Straßenbahnfahrer überlastet und unterbezahlt?,Der Tarifkampf im öffentlichen Nahverkehr stellt andere Lohnrunden in den Schatten. Verdi streikt für ein Plus von mehr als 20 Prozent. Was verdienen Tram- und Busfahrer?,https://media0.faz.net/image/w1200h627/2d02b2bd21e5/w6144h3210x0y443o/202602/43601.0.1728840909/strassenbahnen-der-dresdner.webp,2026-02-02T19:27:24Z,,Mit einem groß angelegten Streiktag hat die Gewerkschaft Verdi am Montag den öffentlichen Nahverkehr in fast allen Bundesländern lahmgelegt. Trotz unterschiedlicher Tarif­for­de­run­gen und Verhandlu… [+3574 chars],,de,'Schatten'
https://www.faz.net/aktuell/sport/mehr-sport/viel-risiko-wie-der-klimawandel-den-bergsport-veraendert-accg-110827158.html,https://www.faz.net/aktuell/sport/mehr-sport/viel-risiko-wie-der-klimawandel-den-bergsport-veraendert-accg-110827158.html,0,www.faz.net,"Bergsport und Klimawandel: Zu warm, zu viel Risiko",Einsteigen oder nicht? Der Klimawandel verändert den Bergsport und verlangt erhöhte Aufmerksamkeit. Laura Dahlmeier starb bei einem Steinschlag. Hat sie die Warnsignale am Laila Peak nicht gesehen?,https://media0.faz.net/image/w1200h627/8e63bca4ad7a/w2999h1566x0y60o/012026/1.10827155/im-wandel-der-laila-peak-und.webp,2026-02-03T05:26:36Z,,"Ob im pakistanischen Karakorum-Gebirge, im Himalaja, in den südamerikanischen Anden und natürlich auch in den Alpen: Die klimatischen Veränderungen hinterlassen auf der ganzen Welt gerade in den Berg… [+363 chars]",,de,'Klimawandel'
https://t3n.de/news/tech-milliardaere-wollten-sonne-dimmen-und-scheitern-an-transparenz-1699422/,https://t3n.de/news/tech-milliardaere-wollten-sonne-dimmen-und-scheitern-an-transparenz-1699422/,0,t3n.de,Tech-Milliardäre wollten heimlich die Sonne dimmen – und scheiterten an fehlender Transparenz,"Ein ausgemusterter Flugzeugträger, ein geheimnisvoller Apparat und das Geld von Tech-Milliardären. Ein Experiment in Kalifornien sollte die Welt verändern, doch dann kam alles ganz anders. Im April 2024 startete ein Team von Wissenschaftler:innen der Universi…",https://cdn.t3n.de/news/wp-content/uploads/2025/07/Wolken_und_Sonne.jpg?class=content,2026-02-03T15:55:00Z,,"Im April 2024 startete ein Team von Wissenschaftler:innen der University of Washington im gleichnamigen US-Bundesstaat einen Test, der enormes Potenzial versprach. Doch nach nur 20 Minuten wurde ihr … [+5175 chars]",,de,'Sonne'
https://www.zeit.de/kultur/2026-01/klimawandel-kapitalismus-umweltzerstoerung-naturschutz-alyssa-battistoni,https://www.zeit.de/kultur/2026-01/klimawandel-kapitalismus-umweltzerstoerung-naturschutz-alyssa-battistoni,0,www.zeit.de,"Klimawandel und Kapitalismus: ""Niemand sagt: Ich zerstöre den Planeten, weil ich Lust dazu habe""","Alyssa Battistoni will Natur nicht länger als Gratisgeschenk betrachten. Aber lässt der Kapitalismus eine Wahl? Hier erklärt sie, ob wir seiner Logik entkommen können.",https://img.zeit.de/kultur/2026-01/klimawandel-kapitalismus-umweltzerstoerung-naturschutz-alyssa-battistoni-bild/wide__1300x731,2026-02-03T18:33:35Z,,"Wir leben in Zeiten, die uns einiges Kopfzerbrechen bereiten. Deshalb fragen wir in dieser Serie, was interessante Köpfe gegenwärtig bedenkenswert finden. Heute antwortet Alyssa Battistoni, die Polit… [+730 chars]",,de,'Klimawandel'
https://www.n-tv.de/panorama/Kuba-erlebt-erstmals-null-Grad-id30321099.html,https://www.n-tv.de/panorama/Kuba-erlebt-erstmals-null-Grad-id30321099.html,0,www.n-tv.de,Negativrekord in der Karibik: Kuba erlebt erstmals null Grad,"Bei Kuba denkt man an tropische Wärme, Palmen und viel Sonne. Doch derzeit erlebt die Insel einen Kälteschock - zumindest für karibische Verhältnisse. Eine Wetterstation meldet einen negativen Temperaturrekord.",https://www.n-tv.de/img/30321071/1770149707/Img_16_9/1200/Huge-waves-break-over-Havana-s-light-tower-in-Havana-Cuba-February-1-2026.jpg,2026-02-03T19:39:50Z,,"Negativrekord in der KaribikKuba erlebt erstmals null Grad
Die Hauptstadt Havanna bleibt vom Frost verschont. (Foto: REUTERS)
Bei Kuba denkt man an tropische Wärme, Palmen und viel Sonne. Doch derz… [+2123 chars]",,de,'Sonne'
https://www.zeit.de/news/2026-02/04/erst-sonne-dann-wolken-und-glaettegefahr,https://www.zeit.de/news/2026-02/04/erst-sonne-dann-wolken-und-glaettegefahr,0,www.zeit.de,"Wetter: Erst Sonne, dann Wolken und Glättegefahr","Hier finden Sie Informationen zu dem Thema „Wetter“. Lesen Sie jetzt „Erst Sonne, dann Wolken und Glättegefahr“.",https://img.zeit.de/news/2026-02/04/erst-sonne-dann-wolken-und-glaettegefahr-image-group/wide__1300x731,2026-02-04T05:07:18Z,,"Nach kurzer Aufheiterung steht Bayern das Eintreffen eines neuen Tiefs aus Italien bevor. Der Deutsche Wetterdienst erwartet heute anfangs teils freundliches Wetter mit etwas Sonne, teils aber auch N… [+798 chars]",,de,'Sonne'
https://www.stern.de/gesellschaft/regional/bayern/wetter--erst-sonne--dann-wolken-und-glaettegefahr-37104264.html,https://www.stern.de/gesellschaft/regional/bayern/wetter--erst-sonne--dann-wolken-und-glaettegefahr-37104264.html,0,www.stern.de,"Wetter: Erst Sonne, dann Wolken und Glättegefahr",München (lby) - Nach kurzer Aufheiterung steht Bayern das Eintreffen eines neuen Tiefs aus Italien bevor. Der Deutsche Wetterdienst erwartet heute anfangs,https://image.stern.de/37104266/t/W9/v1/w1440/r1.7778/-/04--7itojvakhqv4axs2048jpeg---e87db5353c411666.jpg,2026-02-04T05:07:18Z,,"Kopiere den aktuellen Link
Zur Merkliste hinzufügen
Es wird ein wenig milder in Bayern. Auf den Straßen könnte es mancherorts aber wieder glatt werden.
Nach kurzer Aufheiterung steht Bayern das Ei… [+913 chars]",,de,'Sonne'
https://www.stern.de/gesellschaft/regional/baden-wuerttemberg/wetter-im-suedwesten--naechtliche-rutschpartie--autofahrer-sollten-vorsichtig-sein-37104288.html,https://www.stern.de/gesellschaft/regional/baden-wuerttemberg/wetter-im-suedwesten--naechtliche-rutschpartie--autofahrer-sollten-vorsichtig-sein-37104288.html,0,www.stern.de,Wetter im Südwesten: Nächtliche Rutschpartie? Autofahrer sollten vorsichtig sein,"Stuttgart (lsw) - Autofahrer und Fußgänger aufgepasst: Obwohl sich in den kommenden Tagen immer wieder Sonnenstrahlen zeigen, drohen im Südwesten auch",https://image.stern.de/37104290/t/fC/v1/w1440/r1.7778/-/04--6bmx2o6ljrv6axs2048jpeg---40c82ea3f12e7a78.jpg,2026-02-04T05:17:37Z,,"Kopiere den aktuellen Link
Zur Merkliste hinzufügen
Tagsüber Sonne, nachts Glätte: Im Südwesten kann es in den kommenden Nächten rutschig werden. Welche Regionen sind betroffen?
Autofahrer und Fuß… [+2060 chars]",,de,'Sonne'
https://www.sueddeutsche.de/bayern/wetter-bayern-vorhersage-glaette-tief-li.3381136,https://www.sueddeutsche.de/bayern/wetter-bayern-vorhersage-glaette-tief-li.3381136,0,www.sueddeutsche.de,Wetter in Bayern: Nach kurzer Aufheiterung: Das nächste Tief wartet schon,Nach ein bisschen Sonne ziehen schon die nächsten Wolken heran. Zudem wird es ein wenig milder in Bayern. Auf den Straßen kann es mancherorts trotzdem glatt werden.,https://www.sueddeutsche.de/2026/02/04/868e3853-efe0-41dc-bb91-d673bebe1ac4.jpg?q=60&fm=webp&width=1200&rect=33%2C0%2C3934%2C2213,2026-02-04T09:10:21Z,,"Nach kurzer Aufheiterung steht Bayern das Eintreffen eines neuen Tiefs aus Italien bevor. Der Deutsche Wetterdienst erwartet heute anfangs teils freundliches Wetter mit etwas Sonne, teils aber auch N… [+760 chars]",,de,'Sonne'
https://www.urlaubspiraten.de/pauschalreisen/teneriffa-im-sueden-lastminute,https://www.urlaubspiraten.de/pauschalreisen/teneriffa-im-sueden-lastminute,0,www.urlaubspiraten.de,Wie wär's jetzt mit 22 Grad und jeder Menge Sonne? ☀️️,"Ahoi Piraten!Während es in Deutschland grau, kalt und eisig ist, genießt ihr auf Teneriffa im Süden aktuell rund 22 Grad und Sonne satt ☀️ – und das mitten im Winter. Genau deshalb ist dieser Deal jetzt perfekt für eine spontane Auszeit im Februar und März.De…",https://image.urlaubspiraten.de/720/image/upload/v1685604614/Impressions%20and%20Other%20Assets/225338_l9qyqv.webp,2026-02-04T12:09:36Z,,"Ahoi Piraten!
Während es in Deutschland grau, kalt und eisig ist, genießt ihr auf Teneriffa im Süden aktuell rund 22 Grad und Sonne satt und das mitten im Winter. Genau deshalb ist dieser Deal jetzt… [+896 chars]",,de,'Sonne'
https://www.stern.de/gesellschaft/regional/sachsen-anhalt/winterwetter---seltenes-phaenomen----nebelbogen-ueber-dem-brocken-37105700.html,https://www.stern.de/gesellschaft/regional/sachsen-anhalt/winterwetter---seltenes-phaenomen----nebelbogen-ueber-dem-brocken-37105700.html,0,www.stern.de,"Winterwetter: ""Seltenes Phänomen"" - Nebelbogen über dem Brocken","Kommen feinste Wassertröpfchen und die Sonne zusammen, kann ein Nebelbogen entstehen. Der ist nicht bunt wie ein Regenbogen, sondern einfarbig weiß. Auf dem Brocken war das Phänomen zu sehen.",https://image.stern.de/37105702/t/Sl/v1/w1440/r1.7778/-/04--hqvenrokrvv6axs2048jpeg---6f516f1587c1e268.jpg,2026-02-04T12:16:07Z,,"Kopiere den aktuellen Link
Zur Merkliste hinzufügen
Kommen feinste Wassertröpfchen und die Sonne zusammen, kann ein Nebelbogen entstehen. Der ist nicht bunt wie ein Regenbogen, sondern einfarbig we… [+915 chars]",,de,'Sonne'
https://www.tagesspiegel.de/sport/olympia-und-paralympics-ioc-pruft-fruhere-winterspiele-wegen-klimawandels-15217749.html,https://www.tagesspiegel.de/sport/olympia-und-paralympics-ioc-pruft-fruhere-winterspiele-wegen-klimawandels-15217749.html,0,www.tagesspiegel.de,Olympia und Paralympics: IOC prüft frühere Winterspiele wegen Klimawandels,"Das IOC denkt darüber nach, Winterspiele künftig schon im Januar auszutragen. Das hätte auch Folgen auf den Termin der Paralympics. Grund ist der Klimawandel.",https://www.tagesspiegel.de/images/15217748/alternates/BASE_16_9_W1400/1770209903000/olympische-winterspiele-2026.jpeg,2026-02-04T12:58:24Z,,"Das Internationale Olympische Komitee prüft, ob künftige Winterspiele vor dem Hintergrund des Klimawandels bereits im Januar stattfinden könnten. Vielleicht diskutieren wir auch darüber, die Olympisc… [+1243 chars]",,de,'Klimawandel'
https://www.kino.de/film/leise-intensiv-unerwartet-solo-mio-trailer-markiert-einen-wendepunkt-fuer-king-of-queens-star-kevin-james--01KG4PJCAPB752VNEFNJ4M5D4R,https://www.kino.de/film/leise-intensiv-unerwartet-solo-mio-trailer-markiert-einen-wendepunkt-fuer-king-of-queens-star-kevin-james--01KG4PJCAPB752VNEFNJ4M5D4R,0,www.kino.de,"Leise, intensiv, unerwartet: „Solo Mio“-Trailer markiert einen Wendepunkt für „King of Queens“-Star Kevin James","Sonne, Schmerz und überraschende Nähe: In seinem neuen Film „Solo Mio“ zeigt sich Kevin James mal von einer ganz anderen Seite und setzt auf leise Gefühle statt große Gags.",https://static.kino.de/9b/d6/5a/f008f8cf8aa38cc6e6d58d886c_ZmMgN2Q2NDNjNThmZmZmIDE5MjAgMTA4MAM5NmY4Y2E4NmRkNg==.jpg,2026-02-04T13:20:00Z,,"Sonne, Schmerz und überraschende Nähe: In seinem neuen Film Solo Mio zeigt sich Kevin James mal von einer ganz anderen Seite und setzt auf leise Gefühle statt große Gags.
Mit dem neuen Kinotrailer z… [+1162 chars]",,de,'Sonne'
https://www.stern.de/wirtschaft/in-diesen-geschaeften-kauften-die-deutschen-frueher-ein-37101904.html,https://www.stern.de/wirtschaft/in-diesen-geschaeften-kauften-die-deutschen-frueher-ein-37101904.html,0,www.stern.de,"Horten, Schlecker & Co.: In diesen Geschäften kauften die Deutschen früher ein","Den Familieneinkauf bei R-Kauf oder Tengelmann erledigen, bei Schlecker schnell Sonnencreme besorgen und später einen Film bei Video Buster ausleihen? Das war einmal. Keins dieser Geschäfte gibt es noch.",https://image.stern.de/37101918/t/_2/v1/w1440/r1.7778/-/5.jpg,2026-02-04T15:36:00Z,,"Kopiere den aktuellen Link
Zur Merkliste hinzufügen
Den Familieneinkauf bei R-Kauf oder Tengelmann erledigen, bei Schlecker schnell Sonnencreme besorgen und später einen Film bei Video Buster ausle… [+1944 chars]",,de,'Sonne'
https://www.faz.net/aktuell/sport/olympische-winterspiele/ioc-olympia-programm-2030-cyclocross-will-ins-winter-programm-110831269.html,https://www.faz.net/aktuell/sport/olympische-winterspiele/ioc-olympia-programm-2030-cyclocross-will-ins-winter-programm-110831269.html,0,www.faz.net,Zukunft der Winterspiele: Frostige Zeiten für traditionelle Sportarten bei Olympia,Der Klimawandel treibt das IOC zur Programmreform: Cyclocross wird protegiert. Es gibt Argumente für die Aufnahme ins Programm. Nicht so gut sieht es für manche Traditionssportart des Winters aus.,https://media0.faz.net/image/w1200h627/7b226fbaa0b7/w3000h1567x0y140o/022026/1.10831265/schon-bald-koennte-cyclocross.webp,2026-02-04T16:31:07Z,,"Die Zukunft der Winterspiele tritt in die Pedale. Hundertprozentig, sagt David Lappartient, Präsident der Union Cycliste Internationale (UCI), des internationalen Radsport-Verbands. Hundertprozentig … [+5832 chars]",,de,'Klimawandel'
https://www.faz.net/aktuell/wirtschaft/unternehmen/winterspiele-2026-in-mailand-hoffnung-auf-wirtschafts-impulse-110830465.html,https://www.faz.net/aktuell/wirtschaft/unternehmen/winterspiele-2026-in-mailand-hoffnung-auf-wirtschafts-impulse-110830465.html,0,www.faz.net,Winter-Olympia: Italien hofft auf die Macht der Ringe,Mit der nun beginnenden Winterspielen in Mailand und Cortina d’Ampezzo erwartet Norditalien wirtschaftliche Impulse. Doch Verzögerungen und Öko-Kritik werfen ihre Schatten voraus.,https://media0.faz.net/image/w1200h627/8e36cf383bbe/w5078h2653x553y1153o/202602/43601.0.1731025191/sportler-im-anmarsch-am.webp,2026-02-04T18:07:04Z,,Das Olympia-Fieber beginnt sich in Norditalien auszubreiten. Am Flughafen Mailand-Malpensa kommen die ersten Athleten an mit viel Gepäck. Ein professioneller Skifahrer führe mehr als zwanzig Paare Sk… [+6642 chars],,de,'Schatten'
https://www.zeit.de/news/2026-02/05/schnieder-nicht-an-klimaziel-festklammern,https://www.zeit.de/news/2026-02/05/schnieder-nicht-an-klimaziel-festklammern,0,www.zeit.de,"Klimawandel: Schnieder: Nicht an Klimaziel ""festklammern""","Hier finden Sie Informationen zu dem Thema „Klimawandel“. Lesen Sie jetzt „Schnieder: Nicht an Klimaziel ""festklammern""“.",https://img.zeit.de/news/2026-02/05/schnieder-nicht-an-klimaziel-festklammern-image-group/wide__1300x731,2026-02-05T06:01:04Z,,"CDU-Spitzenkandidat für die Landtagswahl, Gordon Schnieder, stellt das bundesweite Klimaziel infrage. «Wenn wir merken sollten, dass wir es bis 2045 nicht schaffen, gleichzeitig klimaneutral und wett… [+748 chars]",,de,'Klimawandel'
https://noe.orf.at/stories/3340796/,https://noe.orf.at/stories/3340796/,0,noe.orf.at,Grau in grau: Zähes Nebelwetter hält an,"Hochnebel, Nebel und teilweise Nieselregen – die Sonne hat man in den vergangenen Tagen vergeblich gesucht. In den Bergen hingegen gab es seit Jahresbeginn überdurchschnittlich viel Sonnenschein. An dem grau in grau im Flachland wird sich in der nächsten Zeit…",https://ibs.orf.at/noe?image=https%3A%2F%2Foekastatic.orf.at%2Fmims%2F2026%2F06%2F71%2Fcrops%2Fw%3D1200%2Ch%3D627%2Cq%3D75%2F2923349_master_1130071_260205_dauer_nebelwetter_haelt_an_00_00_19_10.jpg%3Fs%3D346792615eb78f8c02ae2d497fd0606a70a90cd0,2026-02-05T18:10:23Z,,"Die Sonne sie zeigt sich aktuell nur auf den Bergen. Seit Jahressbeginn wurden überdurchschnittlich viele Sonnenstunden auf der Rax, am Schneeberg (beide Bezirk Neunkirchen) und in den höheren Lagen … [+2109 chars]",,de,'Sonnenstunden'
https://www.stern.de/sport/olympische-winterspiele-durch-klimawandel-bald-schnee-von-gestern--37111746.html,https://www.stern.de/sport/olympische-winterspiele-durch-klimawandel-bald-schnee-von-gestern--37111746.html,0,www.stern.de,morgenstern: Sind Olympische Winterspiele durch den Klimawandel bald Schnee von gestern?,"Bedroht der Klimawandel die Olympischen Winterspiele? Norwegen steckt im Epstein-Sumpf. Und: Das ""Maultaschenproblem"" des Cem Özdemir vor der Wahl. Die Lage am Morgen.",https://image.stern.de/37111808/t/2u/v1/w1440/r1.7778/-/morgenstern-freitag-teaser-olympische-spiele.jpg,2026-02-06T05:08:00Z,,"Kopiere den aktuellen Link
Zur Merkliste hinzufügen
Bedroht der Klimawandel die Olympischen Winterspiele? Norwegen steckt im Epstein-Sumpf. Und: Das ""Maultaschenproblem"" des Cem Özdemir vor der Wah… [+5391 chars]",,de,'Klimawandel'
https://www.stern.de/news/kanada-streicht-vorgabe-von-100-prozent-e-autos-bei-neuwagen-bis-2035-37112560.html,https://www.stern.de/news/kanada-streicht-vorgabe-von-100-prozent-e-autos-bei-neuwagen-bis-2035-37112560.html,0,www.stern.de,Kanada streicht Vorgabe von 100 Prozent E-Autos bei Neuwagen bis 2035,"Kanada hat die Vorgabe gestrichen, dass bis 2035 der Anteil von E-Autos an allen Neuwagenverkäufen im Land auf 100 Prozent steigen muss. Premierminister Mark Carney bekräftigte am Donnerstag Kanadas Führungsanspruch beim Kampf gegen den Klimawandel, verwies j…",https://image.stern.de/37112562/t/Eb/v1/w1440/r1.7778/-/06--mark-carney---43d40f3a82f65df6.jpg,2026-02-06T09:08:44Z,,"Kopiere den aktuellen Link
Zur Merkliste hinzufügen
Kanada hat die Vorgabe gestrichen, dass bis 2035 der Anteil von E-Autos an allen Neuwagenverkäufen im Land auf 100 Prozent steigen muss. Premierm… [+1821 chars]",,de,'Klimawandel'
https://www.googlewatchblog.de/2026/02/pixel-feature-drop-diese-drei-neuen-funktionen-starten-bald-mit-dem-release-von-android-16-qpr3-galerie/,https://www.googlewatchblog.de/2026/02/pixel-feature-drop-diese-drei-neuen-funktionen-starten-bald-mit-dem-release-von-android-16-qpr3-galerie/,0,www.googlewatchblog.de,Pixel Feature Drop: Diese drei neuen Funktionen starten bald mit dem Release von Android 16 QPR3 (Galerie),"Der Februar ist ein kurzer Monat und wir können schon einmal nach vorn blicken auf das nächste Pixel Feature Drop, das für Anfang März erwartet wird und seine Schatten bereits vorauswirft. Der parallele Release von Android 16 QPR3 verrät uns schon jetzt drei …",https://www.googlewatchblog.de/wp-content/uploads/pixel-feature-drop-november-2025.jpg,2026-02-06T10:00:13Z,,"Der Februar ist ein kurzer Monat und wir können schon einmal nach vorn blicken auf das nächste Pixel Feature Drop, das für Anfang März erwartet wird und seine Schatten bereits vorauswirft. Der parall… [+3257 chars]",,de,'Schatten'
https://www.stern.de/wirtschaft/in-folgenden-geschaeften-kauften-die-deutschen-frueher-ein-37101904.html,https://www.stern.de/wirtschaft/in-folgenden-geschaeften-kauften-die-deutschen-frueher-ein-37101904.html,0,www.stern.de,"Horten, Schlecker & Co.: In diesen Geschäften kauften die Deutschen früher ein","Den Familieneinkauf bei Tengelmann erledigen, bei Schlecker Sonnencreme besorgen und einen Film bei Video Buster ausleihen? Das war einmal. Keins dieser Geschäfte gibt es noch.",https://image.stern.de/37101918/t/9v/v4/w1440/r1.7778/-/5.jpg,2026-02-06T11:08:00Z,,"Kopiere den aktuellen Link
Zur Merkliste hinzufügen
Den Familieneinkauf bei Tengelmann erledigen, bei Schlecker Sonnencreme besorgen und einen Film bei Video Buster ausleihen? Das war einmal. Keins… [+1912 chars]",,de,'Sonnencreme'
https://www.faz.net/aktuell/politik/ausland/aragon-boom-von-datenzentren-und-erneuerbarer-energie-accg-110831123.html,https://www.faz.net/aktuell/politik/ausland/aragon-boom-von-datenzentren-und-erneuerbarer-energie-accg-110831123.html,0,www.faz.net,Boom in Aragón: Wenn Elon Musk das „leere Spanien“ entdeckt,Viel Platz und viel Sonne: Die Region Aragón kämpfte bisher mit Landflucht – jetzt erlebt sie einen Boom mit Datenzentren. Aber das gefällt auch nicht allen.,https://media0.faz.net/image/w1200h627/89f692042895/w2281h1191x0y168o/022026/1.10831120/viel-neubau-eine-photovoltaik.webp,2026-02-06T13:23:28Z,,"Dicke Wolken hängen tief über der Hochebene. In den vergangenen Tagen hat es in der Sierra de Albarracín geschneit, und es ist bitterkalt mitten in Spanien. Spanisch-Lappland wird die einsame Gegend … [+6839 chars]",,de,'Sonne'
https://www.zeit.de/2026/06/olympische-winterspiele-2026-italien-milano-cortina-klimawandel,https://www.zeit.de/2026/06/olympische-winterspiele-2026-italien-milano-cortina-klimawandel,0,www.zeit.de,Olympische Winterspiele 2026: Schnee von morgen,"Der Klimawandel kommt, die Russen kommen nicht – warum man sich trotz allem auf Olympia freut. Und freuen darf.",https://img.zeit.de/2026/06/schnee-von-morgen-bild-2/wide__1300x731,2026-02-06T16:50:55Z,,"Wüsste man es nicht besser, könnte man Olympia glatt für eine rheinische Erfindung halten. Stets überschlagen sich vor dem Start die Nachrichten, was alles nicht funktionieren wird. Aber getreu dem k… [+686 chars]",,de,'Klimawandel'
