index,url,valid,domain,title,description,image,published,archive,content,quote,language,keyword
https://www.sueddeutsche.de/wissen/china-klimawandel-propaganda-emissionen-solarenergie-taiwan-li.3349695,https://www.sueddeutsche.de/wissen/china-klimawandel-propaganda-emissionen-solarenergie-taiwan-li.3349695,0,www.sueddeutsche.de,Klimawandel: „Die chinesische Propaganda hat nichts Gutes über Greta zu sagen“,"Dominanz in sauberen Technologien, aber Desinformation zu Solarenergie und Unterdrückung von Klimaprotesten: Der Soziologe John Chung-En Liu über die widersprüchlichen Botschaften Chinas zum Klimawandel.",https://www.sueddeutsche.de/2025/09/24/221cb29a-e4de-4e01-8118-accc64e224ac.jpg?q=60&fm=webp&width=1200&rect=0%2C208%2C4000%2C2250,2025-12-11T14:29:12Z,,"Dominanz in sauberen Technologien, aber Desinformation zu Solarenergie und Unterdrückung von Klimaprotesten: Der Soziologe John Chung-En Liu über die widersprüchlichen Botschaften Chinas zum Klimawan… [+41 chars]",,de,'Klimawandel'
https://www.sueddeutsche.de/bayern/klimakrise-gefahren-berge-garmisch-partenkirchen-li.3352816,https://www.sueddeutsche.de/bayern/klimakrise-gefahren-berge-garmisch-partenkirchen-li.3352816,0,www.sueddeutsche.de,Klimakrise: Mit der Temperatur steigt die auch Gefahr in den Bergen,"Forscher und Bergretter stehen vor der Frage, wie der Klimawandel das Risiko für die Menschen in den Alpen verändert. Am Beispiel der Zugspitze zeigen sie, dass es in Bayern wohl immer öfter zu Unfällen, Unwettern, Muren und Hangrutschen kommen wird.",https://www.sueddeutsche.de/2025/07/11/944ae23f-65cc-48ce-af2c-8329320dc025.jpg?q=60&fm=webp&width=1200&rect=0%2C369%2C4000%2C2250,2025-12-11T15:35:07Z,,"Eine Frau starb, ein Mann gilt bis heute als vermisst. Schon im Jahr davor hatte es ein ähnliches Ereignis gegeben, sagt Toni Vogg. Brücken weg, Wege weg, unter widrigsten Bedingungen Wanderer rausho… [+4797 chars]",,de,'Klimawandel'
https://www.zeit.de/news/2025-12/12/kalte-nebelsuppe-im-tal-und-sonne-in-den-bergen,https://www.zeit.de/news/2025-12/12/kalte-nebelsuppe-im-tal-und-sonne-in-den-bergen,0,www.zeit.de,Wetter in Bayern: Kalte Nebelsuppe im Tal und Sonne in den Bergen,Hier finden Sie Informationen zu dem Thema „Wetter in Bayern“. Lesen Sie jetzt „Kalte Nebelsuppe im Tal und Sonne in den Bergen“.,https://img.zeit.de/news/2025-12/12/kalte-nebelsuppe-im-tal-und-sonne-in-den-bergen-image-group/wide__1300x731,2025-12-12T04:50:46Z,,"Wer am Wochenende Sonne tanken will, muss in die Berge - oder zumindest in die Nähe. Eine trübe Suppe aus Hochnebel, Nebel und Sprühregen sagt der Deutsche Wetterdienst (DWD) bis Sonntag für weite Te… [+623 chars]",,de,'Sonne'
https://orf.at/stories/3413989/,https://orf.at/stories/3413989/,0,orf.at,Meilenstein der Klimapolitik am Bröckeln,"Der 12. Dezember 2015 gilt als Meilenstein der globalen Klimapolitik, hat sich die internationale Gemeinschaft an diesem Tag doch auf das Pariser Klimaabkommen geeinigt. Das Herzstück des Abkommens ist die Begrenzung der Erderwärmung auf 1,5 Grad. Ein Blick a…",https://ibs.orf.at/news?image=https%3A%2F%2Fassets.orf.at%2Fmims%2F2025%2F50%2F42%2Fcrops%2Fw%3D1200%2Ch%3D630%2Cq%3D75%2F2863732_master_1105942_klima_pariser_abkommen_zehn_jahre_luk.jpg%3Fs%3Dd94d804bde51b4d5fc1b226a8e6e3cb4bd7ca2a9,2025-12-12T05:21:04Z,,"Ich sehe den Saal, die Reaktion ist positiv, ich höre keine Einwände, sagte der damalige französische Außenminister Laurent Fabius, als er die Einigung auf der UNO-Klimakonferenz (COP21) in Le Bourge… [+6299 chars]",,de,'Erderwärmung'
https://www.zeit.de/news/2025-12/12/sonne-und-nebel-wetter-bleibt-meist-trocken,https://www.zeit.de/news/2025-12/12/sonne-und-nebel-wetter-bleibt-meist-trocken,0,www.zeit.de,Deutscher Wetterdienst: Sonne und Nebel – Wetter bleibt meist trocken,Hier finden Sie Informationen zu dem Thema „Deutscher Wetterdienst“. Lesen Sie jetzt „Sonne und Nebel – Wetter bleibt meist trocken“.,https://img.zeit.de/news/2025-12/12/sonne-und-nebel-wetter-bleibt-meist-trocken-image-group/wide__1300x731,2025-12-12T05:55:55Z,,Auf eher milde Temperaturen und teils sogar sonniges Wetter können sich die Menschen in Mitteldeutschland einstellen. Nach einem leicht nebligen und frostigen Start in den Tag ist in Sachsen und in S… [+726 chars],,de,'Sonne'
https://www.stern.de/gesellschaft/regional/bayern/erderwaermung--zehn-jahre-klimaabkommen---demo-auf-zugspitze-36956718.html,https://www.stern.de/gesellschaft/regional/bayern/erderwaermung--zehn-jahre-klimaabkommen---demo-auf-zugspitze-36956718.html,0,www.stern.de,Erderwärmung: Zehn Jahre Klimaabkommen - Demo auf Zugspitze,"Garmisch-Partenkirchen (lby) - Zum zehnten Jahrestag des Pariser Klimaabkommens haben Aktivisten auf Deutschlands höchstem Berg, der Zugspitze, für",https://image.stern.de/36956720/t/3A/v1/w1440/r1.7778/-/12--m6ssajadllv8axs2048jpeg---e9725dd8289487ab.jpg,2025-12-12T13:45:31Z,,"Kopiere den aktuellen Link
Zur Merkliste hinzufügen
Vor zehn Jahren einigten sich fast alle Länder der Welt auf eine Begrenzung der Erderwärmung - daran werden sie nun von Aktivsten erinnert.
Zum … [+1219 chars]",,de,'Erderwärmung'
https://www.zeit.de/news/2025-12/12/zehn-jahre-klimaabkommen-demo-auf-zugspitze,https://www.zeit.de/news/2025-12/12/zehn-jahre-klimaabkommen-demo-auf-zugspitze,0,www.zeit.de,Erderwärmung: Zehn Jahre Klimaabkommen - Demo auf Zugspitze,Hier finden Sie Informationen zu dem Thema „Erderwärmung“. Lesen Sie jetzt „Zehn Jahre Klimaabkommen - Demo auf Zugspitze“.,https://img.zeit.de/news/2025-12/12/zehn-jahre-klimaabkommen-demo-auf-zugspitze-image-group/wide__1300x731,2025-12-12T13:59:18Z,,"Zum zehnten Jahrestag des Pariser Klimaabkommens haben Aktivisten auf Deutschlands höchstem Berg, der Zugspitze, für besseren Klimaschutz demonstriert. Auf dem Gipfel entrollten Mitglieder der Umwelt… [+1064 chars]",,de,'Erderwärmung'
https://www.sueddeutsche.de/sport/biathlon-hochfilzen-rennen-frankreich-julia-simon-li.3353416,https://www.sueddeutsche.de/sport/biathlon-hochfilzen-rennen-frankreich-julia-simon-li.3353416,0,www.sueddeutsche.de,Biathlon: Ein Brief erzeugt das nächste Gewitter,"Das französische Biathlon-Team bleibt in Aufruhr: Julia Simon kehrt nach ihrer Sperre zurück, der Verband hüllt sich in Schweigen – und nun bekommt auch noch Olympiasieger Martin Fourcade Gegenwind.",https://www.sueddeutsche.de/2025/12/12/bc7082eb-bec8-4dc3-a8fd-215338f68596.jpg?q=60&fm=webp&width=1200&rect=0%2C306%2C4000%2C2250,2025-12-12T15:42:37Z,,"Für Kapriolen im Skijäger-Kosmos zeigt sich seit Längerem der französische Verband zuständig: Die Kreditkartenaffäre rund um Julia Simon, die angebliche Gewehrsabotage durch Jeanne Richard, der Frust… [+5085 chars]",,de,'Gewitter'
https://www.zeit.de/2025/51/haus-zur-sonne-thomas-melle-leben-tod-wuensche,https://www.zeit.de/2025/51/haus-zur-sonne-thomas-melle-leben-tod-wuensche,0,www.zeit.de,"""Haus zur Sonne"" von Thomas Melle: Eine humpelnde Hymne auf das Leben",Zwischen Todessehnsucht und Superheldenfantasien: Thomas Melle kennt den Wahnsinn seines Romanhelden aus persönlicher Erfahrung.,https://img.zeit.de/2025/51/haus-zur-sonne-thomas-melle-leben-tod-wuensche-bild/wide__1300x731,2025-12-12T17:22:39Z,,"Zum ersten Mal im Leben ist es mir passiert, dass ich zu Beginn einer vor Publikum stattfindenden Abendveranstaltung, während der Moderator seine kurze Einleitung vorlas, noch schnell die Kindle-App … [+1310 chars]",,de,'Sonne'
https://www.zeit.de/news/2025-12/13/licht-und-schatten-bei-spendenbereitschaft-in-thueringen,https://www.zeit.de/news/2025-12/13/licht-und-schatten-bei-spendenbereitschaft-in-thueringen,0,www.zeit.de,Adventszeit ist Spendenzeit: Licht und Schatten bei Spendenbereitschaft in Thüringen,Hier finden Sie Informationen zu dem Thema „Adventszeit ist Spendenzeit“. Lesen Sie jetzt „Licht und Schatten bei Spendenbereitschaft in Thüringen“.,https://img.zeit.de/news/2025-12/13/licht-und-schatten-bei-spendenbereitschaft-in-thueringen-image-group/wide__1300x731,2025-12-13T05:00:16Z,,"Adventszeit ist Spendenzeit - auch in diesem Jahr nutzen viele Menschen im Freistaat die Vorweihnachtszeit für eine gute Tat. «Wir stellen immer wieder fest, dass Menschen etwas tun wollen, um Notlag… [+4697 chars]",,de,'Schatten'
https://www.zeit.de/news/2025-12/13/auf-tristes-truebes-wetter-folgt-etwas-mehr-sonnenschein,https://www.zeit.de/news/2025-12/13/auf-tristes-truebes-wetter-folgt-etwas-mehr-sonnenschein,0,www.zeit.de,Wettervorhersage: Auf tristes trübes Wetter folgt etwas mehr Sonnenschein,Hier finden Sie Informationen zu dem Thema „Wettervorhersage“. Lesen Sie jetzt „Auf tristes trübes Wetter folgt etwas mehr Sonnenschein“.,https://img.zeit.de/news/2025-12/13/auf-tristes-truebes-wetter-folgt-etwas-mehr-sonnenschein-image-group/wide__1300x731,2025-12-13T11:38:34Z,,"Der ganz dicke Wintermantel, Schal und Mütze können auch am dritten Advent im Schrank bleiben: Das Wetter bleibt für die Jahreszeit ungewöhnlich mild. Vielerorts in Deutschland wird es am Sonntag tro… [+1091 chars]",,de,'Sonne'
https://www.zeit.de/news/2025-12/14/sonne-im-kopf-beton-vor-der-tuer-so-probt-malle-ol,https://www.zeit.de/news/2025-12/14/sonne-im-kopf-beton-vor-der-tuer-so-probt-malle-ol,0,www.zeit.de,"Unterhaltung: Sonne im Kopf, Beton vor der Tür: So probt ""Malle Olé!""","Hier finden Sie Informationen zu dem Thema „Unterhaltung“. Lesen Sie jetzt „Sonne im Kopf, Beton vor der Tür: So probt ""Malle Olé!""“.",https://img.zeit.de/news/2025-12/14/sonne-im-kopf-beton-vor-der-tuer-so-probt-malle-ol-image-group/wide__1300x731,2025-12-14T04:45:05Z,,"Duisburg, Fußgängerzone, vormittags. Ein grauer Himmel hängt über der Stadt, auf dem Weihnachtsmarkt schieben sich erste Besucher Bratwürste in die Backen. Zugegeben: Wer sich hier einen Strand auf M… [+5101 chars]",,de,'Sonne'
https://www.zeit.de/news/2025-12/14/trueber-advent-in-hessen-sonne-erst-wieder-zum-wochenstart,https://www.zeit.de/news/2025-12/14/trueber-advent-in-hessen-sonne-erst-wieder-zum-wochenstart,0,www.zeit.de,Wetter: Trüber Advent in Hessen - Sonne erst wieder zum Wochenstart,Hier finden Sie Informationen zu dem Thema „Wetter“. Lesen Sie jetzt „Trüber Advent in Hessen - Sonne erst wieder zum Wochenstart“.,https://img.zeit.de/news/2025-12/14/trueber-advent-in-hessen-sonne-erst-wieder-zum-wochenstart-image-group/wide__1300x731,2025-12-14T08:56:37Z,,"Zum dritten Adventssonntag erwartet die Menschen in Hessen trübes Winterwetter. Der Himmel ist meist hochnebelartig bedeckt, teils ist es neblig, wie der Deutsche Wetterdienst (DWD) in Offenbach mitt… [+476 chars]",,de,'Sonne'
https://www.zeit.de/news/2025-12/14/wochenstart-in-nrw-bringt-viel-sonne-und-bis-zu-13-grad,https://www.zeit.de/news/2025-12/14/wochenstart-in-nrw-bringt-viel-sonne-und-bis-zu-13-grad,0,www.zeit.de,Wetter: Wochenstart in NRW bringt viel Sonne und bis zu 13 Grad,Hier finden Sie Informationen zu dem Thema „Wetter“. Lesen Sie jetzt „Wochenstart in NRW bringt viel Sonne und bis zu 13 Grad“.,https://img.zeit.de/news/2025-12/14/wochenstart-in-nrw-bringt-viel-sonne-und-bis-zu-13-grad-image-group/wide__1300x731,2025-12-14T12:59:59Z,,"Nach einem eher wolkenverhangenen Wochenende können sich die Menschen in Nordrhein-Westfalen in der neuen Woche auf Sonne freuen. Wie der Deutsche Wetterdienst (DWD) mitteilte, startet der Montag mit… [+636 chars]",,de,'Sonne'
https://www.zeit.de/news/2025-12/14/wolken-ueber-berlin-und-brandenburg-sonne-zum-wochenstart,https://www.zeit.de/news/2025-12/14/wolken-ueber-berlin-und-brandenburg-sonne-zum-wochenstart,0,www.zeit.de,Wetter: Wolken über Berlin und Brandenburg - Sonne zum Wochenstart,Hier finden Sie Informationen zu dem Thema „Wetter“. Lesen Sie jetzt „Wolken über Berlin und Brandenburg - Sonne zum Wochenstart“.,https://img.zeit.de/news/2025-12/14/wolken-ueber-berlin-und-brandenburg-sonne-zum-wochenstart-image-group/wide__1300x731,2025-12-14T15:00:42Z,,"In Berlin und Brandenburg sind die Aussichten bis Dienstag wolkig - mit sonnigen Abschnitten. Wie der Deutsche Wetterdienst (DWD) mitteilte, ist es am Sonntag stark bewölkt und es bildet sich «Schlei… [+481 chars]",,de,'Sonne'
https://www.n-tv.de/sport/Nur-Raimund-verhindert-beim-Heimspiel-ein-komplettes-Desaster-id30142403.html,https://www.n-tv.de/sport/Nur-Raimund-verhindert-beim-Heimspiel-ein-komplettes-Desaster-id30142403.html,0,www.n-tv.de,"Kaum Licht, viel Schatten: Nur Raimund verhindert beim Heimspiel ein komplettes Desaster",Nach Rang drei am Samstag reicht es zum Abschluss in Klingenthal für Philipp Raimund nur zu Platz zehn - aus einem schwachen DSV-Team ragt er dennoch heraus.,https://www.n-tv.de/img/30142402/1765746618/Img_16_9/1200/14-12.jpg,2025-12-14T20:44:31Z,,"Kaum Licht, viel SchattenNur Raimund verhindert beim Heimspiel ein komplettes Desaster
Raimund verhinderte ein schlimmes Ergebnis für die Adler. (Foto: IMAGO/Johannes Schmidt)
Nach Rang drei am Sam… [+3337 chars]",,de,'Schatten'
https://www.tagesspiegel.de/sport/krisenduell-beim-1-fc-union-frankfurts-fussballerinnen-sind-ein-schatten-ihrer-selbst-15051240.html,https://www.tagesspiegel.de/sport/krisenduell-beim-1-fc-union-frankfurts-fussballerinnen-sind-ein-schatten-ihrer-selbst-15051240.html,0,www.tagesspiegel.de,Krisenduell beim 1. FC Union: Frankfurts Fußballerinnen sind ein Schatten ihrer selbst,Sowohl die SGE als auch Union tun sich derzeit in der Bundesliga schwer. Bei Frankfurt allerdings zeichnete sich der Leistungseinbruch bereits im Sommer ab.,https://www.tagesspiegel.de/images/15051241/alternates/BASE_16_9_W1400/1765747814000/imago1069317332.jpeg,2025-12-14T21:38:48Z,,"Die Tabelle lügt nicht, heißt es im Fußball. Wenn man derzeit in Frankfurt auf das Tableau schaut, dürfte die Laune nicht besonders gut sein. Nach dem zwölften Spieltag belegten die Hessinnen gerade … [+5561 chars]",,de,'Schatten'
https://www.zeit.de/news/2025-12/15/sonne-zeigt-sich-kurz-im-suedwesten,https://www.zeit.de/news/2025-12/15/sonne-zeigt-sich-kurz-im-suedwesten,0,www.zeit.de,Wettervorhersage: Sonne zeigt sich kurz im Südwesten,Hier finden Sie Informationen zu dem Thema „Wettervorhersage“. Lesen Sie jetzt „Sonne zeigt sich kurz im Südwesten“.,https://img.zeit.de/news/2025-12/15/sonne-zeigt-sich-kurz-im-suedwesten-image-group/wide__1300x731,2025-12-15T05:46:09Z,,Nach zahlreichen nebligen Tagen dürfen sich die Menschen auf Sonne freuen - wenn auch nur kurz. Ab Mittwoch wird es laut der Prognose des Deutschen Wetterdienstes (DWD) wieder vermehrt wolkig im Südw… [+1104 chars],,de,'Sonne'
https://www.zeit.de/news/2025-12/15/sonne-in-den-bergen-nebel-in-vielen-teilen-bayerns,https://www.zeit.de/news/2025-12/15/sonne-in-den-bergen-nebel-in-vielen-teilen-bayerns,0,www.zeit.de,"Wetter: Sonne in den Bergen, Nebel in vielen Teilen Bayerns","Hier finden Sie Informationen zu dem Thema „Wetter“. Lesen Sie jetzt „Sonne in den Bergen, Nebel in vielen Teilen Bayerns“.",https://img.zeit.de/news/2025-12/15/sonne-in-den-bergen-nebel-in-vielen-teilen-bayerns-image-group/wide__1300x731,2025-12-15T06:29:56Z,,Die neue Woche bringt in Bayern Nebel und Sonne in den Bergen. Am Dienstag rechnet der Deutsche Wetterdienst (DWD) in den meisten Regionen mit Sonne.Zunächst erwartet der DWD gebietsweise dichten Neb… [+1490 chars],,de,'Sonne'
https://www.kino.de/news/er-enttaeuscht-nie-netflix-publikum-feiert-neue-platz-1-serie-die-aktuell-sogar-stranger-things-in-den-schatten-stellt--01KC926TENX1WNMGZT3BDPXNRN,https://www.kino.de/news/er-enttaeuscht-nie-netflix-publikum-feiert-neue-platz-1-serie-die-aktuell-sogar-stranger-things-in-den-schatten-stellt--01KC926TENX1WNMGZT3BDPXNRN,0,www.kino.de,„Er enttäuscht nie“: Netflix-Publikum feiert neue Platz-1-Serie – die aktuell sogar „Stranger Things“ in den Schatten stellt,„Mr. Bean“-Star Rowan Atkinson ist zurück – und zwar mit einer neuen Comedy-Serie. Diese landete prompt auf Platz 1 der Netflix-Seriencharts.,https://static.kino.de/99/93/33/5ba2d0f84b522166a37cf88e98_ZmMgODRmYjYyNThmZmZmIDE5MjAgMTA4MAM5MzUyZmIyNjc4OQ==.jpg,2025-12-15T09:59:38Z,,"Mr. Bean-Star Rowan Atkinson ist zurück und zwar mit einer neuen Comedy-Serie. Diese landete prompt auf Platz 1 der Netflix-Seriencharts.
Die Weihnachtszeit bringt nicht nur festliche Stimmung, sond… [+2676 chars]",,de,'Schatten'
https://www.spektrum.de/news/neutrinos-teilchen-von-der-sonne-wandeln-irdische-atome-um/2300868,https://www.spektrum.de/news/neutrinos-teilchen-von-der-sonne-wandeln-irdische-atome-um/2300868,0,www.spektrum.de,Teilchenphysik: Neutrinos von der Sonne wandeln irdische Atome um,"Erstmals wurden solare Neutrinos dabei beobachtet, wie sie aus Kohlenstoff-13 eine radioaktive Variante des Stickstoff machen. Ein unterirdischer Detektor fing die Teilchen ein.",https://static.spektrum.de/fm/912/f1920x1080/GettyImages-1088671260.jpg,2025-12-15T10:00:00Z,,"Neutrinos gelten als Schlüssel zu unbekannten physikalischen Gesetzen, aber sie lassen sich nur schwer untersuchen. Obwohl die Sonne sowie der Rest des Weltalls ständig zahllose der Elementarteilchen… [+837 chars]",,de,'Sonne'
https://www.n-tv.de/auto/Premierenfahrt-im-neuen-Volkswagen-ID-Polo-aber-noch-getarnt-id30143148.html,https://www.n-tv.de/auto/Premierenfahrt-im-neuen-Volkswagen-ID-Polo-aber-noch-getarnt-id30143148.html,0,www.n-tv.de,Hoffnungsträger für 25.000 Euro: Premierenfahrt im neuen Volkswagen ID.Polo - aber noch getarnt,"Volkswagen zündet die nächste Stufe im Elektroauto-Fahrplan. Der Kleinwagen ID.Polo wirft seine Schatten voraus und darf nun erstmals dynamisch erlebt werden als getarnter Entwickler. ntv.de hatte die Möglichkeit, sich hinter das Steuer zu setzen.",https://www.n-tv.de/img/30143199/1765784503/Img_16_9/1200/VW_ID_Polo_tarn_VO.jpg,2025-12-15T11:23:28Z,,"Es dauert noch eine ganze Weile, bis der neue Volkswagen ID.Polo die Tarnfolie verliert. Bis zum Frühsommer des nächsten Jahres müssen sich die Fans noch gedulden. (Foto: Volkswagen)
Volkswagen zünd… [+6482 chars]",,de,'Schatten'
https://www.brigitte.de/leben/reise/antizyklisches-reisen--diese-spanische-stadt-ist-ein-echter-geheimtipp-im-winter-14046684.html,https://www.brigitte.de/leben/reise/antizyklisches-reisen--diese-spanische-stadt-ist-ein-echter-geheimtipp-im-winter-14046684.html,0,www.brigitte.de,Spanische Wintersonne genießen: Granada im Winter ist wie Urlaub im Märchen,"Granada liegt in den Bergen von Andalusien und ist ein echter Geheimtipp für eine kleine Winterflucht: klare Luft, Sonne satt, arabisches Flair – und die berühmte Alhambra, die sich über der Stadt erhebt.",https://image.brigitte.de/14047166/t/-A/v2/w1440/r1.7778/-/granadacatedral.jpg,2025-12-15T11:32:00Z,,"15.12.2025, 12:32
4 Min.
Granada liegt in den Bergen von Andalusien und ist ein echter Geheimtipp für eine kleine Winterflucht: klare Luft, Sonne satt, arabisches Flair und die berühmte Alhambra, d… [+4787 chars]",,de,'Sonne'
https://www.stern.de/wirtschaft/news/fischfang--nordseefischer-muessen-2026-einbussen-hinnehmen-36963638.html,https://www.stern.de/wirtschaft/news/fischfang--nordseefischer-muessen-2026-einbussen-hinnehmen-36963638.html,0,www.stern.de,Fischfang: Nordseefischer müssen 2026 Einbußen hinnehmen,Überfischung und Klimawandel zwingen die EU-Minister bei den Fangquoten zu schwierigen Entscheidungen. Für deutsche Fischer kommt erneut ein Jahr der Entbehrung.,https://image.stern.de/36963640/t/eC/v1/w1440/r1.7778/-/15--s2w54btneov1axs2048jpeg---2c1bf186d1f544a5.jpg,2025-12-15T12:46:09Z,,"Kopiere den aktuellen Link
Zur Merkliste hinzufügen
Überfischung und Klimawandel zwingen die EU-Minister bei den Fangquoten zu schwierigen Entscheidungen. Für deutsche Fischer kommt erneut ein Jahr… [+2077 chars]",,de,'Klimawandel'
https://www.tagesspiegel.de/gesundheit/benotigt-man-jetzt-eine-extradosis-vitamin-d-darauf-kommt-es-bei-nahrungserganzungsmitteln-an-15053010.html,https://www.tagesspiegel.de/gesundheit/benotigt-man-jetzt-eine-extradosis-vitamin-d-darauf-kommt-es-bei-nahrungserganzungsmitteln-an-15053010.html,0,www.tagesspiegel.de,Benötigt man jetzt eine Extradosis Vitamin D?: Darauf kommt es bei Nahrungsergänzungsmitteln an,"Unser Körper kann Vitamin D mithilfe von Sonnenlicht selbst herstellen. Weil das im Winter rar ist, helfen viele mit Präparaten nach. Doch längst nicht für jeden ist das sinnvoll. Ein Überblick.",https://www.tagesspiegel.de/images/15053013/alternates/BASE_16_9_W1400/1765803870000/mann-nimmt-ein-nahrungserganzungsmittel.jpeg,2025-12-15T13:46:55Z,,"In den dunklen Monaten des Jahres mit Vitamin-D-Präparaten nachhelfen: Wer in den sozialen Medien unterwegs ist, bekommt den Eindruck: Das tun ganz schön viele.
Dabei sind die Mittel nicht ohne Risi… [+5180 chars]",,de,'Sonne'
https://www.faz.net/aktuell/technik-motor/technik/skigebiet-soelden-und-die-liebe-sonne-110798876.html,https://www.faz.net/aktuell/technik-motor/technik/skigebiet-soelden-und-die-liebe-sonne-110798876.html,0,www.faz.net,Skigebiet: Sölden und die liebe Sonne,"Was in einem Skigebiet so alles gemacht wird. Für den Skifahrer, für die Einwohner, für den Umweltschutz.",https://media0.faz.net/image/w1200h627/15708fbb903f/w2999h1566x0y60o/112025/1.10798861/bis-zu-15-000-skifahrer.webp,2025-12-15T13:49:00Z,,"Im schroffen Fels am Tiefenbachferner, weit oberhalb der Baumgrenze, wächst auf fast 3000 Metern ein Wald. Einer, wie es ihn noch nirgendwo gibt. Der Kraftwerkswald von Sölden wird nach seiner für nä… [+365 chars]",,de,'Sonne'
https://www.sueddeutsche.de/muenchen/dachau/muenchen-winter-nebel-erklaerung-inversionslage-1.6333252,https://www.sueddeutsche.de/muenchen/dachau/muenchen-winter-nebel-erklaerung-inversionslage-1.6333252,0,www.sueddeutsche.de,Wetter: Warum München im Winter oft unter einer Nebeldecke liegt,"Während am Alpenrand die Sonne scheint, hängen die Wolken manchmal zäh über der Landeshauptstadt. Wieso es hinter der Stadtgrenze oft schon aufreißt und warum sich der Nebel weiter südlich nicht hält, erklärt der Meteorologe Martin Schwienbacher.",https://www.sueddeutsche.de/2024/01/15/84854c87-c028-49f3-9a24-5074272bf6ee.jpeg?q=60&fm=webp&width=1200&rect=0%2C69%2C1355%2C762,2025-12-15T14:59:00Z,,"Während am Alpenrand die Sonne scheint, hängen die Wolken manchmal zäh über der Landeshauptstadt. Wieso es hinter der Stadtgrenze oft schon aufreißt und warum sich der Nebel weiter südlich nicht hält… [+78 chars]",,de,'Sonne'
https://www.stern.de/kultur/rob-reiner--mit-diesen-filmen-bleibt-er-in-erinnerung-36964140.html,https://www.stern.de/kultur/rob-reiner--mit-diesen-filmen-bleibt-er-in-erinnerung-36964140.html,0,www.stern.de,Trauer um den Filmemacher: Mit diesen Filmen bleibt Rob Reiner in Erinnerung,"Seine Ermordung wirft einen Schatten auf sein Leben, das er dem Lachen gewidmet hat. Das sind Rob Reiners beste Filme.",https://image.stern.de/36964144/t/aa/v2/w1440/r1.7778/-/rob-reiner.jpg,2025-12-15T15:40:00Z,,"Kopiere den aktuellen Link
Zur Merkliste hinzufügen
Seine Ermordung wirft einen Schatten auf sein Leben, das er dem Lachen gewidmet hat. Das sind Rob Reiners beste Filme.
Rob Reiner (1947-2025) wu… [+3488 chars]",,de,'Schatten'
https://www.diepresse.com/20407298/bis-2100-verschwindet-mindestens-die-haelfte-aller-gletscher,https://www.diepresse.com/20407298/bis-2100-verschwindet-mindestens-die-haelfte-aller-gletscher,0,www.diepresse.com,Bis 2100 verschwindet mindestens die Hälfte aller Gletscher,"Wie schnell viele Gletscher tatsächlich verschwinden, hängt davon ab, wie stark der menschengemachte Klimawandel eingedämmt werden kann. Im Extremfall könnte auch nur jeder zehnte Gletscher überleben, zeigen Schweizer und österreichische Forschende in einer n…",https://img.diepresse.com/public/incoming/yutyye-KENYA-CLIMATE-ENVIRONMENT-MOUNT-KENYA-AFP-PICTURES-OF-THE-YEAR-2/alternates/DPR_SOCIAL_NACHRICHTEN/KENYA-CLIMATE-ENVIRONMENT-MOUNT%20KENYA-AFP%20PICTURES%20OF%20THE%20YEAR%202,2025-12-15T16:00:00Z,,"Wie schnell viele Gletscher tatsächlich verschwinden, hängt davon ab, wie stark der menschengemachte Klimawandel eingedämmt werden kann. Im Extremfall könnte auch nur jeder zehnte Gletscher überleben… [+3264 chars]",,de,'Klimawandel'
https://science.orf.at/stories/3233368/,https://science.orf.at/stories/3233368/,0,science.orf.at,Bis 2100 Hälfte aller Gletscher verschwunden,"Bis zu 4.000 Gletscher pro Jahr drohen wegen der Erderwärmung zu verschwinden, so das Ergebnis einer neuen internationalen Studie. Mindestens die Hälfte aller Gletscher weltweit werde bis Ende des Jahrhunderts nicht mehr existieren.",https://ibs.orf.at/science?image=https%3A%2F%2Ftubestatic.orf.at%2Fmims%2F2025%2F51%2F13%2Fcrops%2Fw%3D1200%2Ch%3D627%2Cq%3D75%2F2868009_master_1107613_cave_8.jpg%3Fs%3Db3b062e5a4d1e67a6b257347d08ee26a7a131108,2025-12-15T16:00:19Z,,"Mit der soeben in der Fachzeitschrift Nature Climate Change erschienenen Studie wollen die Forscher und Forscherinnen darauf aufmerksam machen, dass der Gletscherschwund mehr als nur ein naturwissens… [+2876 chars]",,de,'Erderwärmung'
https://www.golem.de/sonstiges/zustimmung/auswahl.html?from=https://www.golem.de/news/elon-musk-es-ist-dumm-fusionskraftwerke-zu-bauen-2512-203286.html&referer=https://t.co/ff89930427,https://www.golem.de/sonstiges/zustimmung/auswahl.html?from=https://www.golem.de/news/elon-musk-es-ist-dumm-fusionskraftwerke-zu-bauen-2512-203286.html&referer=https://t.co/ff89930427,0,www.golem.de,"Elon Musk: ""Es ist dumm, Fusionskraftwerke zu bauen""","Verglichen mit der Energie, die die Sonne tagtäglich zur Erde sendet, sei der Beitrag irdischer Kernfusion lächerlich klein. (Kernfusion, Solarenergie)",,2025-12-15T16:43:02Z,,"Besuchen Sie Golem.de wie gewohnt mit Werbung und Tracking,
 indem Sie der Nutzung aller Cookies zustimmen.
 Details zum Tracking finden Sie im Privacy Center.
Skript wurde nicht geladen. Informat… [+607 chars]",,de,'Sonne'
