index,url,valid,domain,title,description,image,published,archive,content,quote,language,keyword
https://www.appgefahren.de/apples-pageturner-fuers-wochenende-sommersonnenwende-fuer-nur-199-euro-392385.html,https://www.appgefahren.de/apples-pageturner-fuers-wochenende-sommersonnenwende-fuer-nur-199-euro-392385.html,0,www.appgefahren.de,"Apples Pageturner fürs Wochenende: „Sommersonnenwende“ für nur 1,99 Euro","2. Januar – Sommersonnenwende: Am ersten Wochenende des neuen Jahres gibt es den Mystery-Thriller von Pascal Engman und Johannes Selåker für nur 1,99 Euro. Und das erwartet euch: „Die Sonne brennt heiß auf den Asphalt in einem Stockholmer Vorort, als eine jun…",https://www.appgefahren.de/wp-content/uploads/2023/10/Kindle-Paperwhite.jpg,2026-01-02T07:20:29Z,,"2. Januar – Sommersonnenwende: Am ersten Wochenende des neuen Jahres gibt es den Mystery-Thriller von Pascal Engman und Johannes Selåker für nur 1,99 Euro. Und das erwartet euch: Die Sonne brennt hei… [+1250 chars]",,de,'Sonne'
https://www.sueddeutsche.de/bayern/bayern-sturm-schnee-strassen-werktag-li.3362211,https://www.sueddeutsche.de/bayern/bayern-sturm-schnee-strassen-werktag-li.3362211,0,www.sueddeutsche.de,Sturm und glatte Straßen: DWD warnt vor Glätte – in Würzburg stehen die Busse still,"Schnee, stürmische Böen und gelegentlich ein paar Sonnenstrahlen – das neue Jahr beginnt so eisig, wie das alte aufgehört hat. Für Wintersportler gibt es gute Nachrichten.",https://www.sueddeutsche.de/2026/01/02/4c3f2dba-b636-44c8-83f8-68e1b35260e6.jpg?q=60&fm=webp&width=1200&rect=0%2C209%2C4000%2C2250,2026-01-02T07:57:22Z,,"Wegen der starken Schneefälle und Straßenglätte fahren in Würzburg am ersten Werktag des Jahres zunächst keine Busse. Die Würzburger Versorgungs- und Verkehrs-GmbH (WVV) werde informieren, wenn sich … [+728 chars]",,de,'Sonne'
https://www.faz.net/aktuell/feuilleton/debatten/wie-der-bundeskanzler-die-klimakrise-normalisiert-accg-110812207.html,https://www.faz.net/aktuell/feuilleton/debatten/wie-der-bundeskanzler-die-klimakrise-normalisiert-accg-110812207.html,0,www.faz.net,Klimawandel und Politik: Unsere Wintermärchen,"Aufbruch in eine neue Zeit: Der Neujahrswunsch des Bundeskanzlers zeigt, wie der Klimawandel heute bis zur Unkenntlichkeit normalisiert wird. Eine verpasste Chance.",https://media0.faz.net/image/w1200h627/cbbbd44fe481/w3000h1567x0y257o/202612/43601.0.1622098519/wintereinbruch-in-riedlingen.webp,2026-01-02T10:08:15Z,,"Einen Wintereinbruch, wie ihn Deutschland in diesen ersten Tagen des Jahres 2026 erlebt, hat es seit anderthalb Jahrzehnten nicht mehr gegeben. Der Winter ist zurück, hurra! Alles doch halb so wild m… [+557 chars]",,de,'Klimawandel'
https://www.n-tv.de/panorama/Das-passiert-bei-einem-sogenannten-Flashover-id30196449.html,https://www.n-tv.de/panorama/Das-passiert-bei-einem-sogenannten-Flashover-id30196449.html,0,www.n-tv.de,"""Eine enorme Hitze"": Das passiert bei einem sogenannten Flashover",Rund 40 Tote und 115 Verletzte: Noch sind viele Fragen zur Ursache der Brandkatastrophe in der Schweiz offen. Die Regierung des Kantons Wallis spricht von einem sogenannten Flashover. Doch was ist das eigentlich?,https://www.n-tv.de/img/30196917/1767360239/Img_16_9/1200/Standbild-aus-einem-Video-der-Kantonspolizei-Wallis-zeigt-einen-Bereich-der-Bar-Le-Constellation-in-der-es-in-den-fruehen-Morgenstunden-der-Silvesternacht-zu-einem-schweren-Brand-gekommen-ist-Nach-Behoerdenangaben-sind-bei-dem-Feuer-Dutzende-Menschen-ums-Leben-gekommen-Viele-weitere-Menschen-seien-verletzt-worden.jpg,2026-01-02T12:47:11Z,,"""Eine enorme Hitze""Das passiert bei einem sogenannten Flashover
Laut der Non-Profit-Internetplattform Brand-Feuer.de handelt es sich bei einem Flashover um einen heftigen Flammenüberschlag, auch Feu… [+3866 chars]",,de,'Hitze'
https://science.orf.at/stories/3233425/,https://science.orf.at/stories/3233425/,0,science.orf.at,Von Mondfahrten und Teleskopen,"Das neue Jahr bringt die Menschheit wieder zum Mond – sofern der NASA-Zeitplan hält. Und: 2026 wird das Jahr der Weltraumteleskope – gleich drei liefern, warten oder starten. Im August steht die stärkste Sonnenfinsternis seit 1999 bevor.",https://ibs.orf.at/science?image=https%3A%2F%2Ftubestatic.orf.at%2Fmims%2F2022%2F44%2F41%2Fcrops%2Fw%3D1200%2Ch%3D627%2Cq%3D75%2F1548670_master_565441_salzburg_partielle_sonnenfinsternis_in_oesterreich_4.jpg%3Fs%3De6fd2bcdff266553137e74efc3a93a4803c22912,2026-01-02T12:54:41Z,,"Jetzt aber wirklich: Artemis II soll heuer zum Mond aufbrechen. Die NASA-Mission wird maßgeblich von der Europäischen Raumfahrtorganisation ESA unterstützt. Mit an Bord ist auch die erste Frau, die z… [+4570 chars]",,de,'Sonne'
https://t3n.de/news/tech-milliardaere-sonne-dimmen-1699422/,https://t3n.de/news/tech-milliardaere-sonne-dimmen-1699422/,0,t3n.de,Tech-Milliardäre wollten heimlich die Sonne dimmen – und scheiterten an einer Kleinstadt,"Ein ausgemusterter Flugzeugträger, ein geheimnisvoller Apparat und das Geld von Tech-Milliardären. Ein Experiment in Kalifornien sollte die Welt verändern, doch dann kam alles ganz anders. Im April 2024 startete ein Team von Wissenschaftler:innen der Universi…",https://cdn.t3n.de/news/wp-content/uploads/2025/07/Wolken_und_Sonne.jpg?class=content,2026-01-02T14:30:00Z,,"Im April 2024 startete ein Team von Wissenschaftler:innen der University of Washington im gleichnamigen US-Bundesstaat einen Test, der enormes Potenzial versprach. Doch nach nur 20 Minuten wurde ihr … [+5175 chars]",,de,'Sonne'
https://futurezone.at/science/fusion-east-china-tokamak-dichte-plasma-instabilitaet-150-millionen-grad-kuenstliche-sonne/403117948,https://futurezone.at/science/fusion-east-china-tokamak-dichte-plasma-instabilitaet-150-millionen-grad-kuenstliche-sonne/403117948,0,futurezone.at,Durchbruch bei EAST Tokamak: Wichtige Grenze erstmals überwunden,"Chinas ""Künstliche Sonne"", wie die Anlage genannt wird, konnte ein dichteres Fusionsplasma erreichen als je zuvor.",https://image.futurezone.at/images/facebook/9185925/east_tokamak.jpg,2026-01-02T14:42:00Z,,"Chinas ""Künstliche Sonne"", wie die Anlage genannt wird, konnte ein dichteres Fusionsplasma erreichen als je zuvor.",,de,'Sonne'
https://www.bild.de/sport/fussball/fortuna-duesseldorf-wie-lange-geht-das-mit-markus-anfang-gut-69577877f6fc544dba9b9efb,https://www.bild.de/sport/fussball/fortuna-duesseldorf-wie-lange-geht-das-mit-markus-anfang-gut-69577877f6fc544dba9b9efb,0,www.bild.de,Neustart-Versuch bei Fortuna - Wie lange geht das mit Anfang gut?,"Mal Schnee, dann nur dunkle Wolken und plötzlich knallende Sonne bei eisiger Kälte – der Trainingsstart von Düsseldorf mit Rakus Anfang als Trainer.","https://images.bild.de/69577877f6fc544dba9b9efb/aa58726c867ee3b4ad68bf9f7f5c988f,13bc16b9?w=1280",2026-01-02T15:14:13Z,,"Mal Schnee, dann nur dunkle Wolken und plötzlich knallende Sonne bei eisiger Kälte der Trainingsstart von Fortuna Düsseldorf ins neue Jahr passt zur bisherigen Saison, in der es für den 16. der 2. Li… [+1532 chars]",,de,'Sonne'
https://www.stern.de/gesellschaft/regional/nordrhein-westfalen/spitzenwert-gab-es-2006--ungewoehnlich-wenig-blitzeinschlaege-in-nrw-im-jahr-2025-37006892.html,https://www.stern.de/gesellschaft/regional/nordrhein-westfalen/spitzenwert-gab-es-2006--ungewoehnlich-wenig-blitzeinschlaege-in-nrw-im-jahr-2025-37006892.html,0,www.stern.de,Spitzenwert gab es 2006: Ungewöhnlich wenig Blitzeinschläge in NRW im Jahr 2025,Mehr als 8.000 Blitze weniger als im Vorjahr: Wie beeinflussen trockene Monate und kühle Temperaturen das Gewitter-Risiko? Die Meteorologen haben Erklärungen.,https://image.stern.de/37006894/t/Xz/v1/w1440/r1.7778/-/03--noa7akkbdrv5axs2048jpeg---d1de0f8960afcd30.jpg,2026-01-03T03:00:38Z,,"Kopiere den aktuellen Link
Zur Merkliste hinzufügen
Mehr als 8.000 Blitze weniger als im Vorjahr: Wie beeinflussen trockene Monate und kühle Temperaturen das Gewitter-Risiko? Die Meteorologen haben… [+1792 chars]",,de,'Gewitter'
https://www.tagesspiegel.de/gesellschaft/panorama/wetter-meistens-zu-trocken-2025-war-extrem-blitzarm-15098139.html,https://www.tagesspiegel.de/gesellschaft/panorama/wetter-meistens-zu-trocken-2025-war-extrem-blitzarm-15098139.html,0,www.tagesspiegel.de,Wetter: Meistens zu trocken: 2025 war extrem blitzarm,Nicht einmal 100.000 Einschläge hat das System des Informationsdienstes Aldis/Blids deutschlandweit gezählt. Oft fehlten wichtige Zutaten für Gewitter.,https://www.tagesspiegel.de/images/15098138/alternates/BASE_16_9_W1400/1767409360000/gewitter.jpeg,2026-01-03T03:02:40Z,,"2025 hat es in Deutschland ungewöhnlich selten geblitzt. 99.930 Erdblitze zählte der Informationsdienst Aldis/Blids im Jahresverlauf. Das waren nicht einmal halb so viele wie im Vorjahr, als das Sens… [+3738 chars]",,de,'Gewitter'
https://www.kino.de/news/durch-diesen-film-wurden-3-grandiose-kriegsfilme-uebergangen-was-zu-einem-der-groessten-oscar-skandale-fuehrte--01K58V0YM0CRZJTRAS051Q9EJV,https://www.kino.de/news/durch-diesen-film-wurden-3-grandiose-kriegsfilme-uebergangen-was-zu-einem-der-groessten-oscar-skandale-fuehrte--01K58V0YM0CRZJTRAS051Q9EJV,0,www.kino.de,Durch diesen Film wurden 3 grandiose Kriegsfilme übergangen – was zu einem der größten Oscar-Skandale führte,Es bleibt für mich eine der fragwürdigsten Entscheidungen der Academy: 1999 gewann ein Film ganze sieben Oscars und stellte drei wichtige Meisterwerke in den Schatten.,https://static.kino.de/57/1b/ed/865cde6e004c4dedf8a1779b3b_ZmMgNzZkMTgxMTFmZmZmIDE5MjAgMTA4MAM1YjhjNjA0ZGE3Mw==.jpeg,2026-01-03T10:00:00Z,,"Es bleibt für mich eine der fragwürdigsten Entscheidungen der Academy: 1999 gewann ein Film ganze sieben Oscars und stellte drei wichtige Meisterwerke in den Schatten.
Mitten in einer Ära des Umbruc… [+2781 chars]",,de,'Schatten'
https://www.stern.de/panorama/animation-erklaert-toedlichen-bar-brand-mit-flashover--video--37007704.html,https://www.stern.de/panorama/animation-erklaert-toedlichen-bar-brand-mit-flashover--video--37007704.html,0,www.stern.de,"Flashover erklärt: Über 1000 Grad Hitze: Animation zeigt, wie eine Bar zur Feuerhölle wird","Handyvideos zeigen den Moment, in dem in der Bar ""Le Constellation"" ein Feuer ausbricht. Experten erklären, wie ein Flashover entsteht – und warum sich binnen Sekunden eine tödliche Feuerwalze bildet.",https://image.stern.de/37007540/t/4Q/v1/w1440/r1.7778/-/animation-brand.jpg,2026-01-03T13:14:00Z,,"Zugang zu stern+statt 11,96 
 nur 1  
<ul><li>Alles von stern+ mit erstklassigen Inhalten von GEO und Capital</li><li>4 Wochen testen, dann 2,99  je Woche</li><li>jederzeit kündbar</li></ul>",,de,'Hitze'
https://www.welt.de/wirtschaft/plus695be064b0086aa64be6f9e3/10-000-raumschiffe-pro-jahr-elon-musks-sagenhafte-plaene-mit-spacex.html,https://www.welt.de/wirtschaft/plus695be064b0086aa64be6f9e3/10-000-raumschiffe-pro-jahr-elon-musks-sagenhafte-plaene-mit-spacex.html,0,www.welt.de,10.000 Raumschiffe pro Jahr – so soll Musks Raketen-Revolution funktionieren,SpaceX will im größten Raketenwerk der Welt künftig 1000 Raketen pro Jahr bauen. Sogar 10.000 Raumschiffe hält Elon Musk für möglich und stellt  wieder einmal alle anderen Hersteller in den Schatten. Mit den sagenhaften Plänen will er sein ultimatives Ziel fü…,https://images.welt.de/695be064b0086aa64be6f9e3/752a4ba04b1947b608c79dabbeef1557/ci16x9-w1200/552907235-jpg,2026-01-05T20:08:03Z,,Die WELT als ePaper: Die vollständige Ausgabe steht Ihnen bereits am Vorabend zur Verfügung so sind Sie immer hochaktuell informiert. Weitere Informationen https://epaper.welt.de,,de,'Schatten'
https://www.stern.de/wirtschaft/news/nummer-1-in-europa--neue-jets-und-alte-schatten---lufthansa-feiert-100-jahre-37013180.html,https://www.stern.de/wirtschaft/news/nummer-1-in-europa--neue-jets-und-alte-schatten---lufthansa-feiert-100-jahre-37013180.html,0,www.stern.de,Nummer 1 in Europa: Neue Jets und alte Schatten - Lufthansa feiert 100 Jahre,"Ein neues Besucherzentrum, eine heikle Vorgängerin und ein Blick in die Zukunft: Wie die Lufthansa ihr kompliziertes Jubiläum begeht – und welche Herausforderungen der Konzern zu meistern hat.",https://image.stern.de/37013182/t/Ff/v1/w1440/r1.7778/-/06--xgfbui4itsv1axs2048jpeg---2dd8a914ab55a40e.jpg,2026-01-06T04:00:18Z,,"Kopiere den aktuellen Link
Zur Merkliste hinzufügen
Ein neues Besucherzentrum, eine heikle Vorgängerin und ein Blick in die Zukunft: Wie die Lufthansa ihr kompliziertes Jubiläum begeht und welche H… [+9213 chars]",,de,'Schatten'
https://www.tagesspiegel.de/wirtschaft/nummer-1-in-europa-neue-jets-und-alte-schatten-lufthansa-feiert-100-jahre-15106169.html,https://www.tagesspiegel.de/wirtschaft/nummer-1-in-europa-neue-jets-und-alte-schatten-lufthansa-feiert-100-jahre-15106169.html,0,www.tagesspiegel.de,Nummer 1 in Europa: Neue Jets und alte Schatten - Lufthansa feiert 100 Jahre,"Ein neues Besucherzentrum, eine heikle Vorgängerin und ein Blick in die Zukunft: Wie die Lufthansa ihr kompliziertes Jubiläum begeht – und welche Herausforderungen der Konzern zu meistern hat.",https://www.tagesspiegel.de/images/15106168/alternates/BASE_16_9_W1400/1767672148000/boeing-787-9-mit-sonderlackierung-100-jahre-lufthansa.jpeg,2026-01-06T04:02:28Z,,"Es ist kein einfaches Jubiläum, das die Lufthansa im neuen Jahr groß feiern will. Heute steht der 100. Jahrestag der Gründung der ersten Deutsche Luft Hansa Aktiengesellschaft in Berlin an, doch die … [+8913 chars]",,de,'Schatten'
https://www.stern.de/politik/deutschland/unter-strom--wie-sich-franziska-giffey-in-der-krise-profiliert-37012714.html,https://www.stern.de/politik/deutschland/unter-strom--wie-sich-franziska-giffey-in-der-krise-profiliert-37012714.html,0,www.stern.de,Berliner Krisenmanagement: Franziska Giffey: Die Senatorin unter Strom,"Sie ist überall präsent, erklärt, lobt und dankt. Franziska Giffey stellt den Regierenden Bürgermeister Kai Wegner in den Schatten. Rettet sie ihre politische Karriere?",https://image.stern.de/37012712/t/S0/v3/w1440/r1.7778/-/foto-giffey.jpg,2026-01-06T04:33:00Z,,"Zugang zu stern+statt 11,96 
 nur 1  
<ul><li>Alles von stern+ mit erstklassigen Inhalten von GEO und Capital</li><li>4 Wochen testen, dann 2,99  je Woche</li><li>jederzeit kündbar</li></ul>",,de,'Schatten'
