index,url,valid,domain,title,description,image,published,archive,content,quote,language,keyword
https://www.teltarif.de/outdoor-smartphone-waermebild/news/102516.html,https://www.teltarif.de/outdoor-smartphone-waermebild/news/102516.html,0,www.teltarif.de,Hart im Nehmen: Handy misst Hitze & übersteht jeden Sturz,Der Hersteller Oscal stellt mit dem Pilot 6 ein robustes Smartphone mit Wärmebildkamera und 10.000-mAh-Akku vor. Zum Marktstart bei AliExpress reduziert ein Gutscheincode den Preis.,https://www.teltarif.de/img/arch/2026/kw12/outdoor-hardware-waermebild-2og.jpg,2026-03-17T11:33:41Z,,"Der Einsatz empfind­licher Elek­tronik auf Baustellen, in forst­wirt­schaft­lichen Betrieben oder bei extremen Witte­rungs­bedin­gungen führt bei herkömm­lichen Mobil­geräten oftmals zu irrepa­rablen… [+3754 chars]",,de,'Hitze'
"https://www.gamestar.de/artikel/koenic-grill-gas-6-brenner-gusseisen-edelstahl-800-grad-angebot,3449850.html","https://www.gamestar.de/artikel/koenic-grill-gas-6-brenner-gusseisen-edelstahl-800-grad-angebot,3449850.html",0,www.gamestar.de,Deals: Grill - Ihr wollt nie wieder etwas anderes im Garten stehen haben! [Anzeige],"Der ewige Winter ist endlich vorbei und die Sonne lacht uns in Deutschland wieder an. Was gehört bei uns in Deutschland einfach zum Starterpack dazu, sobald’s warm wird? Der Grill! Und ich habe jetzt einen, der mich wahrscheinlich bis ans Lebensende begleiten…",https://images.cgames.de/images/gamestar/293/koenic-grill_6361685.jpg,2026-03-17T13:39:00Z,,"Ich habe letzten Sommer Freunde und Familie zum Grillen eingeladen und habe mein neues Schmuckstück mit Ihnen eingeweiht. Am Ende des Abends waren alle neidisch auf diesen Grill!
Letzten Sommer gab … [+5133 chars]",,de,'Sonne'
https://www.bild.de/news/wetter/experten-warnen-kommt-2026-der-super-el-nino-69b7e88ae74d99f444f828ac,https://www.bild.de/news/wetter/experten-warnen-kommt-2026-der-super-el-nino-69b7e88ae74d99f444f828ac,0,www.bild.de,Experten warnen - Kommt 2026 der „Super-El-Niño“?,Bis Ende 2026 könnte sich über dem Pazifik ein ungewöhnlich starker Super-El-Niño entwickeln – mit neuen Hitzerekorden.,"https://images.bild.de/69b7e88ae74d99f444f828ac/6e5fa832db01fa7f2942e0ae226a19b3,b400ee95?w=1280",2026-03-17T14:14:02Z,,"TTS-Player überspringenArtikel weiterlesenÜber dem Pazifik braut sich womöglich etwas Großes zusammen: Bis Ende 2026 könnte sich dort ein ungewöhnlich starker Super-El-Niño entwickeln.
Berlin Neue K… [+4402 chars]",,de,'Hitze'
https://www.diepresse.com/20674456/milbenkrieg-mit-den-guten-dem-boesen-und-den-schiachen,https://www.diepresse.com/20674456/milbenkrieg-mit-den-guten-dem-boesen-und-den-schiachen,0,www.diepresse.com,"Milbenkrieg mit den Guten, dem Bösen und den Schiachen [premium]","Hitzewellen schaden Nützlingen auf dem Obstbaum mehr als Schädlingen. Jetzt wird klar, wie die Kombination von Wärme, Spritzmittel und biologischer Schädlingsbekämpfung auf Milben wirkt.",https://img.diepresse.com/public/incoming/kjheel-obs20230517obs0045hrjpg/alternates/DPR_SOCIAL_MAGAZIN/OBS_20230517_OBS0045.HR.jpg,2026-03-17T14:52:00Z,,"The Good, the Bad and the Ugly: Das Team um Andreas Walzer nimmt im Projekttitel Bezug auf den Kultfilm mit Clint Eastwood aus dem Jahr 1966 (zu Deutsch Zwei glorreiche Halunken). Bei den Biologen si… [+8254 chars]",,de,'Hitze'
https://t3n.de/news/venus-bricht-die-regeln-forscher-finden-hinweise-auf-tunnel-die-physikalisch-unmoeglich-scheinen-1728670/,https://t3n.de/news/venus-bricht-die-regeln-forscher-finden-hinweise-auf-tunnel-die-physikalisch-unmoeglich-scheinen-1728670/,0,t3n.de,"Venus bricht die Regeln: Forscher finden Hinweise auf Tunnel, die physikalisch unmöglich scheinen","Die Venus gilt als absolut lebensfeindlicher Ort mit extremem Druck und enormer Hitze. Doch tief unter der dichten Oberfläche könnte sich etwas verbergen, das physikalisch eigentlich unmöglich scheint. Neue Analysen zeichnen ein überraschendes Bild. In unsere…",https://cdn.t3n.de/news/wp-content/uploads/2022/01/nasa-venus.jpeg?class=content,2026-03-17T17:55:00Z,,"In unserem Sonnensystem galt bisher eine recht simple Faustregel für vulkanische Hinterlassenschaften: Je geringer die Schwerkraft eines Himmelskörpers ist, desto größer können die dortigen Lavaröhre… [+4598 chars]",,de,'Hitze'
https://www.zeit.de/news/2026-03/18/spargelbauern-hoffen-auf-sonne-fuer-ernte-bis-ostern,https://www.zeit.de/news/2026-03/18/spargelbauern-hoffen-auf-sonne-fuer-ernte-bis-ostern,0,www.zeit.de,Spargel-Anbau: Spargelbauern hoffen auf Sonne für Ernte bis Ostern,Hier finden Sie Informationen zu dem Thema „Spargel-Anbau“. Lesen Sie jetzt „Spargelbauern hoffen auf Sonne für Ernte bis Ostern“.,https://img.zeit.de/news/2026-03/18/spargelbauern-hoffen-auf-sonne-fuer-ernte-bis-ostern-image-group/wide__1300x731,2026-03-18T04:00:06Z,,"Die ersten Spargelstangen schauen allmählich aus der Erde - doch damit die Ernte in Nordrhein-Westfalen richtig losgehen kann, braucht es noch ein paar warme Tage. «Der ein oder andere Hofbauer wird … [+1749 chars]",,de,'Sonne'
https://www.zeit.de/news/2026-03/18/in-hamburg-und-schleswig-holstein-strahlt-die-sonne,https://www.zeit.de/news/2026-03/18/in-hamburg-und-schleswig-holstein-strahlt-die-sonne,0,www.zeit.de,Wetter: In Hamburg und Schleswig-Holstein strahlt die Sonne,Hier finden Sie Informationen zu dem Thema „Wetter“. Lesen Sie jetzt „In Hamburg und Schleswig-Holstein strahlt die Sonne“.,https://img.zeit.de/news/2026-03/18/in-hamburg-und-schleswig-holstein-strahlt-die-sonne-image-group/wide__1300x731,2026-03-18T06:35:55Z,,In Hamburg und Schleswig-Holstein wird es frühlingshaft und heiter. Der Deutsche Wetterdienst (DWD) sagt für die nördlichen Bundesländer Sonne und milde Temperaturen vorher. Zu danken sei dafür ein H… [+1040 chars],,de,'Sonne'
https://www.zeit.de/news/2026-03/18/sonne-satt-und-milde-temperaturen-in-hessen,https://www.zeit.de/news/2026-03/18/sonne-satt-und-milde-temperaturen-in-hessen,0,www.zeit.de,DWD-Vorhersage: Sonne satt und milde Temperaturen in Hessen,Hier finden Sie Informationen zu dem Thema „DWD-Vorhersage“. Lesen Sie jetzt „Sonne satt und milde Temperaturen in Hessen“.,https://img.zeit.de/news/2026-03/18/sonne-satt-und-milde-temperaturen-in-hessen-image-group/wide__1300x731,2026-03-18T06:59:31Z,,In Hessen kommt der Frühling zurück - zumindest vorläufig. Im Tagesverlauf klettern die Temperaturen auf 9 bis 16 Grad. Dazu wird es heiter bis sonnig. In der Nacht kühlt es auf minus 3 bis plus 4 Gr… [+344 chars],,de,'Sonne'
https://www.zeit.de/news/2026-03/19/sonne-und-regen-wechselwetter-in-berlin-und-brandenburg,https://www.zeit.de/news/2026-03/19/sonne-und-regen-wechselwetter-in-berlin-und-brandenburg,0,www.zeit.de,Wetter: Sonne und Regen: Wechselwetter in Berlin und Brandenburg,Hier finden Sie Informationen zu dem Thema „Wetter“. Lesen Sie jetzt „Sonne und Regen: Wechselwetter in Berlin und Brandenburg“.,https://img.zeit.de/news/2026-03/19/sonne-und-regen-wechselwetter-in-berlin-und-brandenburg-image-group/wide__1300x731,2026-03-19T04:41:15Z,,Kalte Nächte und gebietsweise Regen ziehen sich in Berlin und Brandenburg trotz milder Temperaturen bis in das Wochenende. Zum Start in den Donnerstag erwartet der Deutsche Wetterdienst (DWD) gebiets… [+1019 chars],,de,'Sonne'
https://www.zeit.de/news/2026-03/19/trotz-der-sonnentage-warum-schirm-und-jacke-wichtig-werden,https://www.zeit.de/news/2026-03/19/trotz-der-sonnentage-warum-schirm-und-jacke-wichtig-werden,0,www.zeit.de,Wetter: Trotz der Sonnentage: Warum Schirm und Jacke wichtig werden,Hier finden Sie Informationen zu dem Thema „Wetter“. Lesen Sie jetzt „Trotz der Sonnentage: Warum Schirm und Jacke wichtig werden“.,https://img.zeit.de/news/2026-03/19/trotz-der-sonnentage-warum-schirm-und-jacke-wichtig-werden-image-group/wide__1300x731,2026-03-19T05:05:38Z,,Freunde von Sonnenschein und blauem Himmel sollten die nächsten beiden Tage lieber in vollen Zügen genießen. Denn nach dem kurzen Frühlingshoch in Baden-Württemberg mit angenehmen Temperaturen kommt … [+1417 chars],,de,'Sonne'
https://www.zeit.de/news/2026-03/19/leichter-frost-nebel-und-sonne-am-wochenende-im-norden,https://www.zeit.de/news/2026-03/19/leichter-frost-nebel-und-sonne-am-wochenende-im-norden,0,www.zeit.de,"Wetter: Leichter Frost, Nebel und Sonne am Wochenende im Norden","Hier finden Sie Informationen zu dem Thema „Wetter“. Lesen Sie jetzt „Leichter Frost, Nebel und Sonne am Wochenende im Norden“.",https://img.zeit.de/news/2026-03/19/leichter-frost-nebel-und-sonne-am-wochenende-im-norden-image-group/wide__1300x731,2026-03-19T05:41:37Z,,"Zum Wochenende hin wird es im Norden freundlich mit leichtem Frost und teilweise Nebel in den Nachtstunden.
Am Donnerstag scheint in allen Regionen die Sonne und es bleibt trocken. Im Tagesverlauf k… [+940 chars]",,de,'Sonne'
https://www.welt.de/vermischtes/article69bcad768f57616717159179/martinez-lake-ort-in-arizona-erreicht-ueber-40-c-neuer-us-hitzerekord-fuer-den-maerz.html,https://www.welt.de/vermischtes/article69bcad768f57616717159179/martinez-lake-ort-in-arizona-erreicht-ueber-40-c-neuer-us-hitzerekord-fuer-den-maerz.html,0,www.welt.de,Ort in Arizona erreicht über 40 °C – neuer US-Hitzerekord für den März,"In Arizona wurde am Donnerstag mit 43,3 °C der heißeste Märzwert in den USA gemessen. Die extreme Hitzewelle traf zahlreiche Städte wie Phoenix, San Diego und Las Vegas – weit früher als die üblichen 40-Grad-Tage im Mai.",https://images.welt.de/69bcad768f57616717159179/c7154186a338ce91de81e204bac1a06e-master/ci16x9-w1200/dpa-com-20090101-260319-99-884452-jpg,2026-03-20T02:20:35Z,,"Die Temperatur in der Wüstengemeinde Martinez Lake im US-Bundesstaat Arizona ist am Donnerstag auf 43,3 Grad Celsius gestiegen. Es ist der heißeste jemals im März gemessene Wert in den Vereinigten St… [+921 chars]",,de,'Hitzerekord'
https://www.faz.net/aktuell/politik/ausland/humanitaere-krise-im-schatten-des-irankriegs-accg-200650713.html,https://www.faz.net/aktuell/politik/ausland/humanitaere-krise-im-schatten-des-irankriegs-accg-200650713.html,0,www.faz.net,Organisationen warnen: Im Schatten des Irankriegs drohen weitere Hungersnöte,"Humanitäre Organisationen können nicht noch eine weitere Notlage abfedern. Die Mittel sinken, die Zahl der Not leidenden Menschen in aller Welt steigt.",https://media0.faz.net/image/w1200h627/60636b41a0bd/w4877h2548x116y394o/202603/8ac146a4-2399-11f1-9971-7ba8e7492b43/noch-gibt-es-vorraete-aber-wie.webp,2026-03-20T09:49:54Z,,"Der Irankrieg stellt humanitäre Organisationen vor ein Problem der Kommunikation. Seit mehr als einem Jahr kürzen Regierungen ihre Budgets, während neue Konflikte aufflammen oder sich verschärfen und… [+5425 chars]",,de,'Schatten'
https://www.faz.net/aktuell/sport/mehr-sport/deutsches-handball-team-siegt-ohne-andreas-wolff-mit-starken-torhuetern-200654435.html,https://www.faz.net/aktuell/sport/mehr-sport/deutsches-handball-team-siegt-ohne-andreas-wolff-mit-starken-torhuetern-200654435.html,0,www.faz.net,Handball-Nationalteam: Traum-Fänger im Schatten des Supermannes,Es geht auch ohne Andreas Wolff: An das junge Duo David Späth/Lasse Ludwig im Tor der Handball-Nationalmannschaft kann man sich schnell gewöhnen. Der Debütant schwärmt: „Das war unbeschreiblich“.,https://media0.faz.net/image/w1200h627/943c785c494b/w5900h3082x0y756o/202603/43601.0.1901606687/kein-andreas-wolff-kein.webp,2026-03-20T15:27:09Z,,"Gerät ein junger Handballtorhüter ins Träumen, sieht es vermutlich so aus: Erstes Länderspiel in ausverkaufter Halle, knapp elftausend Landsleute sind dabei, ein Vielfaches sitzt daheim vor Bildschir… [+5122 chars]",,de,'Schatten'
https://www.stern.de/gesellschaft/regional/niedersachsen-bremen/klimawandel--land-gibt-124-millionen-fuer-hochwasser--und-kuestenschutz-aus-37241056.html,https://www.stern.de/gesellschaft/regional/niedersachsen-bremen/klimawandel--land-gibt-124-millionen-fuer-hochwasser--und-kuestenschutz-aus-37241056.html,0,www.stern.de,Klimawandel: Land gibt 124 Millionen für Hochwasser- und Küstenschutz aus,Hannover (lni) - In den Hochwasserschutz im Binnenland und in den Schutz an der Küste investiert Niedersachsen in diesem Jahr rund 124 Millionen Euro.,https://image.stern.de/37241058/t/FP/v1/w1440/r1.7778/-/20--shhkp5cbtev3axs2048jpeg---97c6b74a9309abe4.jpg,2026-03-20T15:38:38Z,,"Kopiere den aktuellen Link
Zur Merkliste hinzufügen
Niedersachsen verstärkt Deiche und modernisiert Schöpfwerke mit Rekordmitteln.
In den Hochwasserschutz im Binnenland und in den Schutz an der Kü… [+1328 chars]",,de,'Klimawandel'
https://www.stern.de/gesellschaft/regional/mecklenburg-vorpommern/bauerntag--schwesig-wuerdigt-rolle-der-landwirte-in-mv-37241118.html,https://www.stern.de/gesellschaft/regional/mecklenburg-vorpommern/bauerntag--schwesig-wuerdigt-rolle-der-landwirte-in-mv-37241118.html,0,www.stern.de,Bauerntag: Schwesig würdigt Rolle der Landwirte in MV,"Ob Zölle, Krisen, Klimawandel oder Kriege - die Landwirtschaft bekommt die Folgen oft direkt zu spüren. Trotz der angespannten Lage hatten die Bauern in Linstow einen guten Grund zu feiern.",https://image.stern.de/37241120/t/ep/v1/w1440/r1.7778/-/20--ejqxme3a23v1axs2048jpeg---0c0d0656b59ac653.jpg,2026-03-20T16:00:57Z,,"Kopiere den aktuellen Link
Zur Merkliste hinzufügen
Ob Zölle, Krisen, Klimawandel oder Kriege - die Landwirtschaft bekommt die Folgen oft direkt zu spüren. Trotz der angespannten Lage hatten die Ba… [+2988 chars]",,de,'Klimawandel'
https://www.faz.net/aktuell/politik/ausland/lage-in-gaza-ist-angespannt-200654747.html,https://www.faz.net/aktuell/politik/ausland/lage-in-gaza-ist-angespannt-200654747.html,0,www.faz.net,Angriffe trotz Waffenruhe: Warum die Lage in Gaza angespannt bleibt,"Im Schatten des Irankriegs arbeitet die Hamas im Gazastreifen daran, ihre Macht zu festigen. Israel verstärkt derweil seine Angriffe auf das Küstengebiet.",https://media0.faz.net/image/w1200h627/1a5dad55c92f/w3046h1591x26y149o/202603/466e1f56-2455-11f1-a194-7d89aea5d8f3/instabile-lage-krankenwagen.webp,2026-03-20T17:08:43Z,,Krankenwagen und Busse rumpelten am Donnerstag über die sandigen Wege am südlichen Ende des Gazastreifens: Der Rafah-Übergang war zum ersten Mal seit fast drei Wochen wieder für den Personenverkehr g… [+5231 chars],,de,'Schatten'
https://www.bild.de/regional/bayern/letzter-gletscherlift-verschwindet-ende-einer-aera-in-deutschlands-alpen-69bd0afaea8bf301e4ae1d06,https://www.bild.de/regional/bayern/letzter-gletscherlift-verschwindet-ende-einer-aera-in-deutschlands-alpen-69bd0afaea8bf301e4ae1d06,0,www.bild.de,Wegen Klimawandel - Deutschlands letzter Gletscher-Skilift verschwindet,Auf dem Nördlichen Schneeferner auf der Zugspitze wird der Plattlift abgebaut – Deutschlands letztes Gletscherskigebiet endet.,"https://images.bild.de/69bd0afaea8bf301e4ae1d06/8761d020f38e0b560e0b3db6c238eccb,f983d08e?w=1280",2026-03-20T18:17:18Z,,TTS-Player überspringenArtikel weiterlesenGarmisch-Partenkirchen (Bayern) Es ist das Ende einer Ära: Auf Deutschlands höchstem Berg wird der letzte Gletscherlift abgebaut. Nach fast 60 Jahren verschw… [+2598 chars],,de,'Klimawandel'
https://www.stern.de/gesellschaft/regional/rheinland-pfalz-saarland/vor-der-landtagswahl--finale-im-sueden---so-war-der-wahlkampf-in-rheinland-pfalz-37241676.html,https://www.stern.de/gesellschaft/regional/rheinland-pfalz-saarland/vor-der-landtagswahl--finale-im-sueden---so-war-der-wahlkampf-in-rheinland-pfalz-37241676.html,0,www.stern.de,Vor der Landtagswahl: Finale im Süden - so war der Wahlkampf in Rheinland-Pfalz,"Viele fanden ihn langweilig, große Kontroversen bot der rheinland-pfälzische Landtagswahlkampf nicht - auch nicht beim Abschluss. Wie er war und welches Bündnis Schatten vorauswirft.",https://image.stern.de/37241678/t/AI/v1/w1440/r1.7778/-/21--k2axdhnqefv12axs2048jpeg---7444a22f668777ad.jpg,2026-03-21T02:30:05Z,,"Kopiere den aktuellen Link
Zur Merkliste hinzufügen
Viele fanden ihn langweilig, große Kontroversen bot der rheinland-pfälzische Landtagswahlkampf nicht - auch nicht beim Abschluss. Wie er war und … [+5520 chars]",,de,'Schatten'
https://www.stern.de/panorama/wissen/internationaler-tag-des-waldes--mehr-vielfalt--wie-sich-der-wald-von-morgen-wandeln-muss-37241786.html,https://www.stern.de/panorama/wissen/internationaler-tag-des-waldes--mehr-vielfalt--wie-sich-der-wald-von-morgen-wandeln-muss-37241786.html,0,www.stern.de,Internationaler Tag des Waldes: Mehr Vielfalt: Wie sich der Wald von morgen wandeln muss,Der Klimawandel setzt dem Forst zu. Für Experten ist klar: Dieses Ökosystem verändert sich. Warum der Wald der Zukunft anders aussehen und sogar anders riechen wird.,https://image.stern.de/37241788/t/aT/v1/w1440/r1.7778/-/21--egfrzq5ihdv1axs2048jpeg---31227e4b23bdd9c8.jpg,2026-03-21T04:00:06Z,,"Kopiere den aktuellen Link
Zur Merkliste hinzufügen
Der Klimawandel setzt dem Forst zu. Für Experten ist klar: Dieses Ökosystem verändert sich. Warum der Wald der Zukunft anders aussehen und sogar … [+6399 chars]",,de,'Klimawandel'
https://www.tagesspiegel.de/wissen/internationaler-tag-des-waldes-mehr-vielfalt-wie-sich-der-wald-von-morgen-wandeln-muss-15384748.html,https://www.tagesspiegel.de/wissen/internationaler-tag-des-waldes-mehr-vielfalt-wie-sich-der-wald-von-morgen-wandeln-muss-15384748.html,0,www.tagesspiegel.de,Internationaler Tag des Waldes: Mehr Vielfalt: Wie sich der Wald von morgen wandeln muss,Der Klimawandel setzt dem Forst zu. Für Experten ist klar: Dieses Ökosystem verändert sich. Warum der Wald der Zukunft anders aussehen und sogar anders riechen wird.,https://www.tagesspiegel.de/images/15384747/alternates/BASE_16_9_W1400/1774065714000/fruhling-im-wald.jpeg,2026-03-21T04:01:54Z,,"Der Wald ist mehr als nur eine Ansammlung von Bäumen: Er bindet Kohlenstoff, speichert Wasser, schützt Böden und bietet zahlreichen Tierarten einen Lebensraum. Doch der Wald steht vor gewaltigen Hera… [+5829 chars]",,de,'Klimawandel'
https://www.stern.de/news/rekord-hitzewelle-im-westen-der-usa---drohende-ueberschwemmungen-auf-hawaii-37242056.html,https://www.stern.de/news/rekord-hitzewelle-im-westen-der-usa---drohende-ueberschwemmungen-auf-hawaii-37242056.html,0,www.stern.de,Rekord-Hitzewelle im Westen der USA - Drohende Überschwemmungen auf Hawaii,"Der Westen der USA ist von einer Rekord-Hitzewelle heimgesucht worden, die Experten zufolge mit ziemlicher Sicherheit eine Folge des vom Menschen verursachten Klimawandels ist. An vier Orten in der Wüstenregion nahe der Grenze zwischen den US-Bundesstaaten Ka…",https://image.stern.de/37242058/t/FW/v1/w1440/r1.7778/-/21--sonnenuntergang-in-los-angeles---50d320e6f3f0c754.jpg,2026-03-21T09:05:51Z,,"Kopiere den aktuellen Link
Zur Merkliste hinzufügen
Der Westen der USA ist von einer Rekord-Hitzewelle heimgesucht worden, die Experten zufolge mit ziemlicher Sicherheit eine Folge des vom Menschen… [+1837 chars]",,de,'Hitze'
https://www.zeit.de/gesellschaft/2026-03/klimawandel-hitzewelle-usa-hawaii-staudamm,https://www.zeit.de/gesellschaft/2026-03/klimawandel-hitzewelle-usa-hawaii-staudamm,0,www.zeit.de,Klimawandel: Zahlreiche US-Städte messen Rekordtemperaturen,"Im Westen der USA werden Temperaturen bis zu 44 Grad gemessen. Folgen des Klimawandels, sagen Forschungsgruppen. Auf Hawaii droht nach Starkregen ein Dammbruch.",https://img.zeit.de/gesellschaft/2026-03/usa-hitze-bild/wide__1300x731,2026-03-21T09:40:21Z,,"Im Westen der USA werden derzeit Rekord-Hitzewerte gemessen. Experten zufolge müssen sie als eine Folge des vom Menschen verursachten 
Klimawandels betrachtet werden. Laut der Website Weather.com ha… [+1802 chars]",,de,'Klimawandel'
https://www.focus.de/panorama/welt/keine-freude-mehr-auswanderin-71-ertraegt-italiens-dauerregen-nicht-mehr-und-flieht-heim_a8e6461b-b087-43af-a99d-024d33ab9b63.html,https://www.focus.de/panorama/welt/keine-freude-mehr-auswanderin-71-ertraegt-italiens-dauerregen-nicht-mehr-und-flieht-heim_a8e6461b-b087-43af-a99d-024d33ab9b63.html,0,www.focus.de,"""Keine Freude mehr"": Auswanderin (71) erträgt Italiens Dauerregen nicht mehr und flieht heim",Eine britische Rentnerin gibt ihr Leben in Italien auf. Der Klimawandel macht ihren lang erträumten Ruhestand in der Sonne zunichte.,"https://quadro.burda-forward.de/ctf/c71e26b4-361c-4893-9143-89081846ab69.18643a43-4df2-4dbb-9b5b-3c0361929617.jpg?im=RegionOfInterestCrop=(1200,630),regionOfInterest=(1095,633)&hash=1d1c96f8cf0f88a8b7244996a6f92432766fc962005a20f957c5198ff8e973b2",2026-03-21T10:00:00Z,,"Die Britin Stephanie Jones bricht ihr Rentnerleben im italienischen Umbrien ab und zieht zurück nach Leeds in England. Wie I Paper berichtet, hatte die 71-Jährige 2023 ein kleines Landhaus nahe Terni… [+2437 chars]",,de,'Sonne'
https://www.tagesspiegel.de/gesellschaft/panorama/dammbruch-droht-tausende-evakuiert-uberschwemmungen-auf-hawaii--rekordhitzewelle-im-westen-der-usa-15385077.html,https://www.tagesspiegel.de/gesellschaft/panorama/dammbruch-droht-tausende-evakuiert-uberschwemmungen-auf-hawaii--rekordhitzewelle-im-westen-der-usa-15385077.html,0,www.tagesspiegel.de,"Dammbruch droht, Tausende evakuiert: Überschwemmungen auf Hawaii – Rekordhitzewelle im Westen der USA","Nach starken Regenfällen auf den Pazifikinseln richten Fluten große Zerstörungen an. Und die Gefahr ist nicht gebannt. In Arizona, Kalifornien und Idaho leiden Mensch und Tier unter enormen Temperaturen.",https://www.tagesspiegel.de/images/15385166/alternates/BASE_16_9_W1400/1774088323000/uberschwemmungen-auf-hawaii.jpeg,2026-03-21T11:27:14Z,,"Den Vereinigten Staaten macht das Wetter massiv zu schaffen: Während die pazifische Inselgruppe Hawaii mit enormen Überschwemmungen zu kämpfen hat, ächzen Staaten im Westen unter für diese Jahreszeit… [+5997 chars]",,de,'Klimawandel'
https://www.tagesschau.de/wissen/klima/studie-aufforstung-100.html,https://www.tagesschau.de/wissen/klima/studie-aufforstung-100.html,0,www.tagesschau.de,Wo Wälder die Erde kühlen - und wo nicht,Wälder binden CO2. Aufforstung ist deshalb wichtig im Kampf gegen die Erderwärmung. Eine Studie zeigt jedoch: Nur am strategisch richtigen Standort funktionieren Wälder zusätzlich als Klimaanlagen. Von Margareta Holzreiter.,https://images.tagesschau.de/image/86e56a6b-ee18-4cf7-bf1c-0d72c2f3a47e/AAABnQpTAUA/AAABmyZE0EA/16x9-big/wald-236.jpg?width=1280,2026-03-21T11:37:51Z,,"Stand: 21.03.2026 12:37 Uhr
Wälder binden CO2. Aufforstung ist deshalb wichtig im Kampf gegen die Erderwärmung. Eine Studie zeigt jedoch: Nur am strategisch richtigen Standort funktionieren Wälder z… [+6602 chars]",,de,'Erderwärmung'
https://www.stern.de/news/rekord-hitzewelle-im-westen-der-usa-zieht-in-richtung-osten-weiter-37243452.html,https://www.stern.de/news/rekord-hitzewelle-im-westen-der-usa-zieht-in-richtung-osten-weiter-37243452.html,0,www.stern.de,Rekord-Hitzewelle im Westen der USA zieht in Richtung Osten weiter,Hochsommertemperaturen mitten im März: Die historisch frühe Hitzewelle im Westen der USA ist weiter in Richtung Osten gezogen. Dutzende Bundesstaaten von Kalifornien bis zum zentraler gelegenen Colorado verzeichneten am Samstag laut dem Nationalen Wetterdiens…,https://image.stern.de/37243666/t/_x/v1/w1440/r1.7778/-/22--ein-mensch-mit-hut-an-einem-strand-in-kalifornien---445623280409897c.jpg,2026-03-22T10:00:22Z,,"Kopiere den aktuellen Link
Zur Merkliste hinzufügen
Hochsommertemperaturen mitten im März: Die historisch frühe Hitzewelle im Westen der USA ist weiter in Richtung Osten gezogen. Dutzende Bundessta… [+2040 chars]",,de,'Hitze'
https://www.tagesschau.de/wissen/klima/wasser-klimawandel-trockenheit-100.html,https://www.tagesschau.de/wissen/klima/wasser-klimawandel-trockenheit-100.html,0,www.tagesschau.de,Wie es um die Wasserversorgung steht,"Mehr als zwei Milliarden Menschen sind laut einem aktuellen UN-Bericht von sauberem Trinkwasser abgeschnitten. Deutschland gilt noch als wasserreiches Land, doch selbst hier verschärft der Klimawandel die Lage. Von Katha Jansen.",https://images.tagesschau.de/image/1770ec5d-3e9e-47eb-ba42-3b02147c803b/AAABnQvCu_Q/AAABmyZE0EA/16x9-big/ohratalsperre-100.jpg?width=1280,2026-03-22T13:11:54Z,,"Stand: 22.03.2026 14:11 Uhr
Mehr als zwei Milliarden Menschen sind laut einem aktuellen UN-Bericht von sauberem Trinkwasser abgeschnitten. Deutschland gilt noch als wasserreiches Land, doch selbst h… [+5654 chars]",,de,'Klimawandel'
https://taz.de/Historische-Hitzewelle-durch-Klimawandel/!6164928/,https://taz.de/Historische-Hitzewelle-durch-Klimawandel/!6164928/,0,taz.de,Historische Hitzewelle durch Klimawandel: Schwitzen in den USA,"Die Hitzewelle im Westen der Vereinigten Staaten zieht weiter nach Osten. Der Wärmerekord ist eine Folge des Klimawandels, so eine Forschungsgruppe.",https://taz.de/picture/8334118/1200/40714556.jpeg,2026-03-22T14:11:00Z,,"Die Hitzewelle im Westen der Vereinigten Staaten zieht weiter nach Osten. Der Wärmerekord ist eine Folge des Klimawandels, so eine Forschungsgruppe. mehr...",,de,'Hitze'
https://www.sueddeutsche.de/wissen/klimawandel-rekorde-erderwaermung-meeresspiegel-el-nino-li.3455308,https://www.sueddeutsche.de/wissen/klimawandel-rekorde-erderwaermung-meeresspiegel-el-nino-li.3455308,0,www.sueddeutsche.de,Erderwärmung: Das Klima gerät immer weiter aus dem Gleichgewicht,"Eine Studie zeigt, dass die globale Erwärmung ungebremst voranschreitet. Auch der Meeresspiegel steigt schneller.",https://www.sueddeutsche.de/2026/03/20/124f0f9f-2563-4216-8560-5c2bf51a31b9.jpg?q=60&fm=webp&width=1200&rect=0%2C157%2C3000%2C1687,2026-03-23T04:05:00Z,,"Mitte März, wenn in Mitteleuropa längst Krokusse, Winterlinge und andere Frühblüher sprießen, erreicht der Winter rund um den Nordpol erst seinen Höhepunkt. Zu diesem Zeitpunkt im Jahresverlauf ist d… [+352 chars]",,de,'Erderwärmung'
