index,url,valid,domain,title,description,image,published,archive,content,quote,language,keyword
https://www.zeit.de/news/2025-11/04/sonne-und-milde-temperaturen-bis-17-grad-moeglich,https://www.zeit.de/news/2025-11/04/sonne-und-milde-temperaturen-bis-17-grad-moeglich,0,www.zeit.de,Wetter-Vorhersage: Sonne und milde Temperaturen - bis 17 Grad möglich,Hier finden Sie Informationen zu dem Thema „Wetter-Vorhersage“. Lesen Sie jetzt „Sonne und milde Temperaturen - bis 17 Grad möglich“.,https://img.zeit.de/news/2025-11/04/sonne-und-milde-temperaturen-bis-17-grad-moeglich-image-group/wide__1300x731,2025-11-04T06:57:37Z,,"Vor allem die Menschen im Süden von Rheinland-Pfalz und dem Saarland können sich heute Vormittag über wärmende Sonnenstrahlen freuen. Ansonsten ist es wolkig bis stark bewölkt, wie der Deutsche Wette… [+503 chars]",,de,'Sonne'
https://www.brigitte.de/beauty/haut/tattoo-sonnencreme--was-ein-profi-raet-14041676.html,https://www.brigitte.de/beauty/haut/tattoo-sonnencreme--was-ein-profi-raet-14041676.html,0,www.brigitte.de,Tattoo-Sonnencreme: So bleiben deine tätowierten Bilder lange schön,"Braucht mein Tattoo Sonnencreme – und wenn ja, warum? Diese und andere Fragen klären wir auf BRIGITTE – mit Hilfe eines professionellen Tätowierers.",https://image.brigitte.de/14041678/t/Ym/v2/w1440/r1.7778/-/tattoo-sonnencreme.jpg,2025-11-04T08:40:00Z,,"Braucht mein Tattoo Sonnencreme und wenn ja, warum? Diese und andere Fragen klären wir auf BRIGITTE mit Hilfe eines professionellen Tätowierers. 
Sobald du dich für ein Tattoo entschieden und das St… [+4373 chars]",,de,'Sonnencreme'
https://www.nzz.ch/wissenschaft/schweizer-klimaszenarien-2025-temperaturanstieg-und-folgen-ld.1909399,https://www.nzz.ch/wissenschaft/schweizer-klimaszenarien-2025-temperaturanstieg-und-folgen-ld.1909399,0,www.nzz.ch,"Tropennächte, Starkregen, weniger Schnee: Neue Szenarien zeigen, wie stark der Klimawandel die Schweiz verändert","Die Klimaszenarien zeigen in grösserem Detail als zuvor, wie die Erderwärmung das Land beeinflusst. Neben der Hitze dürften vor allem Veränderungen beim Niederschlag für Probleme sorgen.","https://img.nzz.ch/2025/11/04/d064ec31-1a6e-4522-8b71-d27e6db5665d.png?width=1200&height=675&fit=bounds&quality=75&auto=webp&crop=1201,676,x0,y113&wmark=nzz",2025-11-04T10:00:00Z,,Selbst im November laden in diesen Tagen Temperaturen bis 15 Grad zum Flanieren ein. Auch dem Laien schwant: Solche Wetterbedingungen sind dank dem Klimawandel wahrscheinlicher geworden. Wie sich das… [+5891 chars],,de,'Klimawandel'
https://www.faz.net/aktuell/sport/fussball/champions-league/champions-league-wie-scott-mctominay-bei-ssc-neapel-zu-helden-wurde-accg-110762684.html,https://www.faz.net/aktuell/sport/fussball/champions-league/champions-league-wie-scott-mctominay-bei-ssc-neapel-zu-helden-wurde-accg-110762684.html,0,www.faz.net,Duell mit der Eintracht: Wie McTominay in Neapel zum unerwarteten Helden wurde,"Bei Manchester United steht Scott McTominay immer im Schatten eines größeren Stars. Dann wechselt er nach Neapel – und wird in wenigen Wochen der Spieler, der er in England immer werden wollte.",https://media1.faz.net/ppmedia/w1200/aktuell/3724980918/1.10762727/facebook_teaser/geht-voran-bei-der-ssc-neapel.jpg.webp,2025-11-04T10:39:29Z,,"Mit raspelkurzen Haaren, blasser Haut und etwas verlegen landet Scott McTominay in Süditalien. Er hat gerade die EM in Deutschland gespielt, er sollte der Star der schottischen Überraschungsmannschaf… [+3425 chars]",,de,'Schatten'
https://www.freitag.de/autoren/nick-reimer/windstille-dunkelflaute-stromversorgung-in-deutschland-aeusserst-zuverlaessig,https://www.freitag.de/autoren/nick-reimer/windstille-dunkelflaute-stromversorgung-in-deutschland-aeusserst-zuverlaessig,0,www.freitag.de,Windstille? Dunkelflaute? Stromversorgung in Deutschland äußerst zuverlässig,"Grünes Wissen to go: Gefährdet der weitere Ausbau von Sonnen- oder Windkraftwerken tatsächlich unsere Versorgung? Die Bundesnetzagentur legt einen Bericht darüber vor Windstille? Dunkelflaute? Gern, oft und inbrünstig argumentieren die Freunde des fossilen Le…",https://www.freitag.de/autoren/nick-reimer/windstille-dunkelflaute-stromversorgung-in-deutschland-aeusserst-zuverlaessig/@@images/image/great,2025-11-04T11:18:00Z,,"Windstille? Dunkelflaute? Gern, oft und inbrünstig argumentieren die Freunde des fossilen Lebens: Die Erneuerbaren gefährden die Stromversorgung in Deutschland. Denn tatsächlich scheint nachts ja kei… [+3729 chars]",,de,'Sonne'
https://www.telepolis.de/features/Agrivoltaik-Die-doppelte-Revolution-Strom-ernten-Leben-saeen-11045743.html,https://www.telepolis.de/features/Agrivoltaik-Die-doppelte-Revolution-Strom-ernten-Leben-saeen-11045743.html,0,www.telepolis.de,"Agrivoltaik: Die doppelte Revolution – Strom ernten, Leben säen","Zwei Systeme, ein Boden, ein Ziel. Schafe im Schatten, Pflanzen im Gleichgewicht. Ist das der Anfang einer neuen Landwirtschaft?",https://heise.cloudimg.io/bound/1200x1200/q85.png-lossy-85.webp-lossy-85.foil1/_www-heise-de_/imgs/18/4/9/7/0/2/0/7/master_Lange-b094884965c6a79d.jpeg,2025-11-04T12:00:00Z,,"KI-generierte Illustration
Zwei Systeme, ein Boden, ein Ziel. Schafe im Schatten, Pflanzen im Gleichgewicht. Ist das der Anfang einer neuen Landwirtschaft?
Auf den sanften Hügeln von New South Wale… [+7613 chars]",,de,'Hitze'
https://www.faz.net/aktuell/wirtschaft/klima-nachhaltigkeit/vor-klimakonferenz-erde-steuert-laut-un-auf-2-8-grad-erwaermung-zu-110764656.html,https://www.faz.net/aktuell/wirtschaft/klima-nachhaltigkeit/vor-klimakonferenz-erde-steuert-laut-un-auf-2-8-grad-erwaermung-zu-110764656.html,0,www.faz.net,"Vor Klimakonferenz: Erde steuert laut UN auf 2,8 Grad Erwärmung zu","Trotz kleiner Fortschritte reicht der weltweite Klimaschutz den Vereinten Nationen zufolge nicht aus, um die Erderwärmung entscheidend zu bremsen. Viele Länder haben ihre Hausaufgaben nicht gemacht.",https://media0.faz.net/ppmedia/w1200/aktuell/gesellschaft/1047143421/1.10764670/facebook_teaser/sehr-wahrscheinlich-wird-das.jpg.webp,2025-11-04T14:16:13Z,,"Die Erde steuert den Vereinten Nationen zufolge mit der aktuellen weltweiten Klimapolitik bis zum Ende des Jahrhunderts auf 2,8 Grad Erwärmung gegenüber der vorindustriellen Zeit zu. Sehr wahrscheinl… [+3725 chars]",,de,'Erderwärmung'
https://www.tagesschau.de/wissen/klima/klimaschutz-erderwaermung-eu-100.html,https://www.tagesschau.de/wissen/klima/klimaschutz-erderwaermung-eu-100.html,0,www.tagesschau.de,"UN-Report: Welt steuert auf bis zu 2,8 Grad Erderwärmung zu","Kurz vor der 30. Weltklimakonferenz warnen die Vereinten Nationen vor einem dramatischen Anstieg der Erderwärmung. Ohne weitere Schutzmaßnahmen dürfte das 1,5-Grad-Ziel schon bald überschritten werden. Doch es gibt auch Hoffnungsschimmer.",https://images.tagesschau.de/image/295bebd4-4ec6-400c-a6e8-fe6d53777dc1/AAABmk8qAuc/AAABmgWmh8Q/16x9-big/duerre-malaga-100.jpg?width=1280,2025-11-04T15:29:15Z,,"Stand: 04.11.2025 16:29 Uhr
Kurz vor der 30. Weltklimakonferenz warnen die Vereinten Nationen vor einem dramatischen Anstieg der Erderwärmung. Ohne weitere Schutzmaßnahmen dürfte das 1,5-Grad-Ziel s… [+6385 chars]",,de,'Erderwärmung'
https://www.sueddeutsche.de/sport/neapel-frankfurt-champions-league-fans-li.3334513,https://www.sueddeutsche.de/sport/neapel-frankfurt-champions-league-fans-li.3334513,0,www.sueddeutsche.de,Champions League: Frankfurt steht sicher im Schatten des Vesuvs,Zweimal verlor die Eintracht in der Champions League schon mit 1:5. Beim 0:0 in Neapel zeigt Frankfurt fast schon vergessen geglaubte Abwehrtugenden.,https://www.sueddeutsche.de/2025/11/04/2d3565b7-172e-45c8-af00-d0689751ec1f.jpg?q=60&fm=webp&width=1200&rect=0%2C209%2C4000%2C2250,2025-11-04T19:56:38Z,,"Zu den herausragenden Figuren der Eintracht zählte am Dienstagabend Abwehrchef Robin Koch, der die Defensive bestens organisierte und kommandierte: mit Umsicht, souverän, resolut. Es lag auch und vor… [+3092 chars]",,de,'Schatten'
https://www.zeit.de/news/2025-11/05/keine-einigung-eu-laender-verhandeln-weiter-um-klimaziele,https://www.zeit.de/news/2025-11/05/keine-einigung-eu-laender-verhandeln-weiter-um-klimaziele,0,www.zeit.de,Klimawandel: Keine Einigung: EU-Länder verhandeln weiter um Klimaziele,Hier finden Sie Informationen zu dem Thema „Klimawandel“. Lesen Sie jetzt „Keine Einigung: EU-Länder verhandeln weiter um Klimaziele“.,https://img.zeit.de/news/2025-11/05/keine-einigung-eu-laender-verhandeln-weiter-um-klimaziele-image-group/wide__1300x731,2025-11-05T03:07:51Z,,Das zähe Ringen der EU-Länder um neue Klimaziele dauert weiter an. Auch nach etwa 15-stündigen Verhandlungen bis in die frühen Morgenstunden fanden die Umweltministerinnen und Minister in Brüssel kei… [+2034 chars],,de,'Klimawandel'
https://www.basicthinking.de/blog/2025/11/05/solarenergie-ultra-schwarze-nanonadeln/,https://www.basicthinking.de/blog/2025/11/05/solarenergie-ultra-schwarze-nanonadeln/,0,www.basicthinking.de,"Solarenergie: Ultra-schwarze Nanonadeln absorbieren 99,5 % Sonnenlicht","Der Beitrag Solarenergie: Ultra-schwarze Nanonadeln absorbieren 99,5 % Sonnenlicht erschien zuerst beim Online-Magazin BASIC thinking. Über unseren Newsletter UPDATE startest du jeden Morgen bestens informiert in den Tag.
Forscher haben ultra-schwarze Nanonad…",https://www.basicthinking.de/blog/wp-content/uploads/2025/11/solarenergie-ultra-schwarze-nanonadeln.jpg,2025-11-05T04:45:19Z,,"Forscher haben ultra-schwarze Nanonadeln aus Kupfer und Kobalt getestet, die 99,5 Prozent des Sonnenlichts absorbieren können. Das Material ist extrem hitze- und feuchtigkeitsbeständig und könnte so … [+3287 chars]",,de,'Hitze'
https://www.tagesspiegel.de/berlin/es-bleibt-trocken-mildes-herbstwetter-mit-bis-zu-16-grad-in-berlin-und-brandenburg-14758670.html,https://www.tagesspiegel.de/berlin/es-bleibt-trocken-mildes-herbstwetter-mit-bis-zu-16-grad-in-berlin-und-brandenburg-14758670.html,0,www.tagesspiegel.de,Es bleibt trocken: Mildes Herbstwetter mit bis zu 16 Grad in Berlin und Brandenburg,"In Berlin und Brandenburg bleibt es trocken, zeitweise kann sich die Sonne zeigen. In den Nächten kommt es zu Bodenfrost.",https://www.tagesspiegel.de/images/14758667/alternates/BASE_16_9_W1400/1762326150000/herbststimmung-in-brandenburg.jpeg,2025-11-05T05:29:56Z,,In den kommenden Tagen bleibt es mild und trocken in Berlin und Brandenburg. Laut Deutschem Wetterdienst (DWD) wird es heute bewölkt und die Höchsttemperaturen steigen auf 13 bis 16 Grad. Es werde he… [+1148 chars],,de,'Sonne'
https://www.zeit.de/news/2025-11/05/mildes-herbstwetter-bringt-sonne-und-frost-nach-nrw,https://www.zeit.de/news/2025-11/05/mildes-herbstwetter-bringt-sonne-und-frost-nach-nrw,0,www.zeit.de,Wetter: Mildes Herbstwetter bringt Sonne und Frost nach NRW,Hier finden Sie Informationen zu dem Thema „Wetter“. Lesen Sie jetzt „Mildes Herbstwetter bringt Sonne und Frost nach NRW“.,https://img.zeit.de/news/2025-11/05/mildes-herbstwetter-bringt-sonne-und-frost-nach-nrw-image-group/wide__1300x731,2025-11-05T05:35:34Z,,"Das Herbstwetter zeigt sich in Nordrhein-Westfalen zur Wochenmitte von seiner ruhigen und milden Seite. Am Mittwoch werden Temperaturen zwischen 15 und 20 Grad erwartet, wie der Deutsche Wetterdienst… [+761 chars]",,de,'Sonne'
https://www.zeit.de/news/2025-11/05/mildes-herbstwetter-und-viel-sonne-in-mitteldeutschland,https://www.zeit.de/news/2025-11/05/mildes-herbstwetter-und-viel-sonne-in-mitteldeutschland,0,www.zeit.de,Wetter: Mildes Herbstwetter und viel Sonne in Mitteldeutschland,Hier finden Sie Informationen zu dem Thema „Wetter“. Lesen Sie jetzt „Mildes Herbstwetter und viel Sonne in Mitteldeutschland“.,https://img.zeit.de/news/2025-11/05/mildes-herbstwetter-und-viel-sonne-in-mitteldeutschland-image-group/wide__1300x731,2025-11-05T06:48:12Z,,"Mitteldeutschland kann sich in den kommenden Tagen auf mildes Herbstwetter einstellen. Am Mittwoch zeigt sich in Sachsen-Anhalt, Sachsen und Thüringen laut Vorhersage des Deutschen Wetterdienstes (DW… [+1167 chars]",,de,'Sonne'
https://www.zeit.de/news/2025-11/05/eu-laender-wollen-90-prozent-weniger-emissionen-bis-2040,https://www.zeit.de/news/2025-11/05/eu-laender-wollen-90-prozent-weniger-emissionen-bis-2040,0,www.zeit.de,Klima: EU-Länder wollen 90 Prozent weniger Emissionen bis 2040,Hier finden Sie Informationen zu dem Thema „Klimawandel“. Lesen Sie jetzt „EU-Länder wollen 90 Prozent weniger Emissionen bis 2040“.,https://img.zeit.de/news/2025-11/05/eu-laender-wollen-90-prozent-weniger-emissionen-bis-2040-image-group/wide__1300x731,2025-11-05T08:35:02Z,,Zum Klimaschutz wollen die EU-Staaten ihre Treibhausgasemissionen bis 2040 um mindestens 90 Prozent im Vergleich zu 1990 senken. Nach einem Kompromiss der Umweltminister sollen allerdings fünf Prozen… [+3838 chars],,de,'Klimawandel'
https://www.stern.de/kaufkosmos/glaetteisen-test--die-5-besten-geraete-im-vergleich---mit-testsieger-36169374.html,https://www.stern.de/kaufkosmos/glaetteisen-test--die-5-besten-geraete-im-vergleich---mit-testsieger-36169374.html,0,www.stern.de,Hitze trifft Haar: Glatt gelaufen oder haarsträubend? Fünf Glätteisen im Test,"Glätteisen-Test: Fünf Geräte im Vergleich auf Leistung, Handhabung und Glättergebnis – das sind die besten Tools für perfektes Haar.",https://image.stern.de/36186942/t/tP/v1/w1440/r1.7778/-/aufmacher-glaetteisen-test.jpg,2025-11-05T08:44:00Z,,"Kopiere den aktuellen Link
Zur Merkliste hinzufügen
Glattes Haar hat diesen unverwechselbaren Glanz: Es fällt geschmeidig, wirkt gepflegt und elegant, ohne viel Aufwand. Kein Wunder also, dass so v… [+20950 chars]",,de,'Hitze'
https://www.ibiza-heute.de/ab-donnerstag-wechselhaftes-wetter/,https://www.ibiza-heute.de/ab-donnerstag-wechselhaftes-wetter/,0,www.ibiza-heute.de,Ab Donnerstag wechselhaftes Wetter,"Ab dem morgigen Donnerstag, 6. November, zieht eine Kaltluftfront über Ibiza und Formentera, die Regen und Gewitter mit sich bringen könnte. Der spanische Wetterdienst Aemet geht von maximal 30 bis 40 Litern pro Quadratmeter aus. Trotzdem sind zwei Warnstufen…",https://www.ibiza-heute.de/wp-content/uploads/2025/11/ibiza-vollmond-regenwolken-kuegler.jpg,2025-11-05T10:45:28Z,,"Ab dem morgigen Donnerstag, 6. November, zieht eine Kaltluftfront über Ibiza und Formentera, die Regen und Gewitter mit sich bringen könnte. Der spanische Wetterdienst Aemet geht von maximal 30 bis 4… [+419 chars]",,de,'Gewitter'
https://www.stern.de/gesellschaft/regional/baden-wuerttemberg/herbstwetter--nebel-legt-sich-uebers-land---aber-auch-sonne-moeglich-36193536.html,https://www.stern.de/gesellschaft/regional/baden-wuerttemberg/herbstwetter--nebel-legt-sich-uebers-land---aber-auch-sonne-moeglich-36193536.html,0,www.stern.de,Herbstwetter: Nebel legt sich übers Land - aber auch Sonne möglich,Trübe Aussichten für viele Südwest-Regionen: In den kommenden Tagen wird es dem Deutschen Wetterdienst zufolge vielerorts neblig. Doch auch sonnige Momente sind drin – besonders im Schwarzwald.,https://image.stern.de/36193538/t/bM/v1/w1440/r1.7778/-/06--tscii2bgaiv6axs2048jpeg---bc2bf1e55ec708a1.jpg,2025-11-06T04:52:53Z,,"Kopiere den aktuellen Link
Zur Merkliste hinzufügen
Trübe Aussichten für viele Südwest-Regionen: In den kommenden Tagen wird es dem Deutschen Wetterdienst zufolge vielerorts neblig. Doch auch sonni… [+1699 chars]",,de,'Sonne'
https://www.zeit.de/news/2025-11/06/nebel-legt-sich-uebers-land-aber-auch-sonne-moeglich,https://www.zeit.de/news/2025-11/06/nebel-legt-sich-uebers-land-aber-auch-sonne-moeglich,0,www.zeit.de,Herbstwetter: Nebel legt sich übers Land - aber auch Sonne möglich,Hier finden Sie Informationen zu dem Thema „Herbstwetter“. Lesen Sie jetzt „Nebel legt sich übers Land - aber auch Sonne möglich“.,https://img.zeit.de/news/2025-11/06/nebel-legt-sich-uebers-land-aber-auch-sonne-moeglich-image-group/wide__1300x731,2025-11-06T04:52:53Z,,"Wer diesen Tagen im Südwesten unterwegs ist, kann sich in vielen Regionen auf schönes Herbstwetter einstellen. In den Niederungen gibt es dem Deutschen Wetterdienst (DWD) zufolge aber vielerorts auch… [+1492 chars]",,de,'Sonne'
https://www.tagesspiegel.de/berlin/wetter-sonniges-wetter-in-berlin-und-brandenburg-14769485.html,https://www.tagesspiegel.de/berlin/wetter-sonniges-wetter-in-berlin-und-brandenburg-14769485.html,0,www.tagesspiegel.de,Wetter: Sonniges Wetter in Berlin und Brandenburg,In Berlin und Brandenburg zeigt sich der Herbst mit Sonne am Tag und Frost in der Nacht.,https://www.tagesspiegel.de/images/14769482/alternates/BASE_16_9_W1400/1762406541000/herbst-im-naturpark-schlaubetal.jpeg,2025-11-06T05:22:21Z,,In den kommenden Tagen bleibt es sonnig in Berlin und Brandenburg. Nach Angaben des Deutschen Wetterdienstes (DWD) gibt es heute wenig Wolken und viel Sonnenschein. Die Höchsttemperaturen liegen zwis… [+378 chars],,de,'Sonne'
https://www.tagesspiegel.de/berlin/da-ist-sie-wieder-sonne-zeigt-sich-bei-12-grad-in-berlin-14769485.html,https://www.tagesspiegel.de/berlin/da-ist-sie-wieder-sonne-zeigt-sich-bei-12-grad-in-berlin-14769485.html,0,www.tagesspiegel.de,Da ist sie wieder: Sonne zeigt sich bei 12 Grad in Berlin,"In Berlin zeigt sich der Herbst mit viel Sonne und wenig Wolken. In der Nacht wird es deutlich kälter, Bodenfrost ist möglich.",https://www.tagesspiegel.de/images/14769482/alternates/BASE_16_9_W1400/1762406541000/herbst-im-naturpark-schlaubetal.jpeg,2025-11-06T05:22:21Z,,In den kommenden Tagen bleibt es sonnig in Berlin und Brandenburg. Nach Angaben des Deutschen Wetterdienstes (DWD) gibt es heute wenig Wolken und viel Sonnenschein. Die Höchsttemperaturen liegen zwis… [+581 chars],,de,'Sonne'
https://www.zeit.de/news/2025-11/06/nebel-und-sonne-wechseln-sich-in-bayern-ab,https://www.zeit.de/news/2025-11/06/nebel-und-sonne-wechseln-sich-in-bayern-ab,0,www.zeit.de,Wetter: Nebel und Sonne wechseln sich in Bayern ab,Hier finden Sie Informationen zu dem Thema „Wetter“. Lesen Sie jetzt „Nebel und Sonne wechseln sich in Bayern ab“.,https://img.zeit.de/news/2025-11/06/nebel-und-sonne-wechseln-sich-in-bayern-ab-image-group/wide__1300x731,2025-11-06T05:51:46Z,,"Das Novemberwetter in Bayern zeigt sich grau und golden: Während in vielen Niederungen dichter Nebel liegt, scheint in den Bergen und im Alpenvorland oft die Sonne. Laut Deutschem Wetterdienst (DWD) … [+1327 chars]",,de,'Sonne'
https://www.stern.de/gesellschaft/regional/bayern/wetter--nebel-und-sonne-wechseln-sich-in-bayern-ab-36193616.html,https://www.stern.de/gesellschaft/regional/bayern/wetter--nebel-und-sonne-wechseln-sich-in-bayern-ab-36193616.html,0,www.stern.de,Wetter: Nebel und Sonne wechseln sich in Bayern ab,"In vielen Regionen Bayerns wird es in den kommenden Tagen neblig und trüb. Doch wer Glück hat, kann sich auch auf sonnige Stunden freuen – besonders in höheren Lagen.",https://image.stern.de/36193618/t/i3/v1/w1440/r1.7778/-/06--2q6y7rzodbv3axs2048jpeg---becd30efce515a74.jpg,2025-11-06T05:51:46Z,,"Kopiere den aktuellen Link
Zur Merkliste hinzufügen
In vielen Regionen Bayerns wird es in den kommenden Tagen neblig und trüb. Doch wer Glück hat, kann sich auch auf sonnige Stunden freuen besonder… [+1507 chars]",,de,'Sonne'
https://www.zeit.de/news/2025-11/06/nach-sonne-kommt-nebel-wochenende-wird-grau-und-kuehler,https://www.zeit.de/news/2025-11/06/nach-sonne-kommt-nebel-wochenende-wird-grau-und-kuehler,0,www.zeit.de,Wetterwechsel: Nach Sonne kommt Nebel – Wochenende wird grau und kühler,Hier finden Sie Informationen zu dem Thema „Wetterwechsel“. Lesen Sie jetzt „Nach Sonne kommt Nebel – Wochenende wird grau und kühler“.,https://img.zeit.de/news/2025-11/06/nach-sonne-kommt-nebel-wochenende-wird-grau-und-kuehler-image-group/wide__1300x731,2025-11-06T06:29:21Z,,"Nach heiteren Tagen müssen sich die Menschen in Rheinland-Pfalz und im Saarland am Wochenende auf einen meist grauen Himmel einstellen. Wie der Deutsche Wetterdienst (DWD) mitteilt, ist es heute noch… [+565 chars]",,de,'Sonne'
https://www.ibiza-heute.de/gewitter-und-regen/,https://www.ibiza-heute.de/gewitter-und-regen/,0,www.ibiza-heute.de,Wieder Überschwemmungen auf Ibiza,"Wie vorhergesagt haben schwere Gewitter am frühen Morgen Ibiza überzogen und einigen Schaden verursacht. Der starke Regen hat in kurzer Zeit wieder zu Überschwemmungen geführt, Bäume wurden entwurzelt und die Flughafenstraße war zeitweise gesperrt. Die Flugha…",https://www.ibiza-heute.de/wp-content/uploads/2025/11/ibiza-regen2-rathaus.jpeg,2025-11-06T08:45:00Z,,"Wie vorhergesagt haben schwere Gewitter am frühen Morgen Ibiza überzogen und einigen Schaden verursacht. Der starke Regen hat in kurzer Zeit wieder zu Überschwemmungen geführt, Bäume wurden entwurzel… [+506 chars]",,de,'Gewitter'
https://www.n-tv.de/panorama/November-verschafft-uns-Nachschlag-mit-sonnigem-Herbstwetter-article26144815.html,https://www.n-tv.de/panorama/November-verschafft-uns-Nachschlag-mit-sonnigem-Herbstwetter-article26144815.html,0,www.n-tv.de,Danach folgt Wolken-Nebel-Mix: November verschafft uns Nachschlag mit sonnigem Herbstwetter,"Nach dem grauen Oktober geht es in weiten Teilen Deutschlands derzeit schön zu: Sonne und angenehme Temperaturen an vielen Orten. Doch in der Zukunft verdichten sich bereits die Anzeichen für einen Wintereinbruch, erklärt ntv-Meterologe Björn Alexander.",https://www.n-tv.de/img/incoming/crop26144827/4521323215-cImg_16_9-w1200/556850078.jpg,2025-11-06T11:08:48Z,,Nach dem grauen Oktober geht es in weiten Teilen Deutschlands derzeit schön zu: Sonne und angenehme Temperaturen an vielen Orten. Doch in der Zukunft verdichten sich bereits die Anzeichen für einen W… [+4640 chars],,de,'Sonne'
https://www.zeit.de/news/2025-11/06/nach-viel-sonne-ziehen-mehr-wolken-nach-niedersachsen,https://www.zeit.de/news/2025-11/06/nach-viel-sonne-ziehen-mehr-wolken-nach-niedersachsen,0,www.zeit.de,Wetter: Nach viel Sonne ziehen mehr Wolken nach Niedersachsen,Hier finden Sie Informationen zu dem Thema „Wetter“. Lesen Sie jetzt „Nach viel Sonne ziehen mehr Wolken nach Niedersachsen“.,https://img.zeit.de/news/2025-11/06/nach-viel-sonne-ziehen-mehr-wolken-nach-niedersachsen-image-group/wide__1300x731,2025-11-06T12:45:44Z,,"Sonnenschein und blauer Himmel in Niedersachsen und Bremen: Der Donnerstag bringt bestes Wetter. «Verantwortlich ist ein Hochdruckeinfluss, es ist sehr mild für November», sagte ein Meteorologe des D… [+1497 chars]",,de,'Sonne'
https://www.sueddeutsche.de/muenchen/van-gogh-ausstellung-muenchen-utopi-li.3329003,https://www.sueddeutsche.de/muenchen/van-gogh-ausstellung-muenchen-utopi-li.3329003,0,www.sueddeutsche.de,Immersive Kunst-Schau in München: Virtuell eintauchen in van Goghs Farbenrausch,"Knallgelbe Sonnenblumen, tiefblaue Sternennächte, endlose goldene Weizenfelder: In der Utopia-Halle können Besucher in van Goghs Welten baden. Warum der Sprung in die Bilder trotz KI aber nicht wirklich gelingt.",https://www.sueddeutsche.de/2025/10/27/4726850c-bde8-46b0-848e-70b0ae221fd5.jpg?q=60&fm=webp&width=1200&rect=0%2C0%2C4000%2C2250,2025-11-06T12:51:02Z,,"Auch München hatte van Gogh bereits in immersiver Form zu Gast: 2021 brachte die australische Schau Van Gogh Alive den Maler in die bayerische Landeshauptstadt. Jetzt, vier Jahre später, bietet das U… [+4360 chars]",,de,'Gewitter'
https://www.morgenpost.de/bezirke/lichtenberg/article407590969/lost-place-freibad-lichtenberg-bvb-volksbad-verlorene-orte.html,https://www.morgenpost.de/bezirke/lichtenberg/article407590969/lost-place-freibad-lichtenberg-bvb-volksbad-verlorene-orte.html,0,www.morgenpost.de,Berliner Kult-Bad verrottete zu hässlichem Lost Place,Das Freibad Lichtenberg verfiel seit mehr als 30 Jahren – dann reagierte endlich der Bezirk. Alle Infos zu dem ehemaligen Lost Place.,https://img.sparknews.funkemedien.de/407591284/407591284_1730462361_v16_9_1600.jpeg,2025-11-06T13:01:50Z,,"Benutzung auf eigene Gefahr warnte ein verrostetes Schild am Sprungbecken des Freibads Lichtenberg Besucher vor den Wagnissen des Gebrauchs. Vergebens, denn Badegäste hatte die verwunschene Anlage sc… [+11302 chars]",,de,'Freibad'
https://www.stern.de/digital/technik/balkonkraftwerk-im-winter--was-bringt-das-wirklich---35313936.html,https://www.stern.de/digital/technik/balkonkraftwerk-im-winter--was-bringt-das-wirklich---35313936.html,0,www.stern.de,Solarstrom trotz wenig Sonne: Das Balkonkraftwerk im Winter betreiben: Was bringt das wirklich?,Ist ein Balkonkraftwerk im Winter sinnvoll? In der dunklen Jahreszeit klingt das zunächst paradox – doch die Energieausbeute kann überraschend hoch ausfallen.,https://image.stern.de/35313938/t/Yo/v1/w1440/r1.7778/-/balkonkraftwerk-im-winter.jpg,2025-11-06T15:05:00Z,,"Kopiere den aktuellen Link
Zur Merkliste hinzufügen
Ist ein Balkonkraftwerk im Winter sinnvoll? In der dunklen Jahreszeit klingt das zunächst paradox doch die Energieausbeute kann überraschend hoch… [+6566 chars]",,de,'Sonnenstunden'
