index,url,valid,domain,title,description,image,published,archive,content,quote,language,keyword
https://www.stern.de/gesellschaft/regional/baden-wuerttemberg/gesundheit--neue-verbote-fuer-raucher---das-gilt-ab-heute-im-suedwesten-37471900.html,https://www.stern.de/gesellschaft/regional/baden-wuerttemberg/gesundheit--neue-verbote-fuer-raucher---das-gilt-ab-heute-im-suedwesten-37471900.html,0,www.stern.de,Gesundheit: Neue Verbote für Raucher – Das gilt ab heute im Südwesten,"Spielplatz, Freibad oder Haltestelle: Seit heute ist Rauchen an vielen Orten im Südwesten richtig teuer. Auch Vapes und Shishas sind betroffen. Wo gelten die neuen Regeln?",https://image.stern.de/37471902/t/lj/v1/w1440/r1.7778/-/01--ehvzak6kw4v1axs2048jpeg---bb13d606e53f159a.jpg,2026-06-01T02:00:05Z,,"Kopiere den aktuellen Link
Zur Merkliste hinzufügen
Spielplatz, Freibad oder Haltestelle: Seit heute ist Rauchen an vielen Orten im Südwesten richtig teuer. Auch Vapes und Shishas sind betroffen. W… [+5216 chars]",,de,'Freibad'
https://www.nzz.ch/zuerich/zuerich-stadt-versteckt-heikles-gemaelde-im-freibad-hinter-folie-ld.10008843,https://www.nzz.ch/zuerich/zuerich-stadt-versteckt-heikles-gemaelde-im-freibad-hinter-folie-ld.10008843,0,www.nzz.ch,Bilderstreit im Freibad: Die Stadt Zürich versteckt ein Gemälde mit Nackten hinter Folie – weil sie es für Kinder und Jugendliche zu heikel findet,Der Berliner Künstler Sigurd Wendland ist bekannt für seine Aktbilder. Das Vorgehen der Stadt empfindet er als Affront. Das Sportamt verteidigt sich.,"https://img-msp-prod.nzz.ch/2026/05/28/c1d3ca7e-880f-4794-9507-52229d5d4ba8.jpg?width=1200&height=675&fit=bounds&quality=75&auto=webp&crop=1280,720,x0,y0&wmark=nzz",2026-06-01T03:08:00Z,,"Der Berliner Künstler Sigurd Wendland ist bekannt für seine Aktbilder. Das Vorgehen der Stadt empfindet er als Affront. Das Sportamt verteidigt sich.
Zusammenfassung
Die Stadt Zürich glaubt, dass d… [+6574 chars]",,de,'Freibad'
https://www.zeit.de/news/2026-06/01/wechselhaftes-wetter-und-gewitter-im-norden-erwartet,https://www.zeit.de/news/2026-06/01/wechselhaftes-wetter-und-gewitter-im-norden-erwartet,0,www.zeit.de,Wetter: Wechselhaftes Wetter und Gewitter im Norden erwartet,Hier finden Sie Informationen zu dem Thema „Wetter“. Lesen Sie jetzt „Wechselhaftes Wetter und Gewitter im Norden erwartet“.,https://img.zeit.de/news/2026-06/01/wechselhaftes-wetter-und-gewitter-im-norden-erwartet-image-group/wide__1300x731,2026-06-01T06:35:29Z,,"Das Wetter im Norden ist in den kommenden Tagen wechselhaft, auch Gewitter sind vorhergesagt. Dem Deutschen Wetterdienst (DWD) zufolge wechseln sich am Montag Sonne und Wolken in Hamburg und Schleswi… [+1210 chars]",,de,'Gewitter'
https://www.focus.de/sport/die-hitzeschlacht-von-lausanne_ddbc98bc-3102-4eed-8866-873f6614b211.html,https://www.focus.de/sport/die-hitzeschlacht-von-lausanne_ddbc98bc-3102-4eed-8866-873f6614b211.html,0,www.focus.de,Die Hitzeschlacht von Lausanne,Bei 40 Grad im Schatten liefern sich Österreich und die Schweiz 1954 ein irres WM-Viertelfinale. Das 7:5 von Lausanne ist bis heute das torreichste WM-Spiel.,"https://quadro.burda-forward.de/ctf/3e40caa4-0655-462d-ad72-1e0f6168cf05.f965863c-bc95-45e7-82ff-c5dbea1fbdfd.jpg?im=RegionOfInterestCrop=(1200,630),regionOfInterest=(1909,1837)&hash=5c69b04f5f389ae0718ee8e078bfa819462f809b986981ffbcfb6bbec9d9989d",2026-06-01T11:28:00Z,,"Die Fußball-WM 2026 versetzt die Menschen wieder ins Fußball-Fieber. Zwölf Tore, ein taumelnder Torwart und Temperaturen von rund 40 Grad im Schatten: Das Viertelfinale zwischen Österreich und der Sc… [+5214 chars]",,de,'Schatten'
https://hallespektrum.de/aktuelles/schuelerferienticket-2026-in-sachsen-anhalt-gestartet/477220/,https://hallespektrum.de/aktuelles/schuelerferienticket-2026-in-sachsen-anhalt-gestartet/477220/,0,hallespektrum.de,Schülerferienticket 2026 in Sachsen-Anhalt gestartet,"Magdeburg, 1. Juni 2026 – Ab sofort können Schülerinnen und Schüler bis 22 Jahre in Sachsen-Anhalt das Schülerferienticket erwerben. Das Ticket ermöglicht während der Sommerferien vom 4. Juli bis 16. August uneingeschränkte Nutzung des Nahverkehrs im gesamten…",https://hallespektrum.de/wp-content/uploads/2023/02/NASA-Strassenbahn.jpg,2026-06-01T13:40:37Z,,"Magdeburg, 1. Juni 2026 Ab sofort können Schülerinnen und Schüler bis 22 Jahre in Sachsen-Anhalt das Schülerferienticket erwerben. Das Ticket ermöglicht während der Sommerferien vom 4. Juli bis 16. A… [+853 chars]",,de,'Sommerferien'
https://www.nzz.ch/panorama/reisende-aufgepasst-italien-erstattet-bei-langen-baustellenstaus-die-maut-ld.10009287,https://www.nzz.ch/panorama/reisende-aufgepasst-italien-erstattet-bei-langen-baustellenstaus-die-maut-ld.10009287,0,www.nzz.ch,Reisende aufgepasst: Italien erstattet bei langen Baustellenstaus die Maut,"Sobald die Sommerferien starten, rollt in Italien die grosse Reisewelle an. Happige Mautgebühren gehören auf den Autobahnen ebenso dazu wie lange Staus. Doch bei Verzögerungen infolge von Baustellen gibt es nun einfacher Geld zurück. Antworten auf die wichtig…","https://img-msp-prod.nzz.ch/2026/06/01/5d02b097-eec8-4511-a5fe-eac8f82cc542.jpg?width=1200&height=674&fit=bounds&quality=75&auto=webp&crop=2370,1333,x0,y123&wmark=nzz",2026-06-01T14:59:01Z,,"Sobald die Sommerferien starten, rollt in Italien die grosse Reisewelle an. Happige Mautgebühren gehören auf den Autobahnen ebenso dazu wie lange Staus. Doch bei Verzögerungen infolge von Baustellen … [+4106 chars]",,de,'Sommerferien'
https://www.morgenpost.de/ratgeber-wissen/article412003438/sonnencreme-sonnenschutz-hitze-neurodermitis-expertin-empfiehlt-zwei-finger-regel.html,https://www.morgenpost.de/ratgeber-wissen/article412003438/sonnencreme-sonnenschutz-hitze-neurodermitis-expertin-empfiehlt-zwei-finger-regel.html,0,www.morgenpost.de,Richtige Sonnencreme bei Neurodermitis: Expertin gibt „Zwei-Finger-Regel“,Sonnenschutz ist für Neurodermitis-Betroffene extrem wichtig. Welche Creme sich eignet – und welchen Fehler beim Auftragen viele machen.,https://img.sparknews.funkemedien.de/406490130/406490130_1717445026_v16_9_1600.jpeg,2026-06-01T15:00:00Z,,"Wegen der weniger intakten Hautbarriere ist der Sonnenschutz für Menschen mit Neurodermitis mindestens genauso wichtig wie für alle anderen Menschen auch wenn nicht sogar ein Stück wichtiger, sagt Dr… [+886 chars]",,de,'Sonnencreme'
https://noe.orf.at/stories/3356667/,https://noe.orf.at/stories/3356667/,0,noe.orf.at,Ferienbetreuung in drei von vier Gemeinden,In fünf Wochen beginnen in Niederösterreich wieder die Sommerferien. 75 Prozent der Gemeinden wollen heuer eine Ferienbetreuung anbieten. Die Kosten liegen dabei je nach Gemeinde zwischen 50 und 200 Euro pro Woche.,https://ibs.orf.at/noe?image=https%3A%2F%2Foekastatic.orf.at%2Fmims%2F2026%2F23%2F76%2Fcrops%2Fw%3D1200%2Ch%3D627%2Cq%3D75%2F3057786_master_1183676_abd_20240818_abd0007.hr.jpg%3Fs%3D0feaefc03b532248ab5a52acefb1bcd6f17d9f38,2026-06-02T03:22:44Z,,"Neun Wochen Sommerferien das sorgt bei vielen Eltern jedes Jahr für Sorgenfalten, wenn es um die Organisation der Kinderbetreuung geht. Vergangenes Jahr gab es in rund 73 Prozent der Gemeinden ein Be… [+2463 chars]",,de,'Sommerferien'
https://www.tagesspiegel.de/gesellschaft/panorama/abi-stress-lehrer-fordern-sommerferien-nicht-vor-anfang-juli-15664737.html,https://www.tagesspiegel.de/gesellschaft/panorama/abi-stress-lehrer-fordern-sommerferien-nicht-vor-anfang-juli-15664737.html,0,www.tagesspiegel.de,Abi-Stress: Lehrer fordern: Sommerferien nicht vor Anfang Juli,"In einigen Bundesländern beginnen die großen Ferien manchmal sehr früh. Das setzt Lehrende und Prüflinge bei den Abschlussprüfungen unnötig unter Druck, findet der Philologenverband.",https://www.tagesspiegel.de/images/15664736/alternates/BASE_16_9_W1400/1780372944000/ferienbeginn.jpeg,2026-06-02T04:02:25Z,,"Sommerferien nicht vor dem ersten Juli-Wochenende: Der Deutsche Philologenverband drängt alle Bundesländer, dauerhaft auf Starttermine im Juni zu verzichten. Hintergrund sind die Abiturprüfungen. 
E… [+1780 chars]",,de,'Sommerferien'
https://www.zeit.de/news/2026-06/02/ohne-hitze-und-faehnchen-das-erwartet-nagelsmann-in-chicago,https://www.zeit.de/news/2026-06/02/ohne-hitze-und-faehnchen-das-erwartet-nagelsmann-in-chicago,0,www.zeit.de,Fußball-Nationalmannschaft: Ohne Hitze und Fähnchen: Das erwartet Nagelsmann in Chicago,Hier finden Sie Informationen zu dem Thema „Fußball-Nationalmannschaft“. Lesen Sie jetzt „Ohne Hitze und Fähnchen: Das erwartet Nagelsmann in Chicago“.,https://img.zeit.de/news/2026-06/02/ohne-hitze-und-faehnchen-das-erwartet-nagelsmann-in-chicago-image-group/wide__1300x731,2026-06-02T04:04:04Z,,Nach der Ankunft in Amerika wird es Bundestrainer Julian Nagelsmann im Teamhotel des DFB nördlich der Innenstadt von Chicago an nichts mangeln. Nur von WM-Stimmung ist auch im noblen Waldorf Astoria … [+1832 chars],,de,'Hitze'
https://www.stern.de/panorama/sommerferien-sollten-nicht-vor-juli-starten---fordern-lehrer-37478458.html,https://www.stern.de/panorama/sommerferien-sollten-nicht-vor-juli-starten---fordern-lehrer-37478458.html,0,www.stern.de,Stress für Prüfungen: Lehrer fordern: Sommerferien dürfen nicht vor Juli starten,"In einigen Bundesländern beginnen die Sommerferien sehr früh. Das setzt Lehrer und Prüflinge bei den Abschlussprüfungen unnötig unter Druck, findet der Philologenverband.",https://image.stern.de/37478476/t/Rj/v1/w1440/r1.7778/-/sommerferien.jpg,2026-06-02T04:37:00Z,,"Kopiere den aktuellen Link
Zur Merkliste hinzufügen
In einigen Bundesländern beginnen die Sommerferien sehr früh. Das setzt Lehrer und Prüflinge bei den Abschlussprüfungen unnötig unter Druck, find… [+1872 chars]",,de,'Sommerferien'
https://www.zeit.de/bildung/2026-06/schule-sommerferien-lehrer-sommer-urlaub,https://www.zeit.de/bildung/2026-06/schule-sommerferien-lehrer-sommer-urlaub,0,www.zeit.de,Deutscher Philologenverband: Lehrerverband fordert Sommerferien erst ab Juli,In einigen Bundesländern beginnen die Sommerferien bereits im Juni. Aus Sicht des Philologenverbands ist das zu früh. Hintergrund sind die Abiturprüfungen.,https://img.zeit.de/bildung/2026-06/lehrer-fordern-sommerferien-nicht-vor-juli-bild/wide__1300x731,2026-06-02T06:09:18Z,,"Der Deutsche Philologenverband hat alle Bundesländer aufgefordert, den Beginn der Sommerferien nicht schon im Juni anzusetzen. Hintergrund sind die Abiturprüfungen. 
»Ein Sommerferienbeginn vor dem … [+874 chars]",,de,'Sommerferien'
https://www.welt.de/vermischtes/article6a1e74cd411d40cd4c74ee97/schweizer-freibad-verdoppelt-nach-zugangsverbot-jetzt-preise-fuer-auslaender.html,https://www.welt.de/vermischtes/article6a1e74cd411d40cd4c74ee97/schweizer-freibad-verdoppelt-nach-zugangsverbot-jetzt-preise-fuer-auslaender.html,0,www.welt.de,Nach Zugangsverbot – Schweizer Freibad verdoppelt jetzt Preise für Ausländer,"2025 sperrte eine Schweizer Gemeinde ihr Freibad für Ausländer. Die Aufregung war groß. Nun legt die Verwaltung von Pruntrut nach. „Es geht darum, die Ruhe zu garantieren“, sagt der Gemeindepräsident.",https://images.welt.de/6a1e74cd411d40cd4c74ee97/122e2412a30de541c2a5b51052107b25-master/ci16x9-w1200/536200100-jpg,2026-06-02T07:12:36Z,,"2025 sperrte eine Schweizer Gemeinde ihr Freibad für Ausländer. Die Aufregung war groß. Nun legt die Verwaltung von Pruntrut nach. Es geht darum, die Ruhe zu garantieren, sagt der Gemeindepräsident.M… [+3403 chars]",,de,'Freibad'
https://www.stern.de/news/philologenverband-fordert-sommerferienbeginn-fruehestens-ab-anfang-juli-37480788.html,https://www.stern.de/news/philologenverband-fordert-sommerferienbeginn-fruehestens-ab-anfang-juli-37480788.html,0,www.stern.de,Philologenverband fordert Sommerferienbeginn frühestens ab Anfang Juli,Der Deutsche Philologenverband (DPhV) hat für alle Bundesländer einen Sommerferienbeginn frühestens ab dem ersten Juliwochenende gefordert. So sei das Zeitfenster zwischen Beginn und Ende der zentralen und dezentralen Abiturprüfungen und dem Beginn der Sommer…,https://image.stern.de/37480790/t/rM/v1/w1440/r1.7778/-/02--schuelerinnen-bei-pruefung---45c788a9fecfea4f.jpg,2026-06-02T10:39:08Z,,"Kopiere den aktuellen Link
Zur Merkliste hinzufügen
Der Deutsche Philologenverband (DPhV) hat für alle Bundesländer einen Sommerferienbeginn frühestens ab dem ersten Juliwochenende gefordert. So se… [+1706 chars]",,de,'Sommerferien'
https://t3n.de/news/ki-wettervorhersage-10000-mal-schneller-1742229/,https://t3n.de/news/ki-wettervorhersage-10000-mal-schneller-1742229/,0,t3n.de,10.000-mal schneller: Wie KI-Modelle die klassische Wettervorhersage herausfordern,Regnet es am Wochenende oder scheint die Sonne? Instabile Wetterlagen wie jetzt gerade machen die Wettervorhersage besonders unzuverlässig. Wie KI-Modelle hier Abhilfe schaffen – und wo ihre Grenzen liegen. Die wichtigsten Fragen und Antworten.,https://cdn.t3n.de/news/wp-content/uploads/2025/11/shutterstock_2504055095.jpg?class=content,2026-06-02T13:55:00Z,,"Ein langes Mai-Wochenende steht an eigentlich ideal für Freiluftaktivitäten. Aber wird tatsächlich die Sonne scheinen? Wer diese Frage derzeit mit Wetter-Apps auf dem Smartphone beantwortet, wird oft… [+10307 chars]",,de,'Sonne'
https://www.diepresse.com/27823356/auswandern-in-der-pension-in-diesen-laendern-lebt-es-sich-am-besten,https://www.diepresse.com/27823356/auswandern-in-der-pension-in-diesen-laendern-lebt-es-sich-am-besten,0,www.diepresse.com,Auswandern in der Pension: In diesen Ländern lebt es sich am besten [premium],"Sonne, Meer und niedrigere Lebenshaltungskosten: Für viele Pensionisten wird der Ruhestand im Ausland immer attraktiver. Eine Studie zeigt, welche Länder besonders gute Bedingungen bieten.",https://img.diepresse.com/public/incoming/mukk1q-PORTUGAL-SURFING-TOURISM-LEISURE/alternates/WEBP_WIDE_1200/PORTUGAL-SURFING-TOURISM-LEISURE,2026-06-02T15:03:14Z,,"Die Lebenserwartung steigt weltweit weiter an: Ein Mensch, der 2021 geboren wurde, lebt im Schnitt 25 Jahre länger als einer, der 1950 zur Welt kam. Eine aktuelle Studie zeigt auf, in welchen zehn Lä… [+5710 chars]",,de,'Sonne'
https://www.brigitte.de/mode/trends/neu-in-den-shops--die-schoensten-neuheiten-im-juni-14082082.html,https://www.brigitte.de/mode/trends/neu-in-den-shops--die-schoensten-neuheiten-im-juni-14082082.html,0,www.brigitte.de,Neu in den Shops: Die schönsten Neuheiten im Juni,"Wir können es selbst kaum glauben, aber die Mitte des Jahres ist schon wieder erreicht. Das bedeutet allerdings auch: Der Sommer ist da. Wir zeigen, mit welchen stylischen Neuheiten wir die Sonne genießen.",https://image.brigitte.de/14082300/t/SE/v2/w1440/r1.7778/-/nids-teaser1.jpg,2026-06-02T19:00:00Z,,"Bitte logge dich ein, um diesen Inhalt sehen zu können!
Er ist Teil unseres exklusiven Angebots für registrierte Nutzer:innen. Du kannst ihn lesen, sobald du dich angemeldet hast.
Du hast noch kein… [+244 chars]",,de,'Sonne'
https://www.zeit.de/news/2026-06/03/feuchtwarme-luft-bringt-gewitter-regen-und-hagel,https://www.zeit.de/news/2026-06/03/feuchtwarme-luft-bringt-gewitter-regen-und-hagel,0,www.zeit.de,"Wettervorhersage: Feuchtwarme Luft bringt Gewitter, Regen und Hagel","Hier finden Sie Informationen zu dem Thema „Wettervorhersage“. Lesen Sie jetzt „Feuchtwarme Luft bringt Gewitter, Regen und Hagel“.",https://img.zeit.de/news/2026-06/03/feuchtwarme-luft-bringt-gewitter-regen-und-hagel-image-group/wide__1300x731,2026-06-03T04:31:38Z,,"Gewitter, Starkregen und Hagel: In Berlin und Brandenburg wird es ungemütlich. Im Tagesverlauf zieht laut Deutschem Wetterdienst (DWD) ein Regengebiet von Ost nach West und die Wetterexperten rechnen… [+885 chars]",,de,'Gewitter'
https://www.focus.de/panorama/ein-schweizer-bad-greift-durch-auslaender-zahlen-jetzt-doppelte-eintrittspreise_5eb98b25-f36a-49de-b3c3-a9720d6a81fa.html,https://www.focus.de/panorama/ein-schweizer-bad-greift-durch-auslaender-zahlen-jetzt-doppelte-eintrittspreise_5eb98b25-f36a-49de-b3c3-a9720d6a81fa.html,0,www.focus.de,Ein Schweizer Bad greift durch: Ausländer zahlen jetzt doppelte Eintrittspreise,Nach der Debatte um ein Ausländerverbot setzt ein Schweizer Freibad jetzt auf höhere Eintrittspreise. Doch die eigentliche Frage liegt tiefer.,"https://quadro.burda-forward.de/ctf/44a20ca6-49a3-4b90-b81e-bdf3899f7079.92c62d23-a420-4401-a8eb-80abbbb58fd2.jpg?im=RegionOfInterestCrop=(1200,630),regionOfInterest=(217,139)&hash=d6b8cbff76ce2fa0277aec879a3b0133f683a5cb302d70f42a3ad68db3445d96",2026-06-03T05:02:00Z,,<ul><li>Im Video oben: Schweizer Freibad sperrt Ausländer aus - wegen Vorfällen mit jungen Frauen</li></ul>Die meisten Badegäste wollen einfach einen ruhigen Sommertag verbringen. Sie wollen schwimme… [+5096 chars],,de,'Freibad'
https://www.focus.de/gesundheit/im-schwimmbad-viele-halten-chlorgeruch-fuer-sauber-doch-das-gegenteil-stimmt_4b486b57-0f12-4fff-8fc9-aeb60c83bdb9.html,https://www.focus.de/gesundheit/im-schwimmbad-viele-halten-chlorgeruch-fuer-sauber-doch-das-gegenteil-stimmt_4b486b57-0f12-4fff-8fc9-aeb60c83bdb9.html,0,www.focus.de,Im Schwimmbad: Viele halten Chlorgeruch für sauber – doch das Gegenteil stimmt,"Wenn es im Freibad stark nach Chlor riecht, ist das keineswegs ein Zeichen für besonders sauberes Wasser. Im Gegenteil: Der Geruch entsteht, wenn das Chlor mit Urin, Schweiß und Sonnnencreme reagiert.","https://quadro.burda-forward.de/ctf/b3b0cc98-6727-4ed0-af6e-3e68d52828a8.f6cc749a-fc6f-47d3-8168-056b9c95cef6.png?im=RegionOfInterestCrop=(1200,630),regionOfInterest=(1094,570)&hash=f23e0c3bc6a954c24ca3b8f421b7f405849264694541184344523b6e4da7b03a",2026-06-03T05:46:00Z,,"Es gibt diesen Moment fast in jedem Freibad. Jemand läuft an den Beckenrand, zieht kurz die Nase hoch und sagt: Boah, heute haben die aber ordentlich Chlor reingekippt. 
Viele Badegäste glauben bis … [+3076 chars]",,de,'Freibad'
https://www.zeit.de/news/2026-06/03/im-norden-drohen-gewitter-starkregen-und-hagel,https://www.zeit.de/news/2026-06/03/im-norden-drohen-gewitter-starkregen-und-hagel,0,www.zeit.de,"Wetter: Im Norden drohen Gewitter, Starkregen und Hagel","Hier finden Sie Informationen zu dem Thema „Wetter“. Lesen Sie jetzt „Im Norden drohen Gewitter, Starkregen und Hagel“.",https://img.zeit.de/news/2026-06/03/im-norden-drohen-gewitter-starkregen-und-hagel-image-group/wide__1300x731,2026-06-03T06:27:34Z,,"Gewitter, Starkregen und Hagel - die Menschen im Norden müssen sich in den kommenden Tagen eher auf schlechtes Wetter einstellen. Laut dem Deutschen Wetterdienst (DWD) soll es zunächst wechselhaft bi… [+1110 chars]",,de,'Gewitter'
https://www.stern.de/gesellschaft/regional/hamburg-schleswig-holstein/wetter--im-norden-drohen-gewitter--starkregen-und-hagel-37484968.html,https://www.stern.de/gesellschaft/regional/hamburg-schleswig-holstein/wetter--im-norden-drohen-gewitter--starkregen-und-hagel-37484968.html,0,www.stern.de,"Wetter: Im Norden drohen Gewitter, Starkregen und Hagel","Hamburg/Schwerin - Gewitter, Starkregen und Hagel - die Menschen im Norden müssen sich in den kommenden Tagen eher auf schlechtes Wetter einstellen.",https://image.stern.de/37484970/t/T_/v1/w1440/r1.7778/-/03--ipt6ehbbtpv11axs2048jpeg---d6d162801a971a70.jpg,2026-06-03T06:27:34Z,,"Kopiere den aktuellen Link
Zur Merkliste hinzufügen
Das Wetter im Norden ist in den kommenden Tagen von Gewitter geprägt. Welche Regionen besonders betroffen sind und wie warm es wird.
Gewitter, S… [+1258 chars]",,de,'Gewitter'
https://www.morgenpost.de/bezirke/mitte/article412171980/sommerbad-humboldthain-so-witzig-feiert-tropez-sein-10-jubilaeum.html,https://www.morgenpost.de/bezirke/mitte/article412171980/sommerbad-humboldthain-so-witzig-feiert-tropez-sein-10-jubilaeum.html,0,www.morgenpost.de,Sommerbad Humboldthain: So witzig feiert „Tropez“ sein 10. Jubiläum,Im Sommerbad Humboldthain kann man planschen und Kunst genießen. Was die Kunstplattform im Freibad für Kinder und Erwachsene anbietet.,https://img.sparknews.funkemedien.de/412172032/412172032_1780471951_v16_9_1600.jpeg,2026-06-03T08:00:00Z,,"Im vergangenen Jahr begeisterte die Open-Air-Ausstellung Parasite im Sommerbad Humboldthain einer Ausstellung, bei der Anfassen und Mitmachen ausdrücklich erwünscht waren. Dieses Jahr feiert das Trop… [+3677 chars]",,de,'Freibad'
https://www.stern.de/news/hoehlen-installation-an-pariser-bruecke-pont-neuf-beschaedigt---eroeffnung-verschoben-37485438.html,https://www.stern.de/news/hoehlen-installation-an-pariser-bruecke-pont-neuf-beschaedigt---eroeffnung-verschoben-37485438.html,0,www.stern.de,Höhlen-Installation an Pariser Brücke Pont Neuf beschädigt - Eröffnung verschoben,"Nach einem heftigen Gewitter in Paris ist die höhlenähnliche Installation des Künstlers JR auf der Brücke Pont Neuf beschädigt. Die bislang für Samstag geplante Eröffnung der verhüllten Brücke werde verschoben, bis das Ausmaß des Schadens bekannt sei, teilte …",https://image.stern.de/37485440/t/AR/v1/w1440/r1.7778/-/03--beschaedigte-installation-am-pont-neuf---554b17c671b0674b.jpg,2026-06-03T08:06:59Z,,"Kopiere den aktuellen Link
Zur Merkliste hinzufügen
Nach einem heftigen Gewitter in Paris ist die höhlenähnliche Installation des Künstlers JR auf der Brücke Pont Neuf beschädigt. Die bislang für S… [+1133 chars]",,de,'Gewitter'
https://www.faz.net/aktuell/rhein-main/main-kinzig-kreis-schulbus-stoesst-mit-auto-zusammen-eine-verletzte-aktuelle-nachrichten-aus-frankfurt-hessen-faz-19735361.html,https://www.faz.net/aktuell/rhein-main/main-kinzig-kreis-schulbus-stoesst-mit-auto-zusammen-eine-verletzte-aktuelle-nachrichten-aus-frankfurt-hessen-faz-19735361.html,0,www.faz.net,Rhein-Main-Liveblog: Main-Kinzig-Kreis: Schulbus stößt mit Auto zusammen,Weiter Gewitter und Regen in Hessen +++ Unbekannter schlägt Postbotin in Frankfurt nieder +++ Bagger in Flörsheim gestohlen +++ Messerangriff in Hanau +++ Lotto: Familienvater gewinnt Millionen +++ Liveblog zu Rhein-Main und Hessen,https://media0.faz.net/image/w1200h627/c264a51c1445/w3000h1567x0y216o/202511/43601.0.1435318404/laut-polizei-befanden-sich.webp,2026-06-03T09:00:00Z,,Nach einem gewalttätigen Streit in Frankfurt-Sachsenhausen ermittelt die Polizei wegen eines versuchten Tötungsdelikts. Ein Vierundzwanzigjähriger soll einem Achtzehnjährigen gegen den Kopf getreten … [+669 chars],,de,'Gewitter'
https://www.welt.de/vermischtes/article6a1fe0e71f46a650bff5da00/baden-wuerttemberg-palmer-lehnt-umsetzung-von-neuem-gesetz-ab-was-das-bedeutet-muss-jeder-selbst-herausfinden.html,https://www.welt.de/vermischtes/article6a1fe0e71f46a650bff5da00/baden-wuerttemberg-palmer-lehnt-umsetzung-von-neuem-gesetz-ab-was-das-bedeutet-muss-jeder-selbst-herausfinden.html,0,www.welt.de,"Palmer lehnt Umsetzung von neuem Gesetz ab – „Was das bedeutet, muss jeder selbst herausfinden“",Im Südwesten wurde das Rauchverbot deutlich verschärft. Nun darf auch an Haltestellen oder im Freibad nicht mehr geraucht werden. Im Netz wird bereits gespottet. Auch bei Tübingens OB Boris Palmer regt sich Widerstand.,https://images.welt.de/6a1fe0e71f46a650bff5da00/004525ebc8442d7f44f0ba9c469f8c54/ci16x9-w1200/dpa-com-20090101-260320-935-1229598-jpg,2026-06-03T09:11:51Z,,Im Südwesten wurde das Rauchverbot deutlich verschärft. Nun darf auch an Haltestellen oder im Freibad nicht mehr geraucht werden. Im Netz wird bereits gespottet. Auch bei Tübingens OB Boris Palmer re… [+4824 chars],,de,'Freibad'
https://laut.de/News/Iron-Maiden-Metal-gegen-den-Sturm-03-06-2026-21791,https://laut.de/News/Iron-Maiden-Metal-gegen-den-Sturm-03-06-2026-21791,0,laut.de,Iron Maiden: Metal gegen den Sturm,Megadeth eröffneten in Hannover den einzigen Deutschland-Gig abseits von Rock am Ring/Park. Ein drohendes Gewitter tat der Stimmung keinen Abbruch.,https://laut.de/News/Iron-Maiden-Metal-gegen-den-Sturm-03-06-2026-21791/iron-maiden-metal-gegen-den-sturm-250968.jpg,2026-06-03T11:01:00Z,,"Megadeth eröffneten in Hannover den einzigen Deutschland-Gig abseits von Rock am Ring/Park. Ein drohendes Gewitter tat der Stimmung keinen Abbruch.
Hannover (alc) - Iron Maiden und Megadeth luden im… [+2941 chars]",,de,'Gewitter'
https://www.faz.net/aktuell/rhein-main/zweithoechster-wert-ueber-20-000-auslaender-erhielten-2025-den-deutschen-pass-aktuelle-nachrichten-aus-frankfurt-hessen-faz-19735361.html,https://www.faz.net/aktuell/rhein-main/zweithoechster-wert-ueber-20-000-auslaender-erhielten-2025-den-deutschen-pass-aktuelle-nachrichten-aus-frankfurt-hessen-faz-19735361.html,0,www.faz.net,Rhein-Main-Liveblog: Hessen hat 2025 mehr als 20.000 Ausländer eingebürgert,Weiter Gewitter und Regen in Hessen +++ Eine Verletzte bei Unfall mit Schulbus im Main-Kinzig-Kreis +++ Unbekannter schlägt Postbotin in Frankfurt nieder +++ Liveblog zu Rhein-Main und Hessen,https://media0.faz.net/image/w1200h627/e655c8b2d163/w3000h1567x0y216o/202501/43601.0.783805189/begehrt-unter-anderem-bei.webp,2026-06-03T11:38:58Z,,Nach einem gewalttätigen Streit in Frankfurt-Sachsenhausen ermittelt die Polizei wegen eines versuchten Tötungsdelikts. Ein Vierundzwanzigjähriger soll einem Achtzehnjährigen gegen den Kopf getreten … [+669 chars],,de,'Gewitter'
