index,url,valid,domain,title,description,image,published,archive,content,quote,language,keyword
https://taz.de/Nahost-versus-Klima/!6136102/,https://taz.de/Nahost-versus-Klima/!6136102/,0,taz.de,Nahost versus Klima: Greta Thunberg hat andere Sorgen als die Erderwärmung,"Die schwedische Klimaaktivistin verfolgt ein neues, für sie wichtigeres Ziel: Freiheit für Palästina. Alles andere regelt sich dann schon von selbst.",https://taz.de/picture/8142236/1200/39808324.jpeg,2025-12-19T19:07:00Z,,"Die schwedische Klimaaktivistin verfolgt ein neues, für sie wichtigeres Ziel: Freiheit für Palästina. Alles andere regelt sich dann schon von selbst. mehr...",,de,'Erderwärmung'
https://www.n-tv.de/wissen/Wo-der-kuerzeste-Tag-des-Jahres-besonders-duester-bleibt-id30144385.html,https://www.n-tv.de/wissen/Wo-der-kuerzeste-Tag-des-Jahres-besonders-duester-bleibt-id30144385.html,0,www.n-tv.de,Wissenswertes zur Wintersonnenwende: Wo der kürzeste Tag des Jahres besonders düster bleibt,"Der vierte Advent fällt in diesem Jahr auf den Tag der Wintersonnenwende. Das heißt, ab Sonntag werden die Tage wieder länger. Allerdings ist der Effekt anfangs noch sehr klein. Und wie viel Sonnenlicht man wirklich abbekommt, hängt stark vom Wetter und dem W…",https://www.n-tv.de/img/30144392/1765801120/Img_16_9/1200/Besucher-geniessen-die-letzten-Sonnenstrahlen-auf-einem-Berggipfel-im-Weserbergland.jpg,2025-12-20T06:38:40Z,,"Besucher genießen die letzten Sonnenstrahlen auf einem Berggipfel im Weserbergland. (Foto: dpa)
Der vierte Advent fällt in diesem Jahr auf den Tag der Wintersonnenwende. Das heißt, ab Sonntag werden… [+4243 chars]",,de,'Sonne'
https://www.urlaubspiraten.de/hotels/sommerferien-bei-landal,https://www.urlaubspiraten.de/hotels/sommerferien-bei-landal,0,www.urlaubspiraten.de,Sommerferien zum kleinen Preis ,"Landal hat 127 Ferienparks in Deutschland, Österreich, Dänemark, Tschechien, Belgien, der Schweiz, den Niederlanden und dem Vereinigten Königreich. Da ist mit Sicherheit auch was für euch dabei❣️Nach der Weiterleitung lasst ihr euch einfach inspirieren oder w…",https://image.urlaubspiraten.de/720/image/upload/v1669392937/mediavault_images/shutterstock_1631748508_ow0kip.jpg,2025-12-20T12:05:00Z,,"<li>Unterkunftsarten: Die Parks bieten eine breite Palette von Unterkünften, einschließlich komfortabler Ferienhäuser, luxuriöser Villen, gemütlicher Bungalows und geräumiger Apartments.
</li><li>Na… [+1359 chars]",,de,'Sommerferien'
https://www.bild.de/leben-wissen/wissenschaft/wintersonnenwende-hurra-endlich-werden-die-tage-wieder-laenger-6947b1cea0239e2471bf89eb,https://www.bild.de/leben-wissen/wissenschaft/wintersonnenwende-hurra-endlich-werden-die-tage-wieder-laenger-6947b1cea0239e2471bf89eb,0,www.bild.de,"Wintersonnenwende bringt längere Tage - Hurra, es wird endlich wieder heller!",Am 21. Dezember startet der astronomische Winter und die Tage werden langsam wieder länger.,"https://images.bild.de/6947b1cea0239e2471bf89eb/84482d713c52e999227c1a424c283281,81f40b5e?w=1280",2025-12-21T09:37:12Z,,TTS-Player überspringenArtikel weiterlesenEndlich wieder ein Lichtblick am Himmel. Die Wintersonnenwende am 21. Dezember markiert den kürzesten Tag und damit die längste Nacht des Jahres. Ab dann geh… [+1745 chars],,de,'Sonnenstunden'
https://www.zeit.de/news/2025-12/22/trueber-wochenstart-sonne-nur-auf-schwarzwald-und-alb,https://www.zeit.de/news/2025-12/22/trueber-wochenstart-sonne-nur-auf-schwarzwald-und-alb,0,www.zeit.de,Wetter: Trüber Wochenstart – Sonne nur auf Schwarzwald und Alb,Hier finden Sie Informationen zu dem Thema „Wetter“. Lesen Sie jetzt „Trüber Wochenstart – Sonne nur auf Schwarzwald und Alb“.,https://img.zeit.de/news/2025-12/22/trueber-wochenstart-sonne-nur-auf-schwarzwald-und-alb-image-group/wide__1300x731,2025-12-22T05:17:31Z,,"Grautöne in den Niederungen, Lichtblicke in den Höhen so zeigt sich der Montag im Südwesten. Im Land herrscht am Montag zwar ruhiges, aber nicht überall freundliches Winterwetter.
Laut Deutschem Wet… [+1001 chars]",,de,'Sonne'
https://www.tagesschau.de/wissen/klima/indonesien-klage-zementkonzern-100.html,https://www.tagesschau.de/wissen/klima/indonesien-klage-zementkonzern-100.html,0,www.tagesschau.de,Inselbewohner dürfen gegen Schweizer Zementkonzern Holcim klagen,Überraschende Entscheidung eines Schweizer Gerichts: Bewohner einer von Überschwemmungen betroffenen indonesischen Insel dürfen den Zementkonzern Holcim verklagen. Sie machen ihn mitverantwortlich für den Klimawandel. Von S. Wurzel.,https://images.tagesschau.de/image/0746b76e-0299-4bd6-828c-59a1c1156730/AAABm0R0bsM/AAABmyZE0EA/16x9-big/bewohner-insel-pari-100.jpg?width=1280,2025-12-22T05:27:47Z,,"Stand: 22.12.2025 06:27 Uhr
Überraschende Entscheidung eines Schweizer Gerichts: Bewohner einer von Überschwemmungen betroffenen indonesischen Insel dürfen den Zementkonzern Holcim verklagen. Sie ma… [+3535 chars]",,de,'Klimawandel'
https://www.faz.net/aktuell/wirtschaft/unternehmen/warum-man-an-weihnachten-schon-den-sommerurlaub-buchen-sollte-accg-110806894.html,https://www.faz.net/aktuell/wirtschaft/unternehmen/warum-man-an-weihnachten-schon-den-sommerurlaub-buchen-sollte-accg-110806894.html,0,www.faz.net,Dertour-Chef im Interview: „Reiseerlebnisse sind heute Statussymbole“,"Im Onlinezeitalter wollen Menschen mehr raus und in den Urlaub, sagt Dertour-Chef Christoph Debus. Er erklärt, welche Rolle Künstliche Intelligenz fürs Reisen spielt und warum sich Sommerferien gut zu Weihnachten planen lassen.",https://media0.faz.net/image/w1200h627/2320cae59830/w3000h1567x0y216o/122025/1.10806892/selfie-auf-der-seilrutsche-das.webp,2025-12-22T09:16:16Z,,"Herr Debus, die Reisebranche hat das Vorweihnachtsgeschäft, beginnend mit dem Black Friday, entdeckt. Warum soll ich jetzt schon den Sommerurlaub buchen?
Immer mehr Urlauber beschäftigen sich vor We… [+11419 chars]",,de,'Sommerferien'
https://www.zeit.de/news/2025-12/22/schweizer-gericht-laesst-klimaklage-aus-indonesien-zu,https://www.zeit.de/news/2025-12/22/schweizer-gericht-laesst-klimaklage-aus-indonesien-zu,0,www.zeit.de,Klimawandel: Schweizer Gericht lässt Klimaklage aus Indonesien zu,Hier finden Sie Informationen zu dem Thema „Klimawandel“. Lesen Sie jetzt „Schweizer Gericht lässt Klimaklage aus Indonesien zu“.,https://img.zeit.de/news/2025-12/22/schweizer-gericht-laesst-klimaklage-aus-indonesien-zu-image-group/wide__1300x731,2025-12-22T10:04:28Z,,"Erstmals hat ein Schweizer Gericht eine Klimaklage aus dem Ausland gegen einen Großkonzern zugelassen. Drei Fischer und eine Fischerin aus Indonesien werfen dem Baustoffkonzern Holcim vor, durch sein… [+2136 chars]",,de,'Klimawandel'
https://www.zeit.de/news/2025-12/22/amt-2025-war-das-fuenfzehnte-zu-warme-jahr-in-folge,https://www.zeit.de/news/2025-12/22/amt-2025-war-das-fuenfzehnte-zu-warme-jahr-in-folge,0,www.zeit.de,Klimawandel: Amt: 2025 war das fünfzehnte zu warme Jahr in Folge,Hier finden Sie Informationen zu dem Thema „Klimawandel“. Lesen Sie jetzt „Amt: 2025 war das fünfzehnte zu warme Jahr in Folge“.,https://img.zeit.de/news/2025-12/22/amt-2025-war-das-fuenfzehnte-zu-warme-jahr-in-folge-image-group/wide__1300x731,2025-12-22T15:02:10Z,,"Das bayerische Umwelt-Landesamt hat das fünfzehnte zu warme Jahr in Folge ermittelt. Während des sogenannten hydrologischen Jahres 2025 habe die Mitteltemperatur im Freistaat 9,3 Grad Celsius betrage… [+1441 chars]",,de,'Klimawandel'
https://www.stern.de/gesellschaft/regional/bayern/klimawandel--amt--2025-war-das-fuenfzehnte-zu-warme-jahr-in-folge-36985776.html,https://www.stern.de/gesellschaft/regional/bayern/klimawandel--amt--2025-war-das-fuenfzehnte-zu-warme-jahr-in-folge-36985776.html,0,www.stern.de,Klimawandel: Amt: 2025 war das fünfzehnte zu warme Jahr in Folge,Augsburg (lby) - Das bayerische Umwelt-Landesamt hat das fünfzehnte zu warme Jahr in Folge ermittelt. Während des sogenannten hydrologischen Jahres 2025,https://image.stern.de/36985778/t/3Y/v1/w1440/r1.7778/-/22--oi25w7vrwqv8axs2048jpeg---de022f301b2511ee.jpg,2025-12-22T15:02:10Z,,"Kopiere den aktuellen Link
Zur Merkliste hinzufügen
15 Jahre zu warm, 12 davon zu trocken: Warum Bayerns Grundwasser 2025 nach einer kurzen Entspannung wieder unter Druck gerät.
Das bayerische Umw… [+1582 chars]",,de,'Klimawandel'
https://www.tagesschau.de/ausland/amerika/trump-kriegsschiffe-100.html,https://www.tagesschau.de/ausland/amerika/trump-kriegsschiffe-100.html,0,www.tagesschau.de,Trump kündigt Bau neuer Schlachtschiffe für US-Marine an,"US-Präsident Trump will die Marine aufrüsten. Dafür hat er nun eine neue Baureihe von Kriegsschiffen angekündigt, die seinen Namen trägt. Die ""Trump-Klasse"" soll bisherige Schlachtschiffe in den Schatten stellen.",https://images.tagesschau.de/image/c0225319-47cf-4ed3-ab1f-f339e35eb4f7/AAABm0ikkFU/AAABmyZE0EA/16x9-big/trump-kriegsschiff-bild-100.jpg?width=1280,2025-12-23T00:38:23Z,,"Stand: 23.12.2025 01:38 Uhr
US-Präsident Trump will die Marine aufrüsten. Dafür hat er nun eine neue Baureihe von Kriegsschiffen angekündigt, die seinen Namen trägt. Die ""Trump-Klasse"" soll bisherig… [+1326 chars]",,de,'Schatten'
https://www.brigitte.de/liebe/persoenlichkeit/psychologie--wie-dein-weihnachtstyp-verraet--was-dir-wirklich-wichtig-ist-14050530.html,https://www.brigitte.de/liebe/persoenlichkeit/psychologie--wie-dein-weihnachtstyp-verraet--was-dir-wirklich-wichtig-ist-14050530.html,0,www.brigitte.de,"Überperformerin, Genießerin, Schnorrerin: Wie dein Weihnachtstyp verrät, was dir wirklich wichtig ist","Manche bekommen schon beim Gedanken an Weihnachten Pickel, andere beginnen nach den Sommerferien, die Wohnung zu schmücken. Erkennst du dich in einem dieser sechs Weihnachtstypen wieder?",https://image.brigitte.de/14050642/t/7Q/v2/w1440/r1.7778/-/weihnachtstypen.jpg,2025-12-23T07:26:00Z,,"Manche bekommen schon beim Gedanken an Weihnachten Pickel, andere beginnen nach den Sommerferien, die Wohnung zu schmücken. Erkennst du dich in einem dieser sechs Weihnachtstypen wieder?
1) Die Über… [+5815 chars]",,de,'Sommerferien'
https://www.sueddeutsche.de/bayern/bayern-wetter-weihnachten-vorhersage-sonne-glaette-li.3358967,https://www.sueddeutsche.de/bayern/bayern-wetter-weihnachten-vorhersage-sonne-glaette-li.3358967,0,www.sueddeutsche.de,Weihnachtswetter: Sonne am ersten Feiertag in weiten Teilen Bayerns,"Erst trübe Aussichten, dann strahlende Sonne: Zu Weihnachten öffnet sich die Wolkendecke – trotzdem drohen Nebel, Schnee und Glätte.",https://www.sueddeutsche.de/2025/12/23/109255fc-cc01-4961-bb9f-2d0c135c23ab.jpg?q=60&fm=webp&width=1200&rect=0%2C146%2C4000%2C2250,2025-12-23T08:46:44Z,,"Zuvor wird es jedoch noch einmal ungemütlich. Am Dienstag bleibt es laut DWD ganztägig grau, örtlich fällt Sprühregen oder Schneegriesel. In der Nacht zum Mittwoch kann es dadurch verbreitet glatt we… [+985 chars]",,de,'Sonne'
https://www.nzz.ch/wissenschaft/klimaforschung-us-regierung-will-forschungszentrum-ncar-aufloesen-ld.1917660,https://www.nzz.ch/wissenschaft/klimaforschung-us-regierung-will-forschungszentrum-ncar-aufloesen-ld.1917660,0,www.nzz.ch,Das NCAR gilt als Mekka der Wetter- und Klimaforschung in den USA. Jetzt will die Regierung es auflösen,Am National Center for Atmospheric Research in Colorado erforschen Wissenschafter die Wettervorhersage und den Klimawandel. Fachleute bezeichnen die angekündigte Auflösung des stark vernetzten Zentrums als schädlich.,"https://img.nzz.ch/2025/12/22/c96791dd-df21-4151-bd4d-7f5744e0cfd9.jpg?width=1200&height=675&fit=bounds&quality=75&auto=webp&crop=6048,3402,x0,y315&wmark=nzz",2025-12-23T09:00:00Z,,Am National Center for Atmospheric Research in Colorado erforschen Wissenschafter die Wettervorhersage und den Klimawandel. Fachleute bezeichnen die angekündigte Auflösung des stark vernetzten Zentru… [+6426 chars],,de,'Klimawandel'
https://www.bild.de/sport/segel-sonne-weihnachten-laura-wontorra-sendet-heisse-urlaubsgruesse-694a55b836dab63128b5b139,https://www.bild.de/sport/segel-sonne-weihnachten-laura-wontorra-sendet-heisse-urlaubsgruesse-694a55b836dab63128b5b139,0,www.bild.de,"Segel, Sonne, Weihnachten - Laura Wontorra sendet heiße Urlaubsgrüße",Laura Wontorra verbringt ihre Weihnachtsferien gesponsert auf einem Karibik Mehrmaster Kreuzfahrtschiff und zeigt an Bord Workout und eleganten Abendlook.,"https://images.bild.de/694a55b836dab63128b5b139/fd4f8c2e73d5d707391994189be1e825,5c9f2789?w=1280",2025-12-23T09:02:24Z,,"+++Schon wieder ein Rocker-Anschlag? Explosion in Kölner Wohnviertel
+++Schon wieder ein Rocker-Anschlag? Explosion in Kölner Wohnviertel
+++Schon wieder ein Rocker-Anschlag? Explosion in Kölner Wo… [+498 chars]",,de,'Sonne'
https://www.urlaubspiraten.de/reiseziele/thailand/koh-chang,https://www.urlaubspiraten.de/reiseziele/thailand/koh-chang,0,www.urlaubspiraten.de,Urlaub auf Koh Chang: Inselparadies in Thailand,"Die wunderschöne Insel Koh Chang ist eine der größten Inseln im Golf von Thailand und eine der überhaupt. Sie bietet neben tollem Wetter mit viel Sonne, paradiesische Strände mit saftig grünen Palmen natürlich auch super leckeres thailändisches Essen. Seid ih…",https://image.urlaubspiraten.de/720/image/upload/v1603284914/mediavault_images/esop2fmya7dhu50kryyz.jpg,2025-12-23T10:39:18Z,,"Ein Urlaub in Thailand steht ganz klar für Badeurlaub an einigen der Traumstrände dieser Erde. Wer also einfach nur relaxen und entspannen will, der ist in Koh Chang goldrichtig. 
Zu den schönsten S… [+805 chars]",,de,'Sonne'
https://ooe.orf.at/stories/3335279/,https://ooe.orf.at/stories/3335279/,0,ooe.orf.at,Nebel: Ein Drittel weniger PV-Strom,"Der Dauernebel im Dezember im oberösterreichischen Zentralraum war auch für die Besitzer von Photovoltaikanlagen bitter. Denn durch die Hochnebeldecke kam kaum Sonnenschein durch, dementsprechend ist auch weniger Sonnenstrom produziert worden. Österreichweit …",https://ibs.orf.at/ooe?image=https%3A%2F%2Foekastatic.orf.at%2Fmims%2F2021%2F40%2F44%2Fcrops%2Fw%3D1200%2Ch%3D627%2Cq%3D75%2F1098585_master_390044_mission_zero.jpg%3Fs%3D76ece931d477528662f915e0415792c005084cf0,2025-12-23T11:30:29Z,,"Damit hat sich die Wetterlage deutlich auf die Stromproduktion ausgewirkt. Allgemein können die Module aufgrund der kürzeren Tage und des niedrigen Sonnenstandes, der für schlechtere Einfallswinkel s… [+655 chars]",,de,'Sonne'
https://tirol.orf.at/stories/3335320/,https://tirol.orf.at/stories/3335320/,0,tirol.orf.at,Abflüsse aus Blockgletschern verändern sich,"Die Untersuchung von Blockgletschern in Österreich  durch ein Forschungsteam der Universität Graz zeigt, dass der Klimawandel zu einer saisonalen Verschiebung der Wasserabflüsse führen könnte. Eines der erforschten Gebiete liegt in den Ötztaler Alpen.",https://ibs.orf.at/tir?image=https%3A%2F%2Foekastatic.orf.at%2Fmims%2F2022%2F37%2F27%2Fcrops%2Fw%3D1200%2Ch%3D627%2Cq%3D75%2F1493399_master_541927_block3.jpg%3Fs%3De3b828cb11efa5b995961c64f4a8b076a9fb9a34,2025-12-24T05:05:21Z,,"Im Projekt RGAlpCatch wurden Blockgletscher in fünf Testgebieten, darunter dem Radurschltal in den westlichen Ötztaler Alpen (Bezirk Landeck), untersucht und deren Abflussverhalten unter verschiedene… [+1956 chars]",,de,'Klimawandel'
https://www.stern.de/kultur/tv/dokumentation--frostiges-paradies-in-gefahr----meine-arktis--im-zdf-36991122.html,https://www.stern.de/kultur/tv/dokumentation--frostiges-paradies-in-gefahr----meine-arktis--im-zdf-36991122.html,0,www.stern.de,"Dokumentation: Frostiges Paradies in Gefahr - ""Meine Arktis"" im ZDF","Als ""Bergretter"" im ZDF erlebt Schauspieler Sebastian Ströbel den Klimawandel in den Alpen hautnah. Ein Thema, dem er sich auch in Dokumentationen widmet, und das ihn nun in die Arktis führte.",https://image.stern.de/36991124/t/sM/v1/w1440/r1.7778/-/25--u4eobmxj4qv7axs2048jpeg---d7d9da0e50a29a47.jpg,2025-12-25T12:00:04Z,,"Kopiere den aktuellen Link
Zur Merkliste hinzufügen
Als ""Bergretter"" im ZDF erlebt Schauspieler Sebastian Ströbel den Klimawandel in den Alpen hautnah. Ein Thema, dem er sich auch in Dokumentatione… [+4131 chars]",,de,'Klimawandel'
https://www.tagesspiegel.de/gesellschaft/dokumentation-frostiges-paradies-in-gefahr-meine-arktis-im-zdf-15081506.html,https://www.tagesspiegel.de/gesellschaft/dokumentation-frostiges-paradies-in-gefahr-meine-arktis-im-zdf-15081506.html,0,www.tagesspiegel.de,Dokumentation: Frostiges Paradies in Gefahr - „Meine Arktis“ im ZDF,"Als „Bergretter“ im ZDF erlebt Schauspieler Sebastian Ströbel den Klimawandel in den Alpen hautnah. Ein Thema, dem er sich auch in Dokumentationen widmet, und das ihn nun in die Arktis führte.",https://www.tagesspiegel.de/images/15081505/alternates/BASE_16_9_W1400/1766664062000/sebastian-strobel-meine-arktis.jpeg,2025-12-25T12:01:03Z,,"Alltag bei den Inuit, Einblicke in die Polarforschung, monatelange Dunkelheit und Schießtraining für den Fall einer Eisbären-Begegnung: Bergretter-Star Sebastian Ströbel nimmt sein Publikum in der ZD… [+3962 chars]",,de,'Klimawandel'
https://www.diepresse.com/20432426/weihnachtswetter-die-sonne-kehrt-zurueck,https://www.diepresse.com/20432426/weihnachtswetter-die-sonne-kehrt-zurueck,0,www.diepresse.com,Weihnachtswetter: Die Sonne kehrt zurück,Am Stefanitag soll im Tagesverlauf in ganz Österreich die Sonne scheinen. Auch das Wochenende dürfte vielversprechend werden. Wind weht nur schwach.,https://img.diepresse.com/public/incoming/yq7fyt-imago780807387.jpg/alternates/DPR_SOCIAL_NACHRICHTEN/imago780807387.jpg,2025-12-25T13:46:07Z,,"Am Stefanitag soll im Tagesverlauf in ganz Österreich die Sonne scheinen. Auch das Wochenende dürfte vielversprechend werden. Wind weht nur schwach.
Österreich kann für die nächsten Tage ruhiges und… [+3326 chars]",,de,'Sonne'
https://taz.de/Weihnachtsessen-in-Frankreich/!6132667/,https://taz.de/Weihnachtsessen-in-Frankreich/!6132667/,0,taz.de,Weihnachtsessen in Frankreich: Wenn Apfelplantagen Weinbergen weichen,"Die Normandie ist berühmt für Cidre, Calvados und Meeresfrüchte. Doch der Klimawandel verändert Land und Meer.",https://taz.de/picture/8136490/1200/Normandie-Klimawandel-Landwirtschaft-Fischerei-1-1.jpeg,2025-12-25T17:03:00Z,,"Die Normandie ist berühmt für Cidre, Calvados und Meeresfrüchte. Doch der Klimawandel verändert Land und Meer. mehr...",,de,'Klimawandel'
https://www.welt.de/politik/deutschland/article694e061aba368aa0126a36c8/carsten-schneider-klimawirkung-muss-erhalten-bleiben-umweltminister-daempft-erwartungen-an-heizungsgesetz-reform.html,https://www.welt.de/politik/deutschland/article694e061aba368aa0126a36c8/carsten-schneider-klimawirkung-muss-erhalten-bleiben-umweltminister-daempft-erwartungen-an-heizungsgesetz-reform.html,0,www.welt.de,„Klimawirkung muss erhalten bleiben“ –Umweltminister dämpft Erwartungen an Heizungsgesetz-Reform,"Bis Ende Januar will die Bundesregierung Grundzüge für die Reform des Heizungsgesetzes vorlegen. Umweltminister Schneider beharrt, dass es weiter als Instrument gegen den Klimawandel wirksam bleibt. Der Minister äußert sich auch zur E-Mobilität.",https://images.welt.de/694e061aba368aa0126a36c8/9067d012cbd7de839a9b39873f697fa2-master/ci16x9-w1200/dpa-com-20090101-251222-935-1035151-jpg,2025-12-26T04:01:57Z,,"Bis Ende Januar will die Bundesregierung Grundzüge für die Reform des Heizungsgesetzes vorlegen. Umweltminister Schneider beharrt, dass es weiter als Instrument gegen den Klimawandel wirksam bleibt. … [+2171 chars]",,de,'Klimawandel'
https://www.zeit.de/news/2025-12/26/frost-und-sonne-bayern-startet-freundlich-ins-jahresende,https://www.zeit.de/news/2025-12/26/frost-und-sonne-bayern-startet-freundlich-ins-jahresende,0,www.zeit.de,Wetter: Frost und Sonne: Bayern startet freundlich ins Jahresende,Hier finden Sie Informationen zu dem Thema „Wetter“. Lesen Sie jetzt „Frost und Sonne: Bayern startet freundlich ins Jahresende“.,https://img.zeit.de/news/2025-12/26/frost-und-sonne-bayern-startet-freundlich-ins-jahresende-image-group/wide__1300x731,2025-12-26T08:59:10Z,,"Zwischen den Jahren erwartet den Freistaat ruhiges Winterwetter perfekt für Spaziergänge in der Sonne. Trotzdem heißt es: Vorsicht vor Frost und Glätte in Bayern, wie der Deutsche Wetterdienst (DWD) … [+1251 chars]",,de,'Sonne'
https://www.diepresse.com/20424412/als-der-klimawandel-in-bilanzen-einzug-hielt,https://www.diepresse.com/20424412/als-der-klimawandel-in-bilanzen-einzug-hielt,0,www.diepresse.com,Als der Klimawandel in Bilanzen Einzug hielt [premium],Früher war Nachhaltigkeit in der Wirtschaft eher ein Nischenprogramm. Heute ist sie Standard. Doch die Bürokratie uferte aus und der Gegenwind nahm zu.,https://img.diepresse.com/public/incoming/wqfts1-USA-TRUMP/alternates/DPR_SOCIAL_NACHRICHTEN/USA-TRUMP,2025-12-26T11:46:22Z,,"Wien. Wer Anfang der 2000er-Jahre das Schlagwort Corporate Social Responsibility entgegengeworfen bekam, rollte meist mit den Augen. Dass Unternehmen ökologische, soziale und wirtschaftliche Faktoren… [+3997 chars]",,de,'Erderwärmung'
https://www.zeit.de/news/2025-12/26/sonne-und-schnee-im-thueringer-wald-erwartet,https://www.zeit.de/news/2025-12/26/sonne-und-schnee-im-thueringer-wald-erwartet,0,www.zeit.de,Gute Wetteraussichten: Sonne und Schnee im Thüringer Wald erwartet,Hier finden Sie Informationen zu dem Thema „Gute Wetteraussichten“. Lesen Sie jetzt „Sonne und Schnee im Thüringer Wald erwartet“.,https://img.zeit.de/news/2025-12/26/sonne-und-schnee-im-thueringer-wald-erwartet-image-group/wide__1300x731,2025-12-26T14:52:27Z,,"In Thüringen scheint sich das Winterwetter nach den kalten Weihnachtstagen zu halten. Zwar soll es die nächsten Tage etwas milder werden, in den Nächten bleibe es vielerorts aber leicht frostig, sagt… [+1353 chars]",,de,'Sonne'
"https://www.gamestar.de/artikel/flexoelektrizitaet-ferroelektrizitaet-wassereis-blitze,3440613.html","https://www.gamestar.de/artikel/flexoelektrizitaet-ferroelektrizitaet-wassereis-blitze,3440613.html",0,www.gamestar.de,Wissenschaft - Forscher entschlüsseln Mechanismus hinter Blitzen: So bringt Wassereis Gewitterwolken regelrecht zum Kochen,Wie entsteht in Gewitterwolken die Kraft der Blitze? Und wie züngeln sie schließlich gen Boden? Auf beide Fragen haben Wissenschaftler neue Antworten.,https://images.cgames.de/images/gamestar/293/teaser-eis-elektrizität-gewitterwolke-gs_6378768.jpg,2025-12-26T15:30:00Z,,"Blitze und Eis mögen sich optisch unterschieden wie Tag und Nacht. Physikalisch hängen sie aber wohl enger zusammen als wir dachten.
(Bildquelle: Unsplash, Johannes Plenio und Aaron Burden)
Jeder k… [+6382 chars]",,de,'Gewitter'
https://www.nzz.ch/meinung/jetzt-kann-nur-gott-noch-helfen-in-iran-herrscht-epochale-wasserknappheit-doch-viele-der-probleme-sind-menschengemacht-ld.1916047,https://www.nzz.ch/meinung/jetzt-kann-nur-gott-noch-helfen-in-iran-herrscht-epochale-wasserknappheit-doch-viele-der-probleme-sind-menschengemacht-ld.1916047,0,www.nzz.ch,"GASTKOMMENTAR - Jetzt kann nur Gott noch helfen – in Iran herrscht epochale Wasserknappheit, doch viele der Probleme sind menschengemacht","Iran war schon immer ein Land mit wenig Wasser, doch so dramatisch wie heute war der Mangel noch nie. Das liegt am Klimawandel, mehr aber noch an Planlosigkeit, Misswirtschaft und Inkompetenz. Für die Machthaber wird die Lage langsam heikel, Remedur tut not.","https://img.nzz.ch/2025/12/23/7a9b7416-445e-4ac2-9d3f-8d77a6a1f0d8.jpg?width=1200&height=674&fit=bounds&quality=75&auto=webp&crop=7200,4049,x0,y751&wmark=nzz",2025-12-27T04:30:00Z,,"Iran war schon immer ein Land mit wenig Wasser, doch so dramatisch wie heute war der Mangel noch nie. Das liegt am Klimawandel, mehr aber noch an Planlosigkeit, Misswirtschaft und Inkompetenz. Für di… [+10208 chars]",,de,'Klimawandel'
https://www.zeit.de/news/2025-12/27/frost-und-sonne-zwischen-den-jahren,https://www.zeit.de/news/2025-12/27/frost-und-sonne-zwischen-den-jahren,0,www.zeit.de,Wetter: Frost und Sonne zwischen den Jahren,Hier finden Sie Informationen zu dem Thema „Wetter“. Lesen Sie jetzt „Frost und Sonne zwischen den Jahren“.,https://img.zeit.de/news/2025-12/27/frost-und-sonne-zwischen-den-jahren-image-group/wide__1300x731,2025-12-27T08:20:29Z,,"Zwischen den Jahren erwartet den Freistaat ruhiges Winterwetter perfekt für Spaziergänge in der Sonne. Trotzdem heißt es: Vorsicht vor Frost und Glätte in Bayern, wie der Deutsche Wetterdienst (DWD) … [+680 chars]",,de,'Sonne'
https://www.faz.net/aktuell/sport/wintersport/wintersport-problem-lernen-kinder-heute-noch-wie-man-ski-faehrt-accg-110809066.html,https://www.faz.net/aktuell/sport/wintersport/wintersport-problem-lernen-kinder-heute-noch-wie-man-ski-faehrt-accg-110809066.html,0,www.faz.net,"Probleme des Wintersports: Lernen Kinder heute noch, wie man Ski fährt?","Klimawandel, Schneemangel, verändertes Freizeitverhalten und auch immer weiter steigende Kosten: Der Skisport steht vor riesigen Herausforderungen. Es gibt Ideen – und unterschiedliche Prognosen.",https://media0.faz.net/image/w1200h627/b7ce686945db/w5315h2777x0y430o/201801/431.0.21724125/skifahrende-eltern-und.webp,2025-12-27T10:54:04Z,,"Skilaufen ist Motorsport, sagt Boris Bregar, Präsident des Skiklubs Bad Reichenhall. Um zum Skilaufen in den Schnee zu kommen, muss er fahren. Immer. Selbst im bergnahen Berchtesgadener Land. Sogar f… [+8764 chars]",,de,'Klimawandel'
