index,url,valid,domain,title,description,image,published,archive,content,quote,language,keyword
https://www.zeit.de/news/2026-03/05/bis-zu-18-grad-und-sonne-norddeutschland-bleibt-freundlich,https://www.zeit.de/news/2026-03/05/bis-zu-18-grad-und-sonne-norddeutschland-bleibt-freundlich,0,www.zeit.de,Wetter: Bis zu 18 Grad und Sonne: Norddeutschland bleibt freundlich,Hier finden Sie Informationen zu dem Thema „Wetter“. Lesen Sie jetzt „Bis zu 18 Grad und Sonne: Norddeutschland bleibt freundlich“.,https://img.zeit.de/news/2026-03/05/bis-zu-18-grad-und-sonne-norddeutschland-bleibt-freundlich-image-group/wide__1300x731,2026-03-05T05:31:28Z,,"Die nächsten Tage werden im Norden freundlich und mild. Am Donnerstag werden Maximalwerte von neun Grad auf den Inseln und an der Küste, sowie bis zu 16 Grad in Hamburg erwartet, wie der Deutsche Wet… [+1186 chars]",,de,'Sonne'
https://www.zeit.de/2026/11/energieversorgung-strompreise-merit-order-gas-verbraucher,https://www.zeit.de/2026/11/energieversorgung-strompreise-merit-order-gas-verbraucher,0,www.zeit.de,Energieversorgung: Stoppt das Abkassieren!,"Der Gaspreis steigt. Das bringt auch den Stromkonzernen mehr Geld – selbst den Unternehmen, die Energie mit Sonne und Wind erzeugen. Höchste Zeit, die Regeln zu ändern.",https://img.zeit.de/2026/11/stoppt-das-abkassieren-bild-2/wide__1300x731,2026-03-05T09:19:05Z,,"Jetzt beginnen womöglich wieder goldene Wochen für viele Stromproduzenten in Deutschland, insbesondere für die Betreiber von großen Wind- und Solaranlagen. Ohne höhere Kosten zu haben oder etwas dafü… [+539 chars]",,de,'Sonne'
https://www.zeit.de/news/2026-03/05/minister-goldschmidt-klimawandel-laengst-spuerbar,https://www.zeit.de/news/2026-03/05/minister-goldschmidt-klimawandel-laengst-spuerbar,0,www.zeit.de,Klimaanpassungskonferenz: Minister Goldschmidt: Klimawandel längst spürbar,Hier finden Sie Informationen zu dem Thema „Klimaanpassungskonferenz“. Lesen Sie jetzt „Minister Goldschmidt: Klimawandel längst spürbar“.,https://img.zeit.de/news/2026-03/05/minister-goldschmidt-klimawandel-laengst-spuerbar-image-group/wide__1300x731,2026-03-05T09:45:24Z,,"Verwaltung, Wissenschaft, Wirtschaft und Kommunen beraten über notwendige Anpassungen im Zuge des Klimawandels. «Die Auswirkungen des Klimawandels sind auch in Schleswig-Holstein längst spürbar von S… [+722 chars]",,de,'Klimawandel'
https://science.orf.at/stories/3234494/,https://science.orf.at/stories/3234494/,0,science.orf.at,Waldschäden könnten deutlich zunehmen,"Selbst unter eher optimistischen Annahmen zur Erderwärmung bis zum Jahr 2100 geraten Europas Wälder durch Brände, Stürme und Borkenkäfer noch stärker unter Druck, so eine neue Studie. Selbst wenn das Plus knapp unter zwei Grad Celsius bliebe, würden pro Jahr …",https://ibs.orf.at/science?image=https%3A%2F%2Ftubestatic.orf.at%2Fmims%2F2021%2F36%2F26%2Fcrops%2Fw%3D1200%2Ch%3D627%2Cq%3D75%2F1065921_master_377426_der_kampf_gegen_den_borkenkaefer_.jpg%3Fs%3Db705c0da1816bbdd97238c1b9aeb7ed0848767f7,2026-03-05T19:00:00Z,,"Die Kombination aus bereits merklich gestiegenen Durchschnittstemperaturen, zuletzt vermehrt trockenen Jahren, tendenziell mehr und längeren Hitzewellen und einem vielerorts für diese Bedingungen nic… [+3297 chars]",,de,'Erderwärmung'
https://www.zeit.de/wissen/umwelt/2026-03/waldschaeden-klimawandel-borkenkaefer-brand,https://www.zeit.de/wissen/umwelt/2026-03/waldschaeden-klimawandel-borkenkaefer-brand,0,www.zeit.de,Klimakrise: Waldschäden sollen laut Studie durch Klimawandel deutlich zunehmen,"Brände, Stürme und der Borkenkäfer werden Wäldern in Europa künftig stark zusetzen. Bereits bei 2 Grad Erderwärmung werden laut Studie 20 Prozent mehr Schäden erwartet.",https://img.zeit.de/wissen/2026-03/studie-erwartet-steigende-waldschaeden-bild/wide__1300x731,2026-03-05T20:50:45Z,,Waldschäden in Europa werden in Zukunft stark zunehmen. Davor warnt das Potsdam-Institut für Klimafolgenforschung (PIK) in einer neuen Studie. Im Vergleich zu den vergangenen Jahrzehnten werden unter… [+1196 chars],,de,'Klimawandel'
https://www.faz.net/aktuell/rhein-main/fruehjahrsmuedigkeit-ein-arzt-gibt-tipps-zu-vitamin-d-zeitumstellung-und-allergien-accg-110847959.html,https://www.faz.net/aktuell/rhein-main/fruehjahrsmuedigkeit-ein-arzt-gibt-tipps-zu-vitamin-d-zeitumstellung-und-allergien-accg-110847959.html,0,www.faz.net,Nach dem langen Winter: Wie überwinde ich die Frühjahrsmüdigkeit?,"Die Sonne scheint – und doch fühlen sich gerade im Frühling viele Menschen schlapp. Ein Arzt erklärt, was es damit auf sich hat, wie man ganz einfach Vitamin D tanken kann und was die Zeitumstellung mit unseren Körpern macht.",https://media0.faz.net/image/w1200h627/62ddd55aa219/w4120h2152x0y297o/202603/368f0f3f-9591-48a5-82dc-f60d8cabbcab/draussen-scheint-die-sonne.webp,2026-03-06T05:57:08Z,,"06.03.2026, 06:57Lesezeit: 3 Min.
Die Sonne scheint und doch fühlen sich gerade im Frühling viele Menschen schlapp. Ein Arzt erklärt, was es damit auf sich hat, wie man ganz einfach Vitamin D tanken… [+58 chars]",,de,'Sonne'
https://www.zeit.de/news/2026-03/06/sonne-am-wochenende-temperaturen-bis-21-grad,https://www.zeit.de/news/2026-03/06/sonne-am-wochenende-temperaturen-bis-21-grad,0,www.zeit.de,Wetter in Nordrhein-Westfalen: Sonne am Wochenende - Temperaturen bis 21 Grad,Hier finden Sie Informationen zu dem Thema „Wetter in Nordrhein-Westfalen“. Lesen Sie jetzt „Sonne am Wochenende - Temperaturen bis 21 Grad“.,https://img.zeit.de/news/2026-03/06/sonne-am-wochenende-temperaturen-bis-21-grad-image-group/wide__1300x731,2026-03-06T07:41:55Z,,"In Nordrhein-Westfalen dürfen sich die Menschen auf ein Wochenende mit Sonnenschein und frühlingshaften Temperaturen freuen. Am Freitag sei es überwiegend sonnig, teilte der Deutsche Wetterdienst (DW… [+540 chars]",,de,'Sonne'
https://www.faz.net/aktuell/rhein-main/frankfurt/glueck-wieso-gute-laune-im-fruehling-keine-pflicht-ist-200601472.html,https://www.faz.net/aktuell/rhein-main/frankfurt/glueck-wieso-gute-laune-im-fruehling-keine-pflicht-ist-200601472.html,0,www.faz.net,Mehr Toleranz: Gut-Wetter-Glückszwang gibt es nicht,"Nur weil die Sonne scheint, müssen nicht alle Menschen zwanghaft glücklich sein. Ein Appell für ein bisschen mehr Verständnis für schlechte Laune – trotz Sonnenstunden.",https://media0.faz.net/image/w1200h627/d0ed3d670409/w3652h1908x0y263o/202603/43601.0.1847104622/schneegloeckchen-sind-fuer.webp,2026-03-06T09:30:02Z,,Der Frühling ist da! Mit dieser oft euphorisch ausgesprochenen Beobachtung scheint die Erwartung purer Lebensfreude verbunden zu sein. Alles steht auf Anfang. Alles steht für Aufbruch. Die ersten Son… [+2234 chars],,de,'Sonne'
https://www.zeit.de/wissen/2026-03/manuel-hagel-treibhauseffekt-schueler-wahlkampf-baden-wuerttemberg,https://www.zeit.de/wissen/2026-03/manuel-hagel-treibhauseffekt-schueler-wahlkampf-baden-wuerttemberg,0,www.zeit.de,Manuel Hagel: Mal ehrlich: Könnten Sie den Treibhauseffekt kurz erklären?,Manuel Hagel ist nun ein Meme: Weil der Ba-Wü-Spitzenkandidat vor Schülern an den Basics der Erderwärmung scheiterte. Wir hätten da einen Spickzettel. Nicht nur für ihn.,https://img.zeit.de/wissen/2026-03/manuel-hagel-treibhauseffekt-schueler-wahlkampf-baden-wuerttemberg-bild/wide__1300x731,2026-03-06T12:10:11Z,,"Fremdscham-Moment aus dem
Geografieunterricht an einer Schule in Stuttgart. Und vielleicht flammt auch
ein Funken Mitleid auf. Der CDU-Spitzenkandidat für die Landtagswahl in
Baden-Württemberg, Ma… [+657 chars]",,de,'Erderwärmung'
https://www.spektrum.de/news/klimawandel-erderwaermung-seit-2015-deutlich-beschleunigt/2313687,https://www.spektrum.de/news/klimawandel-erderwaermung-seit-2015-deutlich-beschleunigt/2313687,0,www.spektrum.de,Klimawandel: Erderwärmung hat sich seit 2015 deutlich beschleunigt,Wie stark erwärmt sich die Erde? Eine Studie rechnet natürliche Schwankungen heraus. Demnach hat sich der Planet zuletzt verstärkt erhitzt.,https://static.spektrum.de/fm/912/f1920x1080/GettyImages-1197788455.jpg,2026-03-06T14:00:00Z,,"Die Erderwärmung hat sich einer Studie zufolge seit etwa 2015 deutlich beschleunigt. Während die globale Temperatur von 1970 bis 2015 um durchschnittlich 0,2 Grad Celsius pro Jahrzehnt gestiegen sei,… [+1469 chars]",,de,'Klimawandel'
https://science.orf.at/stories/3234513/,https://science.orf.at/stories/3234513/,0,science.orf.at,Erderwärmung deutlich beschleunigt,"Die Erderwärmung hat sich seit etwa 2015 deutlich beschleunigt. Das zeigt eine Studie, für die natürliche Einflüsse auf das Klima herausgerechnet wurden. Während die globale Temperatur von 1970 bis 2015 um durchschnittlich 0,2 Grad Celsius pro Jahrzehnt gesti…",https://ibs.orf.at/science?image=https%3A%2F%2Ftubestatic.orf.at%2Fmims%2F2023%2F46%2F69%2Fcrops%2Fw%3D1200%2Ch%3D627%2Cq%3D75%2F2007865_master_756669_581972_opener_198560_weltumwelttag_gewessler_anschober_3_gy.jpg%3Fs%3Df94c02c317ff8c58f56c6c05132f8275bd3519cc,2026-03-06T14:00:00Z,,"Dass die Erde sich seit geraumer Zeit erwärmt, steht zweifelsfrei fest. Gerade die Jahre 2023 und vor allem 2024 waren die bisher wärmsten seit Beginn der Messungen. Da die Temperatur auch natürliche… [+3331 chars]",,de,'Erderwärmung'
https://www.tagesschau.de/wissen/klima/klimawandek-erderwaermung-folgen-100.html,https://www.tagesschau.de/wissen/klima/klimawandek-erderwaermung-folgen-100.html,0,www.tagesschau.de,Studie: Erderwärmung geht seit 2015 wirklich schneller voran,"Hinweise gab es schon, nun bestätigt eine neue Studie des Potsdam-Instituts für Klimafolgenforschung: Die Erde hat sich in den vergangenen zehn Jahren deutlich schneller erwärmt als in den Jahrzehnten davor. Von Ulrike Brandt.",https://images.tagesschau.de/image/b57a14f6-bae2-4f85-86dc-f2c0f5a20bd2/AAABnMMS__w/AAABmyZE0EA/16x9-big/treibholz-100.jpg?width=1280,2026-03-06T14:00:44Z,,"Stand: 06.03.2026 15:00 Uhr
Hinweise gab es schon, nun bestätigt eine neue Studie des Potsdam-Instituts für Klimafolgenforschung: Die Erde hat sich in den vergangenen zehn Jahren deutlich schneller … [+3549 chars]",,de,'Erderwärmung'
https://www.stern.de/panorama/wissen/analyse-von-temperaturanstieg--studie--erderwaermung-hat-sich-deutlich-beschleunigt-37198388.html,https://www.stern.de/panorama/wissen/analyse-von-temperaturanstieg--studie--erderwaermung-hat-sich-deutlich-beschleunigt-37198388.html,0,www.stern.de,Analyse von Temperaturanstieg: Studie: Erderwärmung hat sich deutlich beschleunigt,Potsdam/Bremerhaven - Die Erderwärmung hat sich einer Studie zufolge seit etwa 2015 deutlich beschleunigt. Während die globale Temperatur von 1970 bis,https://image.stern.de/37198390/t/C1/v1/w1440/r1.7778/-/06--mpqmgwaejzv18axs2048jpeg---94c8eeb4c6cdfa8e.jpg,2026-03-06T14:01:04Z,,"Kopiere den aktuellen Link
Zur Merkliste hinzufügen
Wie stark erwärmt sich die Erde? Eine Studie rechnet natürliche Schwankungen heraus. Demnach hat sich der Planet zuletzt verstärkt erhitzt.
Die … [+4510 chars]",,de,'Erderwärmung'
https://www.zeit.de/news/2026-03/06/studie-erderwaermung-hat-sich-deutlich-beschleunigt,https://www.zeit.de/news/2026-03/06/studie-erderwaermung-hat-sich-deutlich-beschleunigt,0,www.zeit.de,Analyse von Temperaturanstieg: Studie: Erderwärmung hat sich deutlich beschleunigt,Hier finden Sie Informationen zu dem Thema „Analyse von Temperaturanstieg“. Lesen Sie jetzt „Studie: Erderwärmung hat sich deutlich beschleunigt“.,https://img.zeit.de/news/2026-03/06/studie-erderwaermung-hat-sich-deutlich-beschleunigt-image-group/wide__1300x731,2026-03-06T14:01:04Z,,"Die Erderwärmung hat sich einer Studie zufolge seit etwa 2015 deutlich beschleunigt. Während die globale Temperatur von 1970 bis 2015 um durchschnittlich 0,2 Grad Celsius pro Jahrzehnt gestiegen sei,… [+4355 chars]",,de,'Erderwärmung'
https://www.zeit.de/wissen/umwelt/2026-03/klimawandel-erderwaermung-studie-klimakrise-geophysical-research-letters,https://www.zeit.de/wissen/umwelt/2026-03/klimawandel-erderwaermung-studie-klimakrise-geophysical-research-letters,0,www.zeit.de,Klimawandel: Erderwärmung hat sich laut Studie deutlich beschleunigt,"Forscher haben die Erderwärmung untersucht und Faktoren herausgerechnet, die natürliche Temperaturschwankungen verursachen. Ergebnis: Die Erde erhitzt immer schneller.",https://img.zeit.de/wissen/2026-03/klimawandel-erderwaermung-studie-klimakrise-geophysical-research-letters-bild/wide__1300x731,2026-03-06T14:26:09Z,,"Seit rund zehn Jahren hat sich die Erwärmung der Erdatmosphäre einer Studie zweier Klimaforscher zufolge stark beschleunigt. Während die globale Temperatur von 1970 bis 2015 um durchschnittlich 0,2
… [+2471 chars]",,de,'Erderwärmung'
https://www.n-tv.de/wissen/Studie-zeigt-deutliche-Beschleunigung-der-Erderwaermung-id30438197.html,https://www.n-tv.de/wissen/Studie-zeigt-deutliche-Beschleunigung-der-Erderwaermung-id30438197.html,0,www.n-tv.de,Sprung seit dem Jahr 2015: Studie zeigt deutliche Beschleunigung der Erderwärmung,"Die Erderwärmung nimmt deutlich schneller zu als bisher angenommen. Einer neuen Studie zufolge hat sich die Erwärmungsrate seit 2015 massiv erhöht. Wenn sich dieser Trend fortsetzt, könnte die 1,5-Grad-Grenze bereits 2028 oder 2029 erreicht werden, so die For…",https://www.n-tv.de/img/30438294/1772794443/Img_16_9/1200/Die-untergehende-Sonne-hat-den-Wolkenhimmel-rot-verfaerbt.jpg,2026-03-06T14:36:06Z,,"Sprung seit dem Jahr 2015Studie zeigt deutliche Beschleunigung der Erderwärmung
Die Erwärmungsrate hat sich seit 2015 fast verdoppelt. Ein Grund dafür ist der Rückgang kühlender Schwebeteilchen in d… [+4250 chars]",,de,'Erderwärmung'
https://www.sueddeutsche.de/wissen/studie-erderwaermung-beschleunigung-li.3448245,https://www.sueddeutsche.de/wissen/studie-erderwaermung-beschleunigung-li.3448245,0,www.sueddeutsche.de,Klimawandel: Studie: Erderwärmung hat sich beschleunigt,Das haben Forscher aus globalen Temperaturdaten berechnet. Manche Experten sehen die Ergebnisse aber nicht als Beweis.,https://www.sueddeutsche.de/2026/03/06/6690fd4f-b7e3-4dba-97ac-7d9391e70ee9.jpg?q=60&fm=webp&width=1200&rect=0%2C209%2C4000%2C2250,2026-03-06T14:45:16Z,,Die Erde hat sich in den vergangenen zehn Jahren deutlich schneller erwärmt als in den vorherigen Dekaden. Das schreiben Stefan Rahmstorf vom Potsdam-Institut für Klimafolgenforschung (PIK) und der U… [+92 chars],,de,'Klimawandel'
https://www.sueddeutsche.de/politik/trump-usa-kristi-noem-nachrichten-auf-den-punkt-podcast-li.3448653,https://www.sueddeutsche.de/politik/trump-usa-kristi-noem-nachrichten-auf-den-punkt-podcast-li.3448653,0,www.sueddeutsche.de,"Podcast: „Auf den Punkt“: Trump wollte nicht, dass ihn seine Ministerin in den Schatten stellt",Der US-Präsident entlässt seine Heimatschutzministerin Noem. Dabei ist die ihm doch so ähnlich. Oder ist gerade das der Grund?,https://www.sueddeutsche.de/2025/03/12/4d031366-ad93-4b81-89dc-aa57357f2531.png?q=60&fm=webp&width=1200&rect=0%2C0%2C3200%2C1800,2026-03-06T16:31:46Z,,"Gestolpert und gefallen ist Noem letztlich über eine Werbekampagne, die sie selbst in den Mittelpunkt stellt und mehr als 200 Millionen Dollar kostet.
Was bedeutet Noems Entlassung für die US-Regier… [+1521 chars]",,de,'Schatten'
https://www.stern.de/joerg-schuettauf---wenn-ich-alleine-irgendwo-hinreise--geht-das-meistens-nicht-gut-aus--37199304.html,https://www.stern.de/joerg-schuettauf---wenn-ich-alleine-irgendwo-hinreise--geht-das-meistens-nicht-gut-aus--37199304.html,0,www.stern.de,"Im Interview zu ""Im Schatten der Angst – Der Skorpion"": Jörg Schüttauf: ""Wenn ich alleine irgendwo hinreise, geht das meistens nicht gut aus""","""Bei mir muss die Hütte nicht mehr unbedingt brennen"", sagt Jörg Schüttauf, aber gute Rollen spielt er noch immer mit Leidenschaft: Im ZDF-Thriller ""Im Schatten der Angst – Der Skorpion"" ist er als forensischer Psychiater zu sehen. Ein Interview über seine Ka…",https://image.stern.de/37199300/t/id/v2/w1440/r1.7778/-/joerg-schuettauf--1-.jpg,2026-03-06T23:00:04Z,,"Kopiere den aktuellen Link
Zur Merkliste hinzufügen
""Bei mir muss die Hütte nicht mehr unbedingt brennen"", sagt Jörg Schüttauf, aber gute Rollen spielt er noch immer mit Leidenschaft: Im ZDF-Thrill… [+15980 chars]",,de,'Schatten'
https://www.zeit.de/news/2026-03/07/saharastaub-macht-sonne-milchig-was-muss-ich-dazu-wissen,https://www.zeit.de/news/2026-03/07/saharastaub-macht-sonne-milchig-was-muss-ich-dazu-wissen,0,www.zeit.de,Wetter: Saharastaub macht Sonne milchig – Was muss ich dazu wissen?,Hier finden Sie Informationen zu dem Thema „Wetter“. Lesen Sie jetzt „Saharastaub macht Sonne milchig – Was muss ich dazu wissen?“.,https://img.zeit.de/news/2026-03/07/saharastaub-macht-sonne-milchig-was-muss-ich-dazu-wissen-image-group/wide__1300x731,2026-03-06T23:30:04Z,,"Der Himmel sieht diesig aus, die Sonne scheint nur trüb hinter dem Schleier hervor: Wer dieses Wochenende nach oben schaut, sieht vor allem eins: Saharastaub. 
Wie und woher kommt der Staub überhaup… [+1993 chars]",,de,'Sonne'
https://www.zeit.de/news/2026-03/07/afrika-gruss-warum-der-himmel-grau-ist-und-die-sonne-milchig,https://www.zeit.de/news/2026-03/07/afrika-gruss-warum-der-himmel-grau-ist-und-die-sonne-milchig,0,www.zeit.de,Naturphänomene: Afrika-Gruß: Warum der Himmel grau ist und die Sonne milchig,Hier finden Sie Informationen zu dem Thema „Naturphänomene“. Lesen Sie jetzt „Afrika-Gruß: Warum der Himmel grau ist und die Sonne milchig“.,https://img.zeit.de/news/2026-03/07/afrika-gruss-warum-der-himmel-grau-ist-und-die-sonne-milchig-image-group/wide__1300x731,2026-03-07T03:00:13Z,,"Ein grauer Schleier liegt in diesen Tagen über Baden-Württemberg, doch dieses Mal ist es keine Wolke und auch kein Nebel. Es ist die Sahara, aus der quasi per Luftpost Millionen Tonnen Wüstenstaub bi… [+4234 chars]",,de,'Sonne'
https://www.zeit.de/news/2026-03/07/sonne-und-frost-so-wird-das-fruehlingswetter-am-wochenende,https://www.zeit.de/news/2026-03/07/sonne-und-frost-so-wird-das-fruehlingswetter-am-wochenende,0,www.zeit.de,Wetter: Sonne und Frost: So wird das Frühlingswetter am Wochenende,Hier finden Sie Informationen zu dem Thema „Wetter“. Lesen Sie jetzt „Sonne und Frost: So wird das Frühlingswetter am Wochenende“.,https://img.zeit.de/news/2026-03/07/sonne-und-frost-so-wird-das-fruehlingswetter-am-wochenende-image-group/wide__1300x731,2026-03-07T06:03:19Z,,"Hochdruckeinfluss sorgt am Wochenende für ruhiges Frühlingswetter in Berlin und Brandenburg. Viel Sonne und milde Luft prägen die nächsten Tage, wie der Deutsche Wetterdienst (DWD) mitteilte. Am Morg… [+872 chars]",,de,'Sonne'
https://www.faz.net/aktuell/wirtschaft/kaese-klima-und-millionen-das-dorf-spluegen-kaempft-um-die-zukunft-accg-110844110.html,https://www.faz.net/aktuell/wirtschaft/kaese-klima-und-millionen-das-dorf-spluegen-kaempft-um-die-zukunft-accg-110844110.html,0,www.faz.net,Alpen-Tourismus: Und ewig büßt das Murmeltier,Der Klimawandel bedroht die Zukunft vieler Schweizer Skigebiete. In Splügen nehmen sie den Kampf an – mit frischen Ideen und großen Plänen eines ausländischen Investors. Doch die finden nicht alle gut.,https://media0.faz.net/image/w1200h627/5b1476f9b8be/w3000h1567x0y622o/012026/1.10846431/neue-schneekanonen-sollen-das.webp,2026-03-07T10:21:09Z,,"Kaum hat man die Gondel verlassen, geht der Blick zum schneebedeckten Gipfel des Piz Tambo. Dahinter liegt Italien. Obwohl die Sonne vom Himmel lacht, fläzt fast niemand in den einladenden Liegestühl… [+15258 chars]",,de,'Klimawandel'
https://www.zeit.de/zeit-magazin/wochenmarkt/2025-11/chicoree-bohnen-eintopf-rezept-wochenmarkt,https://www.zeit.de/zeit-magazin/wochenmarkt/2025-11/chicoree-bohnen-eintopf-rezept-wochenmarkt,0,www.zeit.de,Chicorée-Bohnen-Eintopf: Winter-Ade-Eintopf,"Der Frühling grüßt, aber noch hat die Sonne wenig Kraft. Um die Winterkälte ganz zu vertreiben, kocht man am besten diesen kräftigen Eintopf mit flexibler Gemüse-Einlage.",https://img.zeit.de/zeit-magazin/wochenmarkt/2025-11/chicoree-bohnen-eintopf-rezept-wochenmarkt-bild/wide__1300x731,2026-03-07T10:39:53Z,,"An kalten Tagen, an denen ich Lust auf etwas Gesundes und Wärmendes
habe, steht dieser Bohneneintopf ganz oben auf der Liste. Er wird weitgehend
aus Zutaten zubereitet, die ich ohnehin meistens zu … [+616 chars]",,de,'Sonne'
https://www.nzz.ch/feuilleton/seelenreise-zu-sich-selbst-das-leben-der-surrealistischen-kuenstlerin-leonora-carrington-als-film-ld.1927565,https://www.nzz.ch/feuilleton/seelenreise-zu-sich-selbst-das-leben-der-surrealistischen-kuenstlerin-leonora-carrington-als-film-ld.1927565,0,www.nzz.ch,Seelenreise zu sich selbst: das Leben der surrealistischen Künstlerin Leonora Carrington als Film,Sie stand lange im Schatten ihrer männlichen Kollegen Salvador Dalí und Max Ernst. Heute zählt sie auf dem Kunstmarkt mit Frida Kahlo und Georgia O’Keeffe zu den teuersten Künstlerinnen. «Leonora im Morgenlicht» gibt der britischen Surrealistin nun auch die l…,"https://img.nzz.ch/2026/03/04/b2347372-3caa-4e60-a5e1-84c29e537f10.jpg?width=1200&height=674&fit=bounds&quality=75&auto=webp&crop=3739,2103,x0,y195&wmark=nzz",2026-03-08T04:30:00Z,,Sie stand lange im Schatten ihrer männlichen Kollegen Salvador Dalí und Max Ernst. Heute zählt sie auf dem Kunstmarkt mit Frida Kahlo und Georgia OKeeffe zu den teuersten Künstlerinnen. «Leonora im M… [+4345 chars],,de,'Schatten'
https://www.faz.net/aktuell/feuilleton/medien-und-film/kino/filmklassiker-macao-schatten-in-denen-schwarze-katzen-verschwinden-accg-110848813.html,https://www.faz.net/aktuell/feuilleton/medien-und-film/kino/filmklassiker-macao-schatten-in-denen-schwarze-katzen-verschwinden-accg-110848813.html,0,www.faz.net,"Filmklassiker „Macao“: Schatten, in denen selbst schwarze Katzen verschwinden",Kantige Gesichter und dunkle Gassen: Keiner malte so schön mit Licht und Schatten wie Josef von Sternberg.,https://media0.faz.net/image/w1200h627/4c7721e5736b/w2723h1422x0y358o/122009/1.10848812/jane-russell-als-barsaengerin.webp,2026-03-08T09:37:23Z,,"Macao ist das Monte Carlo des ­Ostens, und es hat zwei Gesichter, so erklärt gleich zu Beginn der ­Erzähler: Eines offen und hell dem Tageslicht zugewandt, eines geheimnisvoll im Dunkeln liegend. Wir… [+4587 chars]",,de,'Schatten'
https://www.telepolis.de/article/Klimawandel-Wenn-Versicherungen-kapitulieren-11197355.html,https://www.telepolis.de/article/Klimawandel-Wenn-Versicherungen-kapitulieren-11197355.html,0,www.telepolis.de,Klimawandel: Wenn Versicherungen kapitulieren,Versicherer warnen: Klimaschäden werden unbezahlbar. Zwei Drittel der Betroffenen zahlen bereits selbst. Wer trägt künftig die Billionen-Risiken?,https://heise.cloudimg.io/bound/1200x1200/q85.png-lossy-85.webp-lossy-85.foil1/_www-heise-de_/imgs/18/5/0/3/8/3/8/5/shutterstock_2539925307-8a46c2118fb51345.jpg,2026-03-09T05:00:00Z,,"Die Folgend des Klimawandels lassen sich immer schwerer versichern dabei geht es nicht nur um Sachschäden
(Bild: Frame Craft 8/Shutterstock.com)
Versicherer warnen: Klimaschäden werden unbezahlbar.… [+6011 chars]",,de,'Klimawandel'
https://www.zeit.de/news/2026-03/09/nebel-und-sonne-in-rheinland-pfalz-und-im-saarland,https://www.zeit.de/news/2026-03/09/nebel-und-sonne-in-rheinland-pfalz-und-im-saarland,0,www.zeit.de,Wetter: Nebel und Sonne in Rheinland-Pfalz und im Saarland,Hier finden Sie Informationen zu dem Thema „Wetter“. Lesen Sie jetzt „Nebel und Sonne in Rheinland-Pfalz und im Saarland“.,https://img.zeit.de/news/2026-03/09/nebel-und-sonne-in-rheinland-pfalz-und-im-saarland-image-group/wide__1300x731,2026-03-09T05:54:26Z,,"In den Vormittagsstunden gibt es in Rheinland-Pfalz und im Saarland lokal Nebel, in geschützten Tallagen auch Frost. Sobald sich diese aufgelöst haben, zeigt sich die Sonne, wie der Deutsche Wetterdi… [+260 chars]",,de,'Sonne'
https://www.zeit.de/news/2026-03/09/sonne-und-regenschauer-bei-temperaturen-bis-19-grad,https://www.zeit.de/news/2026-03/09/sonne-und-regenschauer-bei-temperaturen-bis-19-grad,0,www.zeit.de,Wetter: Sonne und Regenschauer bei Temperaturen bis 19 Grad,Hier finden Sie Informationen zu dem Thema „Wetter“. Lesen Sie jetzt „Sonne und Regenschauer bei Temperaturen bis 19 Grad“.,https://img.zeit.de/news/2026-03/09/sonne-und-regenschauer-bei-temperaturen-bis-19-grad-image-group/wide__1300x731,2026-03-09T06:39:07Z,,"Der Montag wird zunächst sonnig in Hessen, gegen Nachmittag kann es vereinzelt Schauer geben. Teils sind auch Gewitter möglich, wie der Deutsche Wetterdienst (DWD) mitteilt.
Die Temperaturen liegen … [+344 chars]",,de,'Sonne'
https://www.tagesschau.de/wissen/studie-fruehjahrsmuedigkeit-100.html,https://www.tagesschau.de/wissen/studie-fruehjahrsmuedigkeit-100.html,0,www.tagesschau.de,Studie: Frühjahrsmüdigkeit nicht wissenschaftlich belegt,"Die Sonne kommt raus, die Tage werden länger - und wir werden müde? Das sagt zumindest der Begriff Frühjahrsmüdigkeit aus. Eine neue Untersuchung fand dafür allerdings keine Belege. Auch wenn viele Befragte dachten, sie seien betroffen.",https://images.tagesschau.de/image/bbfc9fd8-b48c-4222-a70c-0be6325adce3/AAABnNLrRjc/AAABmyZE0EA/16x9-big/frau-krokusse-100.jpg?width=1280,2026-03-09T14:31:36Z,,"Stand: 09.03.2026 15:31 Uhr
Die Sonne kommt raus, die Tage werden länger - und wir werden müde? Das sagt zumindest der Begriff Frühjahrsmüdigkeit aus. Eine neue Untersuchung fand dafür allerdings ke… [+4583 chars]",,de,'Sonne'
