index,url,valid,domain,title,description,image,published,archive,content,quote,language,keyword
https://www.n-tv.de/ratgeber/Draussen-bei-Gewitter-Wie-kann-ich-mich-schuetzen-id30887538.html,https://www.n-tv.de/ratgeber/Draussen-bei-Gewitter-Wie-kann-ich-mich-schuetzen-id30887538.html,0,www.n-tv.de,Schutz vor Blitzschlag: Draußen bei Gewitter: Wie kann ich mich schützen?,"Ob bei einer Fahrradtour oder einem Spaziergang im Grünen: Wer draußen von einem Gewitter überrascht wird, stellt sich die Frage: Wohin jetzt? Was ratsam ist - und was gefährlich werden kann.",https://www.n-tv.de/img/3433782/1499932957/Img_16_9/1200/92376588.jpg,2026-06-03T12:25:52Z,,"Gewitter können schnell aufziehen: Sommerliche Wärmegewitter entstehen oft innerhalb weniger Minuten und erfordern schnelles Handeln. 
Ob bei einer Fahrradtour oder einem Spaziergang im Grünen: Wer … [+2483 chars]",,de,'Gewitter'
https://www.zeit.de/news/2026-06/03/hitze-als-risiko-fuer-wohnungslose-was-hilft,https://www.zeit.de/news/2026-06/03/hitze-als-risiko-fuer-wohnungslose-was-hilft,0,www.zeit.de,Obdachlosigkeit im Sommer: Hitze als Risiko für Wohnungslose – was hilft?,Hier finden Sie Informationen zu dem Thema „Obdachlosigkeit im Sommer“. Lesen Sie jetzt „Hitze als Risiko für Wohnungslose – was hilft?“.,https://img.zeit.de/news/2026-06/03/hitze-als-risiko-fuer-wohnungslose-was-hilft-image-group/wide__1300x731,2026-06-03T12:42:14Z,,"Große Hitze kann für Menschen ohne Wohnung besonders gefährlich werden. Anlässlich des bundesweiten Hitzeaktionstags am 11. Juni haben Niedersachsens Gesundheitsministerium, das Landesgesundheitsamt … [+2535 chars]",,de,'Hitze'
https://www.stern.de/gesellschaft/regional/niedersachsen-bremen/obdachlosigkeit-im-sommer--hitze-als-risiko-fuer-wohnungslose---was-hilft--37487610.html,https://www.stern.de/gesellschaft/regional/niedersachsen-bremen/obdachlosigkeit-im-sommer--hitze-als-risiko-fuer-wohnungslose---was-hilft--37487610.html,0,www.stern.de,Obdachlosigkeit im Sommer: Hitze als Risiko für Wohnungslose – was hilft?,"Hitzewellen treffen Menschen ohne Obdach besonders hart. Warum ein schattiger Innenhof, Trinkwasser und Sonnencreme überlebenswichtig sind – und wie jeder helfen kann.",https://image.stern.de/37487612/t/D_/v1/w1440/r1.7778/-/03--5ks5s5alhiv14axs2048jpeg---e11f85c718dd855e.jpg,2026-06-03T12:42:14Z,,"Kopiere den aktuellen Link
Zur Merkliste hinzufügen
Hitzewellen treffen Menschen ohne Obdach besonders hart. Warum ein schattiger Innenhof, Trinkwasser und Sonnencreme überlebenswichtig sind und wi… [+2712 chars]",,de,'Sonne'
https://www.n-tv.de/panorama/Vater-muss-mitansehen-wie-20-Jaehriger-durch-Blitzschlag-stirbt-id30886698.html,https://www.n-tv.de/panorama/Vater-muss-mitansehen-wie-20-Jaehriger-durch-Blitzschlag-stirbt-id30886698.html,0,www.n-tv.de,"Im Kajak auf einem US-Fluss: Vater muss mitansehen, wie 20-Jähriger durch Blitzschlag stirbt","Ein Vater-Sohn-Gespann will einen entspannten Ausflug auf einem Fluss unternehmen. Als plötzlich ein Gewitter aufzieht, unterschätzt die Reisegruppe offenbar die Gefahr. Die Kajaktour endet im Todesdrama.",https://www.n-tv.de/img/30886694/1780482628/Img_16_9/1200/Aerial-view-of-Blackwater-River-Interstate-10-bridge-over-a-Milton-Florida-waterway-at-sunrise.jpg,2026-06-03T12:42:52Z,,"Auf dem Blackwater River in Florida kam es zum tödlichen Unglück. (Foto: IMAGO/Dreamstime)
Ein Vater-Sohn-Gespann will einen entspannten Ausflug auf einem Fluss unternehmen. Als plötzlich ein Gewitt… [+3104 chars]",,de,'Gewitter'
https://www.morgenpost.de/panorama/article412164743/schweizer-freibad-verdoppelt-preise-fuer-auslaender-aeusserst-bedenklich.html,https://www.morgenpost.de/panorama/article412164743/schweizer-freibad-verdoppelt-preise-fuer-auslaender-aeusserst-bedenklich.html,0,www.morgenpost.de,Schweizer Freibad verdoppelt Preise für Ausländer – „äußerst bedenklich“,In einem Schweizer Freibad sollen Menschen ohne Schweizer Pass draufzahlen. Wie Experten die umstrittene Regelung einschätzen.,https://img.sparknews.funkemedien.de/412166570/412166570_1780516344_v16_9_1600.jpeg,2026-06-03T19:52:24Z,,In einem Schweizer Freibad zahlen Menschen mit ausländischem Pass in dieser Saison den doppelten Eintrittspreis. Das teilt die Stadt Pruntrut (franz. Porrentruy) mit. Das Freibad liegt in der Kleinst… [+3109 chars],,de,'Freibad'
https://www.brigitte.de/gesund/gesundheit/yael-adler-klaert-auf--blockiert-sonnencreme-wirklich-die-vitamin-d-bildung--14083264.html,https://www.brigitte.de/gesund/gesundheit/yael-adler-klaert-auf--blockiert-sonnencreme-wirklich-die-vitamin-d-bildung--14083264.html,0,www.brigitte.de,Dr. Yael Adler klärt auf: Blockiert Sonnencreme wirklich die Vitamin-D-Bildung?,"Wer sich konsequent eincremt, kennt die Sorge vielleicht: Kann Sonnencreme verhindern, dass der Körper genügend Vitamin D bildet? Hautärztin Dr. Yael Adler erklärt, was wirklich hinter diesem weitverbreiteten Mythos steckt.",https://image.brigitte.de/14083278/t/TO/v1/w1440/r1.7778/-/sonnenschutz-yael-adler-vitamin-d-mangel.png,2026-06-04T06:30:00Z,,"Wer sich konsequent eincremt, kennt die Sorge vielleicht: Kann Sonnencreme verhindern, dass der Körper genügend Vitamin D bildet? Hautärztin Dr. Yael Adler erklärt, was wirklich hinter diesem weitver… [+852 chars]",,de,'Sonnencreme'
https://www.focus.de/panorama/schweizer-bad-greift-durch-auslaender-muessen-jetzt-doppelte-eintrittspreise-zahlen_5eb98b25-f36a-49de-b3c3-a9720d6a81fa.html,https://www.focus.de/panorama/schweizer-bad-greift-durch-auslaender-muessen-jetzt-doppelte-eintrittspreise-zahlen_5eb98b25-f36a-49de-b3c3-a9720d6a81fa.html,0,www.focus.de,Schweizer Bad greift durch: Ausländer müssen jetzt doppelte Eintrittspreise zahlen,Nach der Debatte um ein Ausländerverbot setzt ein Schweizer Freibad jetzt auf höhere Eintrittspreise. Doch die eigentliche Frage liegt tiefer.,"https://quadro.burda-forward.de/ctf/44a20ca6-49a3-4b90-b81e-bdf3899f7079.92c62d23-a420-4401-a8eb-80abbbb58fd2.jpg?im=RegionOfInterestCrop=(1200,630),regionOfInterest=(217,139)&hash=d6b8cbff76ce2fa0277aec879a3b0133f683a5cb302d70f42a3ad68db3445d96",2026-06-04T07:25:00Z,,<ul><li>Im Video oben: Schweizer Freibad sperrt Ausländer aus - wegen Vorfällen mit jungen Frauen</li></ul>Die meisten Badegäste wollen einfach einen ruhigen Sommertag verbringen. Sie wollen schwimme… [+5096 chars],,de,'Freibad'
https://www.brigitte.de/beauty/haut/tattoo-sonnencreme--wann-sie-drauf-muss---laut-profi-14041676.html,https://www.brigitte.de/beauty/haut/tattoo-sonnencreme--wann-sie-drauf-muss---laut-profi-14041676.html,0,www.brigitte.de,Tattoo-Sonnencreme: Wie deine tätowierten Bilder wirklich lang schön bleiben – laut Experte,"Braucht mein Tattoo Sonnencreme – und wenn ja, wie viel und warum? Diese und andere Fragen klären wir auf BRIGITTE – mit einem professionellen Tätowierer.",https://image.brigitte.de/14083994/t/UN/v1/w1440/r1.7778/-/tattoo-sonnencreme-2.jpg,2026-06-04T09:00:00Z,,"Sobald du dich für ein Tattoo entschieden und das Stechen hinter dich gebracht hast, geht es an die Heilung. Und wenn diese Phase vorbei ist, kannst du dich erst so richtig über das neue Bild auf dei… [+3499 chars]",,de,'Sonne'
https://www.morgenpost.de/ratgeber-wissen/article409337804/sonnencreme-dermatologin-warnt-diese-sonnencremes-wuerde-ich-vermeiden.html,https://www.morgenpost.de/ratgeber-wissen/article409337804/sonnencreme-dermatologin-warnt-diese-sonnencremes-wuerde-ich-vermeiden.html,0,www.morgenpost.de,Dermatologin über Sonnenschutzmittel: „Diese Sonnencremes würde ich vermeiden“,"Sonnencremes bieten Schutz vor UV-Strahlen, doch nicht jede ist unbedenklich. Eine Expertin erklärt, worauf Sie beim Kauf achten sollten.",https://img.sparknews.funkemedien.de/411854780/411854780_1780564145_v16_9_1600.jpeg,2026-06-04T09:08:00Z,,<ul><li>Im Sommer schützen Sonnencremes vor UV-Strahlung</li><li>Man unterscheidet zwischen chemischen und physikalischen UV-Filtern</li><li>Doch welche Produkte sind gut? Eine Dermatologin weiß Rat.… [+651 chars],,de,'Sonnencreme'
https://www.stern.de/panorama/unwetter-erwartet--wetterdienst-ewartet-gewitter-mit--markanter-eigendynamik--37490492.html,https://www.stern.de/panorama/unwetter-erwartet--wetterdienst-ewartet-gewitter-mit--markanter-eigendynamik--37490492.html,0,www.stern.de,Unwetter erwartet: Wetterdienst ewartet Gewitter mit „markanter Eigendynamik“,"„Die Wetterlage hat es in sich“, sagt ein Meteorologe. Der DWD sieht Sturmböen, Hagel und Starkregen kommen. Sogar Tornados seien nicht ausgeschlossen.",https://image.stern.de/37492380/t/vb/v1/w1440/r1.7778/-/04--7gnjwm46fbv5axs2048jpeg---4a71b7eac5d1ebd3.jpg,2026-06-04T09:51:48Z,,"Kopiere den aktuellen Link
Zur Merkliste hinzufügen
Die Wetterlage hat es in sich, sagt ein Meteorologe. Der DWD sieht Sturmböen, Hagel und Starkregen kommen. Sogar Tornados seien nicht ausgeschlos… [+2294 chars]",,de,'Gewitter'
https://www.tagesspiegel.de/sport/keine-wasserflaschen-in-den-wm-stadien-furs-geschaft-riskiert-die-fifa-die-gesundheit-der-fussball-fans-15676495.html,https://www.tagesspiegel.de/sport/keine-wasserflaschen-in-den-wm-stadien-furs-geschaft-riskiert-die-fifa-die-gesundheit-der-fussball-fans-15676495.html,0,www.tagesspiegel.de,Keine Wasserflaschen in den WM-Stadien: Fürs Geschäft riskiert die Fifa die Gesundheit der Fußball-Fans,Trotz Hitze verbietet der Weltverband Wasserflaschen in den Stadien. Die Begründung ist absurd – doch dahinter steckt ein perfides Geschäftsmodell.,https://www.tagesspiegel.de/images/15676504/alternates/BASE_16_9_W1400/1780569325000/trinkpause.jpeg,2026-06-04T10:50:36Z,,"Die Geldgier der Fifa kennt keine Grenzen und jetzt setzt sie damit auch noch die Gesundheit der Fußball-Fans bei aufs Spiel. Denn leere Plastikflaschen, die Zuschauende an Trinkbrunnen und Wasserspe… [+2962 chars]",,de,'Hitze'
https://www.morgenpost.de/ratgeber-wissen/article406432129/sonnencreme-experte-warnt-vor-weichmachern-in-produkten-krebserregend.html,https://www.morgenpost.de/ratgeber-wissen/article406432129/sonnencreme-experte-warnt-vor-weichmachern-in-produkten-krebserregend.html,0,www.morgenpost.de,Experte warnt vor Weichmachern in Sonnencremes – „Rückstände im Körper“,Rückstände verbotener Weichmacher in Sonnencremes sorgen für Unsicherheit. Wie gefährlich sind sie – und was sollte man beim Kauf beachten?,https://img.sparknews.funkemedien.de/412001425/412001425_1780573125_v16_9_1600.jpeg,2026-06-04T11:38:00Z,,"<ul><li>In Sonnencremes wurden verbotenen Chemikalien nachgewiesen</li><li>Welche Produkte sind möglicherweise gefährlich, welche sind sicher?</li><li>Ein Toxikologe weiß Rat und gibt eine Empfehlung… [+787 chars]",,de,'Sonne'
https://www.tagesspiegel.de/berlin/sommer-sonne-regenfall-die-besten-ausflugsziele-in-berlin-bei-unbestandigem-wetter-15668970.html,https://www.tagesspiegel.de/berlin/sommer-sonne-regenfall-die-besten-ausflugsziele-in-berlin-bei-unbestandigem-wetter-15668970.html,0,www.tagesspiegel.de,"Sommer, Sonne, Regenschauer?: Diese acht Ausflugsziele in Berlin sind drinnen wie draußen schön","Ob Biergarten oder Tobeparadies, Museum oder Spa: Wer Freizeitpläne machen will, ohne vom Wetter abhängig zu sein, sollte hier vorbeischauen.",https://www.tagesspiegel.de/images/15675634/alternates/BASE_16_9_W1400/1780559849000/tempelhofer-feld-gewitter-wolken-wetter-tempelhof-berlin-tempelhofer-feld-gewitter-wolken-wetter-tempelhof-ska.jpeg,2026-06-04T11:39:00Z,,"Ob Biergarten oder Tobeparadies, Museum oder Spa: Wer Freizeitpläne machen will, ohne vom Wetter abhängig zu sein, sollte hier vorbeischauen.
 Stand: heute, 05:00 Uhr",,de,'Sonne'
https://www.stern.de/digital/technik/balkonkraftwerk-anschliessen--das-muessen-sie-beachten-32578698.html,https://www.stern.de/digital/technik/balkonkraftwerk-anschliessen--das-muessen-sie-beachten-32578698.html,0,www.stern.de,Mini-Solaranlage für den Balkon: Balkonkraftwerk: So kommt Sonnenenergie in die Wohnung,"Ein Balkonkraftwerk bringt Solarstrom in die Wohnung. Der Ratgeber erklärt alles Wichtige zu Modulen, Montage, Anschluss, Speicher und den rechtlichen Vorgaben.",https://image.stern.de/32578700/t/Lz/v2/w1440/r1.7778/-/balkonkraftwerk.jpg,2026-06-04T12:33:00Z,,"Kopiere den aktuellen Link
Zur Merkliste hinzufügen
Ein Balkonkraftwerk bringt Solarstrom in die Wohnung. Der Ratgeber erklärt alles Wichtige zu Modulen, Montage, Anschluss, Speicher und den rechtl… [+6230 chars]",,de,'Sonne'
https://www.zeit.de/news/2026-06/04/crashout-gehen-trotz-gewitterrisiko-bei-rock-am-ring,https://www.zeit.de/news/2026-06/04/crashout-gehen-trotz-gewitterrisiko-bei-rock-am-ring,0,www.zeit.de,Festival: «Crashout gehen» trotz Gewitterrisiko bei Rock am Ring,Hier finden Sie Informationen zu dem Thema „Festival“. Lesen Sie jetzt „«Crashout gehen» trotz Gewitterrisiko bei Rock am Ring“.,https://img.zeit.de/news/2026-06/04/crashout-gehen-trotz-gewitterrisiko-bei-rock-am-ring-image-group/wide__1300x731,2026-06-04T13:30:44Z,,"Wenn die Bollerwagen voll Dosenbier und Ravioli mühsam durch den Schlamm gezogen werden, ist klar: Rock am Ring 2026 geht los und das unter grauem Himmel mit Aussicht auf Gewitter. Doch die Festivalf… [+4615 chars]",,de,'Gewitter'
https://www.stern.de/gesellschaft/regional/rheinland-pfalz-saarland/festival---crashout-gehen--trotz-gewitterrisiko-bei-rock-am-ring-37493958.html,https://www.stern.de/gesellschaft/regional/rheinland-pfalz-saarland/festival---crashout-gehen--trotz-gewitterrisiko-bei-rock-am-ring-37493958.html,0,www.stern.de,Festival: „Crashout gehen“ trotz Gewitterrisiko bei Rock am Ring,"Schlamm, Biertornados und Weihnachtsbäckerei: Wie Festivalfans bei Rock am Ring Wind, Regen und Gewitterwarnung trotzen – und dabei ziemlich kreativ werden.",https://image.stern.de/37493960/t/sr/v1/w1440/r1.7778/-/04--ypuxntusgdv4axs2048jpeg---45fd7b55c686bef3.jpg,2026-06-04T13:30:44Z,,"Kopiere den aktuellen Link
Zur Merkliste hinzufügen
Schlamm, Biertornados und Weihnachtsbäckerei: Wie Festivalfans bei Rock am Ring Wind, Regen und Gewitterwarnung trotzen und dabei ziemlich kreati… [+4759 chars]",,de,'Gewitter'
https://www.bild.de/sport/mehr-sport/schrecken-im-freibad-turmspringer-landet-auf-unterwasser-ungetuem-6a2180f585a291ced38690fa,https://www.bild.de/sport/mehr-sport/schrecken-im-freibad-turmspringer-landet-auf-unterwasser-ungetuem-6a2180f585a291ced38690fa,0,www.bild.de,Schrecken im Freibad - Turmspringer landet auf Unterwasser-Ungetüm,Schreckmoment in einem Genfer Freibad! Turmspringer Jean-David Duval landet direkt auf einem riesigen Wels.,"https://images.bild.de/6a2180f585a291ced38690fa/4b1246b50f64ba03d7b468e6152e2390-landscape,b91b3f5b?w=1280",2026-06-04T13:58:16Z,,"+++Türkisch für Anfänger-Star: Schauspieler Axel Schreiber (49) an Krebs gestorben
+++Türkisch für Anfänger-Star: Schauspieler Axel Schreiber (49) an Krebs gestorben
+++Türkisch für Anfänger-Star: … [+638 chars]",,de,'Freibad'
https://www.morgenpost.de/ratgeber-wissen/article401888862/hautkrebs-sonnencreme-allein-reicht-nicht-sagen-experten-riesigen-tumore.html,https://www.morgenpost.de/ratgeber-wissen/article401888862/hautkrebs-sonnencreme-allein-reicht-nicht-sagen-experten-riesigen-tumore.html,0,www.morgenpost.de,Dermatologe über Hautkrebs: „Sonnencreme kann den Schutz keinesfalls leisten“,"Sonnencreme allein reicht nicht aus: Zwei Experten erklären, wie man Hautkrebs wirklich vorbeugt – und was viele dabei falsch machen.",https://img.sparknews.funkemedien.de/409782749/409782749_1755597957_v16_9_1600.jpeg,2026-06-04T14:01:00Z,,"<ul><li>UV-Strahlung kann Sonnenbrand und Hautkrebs verursachen</li><li>Sonnencreme alleine reicht nicht aus, um die Haut zu schützen</li><li>Experten erklären, wie man Hautkrebs effektiv vorbeugt</l… [+1068 chars]",,de,'Sonnencreme'
https://www.teltarif.de/freibad-schwimmen-handyverbot/news/103907.html,https://www.teltarif.de/freibad-schwimmen-handyverbot/news/103907.html,0,www.teltarif.de,Handyverbot im Freibad: Diese neuen Regeln gelten jetzt,Die meisten Freibäder haben wieder geöffnet. In vielen gibt es ab diesem Jahr aber strengere Regeln.,https://www.teltarif.de/img/arch/2026/kw23/freibad-schwimmen-handyverbot-2og.jpg,2026-06-04T15:10:00Z,,"Endlich hat sie vielerorts wieder begonnen, die Freibad-Saison. Doch für gewisse Badegäste dürfte der Spaß getrübt werden, denn in vielen Bädern gibt es strengere Regeln. Teilweise müssen Badegäste s… [+3507 chars]",,de,'Freibad'
https://www.zeit.de/news/2026-06/05/zum-wochenende-gewitter-und-schauer-in-thueringen,https://www.zeit.de/news/2026-06/05/zum-wochenende-gewitter-und-schauer-in-thueringen,0,www.zeit.de,Wetter: Zum Wochenende Gewitter und Schauer in Thüringen,Hier finden Sie Informationen zu dem Thema „Wetter“. Lesen Sie jetzt „Zum Wochenende Gewitter und Schauer in Thüringen“.,https://img.zeit.de/news/2026-06/05/zum-wochenende-gewitter-und-schauer-in-thueringen-image-group/wide__1300x731,2026-06-05T03:43:34Z,,In Thüringen sind zum Wochenende hin erneut Gewitter möglich. Nach Angaben des Deutschen Wetterdienstes (DWD) startet der Freitag zunächst bewölkt. Ab dem Nachmittag erwartet der DWD dann örtliche Ge… [+551 chars],,de,'Gewitter'
https://ooe.orf.at/stories/3357285/,https://ooe.orf.at/stories/3357285/,0,ooe.orf.at,Tausende Euro Schaden durch Graffiti im Welldorado,Vandalen haben im Welldorado-Freibad in Wels einen Schaden von mehreren tausend Euro angerichtet. Laut Auskunft der Stadt Wels dürften die unbekannten Täter in der Nacht von Mittwoch auf Donnerstag im Freibad zugeschlagen haben. Die Graffiti könnten aus der F…,https://ibs.orf.at/ooe?image=https%3A%2F%2Foekastatic.orf.at%2Fmims%2F2026%2F23%2F50%2Fcrops%2Fw%3D1200%2Ch%3D627%2Cq%3D75%2F3062743_master_1185650_vandalismus_welldorado_freibad_2026__6_.jpg%3Fs%3D01069c92d6261f08c8f3e8f72d825e080835f76f,2026-06-05T11:42:24Z,,"Rutschen, Sprungturm, Kabinen, Spinde und Gastronomiebereiche an zahlreichen Stellen im Welldorado-Freibad in Wels hinterließen Unbekannte in der Nacht auf Donnerstag Graffiti, nachdem sie sich Zutri… [+1120 chars]",,de,'Freibad'
https://www.zeit.de/news/2026-06/06/wechselhaftes-wochenende-sonne-und-gewitter-am-montag,https://www.zeit.de/news/2026-06/06/wechselhaftes-wochenende-sonne-und-gewitter-am-montag,0,www.zeit.de,Wettervorhersage: Wechselhaftes Wochenende - Sonne und Gewitter am Montag,Hier finden Sie Informationen zu dem Thema „Wettervorhersage“. Lesen Sie jetzt „Wechselhaftes Wochenende - Sonne und Gewitter am Montag“.,https://img.zeit.de/news/2026-06/06/wechselhaftes-wochenende-sonne-und-gewitter-am-montag-image-group/wide__1300x731,2026-06-06T10:59:57Z,,"Das Wetter am Wochenende und zu Beginn der nächsten Woche bleibt wechselhaft. Der Samstag zeigt sich vor allem im Westen und Norden bewölkt, regnerisch und teils mit kurzen Gewittern, wie der Deutsch… [+1205 chars]",,de,'Sonne'
