index,url,valid,domain,title,description,image,published,archive,content,quote,language,keyword
https://www.zeit.de/wirtschaft/2025-10/ottmar-edenhofer-klimaschaeden-klimafolgen-klimapolitik-weltpolitik,https://www.zeit.de/wirtschaft/2025-10/ottmar-edenhofer-klimaschaeden-klimafolgen-klimapolitik-weltpolitik,0,www.zeit.de,"Ottmar Edenhofer: ""Sollen wir jetzt etwa sagen, wir vergessen das Ganze?""","Bill Gates sagt, der Klimawandel ist nicht unser größtes Problem. Der Ökonom Ottmar Edenhofer widerspricht: Klimaschäden bleiben. Und erfordern eine effizientere Politik.",https://img.zeit.de/politik/ausland/2025-10/ottmar-edenhofer-klimaschaeden-klimafolgen-klimapolitik-weltpolitik-bild/wide__1300x731,2025-11-01T07:57:58Z,,"Der Wirtschaftsprofessor Ottmar Edenhofer, 64, ist Direktor und Chefökonom am Potsdam-Institut für Klimafolgenforschung (PIK). Zusammen mit Kollegen wurde der Experte für CO2-Preise schon zu den am m… [+390 chars]",,de,'Klimawandel'
https://taz.de/Hurrikan-Schadensersatz-Klimakrankheit/!6125839/,https://taz.de/Hurrikan-Schadensersatz-Klimakrankheit/!6125839/,0,taz.de,"Hurrikan, Schadensersatz, Klimakrankheit: Die drei wichtigsten Klima-News der Woche",Was Hurrikan Melissa mit dem Klimawandel zu tun hat. Forderung nach Schadensersatz für CO2-Ausstoß. Gesundheitliche Risiken dank Erderhitzung.,https://taz.de/picture/8031717/1200/00-QuadratMitTaz-1.jpeg,2025-11-01T08:55:00Z,,Was Hurrikan Melissa mit dem Klimawandel zu tun hat. Forderung nach Schadensersatz für CO2-Ausstoß. Gesundheitliche Risiken dank Erderhitzung. mehr...,,de,'Klimawandel'
https://www.stern.de/gesellschaft/regional/hamburg-schleswig-holstein/freibad-eroeffnung--freibad-ist-fertig---anbaden-im-november-bei-10-grad-celsius-36180672.html,https://www.stern.de/gesellschaft/regional/hamburg-schleswig-holstein/freibad-eroeffnung--freibad-ist-fertig---anbaden-im-november-bei-10-grad-celsius-36180672.html,0,www.stern.de,Freibad-Eröffnung: Freitag ist fertig - Anbaden im November bei 10 Grad Celsius,"Ein ganzes Dorf packt an, um ein marodes Freibad neu aufzubauen: Drelsdorf in Nordfriesland feiert sein neues Freibad mit einem öffentlichen Anbaden. Was das Projekt für die Dorfgemeinschaft bedeutet.",https://image.stern.de/36180674/t/F1/v2/w1440/r1.7778/-/01--3uublbv3skv8axs2048jpeg---628c272316ba280c.jpg,2025-11-01T12:23:24Z,,"Kopiere den aktuellen Link
Zur Merkliste hinzufügen
Ein ganzes Dorf packt an, um ein marodes Freibad neu aufzubauen: Drelsdorf in Nordfriesland feiert sein neues Freibad mit einem öffentlichen Anba… [+1669 chars]",,de,'Freibad'
https://www.zeit.de/news/2025-11/01/freitag-ist-fertig-anbaden-im-november-bei-10-grad-celsius,https://www.zeit.de/news/2025-11/01/freitag-ist-fertig-anbaden-im-november-bei-10-grad-celsius,0,www.zeit.de,Freibad-Eröffnung: Freitag ist fertig - Anbaden im November bei 10 Grad Celsius,Hier finden Sie Informationen zu dem Thema „Freibad-Eröffnung“. Lesen Sie jetzt „Freibad ist fertig - Anbaden im November bei 10 Grad Celsius“.,https://img.zeit.de/news/2025-11/01/freitag-ist-fertig-anbaden-im-november-bei-10-grad-celsius-image-group/wide__1300x731,2025-11-01T12:23:24Z,,Ausgerechnet am 1. November ist ein neues Freibad im Kreis Nordfriesland in Betrieb genommen worden: Nach monatelangem Einsatz und unzähligen freiwilligen Arbeitsstunden ist das neue Freibad in Drels… [+1453 chars],,de,'Freibad'
https://www.tagesschau.de/ausland/amerika/usa-klimakonferenz-100.html,https://www.tagesschau.de/ausland/amerika/usa-klimakonferenz-100.html,0,www.tagesschau.de,USA schicken keine ranghohen Vertreter zur UN-Klimakonferenz,"US-Präsident Trump betont immer wieder, dass er den Klimawandel für ""Schwindel"" hält. Seine Haltung erkennt man auch im Umgang mit der UN-Klimakonferenz in Brasilien. Die USA entsenden keine hochrangige Delegation.",https://images.tagesschau.de/image/82a41ead-074e-4bcf-876b-c83614c911c6/AAABmkBjQ_c/AAABmgWmh8Q/16x9-big/klimagipfel-202.jpg?width=1280,2025-11-01T17:07:18Z,,"Stand: 01.11.2025 18:07 Uhr
US-Präsident Trump betont immer wieder, dass er den Klimawandel für ""Schwindel"" hält. Seine Haltung erkennt man auch im Umgang mit der UN-Klimakonferenz in Brasilien. Die… [+2141 chars]",,de,'Klimawandel'
https://www.tagesschau.de/ausland/amerika/usa-trump-vought-100.html,https://www.tagesschau.de/ausland/amerika/usa-trump-vought-100.html,0,www.tagesschau.de,Russel Vought - der Mann in Trumps Schatten,"Vieles von dem, was Trump verfügt, ist von Russel Vought vorgedacht worden - und wird von ihm vorangetrieben. Im Weißen Haus kontrolliert er die Finanzen und folgt dabei dem Project 2025. Kein Wunder: Er hat es mitverfasst. Von N. Barth.",https://images.tagesschau.de/image/613a41b7-330d-47a3-84e2-1b200efa861b/AAABmjU-9kM/AAABmgWmh8Q/16x9-big/russell-vought-donald-trump-100.jpg?width=1280,2025-11-01T19:07:22Z,,"Stand: 01.11.2025 20:07 Uhr
Vieles von dem, was Trump verfügt, ist von Russel Vought vorgedacht worden - und wird von ihm vorangetrieben. Im Weißen Haus kontrolliert er die Finanzen und folgt dabei … [+5559 chars]",,de,'Schatten'
https://www.zeit.de/news/2025-11/02/regenschirm-sonne-comeback-nebel-so-wird-das-wetter,https://www.zeit.de/news/2025-11/02/regenschirm-sonne-comeback-nebel-so-wird-das-wetter,0,www.zeit.de,"Wetter: Regenschirm, Sonne-Comeback, Nebel: So wird das Wetter","Hier finden Sie Informationen zu dem Thema „Wetter“. Lesen Sie jetzt „Regenschirm, Sonne-Comeback, Nebel: So wird das Wetter“.",https://img.zeit.de/news/2025-11/02/regenschirm-sonne-comeback-nebel-so-wird-das-wetter-image-group/wide__1300x731,2025-11-02T06:29:52Z,,"Wer zu Allerseelen einen Spaziergang etwa zum Friedhof plant, sollte sich wappnen: Nach Angaben des Deutschen Wetterdienstes (DWD) regnet es vor allem im Süden und Südosten Baden-Württembergs - teils… [+1109 chars]",,de,'Sonne'
https://www.zeit.de/news/2025-11/02/kaltfront-bringt-wolken-schauer-und-kurze-gewitter,https://www.zeit.de/news/2025-11/02/kaltfront-bringt-wolken-schauer-und-kurze-gewitter,0,www.zeit.de,"Wetter: Kaltfront bringt Wolken, Schauer und kurze Gewitter","Hier finden Sie Informationen zu dem Thema „Wetter“. Lesen Sie jetzt „Kaltfront bringt Wolken, Schauer und kurze Gewitter“.",https://img.zeit.de/news/2025-11/02/kaltfront-bringt-wolken-schauer-und-kurze-gewitter-image-group/wide__1300x731,2025-11-02T08:36:06Z,,"Rückseitig einer Kaltfront stellt sich am Sonntag in Hessen wechselhaftes Schauerwetter ein. Im Tagesverlauf sind kurze Gewitter möglich, wie der Deutsche Wetterdienst (DWD) mitteilte.
Es bleibt mei… [+1249 chars]",,de,'Gewitter'
https://www.stern.de/gesellschaft/regional/hessen/wetter--kaltfront-bringt-wolken--schauer-und-kurze-gewitter-36181670.html,https://www.stern.de/gesellschaft/regional/hessen/wetter--kaltfront-bringt-wolken--schauer-und-kurze-gewitter-36181670.html,0,www.stern.de,"Wetter: Kaltfront bringt Wolken, Schauer und kurze Gewitter",Offenbach (lhe) - Rückseitig einer Kaltfront stellt sich am Sonntag in Hessen wechselhaftes Schauerwetter ein. Im Tagesverlauf sind kurze Gewitter,https://image.stern.de/36181672/t/Mg/v1/w1440/r1.7778/-/02--ma7os65j33v6axs2048jpeg---dec8c84c16a79e9a.jpg,2025-11-02T08:36:06Z,,"Kopiere den aktuellen Link
Zur Merkliste hinzufügen
Eine Kaltfront sorgt für unbeständiges Wetter in Hessen. Im Süden können einzelne Gewitter auftreten. Die Temperaturen bleiben mild.
Rückseitig … [+1397 chars]",,de,'Gewitter'
https://www.stern.de/gesellschaft/regional/rheinland-pfalz-saarland/kaltfront--schauer-und-gewitter-in-rheinland-pfalz-und-im-saarland-36181700.html,https://www.stern.de/gesellschaft/regional/rheinland-pfalz-saarland/kaltfront--schauer-und-gewitter-in-rheinland-pfalz-und-im-saarland-36181700.html,0,www.stern.de,Kaltfront: Schauer und Gewitter in Rheinland-Pfalz und im Saarland,Am Sonntag zeigt sich das Wetter in Rheinland-Pfalz und im Saarland wechselhaft. Neben Schauern und vereinzelten Gewittern sind auch kurze Auflockerungen möglich. Zum Wochenstart wird es ruhiger.,https://image.stern.de/36181702/t/1V/v1/w1440/r1.7778/-/02--jgxipx5zbtv7axs2048jpeg---db5830441ac74376.jpg,2025-11-02T08:48:55Z,,"Kopiere den aktuellen Link
Zur Merkliste hinzufügen
Am Sonntag zeigt sich das Wetter in Rheinland-Pfalz und im Saarland wechselhaft. Neben Schauern und vereinzelten Gewittern sind auch kurze Aufloc… [+1772 chars]",,de,'Gewitter'
https://www.zeit.de/news/2025-11/02/schauer-und-gewitter-in-rheinland-pfalz-und-im-saarland,https://www.zeit.de/news/2025-11/02/schauer-und-gewitter-in-rheinland-pfalz-und-im-saarland,0,www.zeit.de,Kaltfront: Schauer und Gewitter in Rheinland-Pfalz und im Saarland,Hier finden Sie Informationen zu dem Thema „Kaltfront“. Lesen Sie jetzt „Schauer und Gewitter in Rheinland-Pfalz und im Saarland“.,https://img.zeit.de/news/2025-11/02/schauer-und-gewitter-in-rheinland-pfalz-und-im-saarland-image-group/wide__1300x731,2025-11-02T08:48:55Z,,"Eine Kaltfront sorgt in Rheinland-Pfalz und im Saarland am Sonntag für wechselhaftes Schauerwetter. Laut Deutschem Wetterdienst (DWD) bleibt es meist stark bewölkt, nur im Norden lockert die Bewölkun… [+1300 chars]",,de,'Gewitter'
https://www.googlewatchblog.de/2025/11/google-one-youtube-premium-mehr-als-300-millionen-abonnenten-gemini-und-werbung-pushen-extrem/,https://www.googlewatchblog.de/2025/11/google-one-youtube-premium-mehr-als-300-millionen-abonnenten-gemini-und-werbung-pushen-extrem/,0,www.googlewatchblog.de,Google One & YouTube Premium: Mehr als 300 Millionen Abonnenten – Gemini und Werbung pushen extrem,"Google hat eine Reihe von Abo-Angeboten im Portfolio, wobei die Plattformen Google One und YouTube Premium natürlich alles andere in den Schatten stellen. Jetzt konnte man einen echten Meilenstein verkünden und zeigen, dass man sich auch in puncto Kundenbindu…",https://www.googlewatchblog.de/wp-content/uploads/google-one-youtube-premium.jpg,2025-11-02T09:45:01Z,,"Google hat eine Reihe von Abo-Angeboten im Portfolio, wobei die Plattformen Google One und YouTube Premium natürlich alles andere in den Schatten stellen. Jetzt konnte man einen echten Meilenstein ve… [+3861 chars]",,de,'Schatten'
https://www.n-tv.de/panorama/Hurrikan-Melissa-mischt-beim-deutschen-Wetter-mit-article26135974.html,https://www.n-tv.de/panorama/Hurrikan-Melissa-mischt-beim-deutschen-Wetter-mit-article26135974.html,0,www.n-tv.de,"Wetterwoche im Schnellcheck: Hurrikan ""Melissa"" mischt beim deutschen Wetter mit","Die erste Novemberwoche startet typisch für November - mit Regen. Doch das bleibt die Ausnahme. Freundliches Wetter setzt sich durch, mit Sonne und milden Temperaturen. Nur vereinzelt ziehen Schauer, Nebel oder kräftige Winde auf. Ab Donnerstag schwächt das H…",https://www.n-tv.de/img/incoming/crop26136007/6941329877-cImg_16_9-w1200/555679868.jpg,2025-11-02T14:03:22Z,,"Die erste Novemberwoche startet typisch für November - mit Regen. Doch das bleibt die Ausnahme. Freundliches Wetter setzt sich durch, mit Sonne und milden Temperaturen. Nur vereinzelt ziehen Schauer,… [+3162 chars]",,de,'Sonne'
https://www.sueddeutsche.de/politik/weltklimakonferenz-brasilien-belem-hotelpreise-li.3332196,https://www.sueddeutsche.de/politik/weltklimakonferenz-brasilien-belem-hotelpreise-li.3332196,0,www.sueddeutsche.de,Weltklimakonferenz: 30 Grad im Schatten,"Die Stadt im Nordosten Brasiliens ist als Austragungsort für die COP30 ein Wagnis. Der alte Glanz ist lange verblasst, Belém zählt zu den heißesten und ärmsten Städten des Landes. Aber genau das könnte ein Vorteil sein.",https://www.sueddeutsche.de/2025/11/02/ba3a9881-df72-4dce-a9b9-37dedee2a6b9.jpg?q=60&fm=webp&width=1200&rect=0%2C0%2C4000%2C2250,2025-11-02T14:40:26Z,,"Natürlich läuft so einiges schief in Belém. Da sind zum Beispiel die künstlichen Bäume, diese riesigen trichterartigen Metallkonstruktionen auf dem Gelände der nächsten Weltklimakonferenz. Sie führte… [+294 chars]",,de,'Schatten'
"https://www.gamestar.de/artikel/oled-tv-vs-bester-4k-hdr-laser-tv-heimkino-120-zoll-awol-vision,3442214.html","https://www.gamestar.de/artikel/oled-tv-vs-bester-4k-hdr-laser-tv-heimkino-120-zoll-awol-vision,3442214.html",0,www.gamestar.de,Deals: 4K HDR auf 120 Zoll - Dieser Beamer stellt absolut jeden Fernseher in den Schatten! [Anzeige],Ein sogenannter Ultra-Kurzdistanzbeamer ist auch für mich als TV und OLED-Experten beinahe alternativlos für echtes Kino-Feeling im eigenen Wohnzimmer – und er ist sogar praktisch ohne Ende! Der beste 4K Laser-TV ist jetzt im Angebot.,https://images.cgames.de/images/gamestar/293/teaserbild-awol-vison-ltv-3500-pro-bester-laser-tv-4k-heimkino-120-zoll_6300599.jpg,2025-11-02T17:10:00Z,,"Mit den besten OLED-, QLED- und Mini-LED-TVs kenne ich mich aus gegen diesen 120 Zoll großen Laser-TV kommen sie nicht an!
Es ist das eine, 3 Meter Bild-Diagonale auf dem Datenblatt eines, zugegeben… [+5220 chars]",,de,'Schatten'
https://www.bild.de/leben-wissen/ernaehrung-diaet/vogelgrippe-hitze-schuetzt-beim-kochen-und-braten-6904840edf9fa029228eedbd,https://www.bild.de/leben-wissen/ernaehrung-diaet/vogelgrippe-hitze-schuetzt-beim-kochen-und-braten-6904840edf9fa029228eedbd,0,www.bild.de,Sicher essen - So kochen und braten Sie Geflügel virensicher,"Geflügel sicher zubereiten: Hitze tötet das Virus ab, während Kühlung nicht ausreicht. Tipps für sorgenfreies Essen.","https://images.bild.de/6904840edf9fa029228eedbd/8397a7fe128db628cc3e7ba2fe47fcdf,dabd6e82?w=1280",2025-11-02T18:32:39Z,,Wie sicher sind unsere Lebensmittel wirklich vor dem Vogelgrippe-Virus? Mit einfachen Koch- und Hygieneregeln können Sie sich effektiv schützen. Entscheidend ist: Das Virus überlebt keine Hitze. Unse… [+253 chars],,de,'Hitze'
https://www.nzz.ch/schweiz/das-dorf-der-superreichen-in-hergiswil-treffen-schweizer-schattenkinder-auf-norwegische-steuerfluechtlinge-ld.1909480,https://www.nzz.ch/schweiz/das-dorf-der-superreichen-in-hergiswil-treffen-schweizer-schattenkinder-auf-norwegische-steuerfluechtlinge-ld.1909480,0,www.nzz.ch,Das Dorf der Superreichen – in Hergiswil treffen Schweizer Schattenkinder auf norwegische Steuerflüchtlinge,"Die Nidwaldner Gemeinde Hergiswil gilt als die Mutter der Schweizer Steueroasen, wo Millionäre auf Milliardäre treffen. Nun ist dieses Paradies durch die Juso-Erbschaftsinitiative bedroht.","https://img.nzz.ch/2025/04/17/40ffeb77-818f-450d-b2ee-cd84a0654ef6.jpeg?width=1200&height=675&fit=bounds&quality=75&auto=webp&crop=5678,3194,x0,y373&wmark=nzz",2025-11-03T04:30:00Z,,"Die Nidwaldner Gemeinde Hergiswil gilt als die Mutter der Schweizer Steueroasen, wo Millionäre auf Milliardäre treffen. Nun ist dieses Paradies durch die Juso-Erbschaftsinitiative bedroht.
In Hergis… [+11102 chars]",,de,'Schatten'
https://www.morgenpost.de/berlin/article410362968/kasupke-hat-noch-keine-lust-auf-weihnachtsmaerkte.html,https://www.morgenpost.de/berlin/article410362968/kasupke-hat-noch-keine-lust-auf-weihnachtsmaerkte.html,0,www.morgenpost.de,Kasupke hat noch keine Lust auf Weihnachtsmärkte,In Berlin öffnen die ersten Budenstädte jefühlt jedet Jahr früha. Irjendwann wern wa ‘n Weihnachtsmarkt im Freibad ham.,https://img.sparknews.funkemedien.de/408091545/408091545_1736958730_v16_9_1600.jpeg,2025-11-03T05:46:28Z,,"Jestan hab ick kritisch anjemerkt, det ville Jeschäfte jetz schon voll uff Weihnachten jepolt sind. Jeht aba noch bessa: In unsam Millionendorf ham die ersten Weihnachtsmärkte uffjemacht vier Wochen … [+415 chars]",,de,'Freibad'
https://www.zeit.de/news/2025-11/03/sonne-und-milde-temperaturen-praegen-wochenstart-in-hessen,https://www.zeit.de/news/2025-11/03/sonne-und-milde-temperaturen-praegen-wochenstart-in-hessen,0,www.zeit.de,Milde Herbsttage: Sonne und milde Temperaturen prägen Wochenstart in Hessen,Hier finden Sie Informationen zu dem Thema „Milde Herbsttage“. Lesen Sie jetzt „Sonne und milde Temperaturen prägen Wochenstart in Hessen“.,https://img.zeit.de/news/2025-11/03/sonne-und-milde-temperaturen-praegen-wochenstart-in-hessen-image-group/wide__1300x731,2025-11-03T05:57:50Z,,"Zum Start in die neue Woche bleibt es in Hessen überwiegend trocken und immer wieder zeigt sich die Sonne. Wie der Deutsche Wetterdienst (DWD) mitteilte, gibt es heute zwischen dichten Wolken nur gel… [+523 chars]",,de,'Sonne'
https://www.zeit.de/news/2025-11/03/viel-sonne-in-bayern-meteorologe-kuendigt-mildes-wetter-an,https://www.zeit.de/news/2025-11/03/viel-sonne-in-bayern-meteorologe-kuendigt-mildes-wetter-an,0,www.zeit.de,Verkehr: Viel Sonne in Bayern - Meteorologe kündigt mildes Wetter an,Hier finden Sie Informationen zu dem Thema „Verkehr“. Lesen Sie jetzt „Viel Sonne in Bayern - Meteorologe kündigt mildes Wetter an“.,https://img.zeit.de/news/2025-11/03/viel-sonne-in-bayern-meteorologe-kuendigt-mildes-wetter-an-image-group/wide__1300x731,2025-11-03T07:26:37Z,,"Die Menschen in Bayern dürfen sich die nächsten Tage auf recht viel Sonne freuen. Heute werde es am Vormittag noch einige Schauer, im Tagesverlauf im Süden öfter Sonne geben, teilte die Deutsche Wett… [+537 chars]",,de,'Sonne'
https://www.stern.de/panorama/wetter/unwetter--sturm--regen--hier-finden-sie-aktuelle-warnungen-des-dwd-35919622.html,https://www.stern.de/panorama/wetter/unwetter--sturm--regen--hier-finden-sie-aktuelle-warnungen-des-dwd-35919622.html,0,www.stern.de,"Wind, Regen, Gewitter: Hier sehen Sie aktuelle Wetterwarnungen für Ihren Wohnort","Droht ein Unwetter, gibt der Deutsche Wetterdienst (DWD) eine Warnung mit Gefahrenhinweisen heraus. Sehen Sie hier, ob es aktuelle Warnungen für ihren Wohnort gibt.",https://image.stern.de/35923446/t/Dr/v2/w1440/r1.7778/-/teaser-ani-unwetterwarnung.gif,2025-11-03T09:21:00Z,,"Die Karten in diesem Artikel zeigen aktuelle Unwetterwarnungen des Deutschen Wetterdienstes (DWD). Die Warnungen sind je nach Abstufung unterschiedlich eingefärbt. Eine grüne Einfärbung bedeutet, das… [+1389 chars]",,de,'Gewitter'
https://www.kino.de/serie/epischer-geht-es-kaum-stranger-things-trailer-heizt-duestere-fan-theorie-zum-grossen-netflix-finale-maechtig-an--01K94MJSK05A5CQ5GVCF7X8MTV,https://www.kino.de/serie/epischer-geht-es-kaum-stranger-things-trailer-heizt-duestere-fan-theorie-zum-grossen-netflix-finale-maechtig-an--01K94MJSK05A5CQ5GVCF7X8MTV,0,www.kino.de,"Epischer geht es kaum: ""Stranger Things""-Trailer heizt düstere Fan-Theorie zum großen Netflix-Finale mächtig an","Diese ""Stranger Things""-Theorie könnte alles Bisherige in den Schatten stellen – und alles Kommende aufs Spiel setzen.",https://static.kino.de/99/7f/f7/0d90713316c59dd29884a01b38_ZmMgNDgzMTZlM2FmZmZmIDE5MjAgMTA4MAM5ZjAwMzY5MjgwMw==.jpg,2025-11-03T10:35:38Z,,"Diese ""Stranger Things""-Theorie könnte alles Bisherige in den Schatten stellen und alles Kommende aufs Spiel setzen.
Die Vorfreude auf das große Finale von ""Stranger Things"" erreicht langsam ihren H… [+3892 chars]",,de,'Schatten'
https://www.bild.de/unterhaltung/tv-fernsehformate/fernsehtipp-des-tages-bei-diesem-brutalen-amoklauf-stimmt-etwas-nicht-6908925b73566d3912c08e8b,https://www.bild.de/unterhaltung/tv-fernsehformate/fernsehtipp-des-tages-bei-diesem-brutalen-amoklauf-stimmt-etwas-nicht-6908925b73566d3912c08e8b,0,www.bild.de,Krimi heute im ZDF - Sarah Kohr ermittelt im rätselhaften Amoklauf,Heute Abend läuft um 20:15 Uhr im ZDF der Krimi „Sarah Kohr: Im Schatten“. Alle Infos zum Top-Film im ZDF lesen Sie hier.,"https://images.bild.de/6908925b73566d3912c08e8b/ab8a5685edd2d9c45fc608af8e8236e5,8b28b74b?w=1280",2025-11-03T14:06:42Z,,"Um 20:15 Uhr heißt es: Primetime! Im Fernsehen laufen dann die besten Blockbuster, Shows und Serienhits. Doch bei der Menge an Angeboten kann man schnell den Überblick verlieren.
Damit Sie gut vorbe… [+2056 chars]",,de,'Schatten'
https://www.stern.de/gesellschaft/regional/bayern/bayerischer-ministerpraesident--politik--wissenschaft-und-safari--soeder-in-suedafrika-36184720.html,https://www.stern.de/gesellschaft/regional/bayern/bayerischer-ministerpraesident--politik--wissenschaft-und-safari--soeder-in-suedafrika-36184720.html,0,www.stern.de,"Bayerischer Ministerpräsident: Politik, Wissenschaft und Safari: Söder in Südafrika","Kapstadt - Und da liegt er, der Löwe, im Schatten unter einem Busch. Die Safariwagen mit Markus Söder und seinem Tross bleiben stehen. Ein paar Minuten",https://image.stern.de/36184722/t/aA/v1/w1440/r1.7778/-/03--gt4e7hxzfbv4axs2048jpeg---a6fd75003ca2f5a1.jpg,2025-11-03T14:19:03Z,,"Kopiere den aktuellen Link
Zur Merkliste hinzufügen
Drei Tage ist Markus Söder zu Gast in Südafrika. Es geht um Politik und Wissenschaft aber beileibe nicht nur. Kritiker lästern schon.
Und da lie… [+5173 chars]",,de,'Schatten'
https://www.brigitte.de/gesund/frauengesundheit/endgegner-hitzewallungen--so-wirken-neue--hormonfreie-medikamente-14039124.html,https://www.brigitte.de/gesund/frauengesundheit/endgegner-hitzewallungen--so-wirken-neue--hormonfreie-medikamente-14039124.html,0,www.brigitte.de,Meno-Pause: Hormonfrei gegen Hitzewallungen: Gibt's da was?,"Zwei Frauen – ein Thema: die Wechseljahre. Die eine, Julia, hat sie noch vor sich und tausend Fragen, die andere, Andrea, kann aufklären und Ängste nehmen. Heute geht es um Hitzewallungen.",https://image.brigitte.de/13912714/t/0S/v3/w1440/r1.7778/-/meno-pause-kolumne-1.jpg,2025-11-03T15:03:00Z,,"Zwei Frauen ein Thema: die Wechseljahre. Die eine, Julia, hat sie noch vor sich und tausend Fragen, die andere, Andrea, kann aufklären und Ängste nehmen. Heute geht es um Hitzewallungen.
""Hitzewallu… [+3824 chars]",,de,'Hitze'
https://www.morgenpost.de/berlin/article410365550/haftbefehl-auf-netflix-ich-wollte-lachen-doch-diese-doku-traf-mich-knallhart.html,https://www.morgenpost.de/berlin/article410365550/haftbefehl-auf-netflix-ich-wollte-lachen-doch-diese-doku-traf-mich-knallhart.html,0,www.morgenpost.de,Ich wollte über Haftbefehl lachen – doch diese Doku traf mich knallhart,"Eine Netflix-Doku zeigt den Rapper Haftbefehl als Schatten seiner selbst. Kein Gangster-Glamour, nur der Mensch Aykut Anhan, der an sich selbst zerbricht.",https://img.sparknews.funkemedien.de/410370586/410370586_1762182607_v16_9_1600.jpeg,2025-11-03T17:00:00Z,,"Liebe Leserin, lieber Leser,
ich sitze da, schaue die Netflix-Doku über den Rapper Haftbefehl und weiß nicht, wohin mit meinen Emotionen. Da ist dieser Mann aus Offenbach, der mit Worten ganze Straß… [+3733 chars]",,de,'Schatten'
https://www.zeit.de/politik/ausland/2025-11/klimakonferenz-brasilien-buergermeister-staedte-klimawandel,https://www.zeit.de/politik/ausland/2025-11/klimakonferenz-brasilien-buergermeister-staedte-klimawandel,0,www.zeit.de,Vor der Weltklimakonferenz: 33 Städte einigen sich vor COP30 auf gemeinsamen Klimaschutz,"Bevor die Weltklimakonferenz beginnt, haben sich in Brasilien 33 Städte zusammengeschlossen. Sie wollen gemeinsam gegen die Folgen des Klimawandels vorgehen.",https://img.zeit.de/politik/ausland/2025-11/buergermeister-bild/wide__1300x731,2025-11-03T22:19:21Z,,Eine Woche vor dem Beginn der Weltklimakonferenz COP30 haben 300 Bürgermeisterinnen und Bürgermeister ein gemeinsames Vorgehen gegen die Folgen der Erderwärmung beschlossen. Bei dem Treffen in Rio de… [+3067 chars],,de,'Hitze'
https://www.zeit.de/news/2025-11/04/eu-laender-ringen-um-klimaziele-einigung-in-letzter-minute,https://www.zeit.de/news/2025-11/04/eu-laender-ringen-um-klimaziele-einigung-in-letzter-minute,0,www.zeit.de,Klimawandel: EU-Länder ringen um Klimaziele - Einigung in letzter Minute?,Hier finden Sie Informationen zu dem Thema „Klimawandel“. Lesen Sie jetzt „EU-Länder ringen um Klimaziele - Einigung in letzter Minute?“.,https://img.zeit.de/news/2025-11/04/eu-laender-ringen-um-klimaziele-einigung-in-letzter-minute-image-group/wide__1300x731,2025-11-04T04:00:09Z,,Wie viel weniger Treibhausgase sollen die EU-Länder bis 2040 ausstoßen - und wie soll das erreicht werden? Nach langem Ringen um Zahlen und mögliche Flexibilität kommen heute in Brüssel die Umweltmin… [+5078 chars],,de,'Klimawandel'
https://www.zeit.de/news/2025-11/04/bis-zu-16-grad-und-sonne-milder-start-in-den-november,https://www.zeit.de/news/2025-11/04/bis-zu-16-grad-und-sonne-milder-start-in-den-november,0,www.zeit.de,Wetter: Bis zu 16 Grad und Sonne – milder Start in den November,Hier finden Sie Informationen zu dem Thema „Wetter“. Lesen Sie jetzt „Bis zu 16 Grad und Sonne – milder Start in den November“.,https://img.zeit.de/news/2025-11/04/bis-zu-16-grad-und-sonne-milder-start-in-den-november-image-group/wide__1300x731,2025-11-04T06:09:43Z,,Sonnenfans aufgepasst - der Novemberanfang glänzt in Hamburg und Schleswig-Holstein mit milden Temperaturen und ein paar Sonnenstunden. Nach Angaben des Deutschen Wetterdienstes (DWD) dominieren am D… [+1397 chars],,de,'Sonne'
https://www.stern.de/gesellschaft/regional/hamburg-schleswig-holstein/wetter--bis-zu-16-grad-und-sonne---milder-start-in-den-november-36186240.html,https://www.stern.de/gesellschaft/regional/hamburg-schleswig-holstein/wetter--bis-zu-16-grad-und-sonne---milder-start-in-den-november-36186240.html,0,www.stern.de,Wetter: Bis zu 16 Grad und Sonne – milder Start in den November,Sonne im November? In Hamburg und Schleswig-Holstein geht’s mild los – doch nicht überall zeigt sich der Himmel von seiner besten Seite. Wo Sie die meisten Sonnenstunden erwarten dürfen.,https://image.stern.de/36186242/t/Ju/v1/w1440/r1.7778/-/04--itna7qlgirv6axs2048jpeg---90a8ad4d1bac4ae6.jpg,2025-11-04T06:09:43Z,,"Kopiere den aktuellen Link
Zur Merkliste hinzufügen
Sonne im November? In Hamburg und Schleswig-Holstein gehts mild los doch nicht überall zeigt sich der Himmel von seiner besten Seite. Wo Sie die … [+1596 chars]",,de,'Sonne'
