index,url,valid,domain,title,description,image,published,archive,content,quote,language,keyword
https://www.zeit.de/news/2026-05/03/regen-und-gewitter-zum-wochenstart-in-niedersachsen-erwartet,https://www.zeit.de/news/2026-05/03/regen-und-gewitter-zum-wochenstart-in-niedersachsen-erwartet,0,www.zeit.de,Wetteraussichten: Regen und Gewitter zum Wochenstart in Niedersachsen erwartet,Hier finden Sie Informationen zu dem Thema „Wetteraussichten“. Lesen Sie jetzt „Regen und Gewitter zum Wochenstart in Niedersachsen erwartet“.,https://img.zeit.de/news/2026-05/03/regen-und-gewitter-zum-wochenstart-in-niedersachsen-erwartet-image-group/wide__1300x731,2026-05-03T11:31:43Z,,"In Niedersachsen und Bremen wird es in den kommenden Tagen zunehmend ungemütlich: Statt sommerlichem Wetter drohen Schauer, Gewitter und teils kräftiger Wind. Verantwortlich sind feuchtwarme Luftmass… [+1443 chars]",,de,'Gewitter'
https://www.n-tv.de/panorama/Gewitter-Front-loest-Kurzzeit-Sommer-ab-id30780895.html,https://www.n-tv.de/panorama/Gewitter-Front-loest-Kurzzeit-Sommer-ab-id30780895.html,0,www.n-tv.de,Wetterwoche im Schnellcheck: Gewitter-Front löst Kurzzeit-Sommer ab,"Mit Tief ""Zuhal"" findet der Vorgeschmack auf den Sommer ein jähes Ende. Doch zum Wochenstart herrscht zunächst ein deutlicher Unterschied zwischen den Regionen: Während es im Norden deutlich kühler wird, bleibt es im Süden noch sommerlich warm.",https://www.n-tv.de/img/30780913/1777818544/Img_16_9/1200/Gewittrige-Stimmung-im-Landkreis-Pfaffenhofen-in-Bayern-zumindest-kuendigt-sich-hier-ein-heftiger-Regenschauer-an.jpg,2026-05-03T13:15:38Z,,"Tief ""Zuhal"" bringt einiges an Regen in die Regionen. (Foto: picture alliance / CHROMORANGE)
Mit Tief ""Zuhal"" findet der Vorgeschmack auf den Sommer ein jähes Ende. Doch zum Wochenstart herrscht zun… [+4785 chars]",,de,'Gewitter'
https://www.stern.de/panorama/wetter--temperaturen-in-rekordnaehe--29-4-grad-am-sonntag-erreicht-37363970.html,https://www.stern.de/panorama/wetter--temperaturen-in-rekordnaehe--29-4-grad-am-sonntag-erreicht-37363970.html,0,www.stern.de,"Wetter: Temperaturen in Rekordnähe: 29,4 Grad am Sonntag erreicht","Nach sommerlicher Hitze am Wochenende kommt der Umbruch: Der Deutsche Wetterdienst rechnet für die neue Woche mit Schauern, Gewittern und spürbar kühleren Temperaturen.",https://image.stern.de/37364478/t/0z/v1/w1440/r1.7778/-/03--jofxful5mov4axs2048jpeg---cff38fec32b054ef.jpg,2026-05-03T16:10:48Z,,"Kopiere den aktuellen Link
Zur Merkliste hinzufügen
Nach sommerlicher Hitze am Wochenende kommt der Umbruch: Der Deutsche Wetterdienst rechnet für die neue Woche mit Schauern, Gewittern und spürbar… [+1619 chars]",,de,'Gewitter'
https://www.zeit.de/news/2026-05/03/dwd-warnt-vor-heftigem-gewitter-in-schleswig-holstein,https://www.zeit.de/news/2026-05/03/dwd-warnt-vor-heftigem-gewitter-in-schleswig-holstein,0,www.zeit.de,Unwetter: DWD warnt vor heftigem Gewitter in Schleswig-Holstein,Hier finden Sie Informationen zu dem Thema „Unwetter“. Lesen Sie jetzt „DWD warnt vor heftigem Gewitter in Schleswig-Holstein“.,https://img.zeit.de/news/2026-05/03/dwd-warnt-vor-heftigem-gewitter-in-schleswig-holstein-image-group/wide__1300x731,2026-05-03T16:42:15Z,,Der Deutsche Wetterdienst hat für den Nordwesten von Schleswig-Holstein vor schwerem Gewitter mit heftigem Starkregen und Hagel gewarnt. Rund um den Kreis Schleswig-Flensburg seien in einer Stunde Ni… [+596 chars],,de,'Gewitter'
https://www.zeit.de/news/2026-05/04/regen-und-gewitter-fuer-nrw-erwartet,https://www.zeit.de/news/2026-05/04/regen-und-gewitter-fuer-nrw-erwartet,0,www.zeit.de,Wetteraussichten: Regen und Gewitter für NRW erwartet,Hier finden Sie Informationen zu dem Thema „Wetteraussichten“. Lesen Sie jetzt „Regen und Gewitter für NRW erwartet“.,https://img.zeit.de/news/2026-05/04/regen-und-gewitter-fuer-nrw-erwartet-image-group/wide__1300x731,2026-05-04T04:30:57Z,,Nach einem eher sonnigen Wochenende wird es in Nordrhein-Westfalen trüb und verregnet. Das geht aus den Vorhersagen des Deutschen Wetterdienstes (DWD) hervor. Der Montag soll demnach mit dichten Wolk… [+755 chars],,de,'Gewitter'
https://www.zeit.de/news/2026-05/04/regen-und-gewitter-statt-sonnenschein,https://www.zeit.de/news/2026-05/04/regen-und-gewitter-statt-sonnenschein,0,www.zeit.de,Wettervorhersage: Regen und Gewitter statt Sonnenschein,Hier finden Sie Informationen zu dem Thema „Wettervorhersage“. Lesen Sie jetzt „Regen und Gewitter statt Sonnenschein“.,https://img.zeit.de/news/2026-05/04/regen-und-gewitter-statt-sonnenschein-image-group/wide__1300x731,2026-05-04T04:32:05Z,,"Schauer und Gewitter lösen das sonnige Wetter in Berlin und Brandenburg ab. Dabei sind örtlich auch Sturmböen mit bis zu 70 Kilometern pro Stunde, Hagel oder Starkregen möglich, wie der Deutsche Wett… [+674 chars]",,de,'Sonne'
https://www.zeit.de/news/2026-05/04/gewitter-und-regen-zum-wochenstart,https://www.zeit.de/news/2026-05/04/gewitter-und-regen-zum-wochenstart,0,www.zeit.de,Wetter in Hessen: Gewitter und Regen zum Wochenstart,Hier finden Sie Informationen zu dem Thema „Wetter in Hessen“. Lesen Sie jetzt „Gewitter und Regen zum Wochenstart“.,https://img.zeit.de/news/2026-05/04/gewitter-und-regen-zum-wochenstart-image-group/wide__1300x731,2026-05-04T05:01:52Z,,Die neue Woche beginnt in Hessen mit dunklen Wolken und einzelnen Gewittern. Dies teilte der Deutsche Wetterdienst (DWD) mit. Die Temperaturen liegen bei Höchstwerten zwischen 20 und 24 Grad. Ab dem … [+574 chars],,de,'Gewitter'
https://www.faz.net/aktuell/rhein-main/schuesse-in-giessen-zwei-schwerverletzte-aktuelle-nachrichten-aus-frankfurt-hessen-faz-19735361.html,https://www.faz.net/aktuell/rhein-main/schuesse-in-giessen-zwei-schwerverletzte-aktuelle-nachrichten-aus-frankfurt-hessen-faz-19735361.html,0,www.faz.net,Rhein-Main-Liveblog: Schüsse in Gießen: Zwei Schwerverletzte,Hoher Schaden nach Brand von Einfamilienhaus +++ Gewitter und Regen zum Wochenstart +++ Hanau: Sportwagen nach Unfall im Feld abgestellt +++ Liveblog zu Rhein-Main und Hessen,https://media0.faz.net/image/w1200h627/5f0eaf3963f3/w6144h3210x0y443o/202605/43601.0.2045229977/die-polizei-sucht-nach-den.webp,2026-05-04T09:02:00Z,,"Gießen. Zwei Männer sind durch Schüsse schwer verletzt worden und werden in  Kliniken behandelt. Wie Staatsanwaltschaft und Polizei berichten, waren fünf Menschen am Sonntag kurz vor Mitternacht in S… [+443 chars]",,de,'Gewitter'
https://www.bild.de/news/wetter/wetterumschwung-noch-einmal-fruehsommer-dann-kommt-der-kaelteeinbruch-69f70f2b6fe2dee7bfb112b8,https://www.bild.de/news/wetter/wetterumschwung-noch-einmal-fruehsommer-dann-kommt-der-kaelteeinbruch-69f70f2b6fe2dee7bfb112b8,0,www.bild.de,"Heftiger Wetterumschwung - Erst Sonnenbrand, dann Regenwand!",Auf strahlenden Sonnenschein folgen heftige Schauer und ein deutlicher Temperatursturz.,"https://images.bild.de/69f70f2b6fe2dee7bfb112b8/d3ef16fdbc89c2d72709979bdfb737ee,9b00349b?w=1280",2026-05-04T09:47:41Z,,TTS-Player überspringenArtikel weiterlesenAuf strahlenden Sonnenschein am Sonntag folgen heftige Schauer und ein deutlicher Temperatursturz immerhin startet der heutige Montag noch einmal schön. Geni… [+3347 chars],,de,'Sonne'
https://www.stern.de/panorama/wetter--im-norden-kalt-und-im-sueden-warm--wetter-bleibt-wechselhaft-37366212.html,https://www.stern.de/panorama/wetter--im-norden-kalt-und-im-sueden-warm--wetter-bleibt-wechselhaft-37366212.html,0,www.stern.de,Wetter: Im Norden kalt und im Süden warm: Wetter bleibt wechselhaft,"Offenbach - Deutschland steht eine wechselhafte Woche mit Gewittern und Starkregen bevor. Im Norden wird es empfindlich kühl, während es im Süden",https://image.stern.de/37366214/t/AF/v1/w1440/r1.7778/-/04--2i265ud5fhv11axs2048jpeg---461a59d7ae956eba.jpg,2026-05-04T10:12:16Z,,"Kopiere den aktuellen Link
Zur Merkliste hinzufügen
Im Norden wird es nachts empfindlich kühl, im Süden bleibt es sommerlich. Der DWD erklärt, was dahintersteckt.
Deutschland steht eine wechselhaf… [+1745 chars]",,de,'Gewitter'
https://www.faz.net/aktuell/rhein-main/neue-erdmaennchen-zuchtgruppe-im-opel-zoo-aktuelle-nachrichten-aus-frankfurt-hessen-faz-19735361.html,https://www.faz.net/aktuell/rhein-main/neue-erdmaennchen-zuchtgruppe-im-opel-zoo-aktuelle-nachrichten-aus-frankfurt-hessen-faz-19735361.html,0,www.faz.net,Rhein-Main-Liveblog: Neue Erdmännchen-Zuchtgruppe im Opel-Zoo,Volksbank Mittelhessen gründet Energiegenossenschaft +++ Schüsse in Gießen: Zwei Schwerverletzte +++ Hoher Schaden nach Brand von Einfamilienhaus +++ Gewitter und Regen zum Wochenstart +++ Hanau: Sportwagen nach Unfall im Feld abgestellt +++ Liveblog zu Rhein…,https://media0.faz.net/image/w1200h627/3b45bc428cbc/w4624h2416x0y527o/201907/431.0.14813970/kuschelig-erdmaennchen-im-opel.webp,2026-05-04T11:28:00Z,,"Gießen. Die Volksbank Mittelhessen will die Energiewende fortan mit einer eigenen Energiegenossenschaft unterstützen. Die Zukunftsenergie eG wird als eigenständige Einheit auftreten, wie das durch za… [+1841 chars]",,de,'Gewitter'
https://www.welt.de/politik/ausland/article69f47557a948f97a9e941520/bericht-aus-dem-iran-selbst-fuer-massstaebe-der-islamischen-republik-beispiellos-die-brutale-hinrichtungswelle-im-iran.html,https://www.welt.de/politik/ausland/article69f47557a948f97a9e941520/bericht-aus-dem-iran-selbst-fuer-massstaebe-der-islamischen-republik-beispiellos-die-brutale-hinrichtungswelle-im-iran.html,0,www.welt.de,„Selbst für Maßstäbe der Islamischen Republik beispiellos“ – Die brutale Hinrichtungswelle im Iran,"Im Schatten des Krieges hat das iranische Regime die Zahl der Todesurteile weiter erhöht. Unser Autor aus Teheran berichtet, unter welchen Vorwänden oft junge Menschen aus dem Leben gerissen werden – und warum der Terror gegen die Angehörigen damit noch lange…",https://images.welt.de/69f47557a948f97a9e941520/18c1a13257aeb3d78ef77742824630ef-master/ci16x9-w1200/dpa-com-260429-99-281299-jpg,2026-05-04T12:23:36Z,,"Im Schatten des Krieges hat das iranische Regime die Zahl der Todesurteile weiter erhöht. Unser Autor aus Teheran berichtet, unter welchen Vorwänden oft junge Menschen aus dem Leben gerissen werden u… [+11500 chars]",,de,'Schatten'
https://www.golem.de/sonstiges/zustimmung/auswahl.html?from=https://www.golem.de/news/energiewende-von-negativen-strompreisen-profitieren-am-ende-alle-2605-208280.html&referer=https://t.co/41106bce60,https://www.golem.de/sonstiges/zustimmung/auswahl.html?from=https://www.golem.de/news/energiewende-von-negativen-strompreisen-profitieren-am-ende-alle-2605-208280.html&referer=https://t.co/41106bce60,0,www.golem.de,Energiewende: Von negativen Strompreisen profitieren am Ende alle,"Viel Sonne und dazu Wind lassen die Strompreise ins Negative fallen. Das verursacht Kosten bei Energieerzeugern und durch Export, ergibt aber Sinn. Von Mario Petzold (Erneuerbare Energien, Smart Meter)",,2026-05-04T13:50:02Z,,"Besuchen Sie Golem.de wie gewohnt mit Werbung und Tracking,
 indem Sie der Nutzung aller Cookies zustimmen.
 Details zum Tracking finden Sie im Privacy Center.
Skript wurde nicht geladen. Informat… [+607 chars]",,de,'Sonne'
https://www.faz.net/aktuell/rhein-main/fuenf-festnahmen-nach-schuessen-in-giessen-aktuelle-nachrichten-aus-frankfurt-hessen-faz-19735361.html,https://www.faz.net/aktuell/rhein-main/fuenf-festnahmen-nach-schuessen-in-giessen-aktuelle-nachrichten-aus-frankfurt-hessen-faz-19735361.html,0,www.faz.net,Rhein-Main-Liveblog: Fünf Festnahmen nach Schüssen in Gießen,Neue Erdmännchen-Zuchtgruppe im Opel-Zoo +++ Hoher Schaden nach Brand von Einfamilienhaus +++ Gewitter und Regen zum Wochenstart +++ Liveblog zu Rhein-Main und Hessen,https://media0.faz.net/image/w1200h627/1c11d3c41710/w6144h3210x0y443o/202604/43601.0.2033302743/zugriff-im-zusammenhang-mit.webp,2026-05-04T14:28:00Z,,"Gießen. Die Volksbank Mittelhessen will die Energiewende fortan mit einer eigenen Energiegenossenschaft unterstützen. Die Zukunftsenergie eG wird als eigenständige Einheit auftreten, wie das durch za… [+1841 chars]",,de,'Gewitter'
https://www.bild.de/news/wetter/wetterumschwung-nach-sommerstart-jetzt-kommt-der-temperatursturz-69f8a0586fe2dee7bfb1281e,https://www.bild.de/news/wetter/wetterumschwung-nach-sommerstart-jetzt-kommt-der-temperatursturz-69f8a0586fe2dee7bfb1281e,0,www.bild.de,Wetterumschwung nach Sommerstart - Jetzt kommt der Temperatursturz!,"Gerade noch Sonne und über 20 Grad – jetzt drohen Regenmassen und Temperatursturz. Vor allem im Norden und in der Mitte wird es ungemütlich, meint Experte Karsten Brandt.","https://images.bild.de/69f8a0586fe2dee7bfb1281e/34be537286ff5dc8c47e24eb2f7dbbff,3bf6e78b?w=1280",2026-05-04T14:29:28Z,,"Mehr zum Video anzeigen 
Gerade noch Sonne und über 20 Grad jetzt drohen Regenmassen und Temperatursturz. Vor allem im Norden und in der Mitte wird es ungemütlich, meint Experte Karsten Brandt.
Que… [+30 chars]",,de,'Sonne'
https://www.stern.de/gesellschaft/regional/berlin-brandenburg/sommer--sonne--sonnenschein--freibadsaison-startet-mit-mehr-als-25-000-gaesten-37367576.html,https://www.stern.de/gesellschaft/regional/berlin-brandenburg/sommer--sonne--sonnenschein--freibadsaison-startet-mit-mehr-als-25-000-gaesten-37367576.html,0,www.stern.de,"Sommer, Sonne, Sonnenschein: Freibadsaison startet mit mehr als 25.000 Gästen","Wer am Wochenende Abkühlung suchte, war nicht allein: Tausende strömten in Berlins Freibäder. Wo es besonders voll wurde und welche Bäder als Nächstes öffnen.",https://image.stern.de/37367578/t/Ce/v1/w1440/r1.7778/-/04--ezathrc2kmv9axs2048jpeg---795c799459d99685.jpg,2026-05-04T14:50:21Z,,"Kopiere den aktuellen Link
Zur Merkliste hinzufügen
Wer am Wochenende Abkühlung suchte, war nicht allein: Tausende strömten in Berlins Freibäder. Wo es besonders voll wurde und welche Bäder als Näc… [+979 chars]",,de,'Sonne'
https://www.zeit.de/news/2026-05/04/freibadsaison-startet-mit-mehr-als-25-000-gaesten,https://www.zeit.de/news/2026-05/04/freibadsaison-startet-mit-mehr-als-25-000-gaesten,0,www.zeit.de,"Sommer, Sonne, Sonnenschein: Freibadsaison startet mit mehr als 25.000 Gästen","Hier finden Sie Informationen zu dem Thema „Sommer, Sonne, Sonnenschein“. Lesen Sie jetzt „Freibadsaison startet mit mehr als 25.000 Gästen“.",https://img.zeit.de/news/2026-05/04/freibadsaison-startet-mit-mehr-als-25-000-gaesten-image-group/wide__1300x731,2026-05-04T14:50:21Z,,Bei Temperaturen von bis zu 30 Grad hat es die Menschen zum Start der Freibadsaison in die Berliner Freibäder gezogen. Mehr als 25.000 Badegäste besuchten am ersten sonnigen Maiwochenende bereits geö… [+804 chars],,de,'Sonne'
https://www.tagesspiegel.de/berlin/sommer-sonne-sonnenschein-freibadsaison-startet-mit-mehr-als-25000-gasten-15554745.html,https://www.tagesspiegel.de/berlin/sommer-sonne-sonnenschein-freibadsaison-startet-mit-mehr-als-25000-gasten-15554745.html,0,www.tagesspiegel.de,"Sommer, Sonne, Sonnenschein: Freibadsaison startet mit mehr als 25.000 Gästen","Wer am Wochenende Abkühlung suchte, war nicht allein: Tausende strömten in Berlins Freibäder. Wo es besonders voll wurde und welche Bäder als Nächstes öffnen.",https://www.tagesspiegel.de/images/15554744/alternates/BASE_16_9_W1400/1777906281000/wetter-in-berlin.jpeg,2026-05-04T14:51:21Z,,Bei Temperaturen von bis zu 30 Grad hat es die Menschen zum Start der Freibadsaison in die Berliner Freibäder gezogen. Mehr als 25.000 Badegäste besuchten am ersten sonnigen Maiwochenende bereits geö… [+1045 chars],,de,'Sonne'
https://www.zeit.de/wissen/2026-05/erderwaermung-mikroplastik-klimawandel-sonnenlicht-studie,https://www.zeit.de/wissen/2026-05/erderwaermung-mikroplastik-klimawandel-sonnenlicht-studie,0,www.zeit.de,Erderwärmung: Wie Mikroplastik das Klima aufheizen,Winzige bunte Plastikpartikel schweben in der Atmosphäre – und absorbieren Sonnenlicht. Eine neue Studie zeigt: Ihr Erwärmungseffekt ist überraschend groß.,https://img.zeit.de/wissen/2026-05/erderwaermung-mikroplastik-klimawandel-sonnenlicht-studie-bild/wide__1300x731,2026-05-04T15:18:53Z,,"Schließen
Artikelzusammenfassung
Der Great Pacific Garbage Patch im Pazifik ist ein Symbol für die Plastikverschmutzung, aber auch für die bisher unterschätzte Wirkung von Mikroplastik auf den Klim… [+758 chars]",,de,'Sonne'
https://www.zeit.de/news/2026-05/05/gewitter-in-rheinland-pfalz-und-dem-saarland,https://www.zeit.de/news/2026-05/05/gewitter-in-rheinland-pfalz-und-dem-saarland,0,www.zeit.de,Wetterprognose: Gewitter in Rheinland-Pfalz und dem Saarland,Hier finden Sie Informationen zu dem Thema „Wetterprognose“. Lesen Sie jetzt „Gewitter in Rheinland-Pfalz und dem Saarland“.,https://img.zeit.de/news/2026-05/05/gewitter-in-rheinland-pfalz-und-dem-saarland-image-group/wide__1300x731,2026-05-05T04:35:06Z,,"In Rheinland-Pfalz und im Saarland müssen sich die Menschen auf nasse Tage einstellen. Bereits heute zieht von Südwesten schauerartiger Regen auf, der von Gewittern begleitet wird. Dabei kann es örtl… [+776 chars]",,de,'Gewitter'
https://www.zeit.de/news/2026-05/05/starkregen-und-gewitter-sonne-meldet-sich-zum-wochenende,https://www.zeit.de/news/2026-05/05/starkregen-und-gewitter-sonne-meldet-sich-zum-wochenende,0,www.zeit.de,Wetter: Starkregen und Gewitter – Sonne meldet sich zum Wochenende,Hier finden Sie Informationen zu dem Thema „Wetter“. Lesen Sie jetzt „Starkregen und Gewitter – Sonne meldet sich zum Wochenende“.,https://img.zeit.de/news/2026-05/05/starkregen-und-gewitter-sonne-meldet-sich-zum-wochenende-image-group/wide__1300x731,2026-05-05T05:15:43Z,,"Kräftiger Regen und einzelne Gewitter bestimmen die nächsten Tage in Sachsen, Sachsen-Anhalt und Thüringen. Laut Deutschen Wetterdienst (DWD) setzt sich zum Wochenende hin die Sonne wieder durch. 
H… [+769 chars]",,de,'Gewitter'
https://www.stern.de/gesellschaft/regional/baden-wuerttemberg/mutmasslicher-justizskandal--was-einen-auftragsmord-mit-einem-justizskandal-verbindet-37372288.html,https://www.stern.de/gesellschaft/regional/baden-wuerttemberg/mutmasslicher-justizskandal--was-einen-auftragsmord-mit-einem-justizskandal-verbindet-37372288.html,0,www.stern.de,Mutmaßlicher Justizskandal: Was einen Auftragsmord mit einem Justizskandal verbindet,Schüsse und ein Datenleck: Im Schatten eines gescheiterten Anschlags wird ein mutmaßliches Korruptionsnetz in der Justiz sichtbar. Was steckt dahinter? Und worum geht es nun vor Gericht?,https://image.stern.de/37372290/t/N4/v1/w1440/r1.7778/-/06--puutvtxclnv6axs2048jpeg---13ff50ab2439f981.jpg,2026-05-06T02:00:28Z,,"Kopiere den aktuellen Link
Zur Merkliste hinzufügen
Schüsse und ein Datenleck: Im Schatten eines gescheiterten Anschlags wird ein mutmaßliches Korruptionsnetz in der Justiz sichtbar. Was steckt dah… [+2795 chars]",,de,'Schatten'
https://www.nzz.ch/podcast/fussball-wm-2026-im-schatten-von-trump-die-unzerstoerbare-macht-der-fifa-ld.10005652,https://www.nzz.ch/podcast/fussball-wm-2026-im-schatten-von-trump-die-unzerstoerbare-macht-der-fifa-ld.10005652,0,www.nzz.ch,PODCAST «NZZ GEOPOLITIK» - Fussball-WM 2026 im Schatten von Trump: Die unzerstörbare Macht der Fifa,"Die Weltmeisterschaft in den USA, Mexiko und Kanada rückt näher und verspricht, inmitten globaler Spannungen, erneut ein hochpolitisches Ereignis zu werden. Nach den hitzigen Debatten um die WM in Katar stellt sich die Frage drängender denn je: Wie politisch …","https://img-msp-prod.nzz.ch/2026/05/04/e8659e9f-fed1-4b41-b224-7686cd226ed3.jpg?width=1200&height=1200&fit=bounds&quality=75&auto=webp&crop=3000,3000,x0,y0&wmark=nzz",2026-05-06T03:30:00Z,,"Die Weltmeisterschaft in den USA, Mexiko und Kanada rückt näher und verspricht, inmitten globaler Spannungen, erneut ein hochpolitisches Ereignis zu werden. Nach den hitzigen Debatten um die WM in Ka… [+1545 chars]",,de,'Schatten'
https://www.zeit.de/news/2026-05/06/erst-regen-zum-wochenende-sonne-in-sicht,https://www.zeit.de/news/2026-05/06/erst-regen-zum-wochenende-sonne-in-sicht,0,www.zeit.de,"Wetter: Erst Regen, zum Wochenende Sonne in Sicht","Hier finden Sie Informationen zu dem Thema „Wetter“. Lesen Sie jetzt „Erst Regen, zum Wochenende Sonne in Sicht“.",https://img.zeit.de/news/2026-05/06/erst-regen-zum-wochenende-sonne-in-sicht-image-group/wide__1300x731,2026-05-06T04:36:07Z,,Nach einem regnerischen Tag wird das Wetter in Berlin und Brandenburg zum Wochenende freundlicher. Für die Morgenstunden sagt der Deutsche Wetterdienst (DWD) Starkregen in der Südhälfte Brandenburgs … [+1302 chars],,de,'Sonne'
https://www.stern.de/gesellschaft/regional/bayern/wettervorhersage--wetterwechsel-bringt-regen---und-wie-geht-es-weiter--37372506.html,https://www.stern.de/gesellschaft/regional/bayern/wettervorhersage--wetterwechsel-bringt-regen---und-wie-geht-es-weiter--37372506.html,0,www.stern.de,Wettervorhersage: Wetterwechsel bringt Regen - und wie geht es weiter?,"München (lby) - Nach dem Wetterwechsel mit Gewittern und Regen bleibt es stark bewölkt. Wer unterwegs ist, sollte Regenschirm und Jacke griffbereit haben,",https://image.stern.de/37372508/t/fN/v1/w1440/r1.7778/-/06--kchbu7zvqlv3axs2048jpeg---26a2a5864d0f6a56.jpg,2026-05-06T05:15:13Z,,"Kopiere den aktuellen Link
Zur Merkliste hinzufügen
Es bleibt bewölkt und regnerisch. Wie wird das Wetter zum Ende der Woche?
Nach dem Wetterwechsel mit Gewittern und Regen bleibt es stark bewölkt… [+1328 chars]",,de,'Gewitter'
https://www.zeit.de/news/2026-05/06/zum-wochenende-kommt-die-sonne-raus,https://www.zeit.de/news/2026-05/06/zum-wochenende-kommt-die-sonne-raus,0,www.zeit.de,Wetter: Zum Wochenende kommt die Sonne raus,Hier finden Sie Informationen zu dem Thema „Wetter“. Lesen Sie jetzt „Zum Wochenende kommt die Sonne raus“.,https://img.zeit.de/news/2026-05/06/zum-wochenende-kommt-die-sonne-raus-image-group/wide__1300x731,2026-05-06T06:31:04Z,,"Die Mitte der Woche gestaltet sich in Mecklenburg-Vorpommern noch bedeckt und regnerisch, bis es zum Wochenende immer weiter auflockert. Laut dem Deutschen Wetterdienst (DWD) bestimmt derzeit noch ei… [+1039 chars]",,de,'Sonne'
https://www.stern.de/gesellschaft/regional/mecklenburg-vorpommern/wetter--zum-wochenende-kommt-die-sonne-raus-37372710.html,https://www.stern.de/gesellschaft/regional/mecklenburg-vorpommern/wetter--zum-wochenende-kommt-die-sonne-raus-37372710.html,0,www.stern.de,Wetter: Zum Wochenende kommt die Sonne raus,Regen und Wolken nerven noch – aber pünktlich zum Wochenende wird es heiter. Was der Deutsche Wetterdienst für das Wetter in Mecklenburg-Vorpommern vorhersagt.,https://image.stern.de/37372712/t/I6/v1/w1440/r1.7778/-/06--lubmtlqwl2v7axs2048jpeg---93a6b4e7627f3479.jpg,2026-05-06T06:31:04Z,,"Kopiere den aktuellen Link
Zur Merkliste hinzufügen
Regen und Wolken nerven noch aber pünktlich zum Wochenende wird es heiter. Was der Deutsche Wetterdienst für das Wetter in Mecklenburg-Vorpommern… [+1213 chars]",,de,'Sonne'
https://www.stern.de/panorama/wissen/komet-3i-atlas-kommt-der-erde-naeher--ist-der-komet-ein-raumschiff--35996202.html,https://www.stern.de/panorama/wissen/komet-3i-atlas-kommt-der-erde-naeher--ist-der-komet-ein-raumschiff--35996202.html,0,www.stern.de,Interstellares Objekt: Ist der Komet 3I/Atlas tatsächlich ein unbekanntes Raumschiff?,Gerade nähert sich uns ein Objekt mit dem Namen 3I/Atlas. Der fremde Besucher kommt aus einem fernen Sonnensystem und gibt Forschern Rätsel auf. Klar ist: So etwas ist sehr selten.,https://image.stern.de/35996204/t/tf/v3/w1440/r1.7778/-/komet-3i-atlas-ein-raumschiff.jpg,2026-05-06T07:02:00Z,,"Kopiere den aktuellen Link
Zur Merkliste hinzufügen
Gerade nähert sich uns ein Objekt mit dem Namen 3I/Atlas. Der fremde Besucher kommt aus einem fernen Sonnensystem und gibt Forschern Rätsel auf. … [+2230 chars]",,de,'Sonne'
https://www.morgenpost.de/berlin/article411914564/wetter-in-berlin-erst-mal-regenwetter-doch-dann-kommt-die-sonne.html,https://www.morgenpost.de/berlin/article411914564/wetter-in-berlin-erst-mal-regenwetter-doch-dann-kommt-die-sonne.html,0,www.morgenpost.de,Wetter in Berlin: Erst mal Regenwetter – doch dann kommt die Sonne,"Regen und Wolken halten Berlin und Brandenburg zunächst in Atem, doch zum Wochenende kündigt sich eine überraschende Wendung an.",https://img.sparknews.funkemedien.de/411914835/411914835_1778050943_v16_9_1600.jpeg,2026-05-06T07:02:23Z,,"Es dauert ein wenig, doch nach einem regnerischen Tag wird das Wetter in Berlin und Brandenburg zum Wochenende freundlicher. Für die Morgenstunden sagt der Deutsche Wetterdienst (DWD) Starkregen in d… [+1300 chars]",,de,'Sonne'
https://www.focus.de/kultur/stars/ralf-schumacher-ueber-karrierestart-in-michaels-schatten-damit-muss-man-umgehen-lernen_4bffb561-5de7-4e02-b400-a96e746f0a58.html,https://www.focus.de/kultur/stars/ralf-schumacher-ueber-karrierestart-in-michaels-schatten-damit-muss-man-umgehen-lernen_4bffb561-5de7-4e02-b400-a96e746f0a58.html,0,www.focus.de,"Ralf Schumacher über Karrierestart in Michaels Schatten: ""Damit muss man umgehen lernen""","Michael Schumacher setzte in der Formel 1 neue Maßstäbe. Auch sein Bruder Ralf war sehr erfolgreich als Rennfahrer. Mit dem plötzlichen Ruhm umzugehen, war für Ralf Schumacher allerdings nicht immer leicht.","https://quadro.burda-forward.de/ctf/f895b822-2415-4c2a-8355-068c88f0dc4d.c6031daf-9030-4955-807c-035359bf0e32.jpg?im=RegionOfInterestCrop=(1200,630),regionOfInterest=(1886,951)&hash=f3d5f3e11af7feec03060a8ae0d1173e7c04db268c3c092c41d7449951a7a93d",2026-05-06T07:45:00Z,,"Das verriet der 50-Jährige nun laut der ""Abendzeitung München"" in einem Interview mit dem ""Erfolg""-Magazin: ""Es macht auch was mit einem, wenn man sehr schnell, in sehr jungen Jahren, sehr erfolgreic… [+1822 chars]",,de,'Schatten'
