index,url,valid,domain,title,description,image,published,archive,content,quote,language,keyword
https://www.zeit.de/news/2026-03/09/klimawandel-aus-fuer-schlepplift-am-zugspitzgletscher,https://www.zeit.de/news/2026-03/09/klimawandel-aus-fuer-schlepplift-am-zugspitzgletscher,0,www.zeit.de,Wintersport: Klimawandel: Aus für Schlepplift am Zugspitzgletscher,Hier finden Sie Informationen zu dem Thema „Wintersport“. Lesen Sie jetzt „Klimawandel: Aus für Schlepplift am Zugspitzgletscher“.,https://img.zeit.de/news/2026-03/09/klimawandel-aus-fuer-schlepplift-am-zugspitzgletscher-image-group/wide__1300x731,2026-03-09T15:18:01Z,,An der Zugspitze muss ein Lift infolge der fortschreitenden Gletscherschmelze komplett abgebaut werden. Nach zwei Wintern Stillstand beginnt am 20. März der Rückbau des Plattlifts auf dem Nördlichen … [+2302 chars],,de,'Klimawandel'
https://www.zeit.de/wissen/umwelt/2026-03/februar-2026-fuenftwaermster-klima,https://www.zeit.de/wissen/umwelt/2026-03/februar-2026-fuenftwaermster-klima,0,www.zeit.de,Klimawandel: Februar war weltweit fünftwärmster seit Aufzeichnungsbeginn,"In Westeuropa und Nordafrika kam es im Februar zu schweren Überschwemmungen mit Toten. Global lagen die Temperaturen fast 1,5 Grad über dem vorindustriellen Niveau.",https://img.zeit.de/administratives/sharing/fallback-image-die-zeit/wide__1300x731,2026-03-10T05:26:11Z,,"In Europa ist der Februar ungewöhnlich kalt gewesen, doch weltweit war es der fünftwärmste Februar seit Beginn der Wetteraufzeichnungen. Das geht aus dem monatlichen Bericht des EU-Klimawandeldienste… [+1687 chars]",,de,'Klimawandel'
https://www.faz.net/aktuell/reise/sonnenfinsternis-2027-warum-man-jetzt-schon-unterkuenfte-buchen-sollte-accg-110848166.html,https://www.faz.net/aktuell/reise/sonnenfinsternis-2027-warum-man-jetzt-schon-unterkuenfte-buchen-sollte-accg-110848166.html,0,www.faz.net,Sonnenfinsternis beobachten: Und ewig lockt die Totalität,"Zur Sonnenfinsternis am 12. August 2026 ist fast alles ausgebucht. Höchste Zeit, sich um ein Quartier zur Totalität am 2. August 2027 zu bemühen, wo die Sonne auf einer Linie von Gibraltar bis zum Jemen verschwindet.",https://media0.faz.net/image/w1200h627/6216cae11f52/w3000h1567x0y248o/032026/1.10848163/mond-statt-sonne-der-himmel.webp,2026-03-10T10:43:34Z,,Langsam ist gut mit Winter. Das wissen auch Reiseanbieter oder einschlägige Vergleichsportale und versuchen daher gerade mit besonderem Elan ihre Klientel mit der magischen Vokabel Frühbucher­rabatt … [+3191 chars],,de,'Sonne'
https://www.faz.net/aktuell/gesellschaft/wie-der-klimawandel-die-spanischen-straende-auffrisst-accg-200532401.html,https://www.faz.net/aktuell/gesellschaft/wie-der-klimawandel-die-spanischen-straende-auffrisst-accg-200532401.html,0,www.faz.net,Bald kein „Playa y Sol“ mehr?: Spanien verzeichnet die ersten Klimaflüchtlinge,In Andalusien verschlingen Wellen eine komplette Küstenpromenade. In Katalonien ist der Zugverkehr gefährdet. Und überall schwinden die Strände. Der Klimawandel am Mittelmeer lässt sich nur noch mit Milliardeninvestitionen stoppen.,https://media0.faz.net/image/w1200h627/d71d18de1b33/w5341h2790x0y385o/202601/43601.0.1630833224/die-zerstoerung-an-der.webp,2026-03-10T10:45:07Z,,"Die alte Geschützstellung stemmt sich den Wellen entgegen. Doch selbst der Betonbunker aus dem spanischen Bürgerkrieg kann nicht verhindern, dass die Gischt in Premià de Mar bis auf die Gleise dahint… [+9663 chars]",,de,'Klimawandel'
https://www.zeit.de/news/2026-03/10/weniger-badetote-aber-zwei-gruppen-sind-staerker-in-gefahr,https://www.zeit.de/news/2026-03/10/weniger-badetote-aber-zwei-gruppen-sind-staerker-in-gefahr,0,www.zeit.de,"Tödliche Badeunfälle: Sommer, Sonne, Lebensgefahr – wieder viele Badetote","Hier finden Sie Informationen zu dem Thema „Tödliche Badeunfälle“. Lesen Sie jetzt „Sommer, Sonne, Lebensgefahr – wieder viele Badetote“.",https://img.zeit.de/news/2026-03/10/weniger-badetote-aber-zwei-gruppen-sind-staerker-in-gefahr-image-group/wide__1300x731,2026-03-10T13:13:31Z,,"Eins ist sicher: Die Flüsse sind es auch im vergangenen Jahr nicht gewesen. Zumindest nicht alle. Und die Seen können ebenfalls gefährlich werden, wenn das kühle Nass zum Baden einlädt. Denn vor alle… [+5566 chars]",,de,'Sonne'
https://www.zeit.de/news/2026-03/11/mehr-tempo-fuers-klima-experten-fordern-rasche-eu-agrarwende,https://www.zeit.de/news/2026-03/11/mehr-tempo-fuers-klima-experten-fordern-rasche-eu-agrarwende,0,www.zeit.de,Risiken durch Klimawandel: Mehr Tempo fürs Klima: Experten fordern rasche EU-Agrarwende,Hier finden Sie Informationen zu dem Thema „Risiken durch Klimawandel“. Lesen Sie jetzt „Mehr Tempo fürs Klima: Experten fordern rasche EU-Agrarwende“.,https://img.zeit.de/news/2026-03/11/mehr-tempo-fuers-klima-experten-fordern-rasche-eu-agrarwende-image-group/wide__1300x731,2026-03-10T23:01:04Z,,Das Agrar- und Ernährungssystem in Europa ist zunehmend durch den Klimawandel bedroht - und verursacht selbst etwa ein Drittel der Netto-Treibhausgasemissionen der Europäischen Union. Mit beiden Prob… [+1245 chars],,de,'Klimawandel'
https://www.stern.de/wirtschaft/news/risiken-durch-klimawandel--mehr-tempo-fuers-klima--experten-fordern-rasche-eu-agrarwende-37209974.html,https://www.stern.de/wirtschaft/news/risiken-durch-klimawandel--mehr-tempo-fuers-klima--experten-fordern-rasche-eu-agrarwende-37209974.html,0,www.stern.de,Risiken durch Klimawandel: Mehr Tempo fürs Klima: Experten fordern rasche EU-Agrarwende,"Überschwemmungen, Dürre, Krankheiten: Der Klimawandel setzt der Landwirtschaft in Europa zu. Gleichzeitig verursacht sie viele CO2-Emissionen. Experten warnen: Die EU nimmt sich der Sache zu wenig an.",https://image.stern.de/37209976/t/C3/v1/w1440/r1.7778/-/11--3flytf5qncv8axs2048jpeg---047f07ae9533892b.jpg,2026-03-10T23:01:04Z,,"Kopiere den aktuellen Link
Zur Merkliste hinzufügen
Überschwemmungen, Dürre, Krankheiten: Der Klimawandel setzt der Landwirtschaft in Europa zu. Gleichzeitig verursacht sie viele CO2-Emissionen. Ex… [+1462 chars]",,de,'Klimawandel'
https://www.tagesspiegel.de/wirtschaft/risiken-durch-klimawandel-mehr-tempo-furs-klima-experten-fordern-rasche-eu-agrarwende-15339719.html,https://www.tagesspiegel.de/wirtschaft/risiken-durch-klimawandel-mehr-tempo-furs-klima-experten-fordern-rasche-eu-agrarwende-15339719.html,0,www.tagesspiegel.de,Risiken durch Klimawandel: Mehr Tempo fürs Klima: Experten fordern rasche EU-Agrarwende,"Überschwemmungen, Dürre, Krankheiten: Der Klimawandel setzt der Landwirtschaft in Europa zu. Gleichzeitig verursacht sie viele CO2-Emissionen. Experten warnen: Die EU nimmt sich der Sache zu wenig an.",https://www.tagesspiegel.de/images/15339718/alternates/BASE_16_9_W1400/1773183740000/risse-im-trockenen-boden-eines-feldes.jpeg,2026-03-10T23:02:21Z,,Das Agrar- und Ernährungssystem in Europa ist zunehmend durch den Klimawandel bedroht - und verursacht selbst etwa ein Drittel der Netto-Treibhausgasemissionen der Europäischen Union. Mit beiden Prob… [+1300 chars],,de,'Klimawandel'
https://www.zeit.de/news/2026-03/11/sonne-regen-und-gewitter-in-bayern-moeglich,https://www.zeit.de/news/2026-03/11/sonne-regen-und-gewitter-in-bayern-moeglich,0,www.zeit.de,"Wetter: Sonne, Regen und Gewitter in Bayern möglich","Hier finden Sie Informationen zu dem Thema „Wetter“. Lesen Sie jetzt „Sonne, Regen und Gewitter in Bayern möglich“.",https://img.zeit.de/news/2026-03/11/sonne-regen-und-gewitter-in-bayern-moeglich-image-group/wide__1300x731,2026-03-11T04:44:09Z,,Nach viel Sonne in den vergangenen Tagen zeigt sich das Wetter in Bayern am Mittwoch etwas wechselhafter. Nach einer ersten Regenphase in der Nacht soll es laut Vorhersage des Deutschen Wetterdienste… [+483 chars],,de,'Sonne'
https://www.basicthinking.de/blog/2026/03/11/startup-check-marvel-fusion/,https://www.basicthinking.de/blog/2026/03/11/startup-check-marvel-fusion/,0,www.basicthinking.de,Marvel Fusion: Münchner Start-up will die Sonne auf die Erde holen,"Der Beitrag Marvel Fusion: Münchner Start-up will die Sonne auf die Erde holen erschien zuerst beim Online-Magazin BASIC thinking. Über unseren Newsletter UPDATE startest du jeden Morgen bestens informiert in den Tag.
In der Serie „Start-up-Check!“ nehmen wir…",https://www.basicthinking.de/blog/wp-content/uploads/2026/03/marvel-fusion.jpg,2026-03-11T12:30:41Z,,In der Serie Start-up-Check!“ nehmen wir regelmäßig die Geschäftsmodelle von Start-ups unter die Lupe. Was steckt hinter dem Unternehmen? Was macht das Start-up so besonders und was gibt es zu kritis… [+9234 chars],,de,'Sonne'
https://www.diepresse.com/20660515/das-comeback-der-baeume-ein-bisschen-schmutz-darf-sein,https://www.diepresse.com/20660515/das-comeback-der-baeume-ein-bisschen-schmutz-darf-sein,0,www.diepresse.com,Das Comeback der Bäume: „Ein bisschen Schmutz darf sein“ [premium],Das gute alte Blätterdach läuft – trotz Ängsten vor Schmutz und Laub – anderen Schattenspendern den Rang ab. Obwohl: Diese können auch immer mehr.,https://img.diepresse.com/public/incoming/leuifx-00405poolimfruehling2jpg/alternates/DPR_SOCIAL_MAGAZIN/004_05_Pool_im_Fruehling__2_.jpg,2026-03-11T20:22:06Z,,Der einst viel besungene Platz an der Sonne hat vor allem in Städten einiges an Popularität abgegeben: an das ebenso viel zitierte schattige Plätzchen. Und das darf in heißen Sommern gerne größer aus… [+8897 chars],,de,'Sonne'
https://www.zeit.de/news/2026-03/13/die-erde-wird-langsamer-der-brems-effekt-des-klimawandels,https://www.zeit.de/news/2026-03/13/die-erde-wird-langsamer-der-brems-effekt-des-klimawandels,0,www.zeit.de,Längere Tage: Die Erde wird langsamer – Der Brems-Effekt des Klimawandels,Hier finden Sie Informationen zu dem Thema „Längere Tage“. Lesen Sie jetzt „Die Erde wird langsamer – Der Brems-Effekt des Klimawandels“.,https://img.zeit.de/news/2026-03/13/die-erde-wird-langsamer-der-brems-effekt-des-klimawandels-image-group/wide__1300x731,2026-03-13T07:48:51Z,,In den vergangenen Millionen Jahren hat sich die Erdrotation laut einer Studie fast noch nie so deutlich abgebremst wie in den vergangenen Jahrzehnten. Forscher in Österreich und der Schweiz sehen da… [+2170 chars],,de,'Klimawandel'
https://www.tagesspiegel.de/wissen/langere-tage-die-erde-wird-langsamer--der-brems-effekt-des-klimawandels-15351981.html,https://www.tagesspiegel.de/wissen/langere-tage-die-erde-wird-langsamer--der-brems-effekt-des-klimawandels-15351981.html,0,www.tagesspiegel.de,Längere Tage: Die Erde wird langsamer – Der Brems-Effekt des Klimawandels,"Die Erde wird minimal, aber messbar langsamer. Die Tageslänge auf unserem Planeten nimmt zu. Forscher führen die aktuellen Veränderungen auf menschliche Faktoren zurück.",https://www.tagesspiegel.de/images/15351980/alternates/BASE_16_9_W1400/1773388214000/klimawandel-bremst-erde.jpeg,2026-03-13T07:50:14Z,,In den vergangenen Millionen Jahren hat sich die Erdrotation laut einer Studie fast noch nie so deutlich abgebremst wie in den vergangenen Jahrzehnten. Forscher in Österreich und der Schweiz sehen da… [+2224 chars],,de,'Erderwärmung'
https://www.faz.net/aktuell/wissen/erde-klima/der-klimawandel-bremst-die-erdrotation-accg-200629251.html,https://www.faz.net/aktuell/wissen/erde-klima/der-klimawandel-bremst-die-erdrotation-accg-200629251.html,0,www.faz.net,Erde wird langsamer: Der Klimawandel bremst die Erdrotation,"Die Tageslänge auf unserem Planeten nimmt zu – wenig zwar, aber messbar. Die aktuellen Veränderungen sind auf menschliche Faktoren zurückzuführen.",https://media0.faz.net/image/w1200h627/83683453dd26/w3000h1567x0y373o/202503/43601.0.892817249/eisschollen-in-der-arktis.webp,2026-03-13T10:05:04Z,,In den vergangenen Millionen Jahren hat sich die Erdrotation fast noch nie so deutlich abgebremst wie in den vergangenen Jahrzehnten. Das berichten Forscher aus Österreich und der Schweiz im Journal … [+2377 chars],,de,'Klimawandel'
https://taz.de/Studie-zu-Klimaschaeden/!6161276/,https://taz.de/Studie-zu-Klimaschaeden/!6161276/,0,taz.de,Studie zu Klimaschäden: Klimawandel erhöht die Staatsverschuldung,"Die Folgen der Erderwärmung schlagen sich auch wirtschaftlich nieder. Um Klimaschäden künftig entgegenzuwirken, muss die EU stärker investieren.",https://taz.de/picture/8307899/1200/40687208.jpeg,2026-03-13T19:00:00Z,,"Die Folgen der Erderwärmung schlagen sich auch wirtschaftlich nieder. Um Klimaschäden künftig entgegenzuwirken, muss die EU stärker investieren. mehr...",,de,'Klimawandel'
https://taz.de/Erderwaermung-hat-sich-stark-beschleunigt/!6162467/,https://taz.de/Erderwaermung-hat-sich-stark-beschleunigt/!6162467/,0,taz.de,Erderwärmung hat sich stark beschleunigt: Die 3 wichtigsten Klima-News der Woche,Der Iran-Krieg treibt die Ölpreise nach oben. Chinas 5-Jahres-Plan ist wenig ambitioniert beim Klimaschutz. Die Erderwärmung hat an Tempo gewonnen.,https://taz.de/picture/8317829/1200/00-QuadratMitTaz.jpeg,2026-03-14T15:24:00Z,,Der Iran-Krieg treibt die Ölpreise nach oben. Chinas 5-Jahres-Plan ist wenig ambitioniert beim Klimaschutz. Die Erderwärmung hat an Tempo gewonnen. mehr...,,de,'Erderwärmung'
