index,url,valid,domain,title,description,image,published,archive,content,quote,language,keyword
https://www.morgenpost.de/panorama/article407917668/insel-fuer-superreiche-die-preise-stellen-alles-in-den-schatten.html,https://www.morgenpost.de/panorama/article407917668/insel-fuer-superreiche-die-preise-stellen-alles-in-den-schatten.html,0,www.morgenpost.de,Insel für Superreiche: Die Preise stellen alles in den Schatten,Im Zwergstaat Monaco lockt das vom Meer abgetrotzte Gebiet „Mareterra“ die Reichsten der Reichen. Die Preise sind astronomisch hoch.,https://img.sparknews.funkemedien.de/407917914/407917914_1735761240_v16_9_1600.jpeg,2025-01-01T19:54:01Z,,"Berlin. Im Zwergstaat Monaco lockt das vom Meer abgetrotzte Gebiet Mareterra die Reichsten der Reichen. Die Preise sind astronomisch hoch.
Monaco es klingt nach Sonne, nach Meer, nach Promis und ein… [+6539 chars]",,de,'Schatten'
https://www.focus.de/panorama/rueckkehr-nach-deutschland-gelaeuterte-auswanderer-wir-sind-deutscher-als-wir-es-uns-eingestehen-wollten_id_260603106.html,https://www.focus.de/panorama/rueckkehr-nach-deutschland-gelaeuterte-auswanderer-wir-sind-deutscher-als-wir-es-uns-eingestehen-wollten_id_260603106.html,0,www.focus.de,"Rückkehr nach Deutschland - Geläuterte Auswanderer: „Wir sind deutscher, als wir es uns eingestehen wollten“","Es gibt einige Menschen, die von einem Leben im Ausland träumen. Sonne, Strand, bessere Arbeitsbedingungen - das ist die Idealvorstellung. Die erfüllt sich nicht immer. Mehrere Auswanderer berichten jetzt, warum sie zurück nach Deutschland gekommen sind.",https://p6.focus.de/img/fotos/id_11647754/rentner-auswandern-fin-vt.jpg?im=Crop%3D%280%2C138%2C4515%2C2257%29%3BResize%3D%281200%2C627%29&impolicy=perceptual&quality=mediumHigh&hash=fde57a7f16489357792774eb0dea55a5948ed01358d27f33d02fa0dbd9ec9f5b,2025-01-02T12:17:08Z,,"Es gibt einige Menschen, die von einem Leben im Ausland träumen. Sonne, Strand, bessere Arbeitsbedingungen - das ist die Idealvorstellung. Die erfüllt sich nicht immer. Mehrere Auswanderer berichten … [+2684 chars]",,de,'Sonne'
https://www.focus.de/earth/report/umweltschutz-und-bekaempfung-des-klimawandels-7-fortschritte-im-jahr-2024-die-hoffnung-machen_id_260586333.html,https://www.focus.de/earth/report/umweltschutz-und-bekaempfung-des-klimawandels-7-fortschritte-im-jahr-2024-die-hoffnung-machen_id_260586333.html,0,www.focus.de,"Kohle-Aus und Sonne-Boom - Sieben bahnbrechende Klima-Trends, die Hoffnung machen","Auch, wenn es angesichts der Ereignisse in diesem Jahr nicht so wirken mag: 2024 lieferte einige Durchbrüche fürs Klima, die Sie vielleicht verpasst haben.Von FOCUS-online-Redakteurin Stefanie Haas",https://p6.focus.de/img/fotos/id_260469794/ns18350291-ngsppamz-andre-dib-21092022-dji-0089-1-.jpg?im=Crop%3D%280%2C577%2C3465%2C1731%29%3BResize%3D%281200%2C627%29&impolicy=perceptual&quality=mediumHigh&hash=a1d0a563bae210518f64d6fd090299693a88b906efaa12862a309f27753dc69f,2025-01-02T12:46:16Z,,"Auch, wenn es angesichts der Ereignisse in diesem Jahr nicht so wirken mag: 2024 lieferte einige Durchbrüche fürs Klima, die Sie vielleicht verpasst haben.Hand aufs Herz: Es ist schwer geworden, den … [+8204 chars]",,de,'Sonne'
https://www.n-tv.de/sport/Lions-feiern-Statement-Sieg-und-einem-Profi-gelingt-dabei-Grosses-article25468559.html,https://www.n-tv.de/sport/Lions-feiern-Statement-Sieg-und-einem-Profi-gelingt-dabei-Grosses-article25468559.html,0,www.n-tv.de,Als Topteam in die Playoffs: Lions feiern Statement-Sieg - und einem Profi gelingt dabei Großes,Die Detroit Lions putzen den direkten Konkurrenten um den Divisionstitel weg und sparen sich in den Playoffs eine Runde. Der deutsche Widereceiver Amon-Ra St. Brown steht dabei im Schatten eines entfesselten Teamkollegen.,https://bilder2.n-tv.de/img/incoming/crop25468569/6981328893-cImg_16_9-w1200/imago1057175739.jpg,2025-01-06T06:14:47Z,,Die Detroit Lions putzen den direkten Konkurrenten um den Divisionstitel weg und sparen sich in den Playoffs eine Runde. Der deutsche Widereceiver Amon-Ra St. Brown steht dabei im Schatten eines entf… [+2459 chars],,de,'Schatten'
https://www.stern.de/panorama/wetter/wetter-heute--so-wird-das-wetter-am-dienstag---die-vorhersage-35359004.html,https://www.stern.de/panorama/wetter/wetter-heute--so-wird-das-wetter-am-dienstag---die-vorhersage-35359004.html,0,www.stern.de,"Vorhersage: Regen, Sturm und Glätte – so wird das Wetter am Dienstag","Gibt es Regenschauer oder Sonnenschein? Der stern verrät Ihnen, wie das Wetter heute bei Ihnen im Ort wird – mit der offiziellen Vorhersage und interaktiven Karten.",https://image.stern.de/35359010/t/bs/v1/w1440/r1.7778/-/wetter-dienstag-heute.jpg,2025-01-07T04:57:00Z,,"Kopiere den aktuellen Link
Gibt es Regenschauer oder Sonnenschein? Der stern verrät Ihnen, wie das Wetter heute bei Ihnen im Ort wird mit der offiziellen Vorhersage und interaktiven Karten.
Wie wir… [+1368 chars]",,de,'Sonne'
https://www.tagesspiegel.de/sport/blitz-und-donner-beim-vendee-globe-boris-herrmann-verliert-einen-teil-der-elektronik-im-gewitter-12982573.html,https://www.tagesspiegel.de/sport/blitz-und-donner-beim-vendee-globe-boris-herrmann-verliert-einen-teil-der-elektronik-im-gewitter-12982573.html,0,www.tagesspiegel.de,Blitz und Donner beim Vendée Globe: Boris Herrmann verliert einen Teil der Elektronik im Gewitter,"Der letzte Akt des Solorennens um die Welt steht bevor. Der Deutsche Segler Boris Herrmann zeigt navigatorisches Geschick, entgeht aber nur knapp einer Katastrophe.",https://www.tagesspiegel.de/images/12982537/alternates/BASE_16_9_W1400/1736347637000/vg2024-2501062221-imo-malizia-whatsapp-image-202-low-resolution.jpeg,2025-01-08T15:15:18Z,,"Wenn es noch eines Beweises bedurfte, dass Boris Herrmann bei seinem zweiten Vendée Globe Race zu den Besten zählt, dann lieferte ihn seine jüngste Kletteraktion in den Mast. Was für ein Unterschied … [+5690 chars]",,de,'Gewitter'
https://www.morgenpost.de/wirtschaft/article408052656/frauen-vorstaende-dax-konzern-rekordhoch-gehalt-maenner-frauenquote-wirtschaft-unternehmen.html,https://www.morgenpost.de/wirtschaft/article408052656/frauen-vorstaende-dax-konzern-rekordhoch-gehalt-maenner-frauenquote-wirtschaft-unternehmen.html,0,www.morgenpost.de,Frauen in Top-Vorständen: Gehaltsvergleich überrascht,Börsennotierte Konzerne haben so viele weibliche Vorstände wie nie. Ihr Gehalt stellte zuletzt das der Männer in den Schatten.,https://img.sparknews.funkemedien.de/408052576/408052576_1736527265_v16_9_1600.jpeg,2025-01-10T16:41:06Z,,"Berlin. Börsennotierte Konzerne haben so viele weibliche Vorstände wie nie. Ihr Gehalt stellte zuletzt das der Männer in den Schatten.
Zwar nicht bei den Vorstandschefs, aber immerhin als Mitglieder… [+4013 chars]",,de,'Schatten'
https://www.tagesschau.de/ausland/europa/russische-schattenflotte-ostsee-100.html,https://www.tagesschau.de/ausland/europa/russische-schattenflotte-ostsee-100.html,0,www.tagesschau.de,"Schattenflotte in der Ostsee: ""Ein Krieg ganz in unserer Nähe""","An die tausend russische ""Schattenschiffe"" haben letztes Jahr die Ostsee durchquert, umgingen Embargos und sabotierten Europas Infrastruktur. Estnische Beobachter sind beunruhigt. Von Julia Wäschenbach.",https://images.tagesschau.de/image/adbe2459-5b43-4b69-927b-e32fb6bd74f1/AAABlFTcBS4/AAABkZLhkrw/16x9-1280/schiff-schattenflotte-100.jpg,2025-01-11T10:14:53Z,,"Stand: 11.01.2025 11:14 Uhr
An die tausend russische ""Schattenschiffe"" haben letztes Jahr die Ostsee durchquert, umgingen Embargos und sabotierten Europas Infrastruktur. Estnische Beobachter sind be… [+6070 chars]",,de,'Schatten'
https://www.tagesspiegel.de/sport/gewitter-und-starkregen-unwetter-niemeier-match-bei-australian-open-verschoben-13003750.html,https://www.tagesspiegel.de/sport/gewitter-und-starkregen-unwetter-niemeier-match-bei-australian-open-verschoben-13003750.html,0,www.tagesspiegel.de,Gewitter und Starkregen: Unwetter: Niemeier-Match bei Australian Open verschoben,"Die Australian Open hatten kaum begonnen, da wurden sie auch schon unterbrochen. Ein Unwetter machte die Außenplätze zunächst unbespielbar. Das Match einer deutschen Spielerin wurde gestrichen.",https://www.tagesspiegel.de/images/13003747/alternates/BASE_16_9_W1400/1736647247000/australian-open.jpeg,2025-01-12T02:00:48Z,,Das Unwetter zum Start der Australian Open hat den Spielplan kräftig durcheinander gewirbelt. Das Erstrunden-Match der Dortmunder Tennisspielerin Jule Niemeier gegen die polnische Qualifikantin Maja … [+2824 chars],,de,'Gewitter'
