index,url,valid,domain,title,description,image,published,archive,content,quote,language,keyword
https://www.stern.de/gesellschaft/regional/berlin-brandenburg/1--mai--auftakt-fuer-berliner-freibad-saison-37359724.html,https://www.stern.de/gesellschaft/regional/berlin-brandenburg/1--mai--auftakt-fuer-berliner-freibad-saison-37359724.html,0,www.stern.de,1. Mai: Auftakt für Berliner Freibad-Saison,Berlin (bb) - Berlin startet in die Freibadsaison: In drei Bädern können Schwimmerinnen und Schwimmer ab heute wieder im Freien ihre Bahnen ziehen. Neben,https://image.stern.de/37359726/t/et/v1/w1440/r1.7778/-/01--2zvyckzgq3v3axs2048jpeg---d8bb98965dcd7541.jpg,2026-05-01T03:00:14Z,,"Kopiere den aktuellen Link
Zur Merkliste hinzufügen
In der Hauptstadt beginnt die Freibadsaison. Jedoch öffnen noch nicht alle Sommerbäder. Wo es jetzt losgeht und was in dieser Saison neu ist.
Be… [+1251 chars]",,de,'Freibad'
https://www.tagesspiegel.de/berlin/1-mai-auftakt-fur-berliner-freibad-saison-15546458.html,https://www.tagesspiegel.de/berlin/1-mai-auftakt-fur-berliner-freibad-saison-15546458.html,0,www.tagesspiegel.de,1. Mai: Auftakt für Berliner Freibad-Saison,In der Hauptstadt beginnt die Freibadsaison. Jedoch öffnen noch nicht alle Sommerbäder. Wo es jetzt losgeht und was in dieser Saison neu ist.,https://www.tagesspiegel.de/images/15546457/alternates/BASE_16_9_W1400/1777604509000/berliner-bader-betriebe-vor-der-saisoneroffnung.jpeg,2026-05-01T03:01:50Z,,Berlin startet in die Freibadsaison: In drei Bädern können Schwimmerinnen und Schwimmer ab heute wieder im Freien ihre Bahnen ziehen. Neben dem Sommerbad Kreuzberg (Prinzenbad) öffnen auch das Kombib… [+1147 chars],,de,'Freibad'
https://www.tagesspiegel.de/berlin/baden-in-berlin-am-1-mai-diese-freibader-haben-ab-heute-geoffnet-15546458.html,https://www.tagesspiegel.de/berlin/baden-in-berlin-am-1-mai-diese-freibader-haben-ab-heute-geoffnet-15546458.html,0,www.tagesspiegel.de,Baden in Berlin am 1. Mai: Diese Freibäder haben ab heute geöffnet,In der Hauptstadt beginnt die Freibadsaison am 1. Mai. Jedoch öffnen noch nicht alle Sommerbäder. Wo es jetzt losgeht und was in dieser Saison neu ist.,https://www.tagesspiegel.de/images/15546457/alternates/BASE_16_9_W1400/1777604509000/berliner-bader-betriebe-vor-der-saisoneroffnung.jpeg,2026-05-01T03:01:50Z,,Berlin startet in die Freibadsaison: In drei Bädern können Schwimmerinnen und Schwimmer ab heute wieder im Freien ihre Bahnen ziehen. Neben dem Sommerbad Kreuzberg (Prinzenbad) öffnen auch das Kombib… [+1384 chars],,de,'Freibad'
https://www.stern.de/gesellschaft/regional/sachsen-anhalt/wetter--sachsen-anhalt-startet-sonnig-ins-feiertagswochenende-37359930.html,https://www.stern.de/gesellschaft/regional/sachsen-anhalt/wetter--sachsen-anhalt-startet-sonnig-ins-feiertagswochenende-37359930.html,0,www.stern.de,Wetter: Sachsen-Anhalt startet sonnig ins Feiertagswochenende,Sonne satt und steigende Temperaturen: In Sachsen-Anhalt bleibt das Wetter am Feiertagswochenende sommerlich. Am Sonntag sind Schauer und Gewitter möglich.,https://image.stern.de/37359932/t/re/v1/w1440/r1.7778/-/01--b4vclcybvov10axs2048jpeg---cd9b24da9f8c1707.jpg,2026-05-01T06:49:13Z,,"Kopiere den aktuellen Link
Zur Merkliste hinzufügen
Sonne satt und steigende Temperaturen: In Sachsen-Anhalt bleibt das Wetter am Feiertagswochenende sommerlich. Am Sonntag sind Schauer und Gewitte… [+865 chars]",,de,'Sonne'
https://www.morgenpost.de/berlin/article411872001/freibadsaison-in-berlin-startet-diese-baeder-haben-ab-heute-geoeffnet.html,https://www.morgenpost.de/berlin/article411872001/freibadsaison-in-berlin-startet-diese-baeder-haben-ab-heute-geoeffnet.html,0,www.morgenpost.de,Freibadsaison in Berlin startet: Diese Bäder haben ab heute geöffnet,Mehrere Berliner Freibäder öffnen passend zum sommerlichen Wetter ihre Pforten. Welche Neuerung beim Einlass die Schwimmer erwartet.,https://img.sparknews.funkemedien.de/411455148/411455148_1777623602_v16_9_1600.jpeg,2026-05-01T08:18:53Z,,In drei Freibädern in Berlin können Schwimmerinnen und Schwimmer ab heute wieder im Freien ihre Bahnen ziehen. Neben dem Sommerbad Kreuzberg (Prinzenbad) öffnen auch das Kombibad Seestraße im Wedding… [+1071 chars],,de,'Freibad'
https://www.stern.de/gesellschaft/regional/niedersachsen-bremen/wetter--sonne-und-gewitter-am-ersten-mai-wochenende-in-niedersachsen-37360184.html,https://www.stern.de/gesellschaft/regional/niedersachsen-bremen/wetter--sonne-und-gewitter-am-ersten-mai-wochenende-in-niedersachsen-37360184.html,0,www.stern.de,Wetter: Sonne und Gewitter am ersten Mai-Wochenende in Niedersachsen,Hannover (lni) - Niedersachsen kann sich am langen Wochenende auf frühlingshafte Temperaturen und Sonne freuen. Regen bleibe Samstag und Sonntag jedoch,https://image.stern.de/37360186/t/Jv/v1/w1440/r1.7778/-/01--zeiyxa2bs6v5axs2048jpeg---742613cddb03a92d.jpg,2026-05-01T09:06:42Z,,"Kopiere den aktuellen Link
Zur Merkliste hinzufügen
Heiteres Wetter lädt im Süden Niedersachsens am langen Wochenende zum Herausgehen ein. Für den Nordwesten sieht die Vorhersage regnerischer aus.… [+1086 chars]",,de,'Gewitter'
https://www.stern.de/gesellschaft/regional/nordrhein-westfalen/wetter--erstes-maiwochenende--schauer-und-gewitter-im-anmarsch-37360240.html,https://www.stern.de/gesellschaft/regional/nordrhein-westfalen/wetter--erstes-maiwochenende--schauer-und-gewitter-im-anmarsch-37360240.html,0,www.stern.de,Wetter: Erstes Maiwochenende: Schauer und Gewitter im Anmarsch,"Ausgerechnet jetzt Aprilwetter? Während zum Feiertag noch strahlender Sonnenschein nach draußen lockt, bringt der Rest des langen ersten Maiwochenendes Regen und gewittrige Luft nach NRW.",https://image.stern.de/37360242/t/Aj/v1/w1440/r1.7778/-/01--qmuzfcd2ulv12axs2048jpeg---7f33f03d8ab02894.jpg,2026-05-01T09:21:31Z,,"Kopiere den aktuellen Link
Zur Merkliste hinzufügen
Ausgerechnet jetzt Aprilwetter? Während zum Feiertag noch strahlender Sonnenschein nach draußen lockt, bringt der Rest des langen ersten Maiwoche… [+1322 chars]",,de,'Sonne'
https://www.zeit.de/news/2026-05/01/erstes-maiwochenende-schauer-und-gewitter-im-anmarsch,https://www.zeit.de/news/2026-05/01/erstes-maiwochenende-schauer-und-gewitter-im-anmarsch,0,www.zeit.de,Wetter: Erstes Maiwochenende: Schauer und Gewitter im Anmarsch,Hier finden Sie Informationen zu dem Thema „Wetter“. Lesen Sie jetzt „Erstes Maiwochenende: Schauer und Gewitter im Anmarsch“.,https://img.zeit.de/news/2026-05/01/erstes-maiwochenende-schauer-und-gewitter-im-anmarsch-image-group/wide__1300x731,2026-05-01T09:21:31Z,,Nach einem sommerlich anmutenden Mai-Feiertag kündigen sich ab Samstag zunehmend Wolken und Schauer an. Während die Menschen in Nordrhein-Westfalen mit strahlend blauem Himmel und Temperaturen bis zu… [+1118 chars],,de,'Gewitter'
https://www.zeit.de/news/2026-05/01/auf-sonne-folgen-regenwolken-und-vereinzelte-gewitter,https://www.zeit.de/news/2026-05/01/auf-sonne-folgen-regenwolken-und-vereinzelte-gewitter,0,www.zeit.de,Wetteraussichten: Auf Sonne folgen Regenwolken und vereinzelte Gewitter,Hier finden Sie Informationen zu dem Thema „Wetteraussichten“. Lesen Sie jetzt „Auf Sonne folgen Regenwolken und vereinzelte Gewitter“.,https://img.zeit.de/news/2026-05/01/auf-sonne-folgen-regenwolken-und-vereinzelte-gewitter-image-group/wide__1300x731,2026-05-01T11:20:17Z,,"Nach einem Hauch von Sommer am Maifeiertag erwartet die Menschen am Wochenende wieder vermehrt Regen und Wolken. Wie der Deutsche Wetterdienst (DWD) mitteilte, werden am Samstag in Rheinland-Pfalz un… [+1037 chars]",,de,'Gewitter'
https://www.morgenpost.de/ratgeber-wissen/article411852429/haut-sonnencreme-sonnenschutz-pickel-akne-aerztin-entlarvt-haeufigen-fehler-bei-problemhaut.html,https://www.morgenpost.de/ratgeber-wissen/article411852429/haut-sonnencreme-sonnenschutz-pickel-akne-aerztin-entlarvt-haeufigen-fehler-bei-problemhaut.html,0,www.morgenpost.de,Sonnencreme & Pickel: Ärztin entlarvt häufigen Fehler „bei Problemhaut“,"Die falsche Sonnencreme kann Pickel begünstigen. Dr. Yael Adler verrät, wie Aknehaut wirksam geschützt wird und was gute Produkte ausmacht.",https://img.sparknews.funkemedien.de/411854773/411854773_1777538647_v16_9_1600.jpeg,2026-05-01T15:00:00Z,,"Sommertage mit Sonnenschein was für viele nach purer Entspannung klingt, wird für Personen mit Akne zur Herausforderung. Viele fürchten neue Ausbrüche durch fettige Texturen. Fettige Aknehaut braucht… [+821 chars]",,de,'Sonnencreme'
https://www.bild.de/news/wetter/temperatursturz-im-anmarsch-gewitterfront-laeutet-wetterumschwung-ein-69f32a536ae0ff2bebbd3a27,https://www.bild.de/news/wetter/temperatursturz-im-anmarsch-gewitterfront-laeutet-wetterumschwung-ein-69f32a536ae0ff2bebbd3a27,0,www.bild.de,Temperatursturz im Anmarsch - Gewitterfront läutet Wetterumschwung ein,"Der Frühling kühlt sich nächste Woche deutlich ab, es drohen Gewitter und Starkregen.","https://images.bild.de/69f32a536ae0ff2bebbd3a27/609a9bad5208049d11126c048827d810,8b1c9db9?w=1280",2026-05-01T17:15:05Z,,"TTS-Player überspringenArtikel weiterlesenBerlin Sonnenschein und fast 30 Grad! Der Wonnemonat Mai ist mit Sommerwetter gestartet. Doch schon ab Samstagnachmittag zeigt er in manchen Regionen, dass e… [+2731 chars]",,de,'Gewitter'
https://www.stern.de/gesellschaft/regional/bayern/wetterbericht--bayern-startet-warm-ins-erste-mai-wochenende-37361634.html,https://www.stern.de/gesellschaft/regional/bayern/wetterbericht--bayern-startet-warm-ins-erste-mai-wochenende-37361634.html,0,www.stern.de,Wetterbericht: Bayern startet warm ins erste Mai-Wochenende,Das Wetter im Freistaat zeigt sich am Wochenende mit viel Sonne und steigenden Temperaturen von seiner Schokoladenseite. Doch zum Wochenbeginn wird es wechselhafter.,https://image.stern.de/37361636/t/3t/v1/w1440/r1.7778/-/02--xcwugwd5plv4axs2048jpeg---f8dd45acfcb30a49.jpg,2026-05-02T05:26:36Z,,"Kopiere den aktuellen Link
Zur Merkliste hinzufügen
Das Wetter im Freistaat zeigt sich am Wochenende mit viel Sonne und steigenden Temperaturen von seiner Schokoladenseite. Doch zum Wochenbeginn wi… [+831 chars]",,de,'Sonne'
https://www.zeit.de/news/2026-05/02/letzter-sonnentag-im-suedwesten-wann-die-schauer-anrollen,https://www.zeit.de/news/2026-05/02/letzter-sonnentag-im-suedwesten-wann-die-schauer-anrollen,0,www.zeit.de,Wetterausblick: Letzter Sonnentag im Südwesten – wann die Schauer anrollen,Hier finden Sie Informationen zu dem Thema „Wetterausblick“. Lesen Sie jetzt „Letzter Sonnentag im Südwesten – wann die Schauer anrollen“.,https://img.zeit.de/news/2026-05/02/letzter-sonnentag-im-suedwesten-wann-die-schauer-anrollen-image-group/wide__1300x731,2026-05-02T05:34:17Z,,"Wer im Südwesten noch einmal Sonne satt genießen will, bekommt dazu ein vorerst letztes Mal Gelegenheit, danach kommt der Regen wieder nach Baden-Württemberg zurück. Der Deutsche Wetterdienst (DWD) v… [+1506 chars]",,de,'Sonne'
https://www.stern.de/gesellschaft/regional/baden-wuerttemberg/wetterausblick--letzter-sonnentag-im-suedwesten---wann-die-schauer-anrollen-37361638.html,https://www.stern.de/gesellschaft/regional/baden-wuerttemberg/wetterausblick--letzter-sonnentag-im-suedwesten---wann-die-schauer-anrollen-37361638.html,0,www.stern.de,Wetterausblick: Letzter Sonnentag im Südwesten – wann die Schauer anrollen,"Ein vorerst letztes Mal Sonne tanken: Der Südwesten bekommt noch einen warmen, freundlichen Tag – bevor Schauer, Gewitter und kühlere Luft das Ende des Frühlingswetters einläuten.",https://image.stern.de/37361640/t/u5/v1/w1440/r1.7778/-/02--xzznqg6ernv7axs2048jpeg---fce8536c2841eb7e.jpg,2026-05-02T05:34:17Z,,"Kopiere den aktuellen Link
Zur Merkliste hinzufügen
Ein vorerst letztes Mal Sonne tanken: Der Südwesten bekommt noch einen warmen, freundlichen Tag bevor Schauer, Gewitter und kühlere Luft das Ende… [+1700 chars]",,de,'Sonne'
https://www.stern.de/gesellschaft/regional/berlin-brandenburg/wetter--warmes-wochenende-in-berlin-und-brandenburg-37361642.html,https://www.stern.de/gesellschaft/regional/berlin-brandenburg/wetter--warmes-wochenende-in-berlin-und-brandenburg-37361642.html,0,www.stern.de,Wetter: Warmes Wochenende in Berlin und Brandenburg,Potsdam (bb) - In Berlin und Brandenburg steigen die Temperaturen am Wochenende auf hochsommerliches Niveau. Bei viel Sonne können Spitzenwerte von 30,https://image.stern.de/37361644/t/i8/v1/w1440/r1.7778/-/02--6kcpwu6y5gv7axs2048jpeg---cd5fed3127a36359.jpg,2026-05-02T05:35:13Z,,"Kopiere den aktuellen Link
Zur Merkliste hinzufügen
Sommerfeeling pur: Bis zu 30 Grad und Sonne satt am Wochenende könnte es Zeit für ein Eis sein. Doch am Sonntagabend drohen Blitz und Donner.
In… [+695 chars]",,de,'Sonne'
https://www.tagesspiegel.de/berlin/wetter-warmes-wochenende-in-berlin-und-brandenburg-15548085.html,https://www.tagesspiegel.de/berlin/wetter-warmes-wochenende-in-berlin-und-brandenburg-15548085.html,0,www.tagesspiegel.de,Wetter: Warmes Wochenende in Berlin und Brandenburg,Sommerfeeling pur: Bis zu 30 Grad und Sonne satt – am Wochenende könnte es Zeit für ein Eis sein. Doch am Sonntagabend drohen Blitz und Donner.,https://www.tagesspiegel.de/images/15548084/alternates/BASE_16_9_W1400/1777700175000/wetter-berlin.jpeg,2026-05-02T05:36:15Z,,"In Berlin und Brandenburg steigen die Temperaturen am Wochenende auf hochsommerliches Niveau. Bei viel Sonne können Spitzenwerte von 30 Grad erreicht werden, wie der Deutsche Wetterdienst (DWD) mitte… [+591 chars]",,de,'Sonne'
https://stadt-bremerhaven.de/ugreen-finetrack-pro-solar-finder-der-laedt-in-der-sonne-wieder-auf/,https://stadt-bremerhaven.de/ugreen-finetrack-pro-solar-finder-der-laedt-in-der-sonne-wieder-auf/,0,stadt-bremerhaven.de,UGREEN FineTrack Pro Solar Finder: Der lädt in der Sonne wieder auf,"Ugreen bringt mit dem FineTrack Pro Solar Finder einen neuen Tracker auf den Markt, der sich optisch an den bekannten Lösungen orientiert, aber eine Besonderheit mitbringt. Das kleine Gadget setzt auf Solarenergie, um die Laufzeit zu verlängern, wobei eine Ba…",https://stadt-bremerhaven.de/wp-content/uploads/2026/04/61No18mRy-L._AC_SL1500_-2.jpg,2026-05-02T06:00:59Z,,"Ugreen bringt mit dem FineTrack Pro Solar Finder einen neuen Tracker auf den Markt, der sich optisch an den bekannten Lösungen orientiert, aber eine Besonderheit mitbringt. Das kleine Gadget setzt au… [+1203 chars]",,de,'Sonne'
https://wien.orf.at/stories/3352461/,https://wien.orf.at/stories/3352461/,0,wien.orf.at,Hitze-Hilfe für Obdachlose,"Die Winterhilfe für Obdachlose ist beendet. Nach der Kälte werden nun zunehmend Sonne und Hitze zum Problem dieser Menschen. Trotzdem gibt es für den Sommer – fast – keine Notschlafstellen. Die Stadt verweist auf ein anderes, ganzjähriges Angebot.",https://ibs.orf.at/wie?image=https%3A%2F%2Foekastatic.orf.at%2Fmims%2F2024%2F28%2F43%2Fcrops%2Fw%3D1200%2Ch%3D627%2Cq%3D75%2F2274052_master_865043_downloadmedium.jpg%3Fs%3Dc9d96586c72ba08bb8373472ea38adcc72d7e813,2026-05-02T06:05:00Z,,"Rund 300 Schlafstellen in vier Notquartieren stehen im Sommer zur Verfügung, allerdings nur für besonders vulnerable obdach- oder wohnungslose Gruppen. Die Schlafstellen werden ebenso wie jene im Win… [+1700 chars]",,de,'Sonne'
https://www.bild.de/news/inland/sommer-wetter-tag-der-sonne-deutschland-streckt-die-koepfe-zum-himmel-69f30c504c47c7adc671d310,https://www.bild.de/news/inland/sommer-wetter-tag-der-sonne-deutschland-streckt-die-koepfe-zum-himmel-69f30c504c47c7adc671d310,0,www.bild.de,Erstes Mini-Sommer-Wochenende - Sonne! Deutschland streckt Köpfe gen Himmel,Bis zu 28 Grad und T‑Shirt‑Wetter: Deutschland genießt den Mini‑Sommer am ersten Mai-Wochenende.,"https://images.bild.de/69f30c504c47c7adc671d310/3d559e3deb0d0b15431bb0271a442618,453a49f8?w=1280",2026-05-02T09:02:40Z,,"TTS-Player überspringenArtikel weiterlesenJa, Mai das fühlt sich ja schon richtig nach Sommer an! Strahlende Sonne, blauer Himmel, T-Shirt-Wetter. Dieses Wochenende ist der reinste Kurzurlaub für die… [+12391 chars]",,de,'Hitze'
https://www.zeit.de/news/2026-05/02/gewitter-und-abkuehlung-in-den-naechsten-tagen,https://www.zeit.de/news/2026-05/02/gewitter-und-abkuehlung-in-den-naechsten-tagen,0,www.zeit.de,Wetterausblick: Gewitter und Abkühlung in den nächsten Tagen,Hier finden Sie Informationen zu dem Thema „Wetterausblick“. Lesen Sie jetzt „Gewitter und Abkühlung in den nächsten Tagen“.,https://img.zeit.de/news/2026-05/02/gewitter-und-abkuehlung-in-den-naechsten-tagen-image-group/wide__1300x731,2026-05-02T10:04:46Z,,"Die sonnige Phase nähert sich in Nordrhein-Westfalen dem vorläufigen Ende. Heute bleibt es zunächst sonnig, von Westen ziehen jedoch zunehmend Wolken auf, teilte der Deutsche Wetterdienst (DWD) mit. … [+803 chars]",,de,'Gewitter'
https://www.stern.de/gesellschaft/regional/baden-wuerttemberg/braende--millionenschaden-nach-grossbrand-auf-hof-bei-ravensburg-37362208.html,https://www.stern.de/gesellschaft/regional/baden-wuerttemberg/braende--millionenschaden-nach-grossbrand-auf-hof-bei-ravensburg-37362208.html,0,www.stern.de,Brände: Millionenschaden nach Großbrand auf Hof bei Ravensburg,Flammen fressen sich durch einen Hof im Kreis Ravensburg: Enorme Hitze und Funkenflug machen den Einsatzkräften zu schaffen. Innerhalb kurzer Zeit ist das Anwesen niedergebrannt.,https://image.stern.de/37362210/t/7g/v1/w1440/r1.7778/-/02--hf3mrbv22cv6axs2048jpeg---58dfa8c535a20fb7.jpg,2026-05-02T10:14:20Z,,"Kopiere den aktuellen Link
Zur Merkliste hinzufügen
Flammen fressen sich durch einen Hof im Kreis Ravensburg: Enorme Hitze und Funkenflug machen den Einsatzkräften zu schaffen. Innerhalb kurzer Zei… [+1498 chars]",,de,'Hitze'
https://www.urlaubspiraten.de/pauschalreisen/aluasun-marbella-park,https://www.urlaubspiraten.de/pauschalreisen/aluasun-marbella-park,0,www.urlaubspiraten.de,"Sommer, Sonne, Marbella ","Pack die Sonnencreme ein, wir schicken dich an die Costa del Sol ☀️ Bei diesem Deal stimmt das Preis-Leistungs-Verhältnis: Für 1 Woche im 4*-Resort inkl. Direktflug, Transfer zum Hotel und Halbpension PLUS bezahlst du im Juni nur 583 € p. P.! Hier hast du die…",https://image.urlaubspiraten.de/720/image/upload/v1603287537/mediavault_images/ewfgeewcw0u3rt6juqat.jpg,2026-05-02T15:00:00Z,,"Pack die Sonnencreme ein, wir schicken dich an die Costa del Sol Bei diesem Deal stimmt das Preis-Leistungs-Verhältnis: Für 1 Woche im 4*-Resort inkl. Direktflug, Transfer zum Hotel und Halbpension P… [+793 chars]",,de,'Sonnencreme'
https://www.zeit.de/news/2026-05/03/regenschauer-und-gewitter-beenden-die-sonnenphase-in-bayern,https://www.zeit.de/news/2026-05/03/regenschauer-und-gewitter-beenden-die-sonnenphase-in-bayern,0,www.zeit.de,Wettervorhersage: Regenschauer und Gewitter beenden die Sonnenphase in Bayern,Hier finden Sie Informationen zu dem Thema „Wettervorhersage“. Lesen Sie jetzt „Regenschauer und Gewitter beenden die Sonnenphase in Bayern“.,https://img.zeit.de/news/2026-05/03/regenschauer-und-gewitter-beenden-die-sonnenphase-in-bayern-image-group/wide__1300x731,2026-05-03T05:30:44Z,,Nach den sonnigen Tagen müssen die Menschen in Teilen des Freistaats nun die Sonnenbrille gegen einen Regenschirm eintauschen. Der Deutsche Wetterdienst (DWD) erwartet vor allem im Nordwesten Regen. … [+707 chars],,de,'Gewitter'
https://www.zeit.de/news/2026-05/03/erst-sonne-dann-gewitter-wo-es-staerker-krachen-koennte,https://www.zeit.de/news/2026-05/03/erst-sonne-dann-gewitter-wo-es-staerker-krachen-koennte,0,www.zeit.de,"Wetter: Erst Sonne, dann Gewitter - Wo es stärker krachen könnte","Hier finden Sie Informationen zu dem Thema „Wetter“. Lesen Sie jetzt „Erst Sonne, dann Gewitter - Wo es stärker krachen könnte“.",https://img.zeit.de/news/2026-05/03/erst-sonne-dann-gewitter-wo-es-staerker-krachen-koennte-image-group/wide__1300x731,2026-05-03T05:41:52Z,,Nach tagelangem Frühsommer-Wetter müssen sich die Menschen im Südwesten am Sonntag auf Regenschauer und einzelne Gewitter einstellen - zumindest in Teilen des Bundeslandes. Der Prognose des Deutschen… [+1273 chars],,de,'Gewitter'
https://www.zeit.de/2026/19/heuschnupfen-klimawandel-pollenflug-allergie-pflanzen,https://www.zeit.de/2026/19/heuschnupfen-klimawandel-pollenflug-allergie-pflanzen,0,www.zeit.de,Heuschnupfen: Klima? Hatschi!,"Durch die Erderwärmung steigt die Pollenbelastung. Eine internationale Studie zeigt, woran das liegt.",https://img.zeit.de/2026/19/klima-hatschi-bild-2/wide__1300x731,2026-05-03T07:03:21Z,,"Gute Nachrichten für die Papiertaschentuch-herstellende Industrie: Künftig gilt es, Schnupfen und Schnodder in ungeahnten Mengen aufzufangen. Ihrem Schnäuz-Zubehör ist eine goldene Zukunft gewiss, je… [+456 chars]",,de,'Erderwärmung'
https://www.n-tv.de/panorama/Gewitterfront-loest-Kurzzeit-Sommer-ab-id30780895.html,https://www.n-tv.de/panorama/Gewitterfront-loest-Kurzzeit-Sommer-ab-id30780895.html,0,www.n-tv.de,Wetterwoche im Schnellcheck: Gewitterfront löst Kurzzeit-Sommer ab,"Mit Tief ""Zuhal"" findet der Vorgeschmack auf den Sommer ein jähes Ende. Doch zum Wochenstart herrscht zunächst ein deutlicher Unterschied zwischen den Regionen: Während es im Norden deutlich kühler wird, bleibt es im Süden noch sommerlich warm.",https://www.n-tv.de/img/30780913/1777818544/Img_16_9/1200/Gewittrige-Stimmung-im-Landkreis-Pfaffenhofen-in-Bayern-zumindest-kuendigt-sich-hier-ein-heftiger-Regenschauer-an.jpg,2026-05-03T13:15:38Z,,"Tief ""Zuhal"" bringt einiges an Regen. (Foto: picture alliance / CHROMORANGE)
Mit Tief ""Zuhal"" findet der Vorgeschmack auf den Sommer ein jähes Ende. Doch zum Wochenstart herrscht zunächst ein deutli… [+4769 chars]",,de,'Sonnenstunden'
https://www.stern.de/panorama/wetter--temperaturen-in-rekordnaehe--29-4-grad-am-sonntag-erreicht-37363970.html,https://www.stern.de/panorama/wetter--temperaturen-in-rekordnaehe--29-4-grad-am-sonntag-erreicht-37363970.html,0,www.stern.de,"Wetter: Temperaturen in Rekordnähe: 29,4 Grad am Sonntag erreicht","Nach sommerlicher Hitze am Wochenende kommt der Umbruch: Der Deutsche Wetterdienst rechnet für die neue Woche mit Schauern, Gewittern und spürbar kühleren Temperaturen.",https://image.stern.de/37364478/t/0z/v1/w1440/r1.7778/-/03--jofxful5mov4axs2048jpeg---cff38fec32b054ef.jpg,2026-05-03T16:10:48Z,,"Kopiere den aktuellen Link
Zur Merkliste hinzufügen
Nach sommerlicher Hitze am Wochenende kommt der Umbruch: Der Deutsche Wetterdienst rechnet für die neue Woche mit Schauern, Gewittern und spürbar… [+1619 chars]",,de,'Gewitter'
https://www.faz.net/aktuell/rhein-main/schuesse-in-giessen-zwei-schwerverletzte-aktuelle-nachrichten-aus-frankfurt-hessen-faz-19735361.html,https://www.faz.net/aktuell/rhein-main/schuesse-in-giessen-zwei-schwerverletzte-aktuelle-nachrichten-aus-frankfurt-hessen-faz-19735361.html,0,www.faz.net,Rhein-Main-Liveblog: Schüsse in Gießen: Zwei Schwerverletzte,Hoher Schaden nach Brand von Einfamilienhaus +++ Gewitter und Regen zum Wochenstart +++ Hanau: Sportwagen nach Unfall im Feld abgestellt +++ Liveblog zu Rhein-Main und Hessen,https://media0.faz.net/image/w1200h627/5f0eaf3963f3/w6144h3210x0y443o/202605/43601.0.2045229977/die-polizei-sucht-nach-den.webp,2026-05-04T09:02:00Z,,"Gießen. Zwei Männer sind durch Schüsse schwer verletzt worden und werden in  Kliniken behandelt. Wie Staatsanwaltschaft und Polizei berichten, waren fünf Menschen am Sonntag kurz vor Mitternacht in S… [+443 chars]",,de,'Gewitter'
https://www.bild.de/news/wetter/wetterumschwung-noch-einmal-fruehsommer-dann-kommt-der-kaelteeinbruch-69f70f2b6fe2dee7bfb112b8,https://www.bild.de/news/wetter/wetterumschwung-noch-einmal-fruehsommer-dann-kommt-der-kaelteeinbruch-69f70f2b6fe2dee7bfb112b8,0,www.bild.de,"Heftiger Wetterumschwung - Erst Sonnenbrand, dann Regenwand!",Auf strahlenden Sonnenschein folgen heftige Schauer und ein deutlicher Temperatursturz.,"https://images.bild.de/69f70f2b6fe2dee7bfb112b8/d3ef16fdbc89c2d72709979bdfb737ee,9b00349b?w=1280",2026-05-04T09:47:41Z,,TTS-Player überspringenArtikel weiterlesenAuf strahlenden Sonnenschein am Sonntag folgen heftige Schauer und ein deutlicher Temperatursturz immerhin startet der heutige Montag noch einmal schön. Geni… [+3347 chars],,de,'Sonne'
https://www.stern.de/panorama/wetter--im-norden-kalt-und-im-sueden-warm--wetter-bleibt-wechselhaft-37366212.html,https://www.stern.de/panorama/wetter--im-norden-kalt-und-im-sueden-warm--wetter-bleibt-wechselhaft-37366212.html,0,www.stern.de,Wetter: Im Norden kalt und im Süden warm: Wetter bleibt wechselhaft,"Offenbach - Deutschland steht eine wechselhafte Woche mit Gewittern und Starkregen bevor. Im Norden wird es empfindlich kühl, während es im Süden",https://image.stern.de/37366214/t/AF/v1/w1440/r1.7778/-/04--2i265ud5fhv11axs2048jpeg---461a59d7ae956eba.jpg,2026-05-04T10:12:16Z,,"Kopiere den aktuellen Link
Zur Merkliste hinzufügen
Im Norden wird es nachts empfindlich kühl, im Süden bleibt es sommerlich. Der DWD erklärt, was dahintersteckt.
Deutschland steht eine wechselhaf… [+1745 chars]",,de,'Gewitter'
