index,url,valid,domain,title,description,image,published,archive,content,quote,language,keyword
https://www.stern.de/gesellschaft/regional/baden-wuerttemberg/mutmasslicher-justizskandal--justiz-auf-anklagebank---prozess-zu-schuessen-und-datenleck-37372288.html,https://www.stern.de/gesellschaft/regional/baden-wuerttemberg/mutmasslicher-justizskandal--justiz-auf-anklagebank---prozess-zu-schuessen-und-datenleck-37372288.html,0,www.stern.de,Mutmaßlicher Justizskandal: Justiz auf Anklagebank - Prozess zu Schüssen und Datenleck,Schüsse und ein Datenleck: Im Schatten eines gescheiterten Anschlags wird ein mutmaßliches Korruptionsnetz in der Justiz sichtbar. Was steckt dahinter? Und worum geht es nun vor Gericht?,https://image.stern.de/37373946/t/Ck/v1/w1440/r1.7778/-/06--qqgy3xmmi7v6axs2048jpeg---66e96f8a7275c315.jpg,2026-05-06T10:19:42Z,,"Kopiere den aktuellen Link
Zur Merkliste hinzufügen
Schüsse und ein Datenleck: Im Schatten eines gescheiterten Anschlags wird ein mutmaßliches Korruptionsnetz in der Justiz sichtbar. Was steckt dah… [+3569 chars]",,de,'Schatten'
https://futurezone.at/science/erderwaermung-mikroplastik-atmosphaere-russ-klimawandel/403157340,https://futurezone.at/science/erderwaermung-mikroplastik-atmosphaere-russ-klimawandel/403157340,0,futurezone.at,Überraschender Anheizer für Erderwärmung entdeckt,Winzige Plastikpartikel in der Atmosphäre tragen zum Treibhauseffekt bei.,https://image.futurezone.at/images/facebook/6808441/46-184873526.jpg?versionId=67b3d760f0df,2026-05-06T13:01:27Z,,Winzige Plastikpartikel in der Atmosphäre tragen zum Treibhauseffekt bei.,,de,'Erderwärmung'
https://www.stern.de/news/studie--abholzung-macht-amazonas-deutlich-anfaelliger-fuer-klimaschaeden-als-gedacht-37375216.html,https://www.stern.de/news/studie--abholzung-macht-amazonas-deutlich-anfaelliger-fuer-klimaschaeden-als-gedacht-37375216.html,0,www.stern.de,Studie: Abholzung macht Amazonas deutlich anfälliger für Klimaschäden als gedacht,"Der Amazonas-Regenwald, die grüne Lunge der Erde, könnte sich einer Studie zufolge bei weiterer Abholzung bereits bei einer Erderwärmung von unter zwei Grad destabilisieren. Wenn die Entwaldung auf etwa 22 bis 28 Prozent des Amazonasgebiets zunehme, könnten s…",https://image.stern.de/37375218/t/nQ/v1/w1440/r1.7778/-/06--amazonregenwald-auf-der-insel-cotijuba-bei-bel%C3%A9m---24c294070f8b9fd4.jpg,2026-05-06T15:03:58Z,,"Kopiere den aktuellen Link
Zur Merkliste hinzufügen
Der Amazonas-Regenwald, die grüne Lunge der Erde, könnte sich einer Studie zufolge bei weiterer Abholzung bereits bei einer Erderwärmung von unte… [+2959 chars]",,de,'Erderwärmung'
https://www.zeit.de/news/2026-05/06/heftige-gewitter-in-bayern-kaum-schaeden,https://www.zeit.de/news/2026-05/06/heftige-gewitter-in-bayern-kaum-schaeden,0,www.zeit.de,Wettervorhersage: Heftige Gewitter in Bayern – kaum Schäden,Hier finden Sie Informationen zu dem Thema „Wettervorhersage“. Lesen Sie jetzt „Heftige Gewitter in Bayern – kaum Schäden“.,https://img.zeit.de/news/2026-05/06/heftige-gewitter-in-bayern-kaum-schaeden-image-group/wide__1300x731,2026-05-06T17:26:11Z,,"Nach tagelangem Sonnenschein sind Gewitter über Teile Bayerns gezogen. In München ging heftiger Regen nieder, weiter südlich bei Weilheim hagelte es auch. Größere Schäden wurden zunächst nicht bekann… [+1843 chars]",,de,'Gewitter'
https://www.faz.net/aktuell/rhein-main/frankfurt/frankfurt-grosse-trockenheit-und-viel-sonne-im-april-200802766.html,https://www.faz.net/aktuell/rhein-main/frankfurt/frankfurt-grosse-trockenheit-und-viel-sonne-im-april-200802766.html,0,www.faz.net,"Wetter in Frankfurt: Rekordverdächtig trocken, sonnig und zu warm",Im April hat es nur an vier Tagen geregnet. Weniger Regentage hat es seit 1949 bisher nur zweimal gegeben. Und auch die Zahl der Sonnenstunden ist rekordverdächtig.,https://media0.faz.net/image/w1200h627/7af3aeb4eee4/w6021h3145x0y121o/202604/43601.0.2026896980/der-vergangene-monat-bot.webp,2026-05-07T14:48:46Z,,"Eine Meldung vom 29. April dürfte die ideale Steilvorlage sein, um in diesen Text über das Wetter des vergangenen Monats einzusteigen: Gefahr von Waldbränden steigt ist da zu lesen. Der Gefahrenindex… [+5274 chars]",,de,'Sonnenstunden'
https://www.stern.de/news/schatten-am-himmel--usa-veroeffentlichen-bisher-geheime-ufo-akten-37382264.html,https://www.stern.de/news/schatten-am-himmel--usa-veroeffentlichen-bisher-geheime-ufo-akten-37382264.html,0,www.stern.de,Schatten am Himmel: USA veröffentlichen bisher geheime UFO-Akten,"""Ist da draußen jemand?"" Die USA haben auf Wunsch von Präsident Donald Trump Akten zu unbekannten Flugobjekten (UFOs) freigegeben. Das US-Verteidigungsministerium veröffentlichte am Freitag mehr als 160 Fotos und weitere Dokumente. ""Diese Akten, die der Gehei…",https://image.stern.de/37382620/t/gv/v1/w1440/r1.7778/-/08--ein-unidentifiziertes-objekt-auf-einer-armeeaufnahme---ca66f1bdd9e55b3d.jpg,2026-05-08T16:19:54Z,,"Kopiere den aktuellen Link
Zur Merkliste hinzufügen
""Ist da draußen jemand?"" Die USA haben auf Wunsch von Präsident Donald Trump Akten zu unbekannten Flugobjekten (UFOs) freigegeben. Das US-Verteid… [+3526 chars]",,de,'Schatten'
https://sport.orf.at/stories/3155576/,https://sport.orf.at/stories/3155576/,0,sport.orf.at,Mexiko verlängert Sommerferien wegen Endrunde,,https://sport.orf.at/mojo/1_4_1/storyserver//news/common/images/og-fallback-sport.png,2026-05-08T17:12:32Z,,Wegen der Weltmeisterschaft hat das mexikanische Bildungsministerium den Beginn der Sommerferien um mehr als einen Monat vorgezogen. Damit verlängern sich die Schulferien in dem lateinamerikanischen … [+1768 chars],,de,'Sommerferien'
https://www.stern.de/lifestyle/leute/prinz-philips-fuenfter-todestag--charmeur-im-schatten-der-koenigin-7926356.html,https://www.stern.de/lifestyle/leute/prinz-philips-fuenfter-todestag--charmeur-im-schatten-der-koenigin-7926356.html,0,www.stern.de,Die Bilder seines Lebens: Der Charmeur im Schatten der Königin: Vor fünf Jahren starb Prinz Philip,"Philip Mountbatten, Herzog von Edinburgh, galt oft als ein „König des Fauxpas“. Doch als Gemahl und wichtigste Stütze von Queen Elizabeth II. übte er enormen Einfluss auf den britischen Hof aus.",https://image.stern.de/7926922/t/Jd/v7/w1440/r1.7778/-/prinz-philip.jpg,2026-05-09T06:19:00Z,,"Kopiere den aktuellen Link
Zur Merkliste hinzufügen
Philip Mountbatten, Herzog von Edinburgh, galt oft als ein König des Fauxpas. Doch als Gemahl und wichtigste Stütze von Queen Elizabeth II. übte … [+698 chars]",,de,'Schatten'
https://www.morgenpost.de/politik/article411947323/parade-light-statt-panzerkolonnen-putin-prahlt-im-schatten-der-drohnenangst.html,https://www.morgenpost.de/politik/article411947323/parade-light-statt-panzerkolonnen-putin-prahlt-im-schatten-der-drohnenangst.html,0,www.morgenpost.de,Parade „light“ statt Panzerkolonnen: Putin prahlt im Schatten der Drohnenangst,"Wladimir Putin inszeniert die Siegesparade ohne Panzer – begleitet von Drohnenangst, diplomatischem Ringen und ungewöhnlichen Gästen.",https://img.sparknews.funkemedien.de/411947324/411947324_1778317576_v16_9_1600.jpeg,2026-05-09T09:06:16Z,,Nun doch keine Drohnen über dem Roten Platz in Moskau: Statt der von Wladimir Putin gewünschten Waffenruhe von zwei Tagen während der Siegesparade dauert der Waffenstillstand nunmehr sogar drei Tage.… [+6357 chars],,de,'Schatten'
https://www.dw.com/de/klimawandel-l%C3%A4sst-kaspisches-meer-schrumpfen-wolga-iran-russland-aralsee-kasachstan/a-77099947,https://www.dw.com/de/klimawandel-l%C3%A4sst-kaspisches-meer-schrumpfen-wolga-iran-russland-aralsee-kasachstan/a-77099947,0,www.dw.com,Klimawandel lässt Kaspisches Meer schrumpfen,Das größte Binnengewässer der Welt verschwindet. In alarmierendem Tempo verliert das Kaspische Meer an Wasser. Wissenschaftler warnen vor einem bevorstehenden Wendepunkt.,https://static.dw.com/image/76812998_6.jpg,2026-05-09T13:41:00Z,,"Als Kind verbrachte die iranische Umweltjournalistin Maryam viel Zeit am Ufer des Kaspischen Meeres. In ihrer Heimatstadt Rudsar konnte sie sehen, wie der Pegel des Meeres stieg und fiel. Einmal, in … [+6075 chars]",,de,'Klimawandel'
https://www.stern.de/gesellschaft/tochter-eines-fuballweltmeisters---ich-stand-immer-in-seinem-schatten--37339938.html,https://www.stern.de/gesellschaft/tochter-eines-fuballweltmeisters---ich-stand-immer-in-seinem-schatten--37339938.html,0,www.stern.de,"Im Schatten des Ruhmes: Gemobbt und beneidet: Was es bedeutet, Tochter eines Nationalhelden zu sein","Als Tochter eines Fußballweltmeisters hatte es Dagmar Eckel nicht immer leicht. Hier erzählt sie, wie der Ruhm ihres Vaters und das „Wunder von Bern“ ihr Leben geprägt haben.",https://image.stern.de/37371380/t/Uw/v3/w1440/r1.7778/-/eckel-tochter-bern.jpg,2026-05-09T14:34:00Z,,"Zugang zu stern+statt 11,96 
 nur 1  
<ul><li>Alles von stern+ mit erstklassigen Inhalten von GEO und Capital</li><li>4 Wochen testen, dann 2,99  je Woche</li><li>jederzeit kündbar</li></ul>",,de,'Schatten'
https://taz.de/Rechtsruck-in-Grossbritannien/!6177511/,https://taz.de/Rechtsruck-in-Grossbritannien/!6177511/,0,taz.de,Rechtsruck in Großbritannien: Der lange Schatten von Farage,"Reform UK wächst zur ernsthaften Macht heran. Wenn Labour und andere progressive Kräfte weiter gegeneinander arbeiten, profitiert vor allem Parteichef Nigel Farage.",https://taz.de/picture/8429324/1200/593227490.jpeg,2026-05-09T15:33:00Z,,"Reform UK wächst zur ernsthaften Macht heran. Wenn Labour und andere progressive Kräfte weiter gegeneinander arbeiten, profitiert vor allem Parteichef Nigel Farage. mehr...",,de,'Schatten'
https://www.nzz.ch/wirtschaft/vekselbergs-langer-schatten-die-sanktionen-gegen-den-russischen-oligarchen-holen-eine-schweizer-firma-ein-ld.10005763,https://www.nzz.ch/wirtschaft/vekselbergs-langer-schatten-die-sanktionen-gegen-den-russischen-oligarchen-holen-eine-schweizer-firma-ein-ld.10005763,0,www.nzz.ch,Vekselbergs langer Schatten: Die Sanktionen gegen den russischen Oligarchen holen eine Schweizer Firma ein,Viktor Vekselberg ist einer der wichtigsten Industriellen der Schweiz. Doch ein neues Gerichtsurteil gegen den Sulzer-Ableger Medmix zeigt: Seine Industriefirmen leiden bis heute unter ihrem wichtigsten Aktionär.,"https://img-msp-prod.nzz.ch/2026/05/06/aedb488a-42e9-4a07-8377-4133f4138d26.jpg?width=1200&height=675&fit=bounds&quality=75&auto=webp&crop=3772,2122,x0,y454&wmark=nzz",2026-05-09T19:54:00Z,,Viktor Vekselberg ist einer der wichtigsten Industriellen der Schweiz. Doch ein neues Gerichtsurteil gegen den Sulzer-Ableger Medmix zeigt: Seine Industriefirmen leiden bis heute unter ihrem wichtigs… [+8090 chars],,de,'Schatten'
