index,url,valid,domain,title,description,image,published,archive,content,quote,language,keyword
https://www.brigitte.de/beauty/redaktionsfavoriten--unsere-liebsten-beauty-produkte-mit-lichtschutzfaktor-11782396.html,https://www.brigitte.de/beauty/redaktionsfavoriten--unsere-liebsten-beauty-produkte-mit-lichtschutzfaktor-11782396.html,0,www.brigitte.de,Gut geschützt in der Sonne: Unsere liebsten Beauty-Produkte mit Lichtschutzfaktor,Zu jeder Jahreszeit müssen wir uns vor schädlichen UV-Strahlen schützen. Deshalb verraten wir euch die besten Beauty-Produkte mit Sonnenschutz. Aber eins vorweg: SPF-Make-up ersetzt AUF KEINEN FALL die Sonnencreme. Beauty-Produkte mit Lichtschutzfaktor sind e…,https://image.brigitte.de/14007750/t/FH/v2/w1440/r1.7778/-/teaser1.jpg,2026-02-10T10:35:00Z,,"Hey, bitte melde dich an, um weiterzulesen
Dieser Inhalt ist Teil von unserem neuen BRIGITTE-Angebot mit spannenden Artikeln, Persönlichkeitstests und Coaching-Videos.
Kostenlos und ohne Abo verspr… [+72 chars]",,de,'Sonnencreme'
https://www.telepolis.de/article/Iran-USA-Verhandlungen-Zeit-gewonnen-Krieg-verschoben-11171183.html,https://www.telepolis.de/article/Iran-USA-Verhandlungen-Zeit-gewonnen-Krieg-verschoben-11171183.html,0,www.telepolis.de,"Iran-USA-Verhandlungen: Zeit gewonnen, Krieg verschoben?",Last-Minute-Diplomatie im Schatten der Eskalation: Washington und Teheran verhandeln heimlich. Kann ein Deal den Krieg noch verhindern? Eine Analyse.,https://heise.cloudimg.io/bound/1200x1200/q85.png-lossy-85.webp-lossy-85.foil1/_www-heise-de_/imgs/18/5/0/2/5/0/5/5/shutterstock_2594932421-8a4062b5bb8f329b.jpg,2026-02-10T13:00:00Z,,"Trumps Unterhändler vom Dienst: US-Sondergesandter Steve Witkoff
(Bild: DT phots1/Shutterstock.com)
Last-Minute-Diplomatie im Schatten der Eskalation: Washington und Teheran verhandeln heimlich. Ka… [+7510 chars]",,de,'Schatten'
https://www.zeit.de/news/2026-02/10/trumps-schatten-ueber-us-team-bei-olympia,https://www.zeit.de/news/2026-02/10/trumps-schatten-ueber-us-team-bei-olympia,0,www.zeit.de,Politik und Winterspiele: Trumps Schatten über US-Team bei Olympia,Hier finden Sie Informationen zu dem Thema „Politik und Winterspiele“. Lesen Sie jetzt „Trumps Schatten über US-Team bei Olympia“.,https://img.zeit.de/news/2026-02/10/trumps-schatten-ueber-us-team-bei-olympia-image-group/wide__1300x731,2026-02-10T13:38:16Z,,Eigentlich wollen Amerikas Athletinnen und Athleten bei diesen Winterspielen doch nur sportlich glänzen. Doch just ihr Präsident liegt wie ein dunkler Schatten über dem Olympia-Team aus den USA. Dona… [+4647 chars],,de,'Schatten'
https://www.faz.net/aktuell/wirtschaft/immobilien-wohnen/garten/klimawandel-im-garten-manche-pflanzen-moegen-es-heiss-200505868.html,https://www.faz.net/aktuell/wirtschaft/immobilien-wohnen/garten/klimawandel-im-garten-manche-pflanzen-moegen-es-heiss-200505868.html,0,www.faz.net,Klimawandel im Garten: Manche mögen’s heiß,Der Klimawandel stellt unsere Gärten auf harte Proben. Zu Besuch bei den Widerständigen von Hyde Hall in Essex.,https://media0.faz.net/image/w1200h627/e5a3c7109abd/w3448h1801x0y2330o/202602/46b0a0a8-f11e-499b-98cf-77ac35f864fb/im-mai-kommen-andere-farben.webp,2026-02-11T10:29:19Z,,"Trocken. Heiß. Windig. Worte, die bei Gärtnern Furcht auslösen. Schon im Vorgriff auf die kommende Pflanzsaison und auch, wenn derzeit noch an vielen Orten Schnee auf der Erde liegt. Denn das Dreiges… [+1040 chars]",,de,'Klimawandel'
https://www.der-postillon.com/2026/02/bmw-blinken.html,https://www.der-postillon.com/2026/02/bmw-blinken.html,0,www.der-postillon.com,"Vorbildlich: BMW-Fahrer spart Strom, indem er nie blinkt","München (dpo) - Jeder muss seinen Teil beitragen, um den Klimawandel aufzuhalten. Das sieht auch Timo Neustedt aus München so. Der 28-jährige BMW-Fahrer verzichtet schon seit Jahren darauf, zu blinken, bevor er abbiegt oder die Spur wechselt. So will er die U…",https://blogger.googleusercontent.com/img/b/R29vZ2xl/AVvXsEjVuVp9tHWo7RrUXhlckQbor7eNwzWM-iP5AgqHcIEoCKxn7bjR3Jiq6rmEMrphAQxSFN4jPQ_GXgBxPrUSVhuXKcG6y12bg6SZ3_pw51ijcDOSjjSTSwJJp_A01JZTBaY7A5wQXCTiNoUxVV6N2Mho1IqlbcrmQbKl-96UCNa4gJ-FKinolfBNAcLjmQc/w1600/shutterstock_1874134429.jpg,2026-02-11T11:50:42Z,,"München (dpo) - Jeder muss seinen Teil beitragen, um den Klimawandel aufzuhalten. Das sieht auch Timo Neustedt aus München so. Der 28-jährige BMW-Fahrer verzichtet schon seit Jahren darauf, zu blinke… [+803 chars]",,de,'Klimawandel'
https://www.zeit.de/news/2026-02/11/klimaforscher-warnen-vor-nahen-kipppunkten,https://www.zeit.de/news/2026-02/11/klimaforscher-warnen-vor-nahen-kipppunkten,0,www.zeit.de,Analyse der Erderwärmung: Klimaforscher warnen vor nahen Kipppunkten,Hier finden Sie Informationen zu dem Thema „Analyse der Erderwärmung“. Lesen Sie jetzt „Klimaforscher warnen vor nahen Kipppunkten“.,https://img.zeit.de/news/2026-02/11/klimaforscher-warnen-vor-nahen-kipppunkten-image-group/wide__1300x731,2026-02-11T16:00:12Z,,"Ein internationales Forscherteam warnt eindringlich vor einer beschleunigten Erderwärmung, die zu einer dauerhaften Hitzephase führen könnte. «Das Klima der Erde entfernt sich gerade von den stabilen… [+5012 chars]",,de,'Erderwärmung'
https://www.telepolis.de/article/Gewoehnt-euch-an-teureren-Kaffee-es-wird-nicht-besser-11170133.html,https://www.telepolis.de/article/Gewoehnt-euch-an-teureren-Kaffee-es-wird-nicht-besser-11170133.html,0,www.telepolis.de,Gewöhnt euch an teureren Kaffee – es wird nicht besser,"Klimawandel, Spekulation und ein unerwarteter Faktor treiben die Preise. Warum Robusta plötzlich so teuer wie Arabica ist.",https://heise.cloudimg.io/bound/1200x1200/q85.png-lossy-85.webp-lossy-85.foil1/_www-heise-de_/imgs/18/5/0/2/4/5/2/1/Alf_Ribeiro_cropped-e4ef86f98394f08f.jpg,2026-02-12T11:00:00Z,,"Kaffeeernte in Brasilien
(Bild: Alf Ribeiro, shutterstock)
Klimawandel, Spekulation und ein unerwarteter Faktor treiben die Preise. Warum Robusta plötzlich so teuer wie Arabica ist.
Für viele Mens… [+4857 chars]",,de,'Klimawandel'
https://www.welt.de/wirtschaft/video698dc00362ee8b267c15cc32/gewinneinbruch-bei-mercedes-china-ist-der-mittelpunkt-der-welt-fuer-alle-keiner-hat-eine-strategie.html,https://www.welt.de/wirtschaft/video698dc00362ee8b267c15cc32/gewinneinbruch-bei-mercedes-china-ist-der-mittelpunkt-der-welt-fuer-alle-keiner-hat-eine-strategie.html,0,www.welt.de,„China ist der Mittelpunkt der Welt für alle – keiner hat eine Strategie“,"Der Gewinn von Mercedes-Benz ist 2025 um knapp die Hälfte auf 5,3 Milliarden Euro eingebrochen. Autoexperte Ferdinand Dudenhöffer erklärt im Gespräch mit Dietmar Deffner, wo er beim Autobauer „Licht und Schatten“ sieht.",https://images.welt.de/698dc00362ee8b267c15cc32/27f5484d4ed65bf7edfea9d4a7b316cf-master/ci16x9-w1200/dpa-com-20090101-260212-935-1146277-jpg,2026-02-12T12:35:39Z,,"Der Gewinn von Mercedes-Benz ist 2025 um knapp die Hälfte auf 5,3 Milliarden Euro eingebrochen. Autoexperte Ferdinand Dudenhöffer erklärt im Gespräch mit Dietmar Deffner, wo er beim Autobauer Licht u… [+77 chars]",,de,'Schatten'
https://www.morgenpost.de/ratgeber-wissen/article411181601/der-mensch-kann-sich-nicht-unendlich-an-den-klimawandel-anpassen.html,https://www.morgenpost.de/ratgeber-wissen/article411181601/der-mensch-kann-sich-nicht-unendlich-an-den-klimawandel-anpassen.html,0,www.morgenpost.de,Der Mensch kann sich nicht unendlich an den Klimawandel anpassen,Donald Trump will die Grundlage für Klimaschutz in den USA kippen. Er argumentiert mit Wohlstand – aber auf dem Spiel steht viel mehr.,https://img.sparknews.funkemedien.de/411183362/411183362_1770900130_v16_9_1600.jpeg,2026-02-12T12:42:10Z,,"Haben Sie schon mal von einem Hothouse gehört? Das ist der Zustand, in den sich die Erde verwandeln könnte, sollte die Erderwärmung nicht gestoppt werden. Und nicht irgendwann gestoppt werden Stichwo… [+1665 chars]",,de,'Erderwärmung'
https://www.faz.net/aktuell/wirtschaft/immobilien-wohnen/bauen-kaufen/klimawandel-trifft-die-alpen-was-das-fuer-kaeufer-von-ferienhaeusern-bedeutet-accg-110831882.html,https://www.faz.net/aktuell/wirtschaft/immobilien-wohnen/bauen-kaufen/klimawandel-trifft-die-alpen-was-das-fuer-kaeufer-von-ferienhaeusern-bedeutet-accg-110831882.html,0,www.faz.net,Idylle in den Bergen: Hat das Ferienhaus in den Alpen noch eine Zukunft?,Abstürzende Hänge und überflutende Bäche: Der Klimawandel trifft die Alpen. Käufer von Ferienhäusern müssen aufpassen.,https://media0.faz.net/image/w1200h627/48c7d677922c/w3000h1567x0y372o/022026/1.10831880/evakuierung-in-brienz.webp,2026-02-12T17:47:59Z,,"Der Klimawandel ist überall spürbar. Hitzewellen, Überschwemmungen und Trockenperioden fordern ihren Tribut. Bergregionen leiden besonders: Felsabbrüche, Hangrutsche und überschießende Bäche verursac… [+295 chars]",,de,'Klimawandel'
https://www.nzz.ch/international/donald-trump-foutiert-sich-um-die-erderwaermung-und-macht-jetzt-ernst-mit-seiner-anti-klima-politik-ld.1924638,https://www.nzz.ch/international/donald-trump-foutiert-sich-um-die-erderwaermung-und-macht-jetzt-ernst-mit-seiner-anti-klima-politik-ld.1924638,0,www.nzz.ch,Donald Trump foutiert sich um die Erderwärmung – und macht jetzt Ernst mit seiner Anti-Klima-Politik,Die amerikanische Umweltbehörde hat Treibhausgasemissionen für unproblematisch erklärt. Damit will der Präsident die «grösste Deregulierungsmassnahme in der Geschichte des Landes» lancieren. Ein 16 Jahre alter konservativer Masterplan geht in Erfüllung.,"https://img.nzz.ch/2026/02/12/0059b3ef-9f90-4448-9bff-63bb20883d56.jpg?width=1200&height=675&fit=bounds&quality=75&auto=webp&crop=3600,2025,x0,y378&wmark=nzz",2026-02-12T19:22:34Z,,Die amerikanische Umweltbehörde hat Treibhausgasemissionen für unproblematisch erklärt. Damit will der Präsident die «grösste Deregulierungsmassnahme in der Geschichte des Landes» lancieren. Ein 16 J… [+3872 chars],,de,'Erderwärmung'
https://www.kino.de/news/wegen-neuen-jeffrey-epstein-enthuellungen-diese-netflix-serie-stellt-aktuell-alles-in-den-schatten--01KGZDK2DWY64ETQBN4CEMTM8Y,https://www.kino.de/news/wegen-neuen-jeffrey-epstein-enthuellungen-diese-netflix-serie-stellt-aktuell-alles-in-den-schatten--01KGZDK2DWY64ETQBN4CEMTM8Y,0,www.kino.de,Wegen neuen Jeffrey-Epstein-Enthüllungen: Diese Netflix-Serie stellt aktuell alles in den Schatten,Aufgrund neuer Enthüllungen ist der Fall Jeffrey Epstein aktuell wieder in aller Munde. Daher wird auf Netflix auch eine Doku-Reihe vermehrt gestreamt.,https://static.kino.de/21/32/0c/703085e8633ec2113bd8385e7f_ZmMgNjc1NjgyZmNmZmZmIDE5MjAgMTA4MAMyMjcwZTNjMWQ4Nw==.jpg,2026-02-13T07:00:00Z,,"Aufgrund neuer Enthüllungen ist der Fall Jeffrey Epstein aktuell wieder in aller Munde. Daher wird auf Netflix auch eine Doku-Reihe vermehrt gestreamt.
Aus aktuellem Anlass ist die vierteilige Netfl… [+3486 chars]",,de,'Schatten'
https://www.stern.de/politik/ausland/erderwaermung--krise--welche-krise--wie-trump-den-klimaschutz-aushebelt-37135092.html,https://www.stern.de/politik/ausland/erderwaermung--krise--welche-krise--wie-trump-den-klimaschutz-aushebelt-37135092.html,0,www.stern.de,"Erderwärmung: Krise, welche Krise? Wie Trump den Klimaschutz aushebelt",Mit Klimaschutz will Donald Trump nichts zu tun haben. Die Krise bleibt trotzdem. Doch dafür hat Trump seine ganz eigene Lösung – mit unabsehbaren Folgen.,https://image.stern.de/37135094/t/FU/v1/w1440/r1.7778/-/13--ldypzrikdyv7axs2048jpeg---3afc938ce1fc4433.jpg,2026-02-13T13:25:46Z,,"Kopiere den aktuellen Link
Zur Merkliste hinzufügen
Mit Klimaschutz will Donald Trump nichts zu tun haben. Die Krise bleibt trotzdem. Doch dafür hat Trump seine ganz eigene Lösung mit unabsehbaren … [+5368 chars]",,de,'Erderwärmung'
https://www.tagesspiegel.de/internationales/erderwarmung-krise-welche-krise-wie-trump-den-klimaschutz-aushebelt-15248911.html,https://www.tagesspiegel.de/internationales/erderwarmung-krise-welche-krise-wie-trump-den-klimaschutz-aushebelt-15248911.html,0,www.tagesspiegel.de,"Erderwärmung: Krise, welche Krise? Wie Trump den Klimaschutz aushebelt",Mit Klimaschutz will Donald Trump nichts zu tun haben. Die Krise bleibt trotzdem. Doch dafür hat Trump seine ganz eigene Lösung – mit unabsehbaren Folgen.,https://www.tagesspiegel.de/images/15248910/alternates/BASE_16_9_W1400/1770989216000/trump-regierung-hebt-einschatzung-zu-treibhausgasen-auf.jpeg,2026-02-13T13:26:56Z,,Schluss mit Klimakrise: US-Präsident Donald Trump hat Treibhausgase kurzerhand für unproblematisch erklärt und damit die zentrale rechtliche Grundlage für Gesetze zum Wohle des Klimas gekippt. Konkre… [+5911 chars],,de,'Erderwärmung'
https://www.welt.de/kultur/kino/article698efa15616e1cbb1fcd4ee8/regisseur-simon-verhoeven-ich-haette-die-ganze-zeit-schiss-wenn-meine-kinder-nach-new-york-gehen-wuerden.html,https://www.welt.de/kultur/kino/article698efa15616e1cbb1fcd4ee8/regisseur-simon-verhoeven-ich-haette-die-ganze-zeit-schiss-wenn-meine-kinder-nach-new-york-gehen-wuerden.html,0,www.welt.de,"„Ich hätte die ganze Zeit Schiss, wenn meine Kinder nach New York gehen würden“","Der Regisseur Simon Verhoeven, aufgewachsen im Schatten zweier berühmter Eltern, findet mit der Joachim-Meyerhoff-Verfilmung  „Ach diese Lücke, diese entsetzliche Lücke“ zu einer stilleren, persönlicheren Tonlage. In einer Hauptrolle: seine Mutter Senta Berge…",https://images.welt.de/698efa15616e1cbb1fcd4ee8/a2ad4126c8f887b93cd7bd571c49db30/ci16x9-w1200/o0a9153-jpg,2026-02-13T15:08:36Z,,"Der Regisseur Simon Verhoeven, aufgewachsen im Schatten zweier berühmter Eltern, findet mit der Joachim-Meyerhoff-Verfilmung Ach diese Lücke, diese entsetzliche Lücke zu einer stilleren, persönlicher… [+9726 chars]",,de,'Schatten'
https://www.focus.de/politik/deutschland/merz-wechselt-sogar-ins-englische-einen-satz-aber-sagt-er-nicht_b3656654-b450-4ddb-bff0-cc8deff42012.html,https://www.focus.de/politik/deutschland/merz-wechselt-sogar-ins-englische-einen-satz-aber-sagt-er-nicht_b3656654-b450-4ddb-bff0-cc8deff42012.html,0,www.focus.de,Merz wechselt sogar ins Englische: Einen Satz aber sagt er nicht,"Als erster deutscher Bundeskanzler eröffnete Friedrich Merz die Münchener Sicherheitskonferenz. Statt großer programmatischer Aufschläge reichte er den USA nur kurz die Hand, sprach für zwei Minuten auf Englisch. Merz bleib im Schatten Söders.",https://quadro.burda-forward.de/ctf/d34ee277-00a3-4b50-a13a-7c2b77f84344.7097a755-b88d-4798-bf68-a6dca7a247ff.jpg?im=RegionOfInterestCrop%3D%281200%2C630%29%2CregionOfInterest%3D%281990%2C1154%29&hash=39303b8b08000f85cb38f83fbf52ceeb4694987419188614b00d219e1d5a6c36,2026-02-13T15:57:00Z,,"Der Start von Bundeskanzler Friedrich Merz in die Münchener Sicherheitskonferenz ähnelt dem Auftritt eines Superstars vor einem Publikum, das noch ganz beseelt von der Vor-Band ist. Schwierig. Denn M… [+6514 chars]",,de,'Schatten'
https://www.tagesspiegel.de/berlin/bezirke/pankow/mehr-grun-und-schatten-fur-berlin-pankow-im-fruhjahr-werden-neue-baume-gepflanzt-15248344.html,https://www.tagesspiegel.de/berlin/bezirke/pankow/mehr-grun-und-schatten-fur-berlin-pankow-im-fruhjahr-werden-neue-baume-gepflanzt-15248344.html,0,www.tagesspiegel.de,Mehr Grün und Schatten für Berlin-Pankow: Im Frühjahr werden neue Bäume gepflanzt,Im Rahmen der Berliner Stadtbaumkampagne ist in diesem Frühling auch wieder Pankow dabei. Bald verschönern gut 150 Neupflanzungen den Bezirk und machen die Luft besser.,https://www.tagesspiegel.de/images/7883008/alternates/BASE_16_9_W1400/1770985495000/baume-helfen-gegen-hitze-brauchen-selbst-aber-auch-schutz.jpeg,2026-02-13T17:16:09Z,,"Der Frühling bringt Grün auch auf den Straßen Pankows: In diesem Frühjahr werden erneut zahlreiche neue Bäume im Bezirk gepflanzt. 
Bezirke-Newsletter: Pankow
 Mehr Neuigkeiten zum Bezirk gibt es i… [+2413 chars]",,de,'Schatten'
https://www.zeit.de/news/2026-02/15/gletschertourismus-boomt-forscher-warnen-vor-folgen,https://www.zeit.de/news/2026-02/15/gletschertourismus-boomt-forscher-warnen-vor-folgen,0,www.zeit.de,Klimawandel: Gletschertourismus boomt – Forscher warnen vor Folgen,Hier finden Sie Informationen zu dem Thema „Klimawandel“. Lesen Sie jetzt „Gletschertourismus boomt – Forscher warnen vor Folgen“.,https://img.zeit.de/news/2026-02/15/gletschertourismus-boomt-forscher-warnen-vor-folgen-image-group/wide__1300x731,2026-02-15T04:00:22Z,,"Meterdicke und kilometerlange Eisfelder, die wie erstarrt in der Natur liegen: Der Faszination von Gletschern kann sich kaum jemand entziehen. Immer mehr Menschen schauen sich das gerne selbst aus de… [+1720 chars]",,de,'Klimawandel'
