index,url,valid,domain,title,description,image,published,archive,content,quote,language,keyword
https://www.tagesspiegel.de/berlin/trockenheit-brandgefahr-in-brandenburgs-waldern-ist-aktuell-hoch-13622197.html,https://www.tagesspiegel.de/berlin/trockenheit-brandgefahr-in-brandenburgs-waldern-ist-aktuell-hoch-13622197.html,0,www.tagesspiegel.de,Trockenheit: Brandgefahr in Brandenburgs Wäldern ist aktuell hoch,Die Brandenburg-Landkarte zeigt rot - die Waldbrandgefahr ist flächendeckend hoch. Für Freitag bahnen dann sich teils starke Gewitter an.,https://www.tagesspiegel.de/images/13622194/alternates/BASE_16_9_W1400/1746088529000/trockene-walder-und-hohe-brandgefahr-in-brandenburg.jpeg,2025-05-01T08:35:29Z,,Angespannte Lage für Brandenburgs Wälder: Die Brandgefahr ist am Feiertag flächendeckend auf die zweithöchste Gefahrenstufe 4 gestiegen. Das geht den täglich veröffentlichten Daten des Landesumweltmi… [+1792 chars],,de,'Gewitter'
https://www.stern.de/gesellschaft/regional/nordrhein-westfalen/wetter--fruehsommerliche-temperaturen-in-nrw-35684814.html,https://www.stern.de/gesellschaft/regional/nordrhein-westfalen/wetter--fruehsommerliche-temperaturen-in-nrw-35684814.html,0,www.stern.de,Wetter: Frühsommerliche Temperaturen in NRW,"Essen (lnw) - Die Menschen in NRW erwartet frühsommerliches Wetter mit viel Sonne und hohen Temperaturen. Wie der Deutsche Wetterdienst (DWD) mitteilte,",https://image.stern.de/35684816/t/yM/v1/w1440/r1.7778/-/01--qrzf5nrodpv4axs2048jpeg---479365f93bc1931d.jpg,2025-05-01T11:10:51Z,,"Kopiere den aktuellen Link
Zur Merkliste hinzufügen
Viel Sonne, kaum Wolken, bis zu 30 Grad - der Mai beginnt mit sommerlichem Wetter. Doch zum Wochenende soll es deutlich abkühlen.
Die Menschen i… [+929 chars]",,de,'Sonne'
https://www.zeit.de/news/2025-05/01/freibadsaison-eroeffnet-ueber-tausend-besucher-in-muenchen,https://www.zeit.de/news/2025-05/01/freibadsaison-eroeffnet-ueber-tausend-besucher-in-muenchen,0,www.zeit.de,Strahlender Sonnenschein: Freibadsaison eröffnet - über tausend Besucher in München,Hier finden Sie Informationen zu dem Thema „Strahlender Sonnenschein“. Lesen Sie jetzt „Freibadsaison eröffnet - über tausend Besucher in München“.,https://img.zeit.de/news/2025-05/01/freibadsaison-eroeffnet-ueber-tausend-besucher-in-muenchen-image-group/wide__1300x731,2025-05-01T13:34:48Z,,Bei strahlendem Sonnenschein haben die ersten Freibäder in Bayern die diesjährige Badesaison eröffnet. In München kamen nach Angaben der Stadtwerke schon in den ersten Stunden 1.360 Besucherinnen und… [+862 chars],,de,'Freibad'
https://www.stern.de/gesellschaft/regional/bayern/strahlender-sonnenschein--freibadsaison-eroeffnet---ueber-tausend-besucher-in-muenchen-35685066.html,https://www.stern.de/gesellschaft/regional/bayern/strahlender-sonnenschein--freibadsaison-eroeffnet---ueber-tausend-besucher-in-muenchen-35685066.html,0,www.stern.de,Strahlender Sonnenschein: Freibadsaison eröffnet - über tausend Besucher in München,München (lby) - Bei strahlendem Sonnenschein haben die ersten Freibäder in Bayern die diesjährige Badesaison eröffnet. In München kamen nach Angaben der,https://image.stern.de/35685068/t/Pc/v1/w1440/r1.7778/-/01--xa6rdc5bv6v7axs2048jpeg---f1cc832127f27e93.jpg,2025-05-01T13:34:48Z,,"Kopiere den aktuellen Link
Zur Merkliste hinzufügen
Zum Sommer gehört das Freibad - auch wenn nicht jeder gechlortes Wasser mag.
Bei strahlendem Sonnenschein haben die ersten Freibäder in Bayern d… [+954 chars]",,de,'Sonne'
