index,url,valid,domain,title,description,image,published,archive,content,quote,language,keyword
https://www.zeit.de/news/2025-07/01/wegen-hitze-die-muellabfuhr-kommt-vielerorts-frueher,https://www.zeit.de/news/2025-07/01/wegen-hitze-die-muellabfuhr-kommt-vielerorts-frueher,0,www.zeit.de,Entsorger ändern Arbeitsbeginn: Wegen Hitze: Die Müllabfuhr kommt vielerorts früher,Hier finden Sie Informationen zu dem Thema „Entsorger ändern Arbeitsbeginn“. Lesen Sie jetzt „Wegen Hitze: Die Müllabfuhr kommt vielerorts früher“.,https://img.zeit.de/news/2025-07/01/wegen-hitze-die-muellabfuhr-kommt-vielerorts-frueher-image-group/wide__1300x731,2025-07-01T02:30:38Z,,"Die Mülltonnen klappern in einigen Kommunen jetzt noch früher. Wegen der Sommerhitze ziehen etliche Entsorgungsbetriebe den Start der Müllabholung eine Stunde etwa von 7 auf 6 Uhr vor, wie eine Umfra… [+1039 chars]",,de,'Hitze'
https://www.zeit.de/news/2025-07/01/heisser-dienstag-steht-bevor-warnungen-vor-extremer-hitze,https://www.zeit.de/news/2025-07/01/heisser-dienstag-steht-bevor-warnungen-vor-extremer-hitze,0,www.zeit.de,Wetter: Heißer Dienstag steht bevor - Warnungen vor extremer Hitze,Hier finden Sie Informationen zu dem Thema „Wetter“. Lesen Sie jetzt „Heißer Dienstag steht bevor - Warnungen vor extremer Hitze“.,https://img.zeit.de/news/2025-07/01/heisser-dienstag-steht-bevor-warnungen-vor-extremer-hitze-image-group/wide__1300x731,2025-07-01T04:10:46Z,,"Mit Höchstwerten von 30 bis 38 Grad breitet sich die Hitze am Dienstag auf fast ganz Deutschland aus. Besonders im Westen und Südwesten wird vor starker Wärmebelastung gewarnt, heißt es im Bericht de… [+975 chars]",,de,'Hitze'
https://www.zeit.de/news/2025-07/01/diakonie-bei-hitze-gebaeude-fuer-obdachlose-oeffnen,https://www.zeit.de/news/2025-07/01/diakonie-bei-hitze-gebaeude-fuer-obdachlose-oeffnen,0,www.zeit.de,Wetter: Diakonie: Bei Hitze Gebäude für Obdachlose öffnen,Hier finden Sie Informationen zu dem Thema „Wetter“. Lesen Sie jetzt „Diakonie: Bei Hitze Gebäude für Obdachlose öffnen“.,https://img.zeit.de/news/2025-07/01/diakonie-bei-hitze-gebaeude-fuer-obdachlose-oeffnen-image-group/wide__1300x731,2025-07-01T05:53:26Z,,"Angesichts der bevorstehenden Hitze ruft die Diakonie Deutschland dazu auf, öffentliche Einrichtungen für wohnungslose Menschen zu öffnen. «Klimatisierte Einrichtungen wie Bezirksämter, Bibliotheken … [+1467 chars]",,de,'Hitze'
https://www.tagesschau.de/inland/gesellschaft/hitze-warnung-dwd-100.html,https://www.tagesschau.de/inland/gesellschaft/hitze-warnung-dwd-100.html,0,www.tagesschau.de,Wetterdienst warnt vor extremer Hitze,Bis zu 38 Grad: Der Deutsche Wetterdienst warnt vor starker und teils extremer Wärme fast im ganzen Land. Auch starke Gewitter sind möglich. Morgen soll es sogar noch heißer werden.,https://images.tagesschau.de/image/55706b5e-56f6-44bf-bc90-2f6762b124dc/AAABl41y7G0/AAABkZLlo-k/16x9-big/sonne-184.jpg?width=1280,2025-07-01T06:08:22Z,,"Stand: 01.07.2025 08:08 Uhr
Bis zu 38 Grad: Der Deutsche Wetterdienst warnt vor starker und teils extremer Wärme fast im ganzen Land. Auch starke Gewitter sind möglich. Morgen soll es sogar noch hei… [+1131 chars]",,de,'Hitze'
https://www.diepresse.com/19854502/regierung-will-arbeitnehmende-besser-vor-hitze-schuetzen,https://www.diepresse.com/19854502/regierung-will-arbeitnehmende-besser-vor-hitze-schuetzen,0,www.diepresse.com,Regierung will Arbeitnehmende besser vor Hitze schützen,"Eine „Schutzverordnung“ für Menschen, die im Freien hackeln soll noch dieser Tage
präsentiert werden.",https://img.diepresse.com/public/incoming/hrfxlb-imago202554174.jpg/alternates/DPR_SOCIAL_NACHRICHTEN/imago202554174.jpg,2025-07-01T09:16:31Z,,"Eine Schutzverordnung für Menschen, die im Freien hackeln soll noch dieser Tagepräsentiert werden.
Die Bundesregierung will laut ihrem Regierungsprogramm Menschen besser vor Hitze am Arbeitsplatz sc… [+2705 chars]",,de,'Siesta'
https://www.bild.de/politik/meinung-kommentare-kolumnen/post-von-wagner-lieber-jeff-bezos-68642a9456f8e0177592b7ea,https://www.bild.de/politik/meinung-kommentare-kolumnen/post-von-wagner-lieber-jeff-bezos-68642a9456f8e0177592b7ea,0,www.bild.de,"Post von Wagner - Liebes Hitzeleben,","Deutschland muss sich an die südliche Hitze anpassen. Siesta zur neuen Tradition machen, den Kudamm mittags schließen.","https://images.bild.de/68642a9456f8e0177592b7ea/df284fd8e4f44a91d111fa4c7fae7a2d,68eb4656?w=1280",2025-07-01T19:44:00Z,,"Nun, da die Hitze da ist, fast 40 Grad, wird es das kühle Deutschland nicht mehr geben. Wir werden, müssen Südländer werden. Das ist nichts Schlimmes.
Um die Mittagszeit werden im Süden die Fensterl… [+720 chars]",,de,'Siesta'
https://www.stern.de/gesellschaft/regional/berlin-brandenburg/gefahr-durch-hitze--berliner-kirchen-oeffnen-tueren-wegen-hitze-35858526.html,https://www.stern.de/gesellschaft/regional/berlin-brandenburg/gefahr-durch-hitze--berliner-kirchen-oeffnen-tueren-wegen-hitze-35858526.html,0,www.stern.de,Gefahr durch Hitze: Berliner Kirchen öffnen Türen wegen Hitze,"Berlin (bb) - Mehrere Berliner Kirchen öffnen in diesen Tagen ihre Türen, um in der Hitze einen kühlen Schutzraum zu bieten. Das Angebot richte sich",https://image.stern.de/35858528/t/vP/v1/w1440/r1.7778/-/02--3svs4h4ml6v6axs2048jpeg---0d8f15b8c32470af.jpg,2025-07-02T05:18:10Z,,"Kopiere den aktuellen Link
Zur Merkliste hinzufügen
Temperaturen von bis zu 39 Grad werden heute im Berliner Raum erwartet. Einige Kirchen bieten kühle Schutzräume.
Mehrere Berliner Kirchen öffnen… [+989 chars]",,de,'Hitze'
https://www.zeit.de/news/2025-07/02/berliner-kirchen-oeffnen-tueren-wegen-hitze,https://www.zeit.de/news/2025-07/02/berliner-kirchen-oeffnen-tueren-wegen-hitze,0,www.zeit.de,Gefahr durch Hitze: Berliner Kirchen öffnen Türen wegen Hitze,Hier finden Sie Informationen zu dem Thema „Gefahr durch Hitze“. Lesen Sie jetzt „Berliner Kirchen öffnen Türen wegen Hitze“.,https://img.zeit.de/news/2025-07/02/berliner-kirchen-oeffnen-tueren-wegen-hitze-image-group/wide__1300x731,2025-07-02T05:18:10Z,,"Mehrere Berliner Kirchen öffnen in diesen Tagen ihre Türen, um in der Hitze einen kühlen Schutzraum zu bieten. Das Angebot richte sich insbesondere an wohnungslose und an andere bedürftige Menschen, … [+861 chars]",,de,'Hitze'
https://www.tagesspiegel.de/berlin/insbesondere-fur-wohnungslose-bedurftige-diese-berliner-kirchen-bieten-zuflucht-vor-der-hitze-13952270.html,https://www.tagesspiegel.de/berlin/insbesondere-fur-wohnungslose-bedurftige-diese-berliner-kirchen-bieten-zuflucht-vor-der-hitze-13952270.html,0,www.tagesspiegel.de,Insbesondere für Wohnungslose & Bedürftige: Diese Berliner Kirchen bieten Zuflucht vor der Hitze,Temperaturen von bis zu 39 Grad werden heute im Berliner Raum erwartet. Einige Kirchen bieten kühle Schutzräume. Ein Überblick für verschiedene Bezirke.,https://www.tagesspiegel.de/images/13952410/alternates/BASE_16_9_W1400/1751436960000/friedrichswerder011.jpeg,2025-07-02T05:19:08Z,,"Mehrere Berliner Kirchen öffnen in diesen Tagen ihre Türen, um in der Hitze einen kühlen Schutzraum zu bieten. Das Angebot richte sich insbesondere an Wohnungslose und an andere bedürftige Menschen, … [+1912 chars]",,de,'Hitze'
https://www.tagesspiegel.de/berlin/gefahr-durch-hitze-berliner-kirchen-offnen-turen-wegen-hitze-13952270.html,https://www.tagesspiegel.de/berlin/gefahr-durch-hitze-berliner-kirchen-offnen-turen-wegen-hitze-13952270.html,0,www.tagesspiegel.de,Gefahr durch Hitze: Berliner Kirchen öffnen Türen wegen Hitze,Temperaturen von bis zu 39 Grad werden heute im Berliner Raum erwartet. Einige Kirchen bieten kühle Schutzräume.,https://www.tagesspiegel.de/images/13952267/alternates/BASE_16_9_W1400/1751433548000/hitze-belastet-bedurftige-menschen.jpeg,2025-07-02T05:19:08Z,,"Mehrere Berliner Kirchen öffnen in diesen Tagen ihre Türen, um in der Hitze einen kühlen Schutzraum zu bieten. Das Angebot richte sich insbesondere an wohnungslose und an andere bedürftige Menschen, … [+1584 chars]",,de,'Hitze'
https://www.n-tv.de/wissen/Wie-viel-Hitze-haelt-der-Mensch-aus-Ab-diesen-Temperaturen-wird-es-lebensgefaehrlich-article25870579.html,https://www.n-tv.de/wissen/Wie-viel-Hitze-haelt-der-Mensch-aus-Ab-diesen-Temperaturen-wird-es-lebensgefaehrlich-article25870579.html,0,www.n-tv.de,Wie viel verträgt der Mensch?: Ab diesen Temperaturen wird Hitze lebensgefährlich,Deutschland ächzt unter Temperaturen bis zu 40 Grad. Und dabei ist es erst der Anfang des Sommers. Hitzewellen bringen den Körper an seine Grenzen. Doch wann wird Hitze zur Lebensgefahr? Entscheidend ist nicht allein die Zahl auf dem Thermometer.,https://www.n-tv.de/img/incoming/crop25871677/7171326788-cImg_16_9-w1200/imago92418988.jpg,2025-07-02T06:15:45Z,,Deutschland ächzt unter Temperaturen bis zu 40 Grad. Und dabei ist es erst der Anfang des Sommers. Hitzewellen bringen den Körper an seine Grenzen. Doch wann wird Hitze zur Lebensgefahr? Entscheidend… [+6195 chars],,de,'Hitze'
https://www.morgenpost.de/berlin/article409397960/wetter-berlin-hitze-sommer-hitzewarnung-heiss-news-aktuell-blog.html,https://www.morgenpost.de/berlin/article409397960/wetter-berlin-hitze-sommer-hitzewarnung-heiss-news-aktuell-blog.html,0,www.morgenpost.de,Heißester Tag des Jahres – Waldbrandgefahr erreicht Höchststufe,Berlin schwitzt am bisher heißesten Tag des Jahres. Es gilt eine Hitzewarnung – und die Waldbrandgefahr ist groß. News und Bilder im Blog.,https://img.sparknews.funkemedien.de/409232889/409232889_1751447554_v16_9_1600.jpeg,2025-07-02T09:14:09Z,,"Bei den grundlegenden Tipps für extrem heiße Tage sind sich Experten einig: Ausreichend Trinken, leichte Speisen zu sich nehmen: nicht zu fett, nicht zu stark gewürzt, nicht sehr heiß, nicht zu süß, … [+903 chars]",,de,'Hitze'
https://www.tagesschau.de/faktenfinder/mythen-sommer-sonnencreme-sonnenbrille-100.html,https://www.tagesschau.de/faktenfinder/mythen-sommer-sonnencreme-sonnenbrille-100.html,0,www.tagesschau.de,Faktenfinder: Mythen über Sonnencreme und -brillen im Umlauf,"In sozialen Netzwerken gehen Gerüchte um, dass Sonnencremes und -brillen schädlich seien. Experten raten klar davon ab, statt auf herkömmlichen Sonnenschutz etwa auf Nahrungsergänzungsmittel zu setzen. Von P. Siggelkow.",https://images.tagesschau.de/image/0942de4e-026e-47bb-83d3-cb26bff658fa/AAABl8ZH_cM/AAABkZLlo-k/16x9-big/mallorca-strand-140.jpg?width=1280,2025-07-02T09:58:31Z,,"Stand: 02.07.2025 11:58 Uhr
In sozialen Netzwerken gehen Gerüchte um, dass Sonnencremes und -brillen schädlich seien. Experten raten klar davon ab, statt auf herkömmlichen Sonnenschutz etwa auf Nahr… [+7968 chars]",,de,'Sonnencreme'
https://www.stern.de/gesellschaft/diese-hitze-macht-mich-richtig-wuetend--sie-aber-hoffentlich-auch--35851548.html,https://www.stern.de/gesellschaft/diese-hitze-macht-mich-richtig-wuetend--sie-aber-hoffentlich-auch--35851548.html,0,www.stern.de,Meinung: Diese Hitze macht mich richtig wütend – Sie hoffentlich auch!,Deutschland wird von einer Hitzewelle gegrillt. Doch unter den Sommergefühlen brodelt bei unserer Autorin eine stetig wachsende Wut. Zeit für einen Ausbruch.,https://image.stern.de/35853436/t/QC/v3/w1440/r1.7778/-/hitze-klimawandel.jpg,2025-07-02T11:44:00Z,,"Kopiere den aktuellen Link
Zur Merkliste hinzufügen
Deutschland wird von einer Hitzewelle gegrillt. Doch unter den Sommergefühlen brodelt bei unserer Autorin eine stetig wachsende Wut. Zeit für ein… [+6718 chars]",,de,'Hitze'
https://www.dw.com/de/hitzschlag-klimawandel-gefahr-risiko-hitze-waldbr%C3%A4nde-hitzewarnung-l%C3%B6sungen/a-73110077,https://www.dw.com/de/hitzschlag-klimawandel-gefahr-risiko-hitze-waldbr%C3%A4nde-hitzewarnung-l%C3%B6sungen/a-73110077,0,www.dw.com,Es ist zu heiß: Ist diese Hitze das neue Normal?,"Hitzewellen werden an vielen Orten der Welt immer extremer. Brütende Hitze belastet unseren Körper, bringt die Gesellschaft durcheinander und legt unsere Infrastruktur lahm. Wie kann sich die Welt darauf einstellen?",https://static.dw.com/image/73094019_6.jpg,2025-07-02T12:53:00Z,,"Menschen auf der ganzen Welt haben mit schwül-heißen Temperaturen zu kämpfen, die durch den Klimawandel angeheizt werden. Die erste Hitzewelle dieses Sommers hat Teile Europas und der USA fest im Gri… [+6256 chars]",,de,'Hitze'
https://www.stern.de/gesellschaft/regional/berlin-brandenburg/obdachlosenhilfe--sonnencreme--wasser-und-ein-kuehler-ort-35860778.html,https://www.stern.de/gesellschaft/regional/berlin-brandenburg/obdachlosenhilfe--sonnencreme--wasser-und-ein-kuehler-ort-35860778.html,0,www.stern.de,"Obdachlosenhilfe: Sonnencreme, Wasser und ein kühler Ort","Unter der Hitze leiden vor allem diejenigen, die keinen kühlen Ort zum Rückzug haben. Im Rahmen der Berliner Hitzehilfe sind Helfer unterwegs und Kirchen öffnen ihre Türen.",https://image.stern.de/35860780/t/tb/v1/w1440/r1.7778/-/02--se35itftvev5axs2048jpeg---95dedba3864b5341.jpg,2025-07-02T14:01:29Z,,"Kopiere den aktuellen Link
Zur Merkliste hinzufügen
Unter der Hitze leiden vor allem diejenigen, die keinen kühlen Ort zum Rückzug haben. Im Rahmen der Berliner Hitzehilfe sind Helfer unterwegs und… [+2804 chars]",,de,'Sonnencreme'
https://www.tagesspiegel.de/berlin/obdachlosenhilfe-sonnencreme-wasser-und-ein-kuhler-ort-13956713.html,https://www.tagesspiegel.de/berlin/obdachlosenhilfe-sonnencreme-wasser-und-ein-kuhler-ort-13956713.html,0,www.tagesspiegel.de,"Obdachlosenhilfe: Sonnencreme, Wasser und ein kühler Ort","Unter der Hitze leiden vor allem diejenigen, die keinen kühlen Ort zum Rückzug haben. Im Rahmen der Berliner Hitzehilfe sind Helfer unterwegs und Kirchen öffnen ihre Türen.",https://www.tagesspiegel.de/images/13956710/alternates/BASE_16_9_W1400/1751464946000/hitze-in-berlin.jpeg,2025-07-02T14:02:27Z,,"Leichte Sommerkleidung, ausreichend Trinken, Sonnenschutz und Aufenthalt im Schatten - grundsätzliche Tipps für den Umgang mit Hitzetagen gelten mindestens genauso für Menschen ohne eigene Wohnung od… [+3329 chars]",,de,'Sonnencreme'
https://www.morgenpost.de/berlin/article409409623/zu-heiss-komm-rein-wo-in-berlin-hitzehilfe-geleistet-wird.html,https://www.morgenpost.de/berlin/article409409623/zu-heiss-komm-rein-wo-in-berlin-hitzehilfe-geleistet-wird.html,0,www.morgenpost.de,„Zu heiß? Komm rein!“ – Wo in Berlin Hitzehilfe geleistet wird,"Sozialsenatorin Kiziltepe stellt Projekte der Berliner Hitzehilfe 2025 für obdachlose Menschen vor. Willkommen sind aber alle Menschen, die Abkühlung benötigen.",https://img.sparknews.funkemedien.de/409412292/409412292_1751465524_v16_9_1600.jpeg,2025-07-02T14:12:04Z,,"Berlin. Senatorin Kiziltepe stellt Projekte der Hitzehilfe 2025 für obdachlose Menschen vor. Willkommen sind aber alle, die Abkühlung benötigen. 
Das Thermometer zeigt am Mittag vor dem Portal der P… [+3600 chars]",,de,'Hitze'
https://www.bild.de/sport/fussball/hannover-96-tropen-hitze-96-trainiert-mit-salzstangen-und-sonnencreme-686547b7aa0dfb270f803ac4,https://www.bild.de/sport/fussball/hannover-96-tropen-hitze-96-trainiert-mit-salzstangen-und-sonnencreme-686547b7aa0dfb270f803ac4,0,www.bild.de,Tropen-Hitze! - 96 trainiert mit Salzstangen und Sonnencreme,"Hitze-Training Mittwoch bei Hannover 96 – mit Eis-Handtuch, Salzstangen und Sonnencreme.","https://images.bild.de/686547b7aa0dfb270f803ac4/c0b78fc66a654afb5466c1412fab16ad,e8de5ecf?w=1280",2025-07-02T15:29:15Z,,"Deutschland ächzt unter der Tropen-Hitze und die Profis von Hannover 96 trainierten zweieinhalb Stunden.
Morgens um kurz vor halb zehn waren es Mittwoch schon 31 Grad an der 96-Arena, beim Start der… [+1278 chars]",,de,'Sonnencreme'
