index,url,valid,domain,title,description,image,published,archive,content,quote,language,keyword
https://www.zeit.de/news/2025-11/11/sachsen-will-sich-umfassend-auf-hitze-perioden-vorbereiten,https://www.zeit.de/news/2025-11/11/sachsen-will-sich-umfassend-auf-hitze-perioden-vorbereiten,0,www.zeit.de,Kabinett: Sachsen will sich umfassend auf Hitze-Perioden vorbereiten,Hier finden Sie Informationen zu dem Thema „Kabinett“. Lesen Sie jetzt „Sachsen will sich umfassend auf Hitze-Perioden vorbereiten“.,https://img.zeit.de/news/2025-11/11/sachsen-will-sich-umfassend-auf-hitze-perioden-vorbereiten-image-group/wide__1300x731,2025-11-11T13:29:03Z,,"Sachsen will sich umfassend auf Hitze- und Dürreperioden vorbereiten. Der Freistaat werde in Zukunft stark von Hitze betroffen sein, sagte Innenminister Armin Schuster (CDU) nach einer Sitzung des Si… [+3524 chars]",,de,'Hitze'
https://www.stern.de/gesellschaft/regional/sachsen/kabinett--sachsen-will-sich-umfassend-auf-hitze-perioden-vorbereiten-36334522.html,https://www.stern.de/gesellschaft/regional/sachsen/kabinett--sachsen-will-sich-umfassend-auf-hitze-perioden-vorbereiten-36334522.html,0,www.stern.de,Kabinett: Sachsen will sich umfassend auf Hitze-Perioden vorbereiten,"Hitze, Dürre, Waldbrände: Sachsen will in Zeiten des Klimawandels Vorsorge treffen. Dem Sicherheitskabinett war das eine Sitzung wert. Auch die Kommunen sind in der Pflicht.",https://image.stern.de/36334524/t/w3/v1/w1440/r1.7778/-/11--4fwr2745wdv7axs2048jpeg---76cf3827bd9c83ab.jpg,2025-11-11T13:29:03Z,,"Kopiere den aktuellen Link
Zur Merkliste hinzufügen
Hitze, Dürre, Waldbrände: Sachsen will in Zeiten des Klimawandels Vorsorge treffen. Dem Sicherheitskabinett war das eine Sitzung wert. Auch die K… [+3975 chars]",,de,'Hitze'
https://www.sueddeutsche.de/sport/sinner-tennis-atp-finals-2025-turin-li.3337276,https://www.sueddeutsche.de/sport/sinner-tennis-atp-finals-2025-turin-li.3337276,0,www.sueddeutsche.de,Jannik Sinner: Ins Himmelblau mischt sich ein dunkler Fleck,Der Weltranglistenerste Jannik Sinner setzt seinen Siegeszug in Turin fort. Und doch schwebt beim Jahresfinale der acht besten Tennisprofis ein Schatten der Vergangenheit über ihm.,https://www.sueddeutsche.de/2025/11/11/abf07f53-b3bf-41fc-8382-c795ffac755f.jpg?q=60&fm=webp&width=1200&rect=0%2C21%2C3620%2C2036,2025-11-11T15:44:19Z,,"Zur Wahrheit über die ATP Finals nämlich gehört auch die Tatsache, dass es sich um ein sehr eigentümliches Tennisturnier handelt, insbesondere aus der Ferne betrachtet. Das Gruppenformat nimmt dem Sp… [+4772 chars]",,de,'Schatten'
https://orf.at/stories/3411209/,https://orf.at/stories/3411209/,0,orf.at,Ein Hauch von Frühling im November,Ungewöhnliche Wärme erfasst weite Teile Österreichs: Temperaturen um 20 Grad werden in der zweiten Wochenhälfte erwartet – ein Hauch Frühling mitten im November. Auch die Sonne zeigt sich vor allem im Westen nicht geizig. Eine Einstimmung auf die Vorweihnacht…,https://ibs.orf.at/news?image=https%3A%2F%2Fassets.orf.at%2Fmims%2F2025%2F46%2F69%2Fcrops%2Fw%3D1200%2Ch%3D630%2Cq%3D75%2F2830587_master_1092769_wetter_november_wetter_hum.jpg%3Fs%3D5798329fe3695db144ae5df3dc8462f688936cfb,2025-11-11T22:45:48Z,,Der November ist bisher schon sehr mild verlaufen und liegt um gut ein Grad Celsius über dem Mittel der aktuellen Klimanormalperiode das ist der Zeitraum vom 1991 bis 2020. Nicht nur tagsüber ist es … [+3547 chars],,de,'Sonne'
https://www.tagesschau.de/wissen/klima/klima-risiko-index-102.html,https://www.tagesschau.de/wissen/klima/klima-risiko-index-102.html,0,www.tagesschau.de,Klima-Risiko-Index: Wetterextreme treffen arme Länder am härtesten,Laut Klima-Risiko-Index werden Extremwetter-Ereignisse immer häufiger - und treffen arme Länder am härtesten. Aber auch Deutschland bleibt dem Bericht zufolge von den Folgen des Klimawandels nicht verschont. Von Jakob Mayr.,https://images.tagesschau.de/image/03d0e824-a4ca-4a7c-8031-b95457141d2f/AAABmnU14W8/AAABmgWmh8Q/16x9-big/taifun-fung-wong-102.jpg?width=1280,2025-11-11T23:20:02Z,,"Stand: 12.11.2025 00:20 Uhr
Laut Klima-Risiko-Index werden Extremwetter-Ereignisse immer häufiger - und treffen arme Länder am härtesten. Aber auch Deutschland bleibt dem Bericht zufolge von den Fol… [+4623 chars]",,de,'Klimawandel'
https://www.zeit.de/news/2025-11/12/56-000-teilnehmer-auf-dem-un-klimagipfel-usa-fehlen,https://www.zeit.de/news/2025-11/12/56-000-teilnehmer-auf-dem-un-klimagipfel-usa-fehlen,0,www.zeit.de,Erderwärmung: 56.000 Teilnehmer auf dem UN-Klimagipfel - USA fehlen,Hier finden Sie Informationen zu dem Thema „Erderwärmung“. Lesen Sie jetzt „56.000 Teilnehmer auf dem UN-Klimagipfel - USA fehlen“.,https://img.zeit.de/news/2025-11/12/56-000-teilnehmer-auf-dem-un-klimagipfel-usa-fehlen-image-group/wide__1300x731,2025-11-12T04:15:07Z,,Mehr als 56.000 Delegierte haben sich für eine persönliche Teilnahme an der Weltklimakonferenz in Brasilien angemeldet damit ist das inzwischen 30. derartige UN-Treffen eins der größten überhaupt. Di… [+1127 chars],,de,'Erderwärmung'
https://www.zeit.de/news/2025-11/12/herbstwetter-in-hessen-erst-sonne-dann-wolken-erwartet,https://www.zeit.de/news/2025-11/12/herbstwetter-in-hessen-erst-sonne-dann-wolken-erwartet,0,www.zeit.de,"Wettervorhersage: Herbstwetter in Hessen – erst Sonne, dann Wolken erwartet","Hier finden Sie Informationen zu dem Thema „Wettervorhersage“. Lesen Sie jetzt „Herbstwetter in Hessen – erst Sonne, dann Wolken erwartet“.",https://img.zeit.de/news/2025-11/12/herbstwetter-in-hessen-erst-sonne-dann-wolken-erwartet-image-group/wide__1300x731,2025-11-12T05:02:24Z,,"Nach einem teils nebligen Start bleibt das Wetter in Hessen am Mittwoch heiter und mild. Nach Angaben des Deutschen Wetterdienstes (DWD) lösen sich die Nebelfelder am Vormittag allmählich auf, anschl… [+760 chars]",,de,'Sonne'
https://www.zeit.de/news/2025-11/12/sonne-und-bis-zu-20-grad-mit-der-neuen-woche-kuehler,https://www.zeit.de/news/2025-11/12/sonne-und-bis-zu-20-grad-mit-der-neuen-woche-kuehler,0,www.zeit.de,Wettervorhersage: Sonne und bis zu 20 Grad - mit der neuen Woche kühler,Hier finden Sie Informationen zu dem Thema „Wettervorhersage“. Lesen Sie jetzt „Sonne und bis zu 20 Grad - mit der neuen Woche kühler“.,https://img.zeit.de/news/2025-11/12/sonne-und-bis-zu-20-grad-mit-der-neuen-woche-kuehler-image-group/wide__1300x731,2025-11-12T05:41:19Z,,"Leichter Frost nachts, ungewöhnlich mild tagsüber und vielerorts Sonne: In den nächsten Tagen verwöhnt das Wetter die Bayern noch einmal, bevor es am Wochenende kälter und regnerischer wird. Mit der … [+1188 chars]",,de,'Sonne'
https://www.zeit.de/news/2025-11/12/milde-temperaturen-und-sonne,https://www.zeit.de/news/2025-11/12/milde-temperaturen-und-sonne,0,www.zeit.de,Wetter: Milde Temperaturen und Sonne,Hier finden Sie Informationen zu dem Thema „Wetter“. Lesen Sie jetzt „Milde Temperaturen und Sonne“.,https://img.zeit.de/news/2025-11/12/milde-temperaturen-und-sonne-image-group/wide__1300x731,2025-11-12T06:22:25Z,,"Das Wetter bleibt trocken und heiter in Sachsen, Sachsen-Anhalt und Thüringen. Am Mittwochmorgen lösen sich die Nebelfelder laut Deutschem Wetterdienst (DWD) zumeist schnell auf, danach soll es bei d… [+603 chars]",,de,'Sonne'
"https://www.gamestar.de/artikel/flexoelektrizitaet-ferroelektrizitaet-wasser-eis-gewitter-blitze,3440613.html","https://www.gamestar.de/artikel/flexoelektrizitaet-ferroelektrizitaet-wasser-eis-gewitter-blitze,3440613.html",0,www.gamestar.de,Wissenschaft - Wir haben gerade etwas Unerwartetes über Eis gelernt - es dürfte einer der Gründe für Gewitterblitze sein,Wie entsteht in Gewitterwolken die Kraft der Blitze? Und wie züngeln sie schließlich gen Boden? Auf beide Fragen haben Wissenschaftler neue Antworten.,https://images.cgames.de/images/gamestar/293/teaser-eis-elektrizität-gewitterwolke-gs_6378768.jpg,2025-11-12T10:36:00Z,,"Blitze und Eis mögen sich optisch unterschieden wie Tag und Nacht. Physikalisch hängen sie aber wohl enger zusammen als wir dachten.
(Bildquelle: Unsplash, Johannes Plenio und Aaron Burden)
Jeder k… [+6382 chars]",,de,'Gewitter'
https://www.diepresse.com/20292096/ist-das-architektur-oder-kann-das-weg-zur-aufregung-um-roland-rainers,https://www.diepresse.com/20292096/ist-das-architektur-oder-kann-das-weg-zur-aufregung-um-roland-rainers,0,www.diepresse.com,Ist das Architektur oder kann das weg? Zur Aufregung um Roland Rainers Sprungturm in Ternitz [premium],"In letzter Minute konnte der Abriss des Sprungturms im Ternitzer Freibad verhindert werden. Profan, aber dennoch eine Architekturikone, gebaut von Roland Rainer, der auch die Wiener Stadthalle schuf. Chronik einer Rettung.",https://img.diepresse.com/public/kultur/paxen0-10er-1-1.jpeg/alternates/DPR_SOCIAL_MAGAZIN/10er%20-%201%201.jpeg,2025-11-12T11:12:15Z,,"Der Gemeinderat der Stadt Ternitz im niederösterreichischen Industrieviertel hat turbulente Tage hinter sich. Dabei ging es scheinbar nur um einen Turm. Um einen zehn Meter hohen Sprungturm, prominen… [+5484 chars]",,de,'Freibad'
https://www.zeit.de/gesellschaft/zeitgeschehen/2025-11/umweltschutz-co2-kohlenstoffdioxid-austoss-emmissionen-exeter-erderwaermung-2025,https://www.zeit.de/gesellschaft/zeitgeschehen/2025-11/umweltschutz-co2-kohlenstoffdioxid-austoss-emmissionen-exeter-erderwaermung-2025,0,www.zeit.de,Treibhausgase: CO₂-Emissionen steigen im Jahr 2025 weiter,"Mehr CO₂-Emissionen, weniger Flächen, die es aufnehmen könnten. Eine internationale Forschungsgruppe glaubt nicht, dass die Erderwärmung unter 1,5 Grad zu halten ist.",https://img.zeit.de/wirtschaft/2025-11/umweltschutz-co2-emissionen-globaler-co2-ausstoss-2025/wide__1300x731,2025-11-13T00:01:54Z,,"Der weltweite CO-Ausstoß wird im Jahr 2025 wohl um 1,1 Prozent gegenüber dem Vorjahr steigen. Davon geht eine internationale Forschungsgruppe der Universität Exeter in ihrem Bericht Global Carbon Bud… [+1706 chars]",,de,'Erderwärmung'
https://www.stern.de/gesellschaft/regional/hessen/theaterfestspiele--blitzschutz-und-spruehnebel---buehnen-trotzen-wetterkapriolen-36339932.html,https://www.stern.de/gesellschaft/regional/hessen/theaterfestspiele--blitzschutz-und-spruehnebel---buehnen-trotzen-wetterkapriolen-36339932.html,0,www.stern.de,Theaterfestspiele: Blitzschutz und Sprühnebel – Bühnen trotzen Wetterkapriolen,"Bad Vilbel/Bad Hersfeld/Mayen - Starkregen, Hitze, Hagel - für die Organisatoren von Theaterfestivals bringen Klimawandel und Wetterextreme in den",https://image.stern.de/36339934/t/XF/v1/w1440/r1.7778/-/13--ospl4nmrvxv11axs2048jpeg---5055576ae68702f2.jpg,2025-11-13T03:00:11Z,,"Kopiere den aktuellen Link
Zur Merkliste hinzufügen
Starkregen, Hitze und Hagel fordern Theaterfestivals heraus. Wie sich Veranstalter mit kreativen Lösungen gegen Wetterextreme wappnen.
Starkrege… [+5596 chars]",,de,'Hitze'
https://www.zeit.de/news/2025-11/13/nach-nebel-viel-sonne-im-sueden-hessens,https://www.zeit.de/news/2025-11/13/nach-nebel-viel-sonne-im-sueden-hessens,0,www.zeit.de,Wettervorhersage: Nach Nebel viel Sonne im Süden Hessens,Hier finden Sie Informationen zu dem Thema „Wettervorhersage“. Lesen Sie jetzt „Nach Nebel viel Sonne im Süden Hessens“.,https://img.zeit.de/news/2025-11/13/nach-nebel-viel-sonne-im-sueden-hessens-image-group/wide__1300x731,2025-11-13T06:22:33Z,,Nach der Auflösung teils zäher Nebelfelder ist das Wetter in Hessen am Donnerstag meist heiter bis wolkig. Im Süden ist es vielfach sonnig und trocken. Nach Angaben des Deutschen Wetterdienstes (DWD)… [+656 chars],,de,'Sonne'
https://www.zeit.de/news/2025-11/13/nebel-am-morgen-sonne-am-tag-regen-am-wochenende,https://www.zeit.de/news/2025-11/13/nebel-am-morgen-sonne-am-tag-regen-am-wochenende,0,www.zeit.de,"Wettervorhersage: Nebel am Morgen, Sonne am Tag – Regen am Wochenende","Hier finden Sie Informationen zu dem Thema „Wettervorhersage“. Lesen Sie jetzt „Nebel am Morgen, Sonne am Tag – Regen am Wochenende“.",https://img.zeit.de/news/2025-11/13/nebel-am-morgen-sonne-am-tag-regen-am-wochenende-image-group/wide__1300x731,2025-11-13T06:33:03Z,,"Der Start in den neuen Tag ist in Teilen von Rheinland-Pfalz und des Saarlandes am Donnerstag neblig. Doch im Tagesverlauf lässt sich vielerorts die Sonne blicken, wie der Deutsche Wetterdienst (DWD)… [+546 chars]",,de,'Gewitter'
https://www.stern.de/gesellschaft/regional/rheinland-pfalz-saarland/wettervorhersage--nebel-am-morgen--sonne-am-tag---regen-am-wochenende-36340406.html,https://www.stern.de/gesellschaft/regional/rheinland-pfalz-saarland/wettervorhersage--nebel-am-morgen--sonne-am-tag---regen-am-wochenende-36340406.html,0,www.stern.de,"Wettervorhersage: Nebel am Morgen, Sonne am Tag – Regen am Wochenende",Mainz (lrs) - Der Start in den neuen Tag ist in Teilen von Rheinland-Pfalz und des Saarlandes am Donnerstag neblig. Doch im Tagesverlauf lässt sich,https://image.stern.de/36340408/t/Nc/v1/w1440/r1.7778/-/13--b3lktd6cuwv5axs2048jpeg---784973d8905c62a8.jpg,2025-11-13T06:33:03Z,,"Kopiere den aktuellen Link
Zur Merkliste hinzufügen
Von fast 20 Grad und Sonne zu Regen und Gewitter: Das Wochenende bringt den Wetterwechsel.
Der Start in den neuen Tag ist in Teilen von Rheinlan… [+652 chars]",,de,'Gewitter'
https://www.tagesspiegel.de/berlin/nach-sonnenschein-folgt-regen-milde-temperaturen-vor-schmuddeligem-berliner-herbst-wochenende-14825198.html,https://www.tagesspiegel.de/berlin/nach-sonnenschein-folgt-regen-milde-temperaturen-vor-schmuddeligem-berliner-herbst-wochenende-14825198.html,0,www.tagesspiegel.de,Nach Sonnenschein folgt Regen: Milde Temperaturen vor schmuddeligem Berliner Herbst-Wochenende,Bis zu 18 Grad erwartet der Deutsche Wetterdienst in der Hauptstadtregion. Doch die milden Temperaturen weichen schnell wieder einstelligen Werten und Regen.,https://www.tagesspiegel.de/images/14825195/alternates/BASE_16_9_W1400/1763017289000/herbst-in-brandenburg-wetter.jpeg,2025-11-13T07:01:29Z,,In Berlin und Brandenburg können sich die Menschen kurz vor dem Wochenende auf milde Temperaturen mit bis zu 18 Grad freuen. Der Donnerstag zeigt sich ansonsten eher trüb: Dichter Nebel lässt die Son… [+871 chars],,de,'Sonne'
https://www.tagesschau.de/faktenfinder/klimawandel-co2-desinformation-100.html,https://www.tagesschau.de/faktenfinder/klimawandel-co2-desinformation-100.html,0,www.tagesschau.de,Irreführende Studie verharmlost CO2-Einfluss auf den Klimawandel,"Eine neue Studie soll angeblich beweisen, dass das Treibhausgas CO2 nicht für die steigenden Temperaturen auf der Erde verantwortlich ist. Doch das ist falsch - und ein weiteres Beispiel für Klimawandelleugnung. Von P. Siggelkow.",https://images.tagesschau.de/image/7780614e-e260-4cbc-ab66-df18c5e36854/AAABlZAPqvY/AAABmgWmh8Q/16x9-big/braunkohlekraftwerk-114.jpg?width=1280,2025-11-13T08:52:57Z,,"Stand: 13.11.2025 09:52 Uhr
Eine neue Studie soll angeblich beweisen, dass das Treibhausgas CO2 nicht für die steigenden Temperaturen auf der Erde verantwortlich ist. Doch das ist falsch - und ein w… [+6261 chars]",,de,'Erderwärmung'
https://www.golem.de/sonstiges/zustimmung/auswahl.html?from=https://www.golem.de/news/zu-hohe-temperaturen-tesla-entlaesst-gehoerlosen-mitarbeiter-nach-versetzungsgesuch-2511-202140.html&referer=https://t.co/df1ec0620f,https://www.golem.de/sonstiges/zustimmung/auswahl.html?from=https://www.golem.de/news/zu-hohe-temperaturen-tesla-entlaesst-gehoerlosen-mitarbeiter-nach-versetzungsgesuch-2511-202140.html&referer=https://t.co/df1ec0620f,0,www.golem.de,Zu hohe Temperaturen: Tesla entlässt gehörlosen Mitarbeiter nach Versetzungsgesuch,"Zu hohe Hitze an den Gussmaschinen führte zum Ausfall der Hörgeräte eines Tesla-Arbeiters. Nach einem Versetzungsgesuch hat Tesla ihn entlassen. (Tesla, Elektroauto)",,2025-11-13T10:22:05Z,,"Besuchen Sie Golem.de wie gewohnt mit Werbung und Tracking,
 indem Sie der Nutzung aller Cookies zustimmen.
 Details zum Tracking finden Sie im Privacy Center.
Skript wurde nicht geladen. Informat… [+607 chars]",,de,'Hitze'
https://www.sueddeutsche.de/politik/klimakonferenz-belem-initiative-klima-desinformation-li.3338112,https://www.sueddeutsche.de/politik/klimakonferenz-belem-initiative-klima-desinformation-li.3338112,0,www.sueddeutsche.de,COP30 in Belém: Kein Klima für Fake News,Brasiliens Präsident Lula da Silva spricht von der „Klimakonferenz der Wahrheit“ – weil heute „Finsterlinge wissenschaftliche Erkenntnisse ablehnen“ und so den Kampf gegen die Erderwärmung erschweren.,https://www.sueddeutsche.de/2025/11/13/0e6849cb-96c2-4ed8-bb1d-64f8b300075d.jpg?q=60&fm=webp&width=1200&rect=0%2C0%2C3056%2C1719,2025-11-13T15:36:59Z,,"Eine Frau in Bürokleidung geht auf hohen Absätzen an fast verfallenen Häusern vorbei, der Putz blättert, der Weg ist verschlammt. In dem Video heißt es, sie suche ihre Unterkunft bei der Weltklimakon… [+229 chars]",,de,'Erderwärmung'
https://www.zeit.de/news/2025-11/13/badegaeste-trotzen-dem-herbst-im-privaten-freibad,https://www.zeit.de/news/2025-11/13/badegaeste-trotzen-dem-herbst-im-privaten-freibad,0,www.zeit.de,Ungewöhnliches Freibad: Badegäste trotzen dem Herbst im privaten Freibad,Hier finden Sie Informationen zu dem Thema „Ungewöhnliches Freibad“. Lesen Sie jetzt „Badegäste trotzen dem Herbst im privaten Freibad“.,https://img.zeit.de/news/2025-11/13/badegaeste-trotzen-dem-herbst-im-privaten-freibad-image-group/wide__1300x731,2025-11-13T15:45:53Z,,Achim Gall und sein selbstgebautes Freibad sorgten bereits im Sommer deutschlandweit für Aufsehen. Auch im November erfreut sich das Freibad weiterhin großer Beliebtheit in Uhingen (Kreis Göppingen).… [+1216 chars],,de,'Freibad'
https://www.stern.de/gesellschaft/regional/baden-wuerttemberg/ungewoehnliches-freibad--badegaeste-trotzen-dem-herbst-im-privaten-freibad-36343056.html,https://www.stern.de/gesellschaft/regional/baden-wuerttemberg/ungewoehnliches-freibad--badegaeste-trotzen-dem-herbst-im-privaten-freibad-36343056.html,0,www.stern.de,Ungewöhnliches Freibad: Badegäste trotzen dem Herbst im privaten Freibad,Uhingen (lsw) - Achim Gall und sein selbstgebautes Freibad sorgten bereits im Sommer deutschlandweit für Aufsehen. Auch im November erfreut sich das,https://image.stern.de/36343058/t/NO/v1/w1440/r1.7778/-/13--ml4o7ol7pzv10axs2048jpeg---b6830ca6ea15c3b8.jpg,2025-11-13T15:45:53Z,,"Kopiere den aktuellen Link
Zur Merkliste hinzufügen
Während andere längst die Badesaison beendet haben, ziehen im privaten Freibad von Achim Gall Gäste weiter ihre Bahnen. Und das mitten im Novembe… [+1379 chars]",,de,'Freibad'
https://www.stern.de/gesellschaft/regional/baden-wuerttemberg/dwd-prognose--letzte-chance-auf-goldenen-herbst---dann-wird-es-kaelter-36344158.html,https://www.stern.de/gesellschaft/regional/baden-wuerttemberg/dwd-prognose--letzte-chance-auf-goldenen-herbst---dann-wird-es-kaelter-36344158.html,0,www.stern.de,DWD-Prognose: Letzte Chance auf goldenen Herbst - dann wird es kälter,"Einmal noch durch die Sonne spazieren, den Herbst im Sonnenschein genießen. Denn nach den Tagen mit T-Shirt-Wetter dürfte die Temperatur stark sinken. Mehr noch: Der DWD spricht sogar von Schnee.",https://image.stern.de/36344160/t/H9/v1/w1440/r1.7778/-/14--lrwhddqhzlv9axs2048jpeg---1be4393416c8c100.jpg,2025-11-14T04:42:24Z,,"Kopiere den aktuellen Link
Zur Merkliste hinzufügen
Einmal noch durch die Sonne spazieren, den Herbst im Sonnenschein genießen. Denn nach den Tagen mit T-Shirt-Wetter dürfte die Temperatur stark si… [+1408 chars]",,de,'Sonne'
https://www.stern.de/politik/ausland/erderwaermung--1-600-oel---gas--und-kohle-lobbyisten-auf-un-klimagipfel-36344234.html,https://www.stern.de/politik/ausland/erderwaermung--1-600-oel---gas--und-kohle-lobbyisten-auf-un-klimagipfel-36344234.html,0,www.stern.de,"Erderwärmung: 1.600 Öl-, Gas- und Kohle-Lobbyisten auf UN-Klimagipfel","Weil die Menschen zu viel Kohle, Öl und Gas verbrennen, heizt sich der Planet gefährlich auf. Doch die Industrie, die damit Geld verdient, will Einfluss behalten - auch auf der Klimakonferenz.",https://image.stern.de/36344236/t/SV/v1/w1440/r1.7778/-/14--xpn6raaqkyv37axs2048jpeg---20d4b156248a6a96.jpg,2025-11-14T05:00:07Z,,"Kopiere den aktuellen Link
Zur Merkliste hinzufügen
Weil die Menschen zu viel Kohle, Öl und Gas verbrennen, heizt sich der Planet gefährlich auf. Doch die Industrie, die damit Geld verdient, will E… [+3658 chars]",,de,'Erderwärmung'
https://www.zeit.de/news/2025-11/14/1-600-oel-gas-und-kohle-lobbyisten-auf-un-klimagipfel,https://www.zeit.de/news/2025-11/14/1-600-oel-gas-und-kohle-lobbyisten-auf-un-klimagipfel,0,www.zeit.de,"Erderwärmung: 1.600 Öl-, Gas- und Kohle-Lobbyisten auf UN-Klimagipfel","Hier finden Sie Informationen zu dem Thema „Erderwärmung“. Lesen Sie jetzt „1.600 Öl-, Gas- und Kohle-Lobbyisten auf UN-Klimagipfel“.",https://img.zeit.de/news/2025-11/14/1-600-oel-gas-und-kohle-lobbyisten-auf-un-klimagipfel-image-group/wide__1300x731,2025-11-14T05:00:07Z,,"Die Weltklimakonferenz berät über die Eindämmung der Erderwärmung doch nach einer Datenanalyse sind mindestens 1.602 Lobbyisten der Öl-, Gas- und Kohleindustrie ganz offiziell beim UN-Treffen in Bras… [+3418 chars]",,de,'Erderwärmung'
https://www.tagesspiegel.de/internationales/erderwarmung-1600-ol-gas-und-kohle-lobbyisten-auf-un-klimagipfel-14836745.html,https://www.tagesspiegel.de/internationales/erderwarmung-1600-ol-gas-und-kohle-lobbyisten-auf-un-klimagipfel-14836745.html,0,www.tagesspiegel.de,"Erderwärmung: 1.600 Öl-, Gas- und Kohle-Lobbyisten auf UN-Klimagipfel","Weil die Menschen zu viel Kohle, Öl und Gas verbrennen, heizt sich der Planet gefährlich auf. Doch die Industrie, die damit Geld verdient, will Einfluss behalten - auch auf der Klimakonferenz.",https://www.tagesspiegel.de/images/14836742/alternates/BASE_16_9_W1400/1763096487000/das-verbrennen-von-ol-befeuert-die-erderhitzung.jpeg,2025-11-14T05:01:27Z,,"Die Weltklimakonferenz berät über die Eindämmung der Erderwärmung doch nach einer Datenanalyse sind mindestens 1.602 Lobbyisten der Öl-, Gas- und Kohleindustrie ganz offiziell beim UN-Treffen in Bras… [+3466 chars]",,de,'Erderwärmung'
https://www.stern.de/gesellschaft/regional/rheinland-pfalz-saarland/wetter--wolken-und-teils-regen-in-rheinland-pfalz-und-dem-saarland-36344276.html,https://www.stern.de/gesellschaft/regional/rheinland-pfalz-saarland/wetter--wolken-und-teils-regen-in-rheinland-pfalz-und-dem-saarland-36344276.html,0,www.stern.de,Wetter: Wolken und teils Regen in Rheinland-Pfalz und dem Saarland,In Rheinland-Pfalz und dem Saarland bringt das Ende der Woche einige Wolken und zeitweise Regen. Für den Samstag sind auch Gewitter nicht ganz ausgeschlossen. Die Aussichten.,https://image.stern.de/36344278/t/R9/v1/w1440/r1.7778/-/14--wourr5gwowv5axs2048jpeg---947e15b518aa8c0c.jpg,2025-11-14T05:09:49Z,,"Kopiere den aktuellen Link
Zur Merkliste hinzufügen
In Rheinland-Pfalz und dem Saarland bringt das Ende der Woche einige Wolken und zeitweise Regen. Für den Samstag sind auch Gewitter nicht ganz au… [+899 chars]",,de,'Gewitter'
https://science.orf.at/stories/3232912/,https://science.orf.at/stories/3232912/,0,science.orf.at,Neuer Satellit erfasst Meeresspiegelanstieg,Den durch die Erderwärmung fortschreitenden Anstieg des Meeresspiegels nimmt bald ein neuer europäischer Erdbeobachtungssatellit namens „Sentinel-6B“ unter die Lupe. Am Montag soll das Hightech-Gerät von Kalifornien aus an Bord einer SpaceX-Falcon 9-Rakete se…,https://ibs.orf.at/science?image=https%3A%2F%2Ftubestatic.orf.at%2Fmojo%2F1_4_1%2Fstoryserver%2Ftube%2Fscience%2Fimages%2Fog-fallback.jpg%3Fs%3D9468ebfda8d575e29237d4fe069891178635d8e1,2025-11-14T08:43:48Z,,"Seit den frühen 1990er-Jahren messen europäische Geräte im All in Kooperation mit internationalen Partnern die Entwicklung des globalen Meeresspiegels Tendenz steigend, mit Hang zur Beschleunigung. G… [+3334 chars]",,de,'Erderwärmung'
https://www.golem.de/sonstiges/zustimmung/auswahl.html?from=https://www.golem.de/news/klimawandel-40-prozent-der-windparks-angeblich-durch-starkwind-gefaehrdet-2511-202177.html&referer=https://t.co/f61cb6b87e,https://www.golem.de/sonstiges/zustimmung/auswahl.html?from=https://www.golem.de/news/klimawandel-40-prozent-der-windparks-angeblich-durch-starkwind-gefaehrdet-2511-202177.html&referer=https://t.co/f61cb6b87e,0,www.golem.de,Klimawandel: 40 Prozent der Windparks angeblich durch Starkwind gefährdet,"Weil Stürme global zunehmen, seien viele Windräder weltweit bedroht, signalisiert eine Studie. Das stimme so gar nicht, sagt die Windenergiebranche. (Windpark, Studien)",,2025-11-14T09:52:02Z,,"Besuchen Sie Golem.de wie gewohnt mit Werbung und Tracking,
 indem Sie der Nutzung aller Cookies zustimmen.
 Details zum Tracking finden Sie im Privacy Center.
Skript wurde nicht geladen. Informat… [+607 chars]",,de,'Klimawandel'
https://www.tagesspiegel.de/berlin/klimaforscher-warnt-in-berlin-werden-wir-mit-temperaturen-von-45-grad-celsius-leben-14846987.html,https://www.tagesspiegel.de/berlin/klimaforscher-warnt-in-berlin-werden-wir-mit-temperaturen-von-45-grad-celsius-leben-14846987.html,0,www.tagesspiegel.de,Klimaforscher warnt: „In Berlin werden wir mit Temperaturen von 45 Grad Celsius leben“,Stefan Rahmstorf warnt in Berlin vor extremen Folgen der Erderwärmung. Beim Klimastreik fordert Fridays for Future entschlossenes Handeln.,https://www.tagesspiegel.de/images/13537669/alternates/BASE_16_9_W1400/1744622165000/der-sonnenaufgang-zeichnet-sich-ab-hinter-der-stadtsilhouette-mit-dem-fernsehturm-und-dem-funkturm-in-berlin-04-09-2024.jpeg,2025-11-14T18:37:00Z,,"In Berlin hat der Klimaforscher Stefan Rahmstorf auf einem Klimastreik von Fridays for Future vor gravierenden Folgen bei einer Erderwärmung von 2,8 Grad Celsius gewarnt. In Berlin werden wir mit Tem… [+2672 chars]",,de,'Erderwärmung'
